2,We think it’s genius; we want to support your vision and make this tiny company of yours internationally known.,2,2,None,,,,,,0,2,2,2,,,,,0,12,12,12,,,,,,,,,,,,,,,,,,,,,,,,,,,,,,,,,,,1,3.450866675004363,,,,,,,,,,,,,,,,,,,,,,,,,,,,061419_p1,001,2019_Jun_14_1401,body_behavioural,3.0.4,59.981604842409226,
2,"But honestly, your company doesn’t have the resources to reach international markets right now.",2,2,None,,,,,,0,2,2,2,,,,,0,13,13,13,,,,,,,,,,,,,,,,,,,,,,,,,,,,,,,,,,,1,1.8536862450418994,,,,,,,,,,,,,,,,,,,,,,,,,,,,061419_p1,001,2019_Jun_14_1401,body_behavioural,3.0.4,59.981604842409226,
2,"Maybe in a few years you could, but by that time, other companies may have already filled your niche.",2,2,None,,,,,,0,2,2,2,,,,,0,14,14,14,,,,,,,,,,,,,,,,,,,,,,,,,,,,,,,,,,,1,3.5700440520304255,,,,,,,,,,,,,,,,,,,,,,,,,,,,061419_p1,001,2019_Jun_14_1401,body_behavioural,3.0.4,59.981604842409226,
2,I think we should join forces.”,2,2,None,,,,,,0,2,2,2,,,,,0,15,15,15,,,,,,,,,,,,,,,,,,,,,,,,,,,,,,,,,,,1,1.2526678059948608,,,,,,,,,,,,,,,,,,,,,,,,,,,,061419_p1,001,2019_Jun_14_1401,body_behavioural,3.0.4,59.981604842409226,
2,The waitress arrived and asked if they were ready to order.,3,2,None,,,,,,0,2,2,2,,,,,0,16,16,16,,,,,,,,,,,,,,,,,,,,,,,,,,,,,,,,,,,9,2.870682367007248,,,,,,,,,,,,,,,,,,,,,,,,,,,,061419_p1,001,2019_Jun_14_1401,body_behavioural,3.0.4,59.981604842409226,
2,"Mr. Gordon chose the medium-rare steak and a martini, and Mr. Shelton ordered the veal and a manhattan. ",3,2,None,,,,,,0,2,2,2,,,,,0,17,17,17,,,,,,,,,,,,,,,,,,,,,,,,,,,,,,,,,,,1,2.1033734799711965,,,,,,,,,,,,,,,,,,,,,,,,,,,,061419_p1,001,2019_Jun_14_1401,body_behavioural,3.0.4,59.981604842409226,
2,"Then Mr. Shelton continued, “Look, I’ve talked to other members of the board, and we are prepared to offer $600 million to buy your company. ",3,2,None,,,,,,0,2,2,2,,,,,0,18,18,18,,,,,,,,,,,,,,,,,,,,,,,,,,,,,,,,,,,9,4.767008079972584,,,,,,,,,,,,,,,,,,,,,,,,,,,,061419_p1,001,2019_Jun_14_1401,body_behavioural,3.0.4,59.981604842409226,
2,"We'd keep on all of your current employees, and you would join as the director of your company branch.” ",3,2,None,,,,,,0,2,2,2,,,,,0,19,19,19,,,,,,,,,,,,,,,,,,,,,,,,,,,,,,,,,,,1,7.270775157958269,,,,,,,,,,,,,,,,,,,,,,,,,,,,061419_p1,001,2019_Jun_14_1401,body_behavioural,3.0.4,59.981604842409226,
2,"Mr. Gordon looked at Mr. Shelton skeptically for a few moments considering his response until he said, “Mr. Shelton, I think that you make a compelling offer, but there are definitely some disadvantages to attaching our small, streamlined productions to a large company like yours.",3,3,None,,,,,,0,2,2,2,,,,,0,20,20,20,,,,,,,,,,,,,,,,,,,,,,,,,,,,,,,,,,,1,6.853600364993326,,,,,,,,,,,,,,,,,,,,,,,,,,,,061419_p1,001,2019_Jun_14_1401,body_behavioural,3.0.4,59.981604842409226,
2,"We operate in a very different way than a large company, and the kind of administrative complexity that makes the scale of your productions possible would suffocate our business.",3,3,None,,,,,,0,2,2,2,,,,,0,21,21,21,,,,,,,,,,,,,,,,,,,,,,,,,,,,,,,,,,,1,4.703587219992187,,,,,,,,,,,,,,,,,,,,,,,,,,,,061419_p1,001,2019_Jun_14_1401,body_behavioural,3.0.4,59.981604842409226,
2,"With our product, scaling-up doesn’t necessarily make sense.” ",3,3,None,,,,,,0,2,2,2,,,,,0,22,22,22,,,,,,,,,,,,,,,,,,,,,,,,,,,,,,,,,,,1,6.370794204995036,,,,,,,,,,,,,,,,,,,,,,,,,,,,061419_p1,001,2019_Jun_14_1401,body_behavioural,3.0.4,59.981604842409226,
2,Mr. Shelton had expected this response and had come prepared.,3,3,None,,,,,,0,2,2,2,,,,,0,23,23,23,,,,,,,,,,,,,,,,,,,,,,,,,,,,,,,,,,,9,4.4532533349702135,,,,,,,,,,,,,,,,,,,,,,,,,,,,061419_p1,001,2019_Jun_14_1401,body_behavioural,3.0.4,59.981604842409226,
2,He began laying out the details of how he had handled similar acquisitions successfully in the past.,3,3,None,,,,,,0,2,2,2,,,,,0,24,24,24,,,,,,,,,,,,,,,,,,,,,,,,,,,,,,,,,,,1,3.237015313003212,,,,,,,,,,,,,,,,,,,,,,,,,,,,061419_p1,001,2019_Jun_14_1401,body_behavioural,3.0.4,59.981604842409226,
2,"He also played out projections of how Mr. Gordon’s company could out-compete their own main competitor in the industry, TechJet, by using the resources of a larger corporation. ",3,3,None,,,,,,0,2,2,2,,,,,0,25,25,25,,,,,,,,,,,,,,,,,,,,,,,,,,,,,,,,,,,1,5.619895765034016,,,,,,,,,,,,,,,,,,,,,,,,,,,,061419_p1,001,2019_Jun_14_1401,body_behavioural,3.0.4,59.981604842409226,
2,"Mr. Gordon was impressed, and they went back and forth hashing out what the company configuration would look like post-merger. ",3,3,None,,,,,,0,2,2,2,,,,,0,26,26,26,,,,,,,,,,,,,,,,,,,,,,,,,,,,,,,,,,,1,3.6869336219970137,,,,,,,,,,,,,,,,,,,,,,,,,,,,061419_p1,001,2019_Jun_14_1401,body_behavioural,3.0.4,59.981604842409226,
2,The waitress brought out their food on a large tray.,4,3,None,,,,,,0,2,2,2,,,,,0,27,27,27,,,,,,,,,,,,,,,,,,,,,,,,,,,,,,,,,,,9,2.2365383579744957,,,,,,,,,,,,,,,,,,,,,,,,,,,,061419_p1,001,2019_Jun_14_1401,body_behavioural,3.0.4,59.981604842409226,
2,“Oh this looks so good!” Mr. Gordon said. ,4,3,None,,,,,,0,2,2,2,,,,,0,28,28,28,,,,,,,,,,,,,,,,,,,,,,,,,,,,,,,,,,,1,1.2673607949982397,,,,,,,,,,,,,,,,,,,,,,,,,,,,061419_p1,001,2019_Jun_14_1401,body_behavioural,3.0.4,59.981604842409226,
2, “Can I get you anything else?” the waitress asked.,4,3,None,,,,,,0,2,2,2,,,,,0,29,29,29,,,,,,,,,,,,,,,,,,,,,,,,,,,,,,,,,,,1,2.4341311819734983,,,,,,,,,,,,,,,,,,,,,,,,,,,,061419_p1,001,2019_Jun_14_1401,body_behavioural,3.0.4,59.981604842409226,
2,They declined and began to eat. ,4,3,None,,,,,,0,2,2,2,,,,,0,30,30,30,,,,,,,,,,,,,,,,,,,,,,,,,,,,,,,,,,,9,1.719873288006056,,,,,,,,,,,,,,,,,,,,,,,,,,,,061419_p1,001,2019_Jun_14_1401,body_behavioural,3.0.4,59.981604842409226,
2,The meal was subpar- they both found the meat to be a bit overcooked and dry. ,4,3,None,,,,,,0,2,2,2,,,,,0,31,31,31,,,,,,,,,,,,,,,,,,,,,,,,,,,,,,,,,,,1,4.303562201966997,,,,,,,,,,,,,,,,,,,,,,,,,,,,061419_p1,001,2019_Jun_14_1401,body_behavioural,3.0.4,59.981604842409226,
2,"Mr. Gordon, after taking a contemplative bite and swallowing, said, “Mr. Shelton, I think we have a deal. ",4,4,None,,,,,,0,2,2,2,,,,,0,32,32,32,,,,,,,,,,,,,,,,,,,,,,,,,,,,,,,,,,,1,8.770328097976744,,,,,,,,,,,,,,,,,,,,,,,,,,,,061419_p1,001,2019_Jun_14_1401,body_behavioural,3.0.4,59.981604842409226,
2,"If you can guarantee that I can still have the final say in the all the work done by my team, I think this could be beneficial for both of us.",4,4,None,,,,,,0,2,2,2,,,,,0,33,33,33,,,,,,,,,,,,,,,,,,,,,,,,,,,,,,,,,,,1,4.52039328601677,,,,,,,,,,,,,,,,,,,,,,,,,,,,061419_p1,001,2019_Jun_14_1401,body_behavioural,3.0.4,59.981604842409226,
2,I propose a toast to the merging of our companies.”,4,4,None,,,,,,0,2,2,2,,,,,0,34,34,34,,,,,,,,,,,,,,,,,,,,,,,,,,,,,,,,,,,1,1.6506606350303628,,,,,,,,,,,,,,,,,,,,,,,,,,,,061419_p1,001,2019_Jun_14_1401,body_behavioural,3.0.4,59.981604842409226,
2,Mr. Shelton grinned and lifted his martini to clink glasses.,4,4,None,,,,,,0,2,2,2,,,,,0,35,35,35,,,,,,,,,,,,,,,,,,,,,,,,,,,,,,,,,,,1,1.5197250850033015,,,,,,,,,,,,,,,,,,,,,,,,,,,,061419_p1,001,2019_Jun_14_1401,body_behavioural,3.0.4,59.981604842409226,
2,"He said, “Cheers to a lifelong partnership and to the growth of our company.” ",4,4,None,,,,,,0,2,2,2,,,,,0,36,36,36,,,,,,,,,,,,,,,,,,,,,,,,,,,,,,,,,,,1,1.2864479100098833,,,,,,,,,,,,,,,,,,,,,,,,,,,,061419_p1,001,2019_Jun_14_1401,body_behavioural,3.0.4,59.981604842409226,
2,,,,,,,,,,0,2,2,2,,,,,,,,,,,,,,,,,,,,,,,,,,,,,,,,,,,,,,,,,,,,,,,,,,,,,,,,,,,,,,,,,,,,,,,,061419_p1,001,2019_Jun_14_1401,body_behavioural,3.0.4,59.981604842409226,
3,,,,,,,,,,0,3,3,3,0,0,0,0,,,,,,,,,,,,,,,,,,,,,,,,,,,,,space,1.136434497020673,space,1.252797010994982,space,0.6673559100017883,,,,,,,,,,,,,,,,,,,,,,,,,,,,,,,,,,061419_p1,001,2019_Jun_14_1401,body_behavioural,3.0.4,59.981604842409226,
3,The grocery store was not the place Emmanuella and Liam wanted to be at the moment considering that they had been fighting to the point where Emmanuella was thinking of breaking up with Liam.,1.0,1.0,13.0,,,,,,0,3,3,3,,,,,0,0,0,0,,,,,,,,,,,,,,,,,,,,,,,,,,,,,,,space,0.9865403520525433,space,0.7872637680266052,1,8.236993055033963,,,,,,,,,,,,,,,,,,,,,,,,,,,,061419_p1,001,2019_Jun_14_1401,body_behavioural,3.0.4,59.981604842409226,
3,Emmanuella had been thinking of breaking up with Liam for the past 5 months.,None,None,None,,,,,,0,3,3,3,,,,,0,1,1,1,,,,,,,,,,,,,,,,,,,,,,,,,,,,,,,,,,,1,7.390803540998604,,,,,,,,,,,,,,,,,,,,,,,,,,,,061419_p1,001,2019_Jun_14_1401,body_behavioural,3.0.4,59.981604842409226,
3,"Despite the current tension, they had to go grocery shopping because they were hosting a dinner party for friends that evening and had little at home with which to cook. ",1.0,1.0,None,,,,,,0,3,3,3,,,,,0,2,2,2,,,,,,,,,,,,,,,,,,,,,,,,,,,,,,,,,,,9,6.601122165040579,,,,,,,,,,,,,,,,,,,,,,,,,,,,061419_p1,001,2019_Jun_14_1401,body_behavioural,3.0.4,59.981604842409226,
3,"The grocery store smelled like lavender upon entering and was dimly lit with pine shelves in the entrance and obscure, organic products displayed on them.",1.0,1.0,None,,,,,,0,3,3,3,,,,,0,3,3,3,,,,,,,,,,,,,,,,,,,,,,,,,,,,,,,,,,,1,8.920352418033872,,,,,,,,,,,,,,,,,,,,,,,,,,,,061419_p1,001,2019_Jun_14_1401,body_behavioural,3.0.4,59.981604842409226,
3,"In the pasta section, Emmanuella grabbed a few boxes of bow-tie pasta.",2.0,1.0,None,,,,,,0,3,3,3,,,,,0,4,4,4,,,,,,,,,,,,,,,,,,,,,,,,,,,,,,,,,,,9,7.8036757570225745,,,,,,,,,,,,,,,,,,,,,,,,,,,,061419_p1,001,2019_Jun_14_1401,body_behavioural,3.0.4,59.981604842409226,
3,"“I guess we are having a pasta dish tonight,” Liam said.",2.0,1.0,None,,,,,,0,3,3,3,,,,,0,5,5,5,,,,,,,,,,,,,,,,,,,,,,,,,,,,,,,,,,,1,1.7005607369937934,,,,,,,,,,,,,,,,,,,,,,,,,,,,061419_p1,001,2019_Jun_14_1401,body_behavioural,3.0.4,59.981604842409226,
3,"Emmanuella looked back at him and said, “Well if you were going to actually help cook, I would be fine with something else.”",2.0,1.0,None,,,,,,0,3,3,3,,,,,0,6,6,6,,,,,,,,,,,,,,,,,,,,,,,,,,,,,,,,,,,1,2.903202635992784,,,,,,,,,,,,,,,,,,,,,,,,,,,,061419_p1,001,2019_Jun_14_1401,body_behavioural,3.0.4,59.981604842409226,
3,"Liam sighed, and finally said, “You know- you don’t want me to help.",2.0,1.0,None,,,,,,0,3,3,3,,,,,0,7,7,7,,,,,,,,,,,,,,,,,,,,,,,,,,,,,,,,,,,1,4.920565385022201,,,,,,,,,,,,,,,,,,,,,,,,,,,,061419_p1,001,2019_Jun_14_1401,body_behavioural,3.0.4,59.981604842409226,
3,"I try to, but it seems like I always get in the way!” ",2.0,1.0,None,,,,,,0,3,3,3,,,,,0,8,8,8,,,,,,,,,,,,,,,,,,,,,,,,,,,,,,,,,,,1,3.1528055630042218,,,,,,,,,,,,,,,,,,,,,,,,,,,,061419_p1,001,2019_Jun_14_1401,body_behavioural,3.0.4,59.981604842409226,
3,Emmanuella shook her head and dropped the pasta boxes in the basket she was holding.,2.0,1.0,None,,,,,,0,3,3,3,,,,,0,9,9,9,,,,,,,,,,,,,,,,,,,,,,,,,,,,,,,,,,,9,2.520417655003257,,,,,,,,,,,,,,,,,,,,,,,,,,,,061419_p1,001,2019_Jun_14_1401,body_behavioural,3.0.4,59.981604842409226,
3," “Like you even try,” she mumbled to herself. ",2.0,1.0,None,,,,,,0,3,3,3,,,,,0,10,10,10,,,,,,,,,,,,,,,,,,,,,,,,,,,,,,,,,,,1,2.837186870048754,,,,,,,,,,,,,,,,,,,,,,,,,,,,061419_p1,001,2019_Jun_14_1401,body_behavioural,3.0.4,59.981604842409226,
3,She continued down the aisle and studied a jar of vodka sauce and a can of olives before putting them in the basket as well. ,2.0,1.0,None,,,,,,0,3,3,3,,,,,0,11,11,11,,,,,,,,,,,,,,,,,,,,,,,,,,,,,,,,,,,1,3.2368184599909,,,,,,,,,,,,,,,,,,,,,,,,,,,,061419_p1,001,2019_Jun_14_1401,body_behavioural,3.0.4,59.981604842409226,
3,"Emmanuella suddenly wrinkled her eyebrows, turned to Liam, and said, “I want to break up since I’m tired of the constant fighting. ",2.0,2.0,None,,,,,,0,3,3,3,,,,,0,12,12,12,,,,,,,,,,,,,,,,,,,,,,,,,,,,,,,,,,,9,5.45344633795321,,,,,,,,,,,,,,,,,,,,,,,,,,,,061419_p1,001,2019_Jun_14_1401,body_behavioural,3.0.4,59.981604842409226,
3,"I was going to wait until after this horribly-timed dinner party tonight to talk about this, but I might as well say it now.",2.0,2.0,None,,,,,,0,3,3,3,,,,,0,13,13,13,,,,,,,,,,,,,,,,,,,,,,,,,,,,,,,,,,,1,2.736450965050608,,,,,,,,,,,,,,,,,,,,,,,,,,,,061419_p1,001,2019_Jun_14_1401,body_behavioural,3.0.4,59.981604842409226,
3,"I feel like when we try to do anything anymore it ends up unpleasant for the stupidest reasons, and I am just past trying to work things out.”",2.0,2.0,None,,,,,,0,3,3,3,,,,,0,14,14,14,,,,,,,,,,,,,,,,,,,,,,,,,,,,,,,,,,,1,3.2528802740271203,,,,,,,,,,,,,,,,,,,,,,,,,,,,061419_p1,001,2019_Jun_14_1401,body_behavioural,3.0.4,59.981604842409226,
3,Liam was nodding automatically.,2.0,2.0,None,,,,,,0,3,3,3,,,,,0,15,15,15,,,,,,,,,,,,,,,,,,,,,,,,,,,,,,,,,,,1,1.7361138389678672,,,,,,,,,,,,,,,,,,,,,,,,,,,,061419_p1,001,2019_Jun_14_1401,body_behavioural,3.0.4,59.981604842409226,
3,"In the checkout area, there was only one station open, Station 2, but it was not very crowded.",3.0,2.0,None,,,,,,0,3,3,3,,,,,0,16,16,16,,,,,,,,,,,,,,,,,,,,,,,,,,,,,,,,,,,9,3.6866469999658875,,,,,,,,,,,,,,,,,,,,,,,,,,,,061419_p1,001,2019_Jun_14_1401,body_behavioural,3.0.4,59.981604842409226,
3,They got in line.,3.0,2.0,None,,,,,,0,3,3,3,,,,,0,17,17,17,,,,,,,,,,,,,,,,,,,,,,,,,,,,,,,,,,,1,0.7868543119984679,,,,,,,,,,,,,,,,,,,,,,,,,,,,061419_p1,001,2019_Jun_14_1401,body_behavioural,3.0.4,59.981604842409226,
3,"Liam gazed in the direction of the magazines, but his eyes were glazed over as he was working things out in his head while Emmanuella scrutinized the pasta sauce again. ",3.0,2.0,None,,,,,,0,3,3,3,,,,,0,18,18,18,,,,,,,,,,,,,,,,,,,,,,,,,,,,,,,,,,,1,5.553602126950864,,,,,,,,,,,,,,,,,,,,,,,,,,,,061419_p1,001,2019_Jun_14_1401,body_behavioural,3.0.4,59.981604842409226,
3,"After a few minutes of thinking, Liam recollected himself, turned to her, and sighed, “Yes, I think the same thing.",3.0,3.0,None,,,,,,0,3,3,3,,,,,0,19,19,19,,,,,,,,,,,,,,,,,,,,,,,,,,,,,,,,,,,1,4.019906731962692,,,,,,,,,,,,,,,,,,,,,,,,,,,,061419_p1,001,2019_Jun_14_1401,body_behavioural,3.0.4,59.981604842409226,
3,I think we should break up because we could definitely be happier with other people.” ,3.0,3.0,None,,,,,,0,3,3,3,,,,,0,20,20,20,,,,,,,,,,,,,,,,,,,,,,,,,,,,,,,,,,,1,4.519391416979488,,,,,,,,,,,,,,,,,,,,,,,,,,,,061419_p1,001,2019_Jun_14_1401,body_behavioural,3.0.4,59.981604842409226,
3,Emmanuella nodded as she listened. ,3.0,3.0,None,,,,,,0,3,3,3,,,,,0,21,21,21,,,,,,,,,,,,,,,,,,,,,,,,,,,,,,,,,,,1,1.7365630250424147,,,,,,,,,,,,,,,,,,,,,,,,,,,,061419_p1,001,2019_Jun_14_1401,body_behavioural,3.0.4,59.981604842409226,
3,The cashier scanned their groceries.,4.0,3.0,None,,,,,,0,3,3,3,,,,,0,22,22,22,,,,,,,,,,,,,,,,,,,,,,,,,,,,,,,,,,,9,2.2668957919813693,,,,,,,,,,,,,,,,,,,,,,,,,,,,061419_p1,001,2019_Jun_14_1401,body_behavioural,3.0.4,59.981604842409226,
3,"The cost came to $30, and Emmanuella paid with her credit card.",4.0,3.0,None,,,,,,0,3,3,3,,,,,0,23,23,23,,,,,,,,,,,,,,,,,,,,,,,,,,,,,,,,,,,1,2.2199159300071187,,,,,,,,,,,,,,,,,,,,,,,,,,,,061419_p1,001,2019_Jun_14_1401,body_behavioural,3.0.4,59.981604842409226,
3,"She asked Liam politely to take the bags, and he obliged, following her to the exit. ",4.0,3.0,None,,,,,,0,3,3,3,,,,,0,24,24,24,,,,,,,,,,,,,,,,,,,,,,,,,,,,,,,,,,,9,3.437240512983408,,,,,,,,,,,,,,,,,,,,,,,,,,,,061419_p1,001,2019_Jun_14_1401,body_behavioural,3.0.4,59.981604842409226,
3,"Filled with a sudden wave of sadness, Emmanuella said, “Liam, I think we are making the right decision- this is good.”",4.0,4.0,None,,,,,,0,3,3,3,,,,,0,25,25,25,,,,,,,,,,,,,,,,,,,,,,,,,,,,,,,,,,,1,2.269877059967257,,,,,,,,,,,,,,,,,,,,,,,,,,,,061419_p1,001,2019_Jun_14_1401,body_behavioural,3.0.4,59.981604842409226,
3,"“I agree,” he said, relieved at the hope he was entertaining that they had just gotten through their last fight. ",4.0,4.0,None,,,,,,0,3,3,3,,,,,0,26,26,26,,,,,,,,,,,,,,,,,,,,,,,,,,,,,,,,,,,1,4.2701077070087194,,,,,,,,,,,,,,,,,,,,,,,,,,,,061419_p1,001,2019_Jun_14_1401,body_behavioural,3.0.4,59.981604842409226,
3,"“I think we can still host this dinner tonight, as long as you're still on board,” Emmanuella said.",4.0,4.0,None,,,,,,0,3,3,3,,,,,0,27,27,27,,,,,,,,,,,,,,,,,,,,,,,,,,,,,,,,,,,9,5.353341900045052,,,,,,,,,,,,,,,,,,,,,,,,,,,,061419_p1,001,2019_Jun_14_1401,body_behavioural,3.0.4,59.981604842409226,
3,"Liam nodded, “Yes, let’s just not tell anyone we’ve broken up tonight.” ",4.0,4.0,None,,,,,,0,3,3,3,,,,,0,28,28,28,,,,,,,,,,,,,,,,,,,,,,,,,,,,,,,,,,,1,1.4523020639899187,,,,,,,,,,,,,,,,,,,,,,,,,,,,061419_p1,001,2019_Jun_14_1401,body_behavioural,3.0.4,59.981604842409226,
3,"Emmanuella laughed, “Whoever leaks it loses their right to the cat.”",4.0,4.0,None,,,,,,0,3,3,3,,,,,0,29,29,29,,,,,,,,,,,,,,,,,,,,,,,,,,,,,,,,,,,1,4.186594709986821,,,,,,,,,,,,,,,,,,,,,,,,,,,,061419_p1,001,2019_Jun_14_1401,body_behavioural,3.0.4,59.981604842409226,
3,"Liam chuckled and responded, “Hey!",4.0,4.0,None,,,,,,0,3,3,3,,,,,0,30,30,30,,,,,,,,,,,,,,,,,,,,,,,,,,,,,,,,,,,1,1.6197936960379593,,,,,,,,,,,,,,,,,,,,,,,,,,,,061419_p1,001,2019_Jun_14_1401,body_behavioural,3.0.4,59.981604842409226,
3,Luna is mine and I want her back.”,4.0,4.0,None,,,,,,0,3,3,3,,,,,0,31,31,31,,,,,,,,,,,,,,,,,,,,,,,,,,,,,,,,,,,1,4.336733684991486,,,,,,,,,,,,,,,,,,,,,,,,,,,,061419_p1,001,2019_Jun_14_1401,body_behavioural,3.0.4,59.981604842409226,
3,"Emmanuella rolled her eyes, knowing the cat would be a whole other issue to sort out later.
",4.0,4.0,None,,,,,,0,3,3,3,,,,,0,32,32,32,,,,,,,,,,,,,,,,,,,,,,,,,,,,,,,,,,,1,4.970502834999934,,,,,,,,,,,,,,,,,,,,,,,,,,,,061419_p1,001,2019_Jun_14_1401,body_behavioural,3.0.4,59.981604842409226,
3,,,,,,,,,,0,3,3,3,,,,,,,,,,,,,,,,,,,,,,,,,,,,,,,,,,,,,,,,,,,,,,,,,,,,,,,,,,,,,,,,,,,,,,,,061419_p1,001,2019_Jun_14_1401,body_behavioural,3.0.4,59.981604842409226,
4,,,,,,,,,,0,4,4,4,0,0,0,0,,,,,,,,,,,,,,,,,,,,,,,,,,,,,space,2.1205625230213627,space,0.719717021973338,space,0.4679681300185621,,,,,,,,,,,,,,,,,,,,,,,,,,,,,,,,,,061419_p1,001,2019_Jun_14_1401,body_behavioural,3.0.4,59.981604842409226,
4,"Ms. Bianchi and Ms. Morrison walked into the grocery store at the same time, and, after a moment of mutual recognition, greeted each other with a handshake.",1.0,1.0,33.0,,,,,,0,4,4,4,,,,,0,0,0,0,,,,,,,,,,,,,,,,,,,,,,,,,,,,,,,space,0.5358129430096596,space,0.5530823349836282,1,10.386303816980217,,,,,,,,,,,,,,,,,,,,,,,,,,,,061419_p1,001,2019_Jun_14_1401,body_behavioural,3.0.4,59.981604842409226,
4,"They were standing in the entrance of the grocery store, which had displays of pumpkins, candy, and halloween decorations set up in different stations around the door. ",1.0,1.0,None,,,,,,0,4,4,4,,,,,0,1,1,1,,,,,,,,,,,,,,,,,,,,,,,,,,,,,,,,,,,1,3.553623530024197,,,,,,,,,,,,,,,,,,,,,,,,,,,,061419_p1,001,2019_Jun_14_1401,body_behavioural,3.0.4,59.981604842409226,
4,"“Thank you again for inviting me here to discuss my business proposal,” said Ms. Bianchi.",1.0,1.0,None,,,,,,0,4,4,4,,,,,0,2,2,2,,,,,,,,,,,,,,,,,,,,,,,,,,,,,,,,,,,1,2.118927725998219,,,,,,,,,,,,,,,,,,,,,,,,,,,,061419_p1,001,2019_Jun_14_1401,body_behavioural,3.0.4,59.981604842409226,
4,“It’s a pleasure to be out of the office.” ,1.0,1.0,None,,,,,,0,4,4,4,,,,,0,3,3,3,,,,,,,,,,,,,,,,,,,,,,,,,,,,,,,,,,,1,1.5858670479501598,,,,,,,,,,,,,,,,,,,,,,,,,,,,061419_p1,001,2019_Jun_14_1401,body_behavioural,3.0.4,59.981604842409226,
4,"As an account representative for an Italian cheese company that was trying to expand its outreach to American grocery stores, this meeting was pivotal for Ms. Bianchi.",1.0,1.0,None,,,,,,0,4,4,4,,,,,0,4,4,4,,,,,,,,,,,,,,,,,,,,,,,,,,,,,,,,,,,9,4.336957782972604,,,,,,,,,,,,,,,,,,,,,,,,,,,,061419_p1,001,2019_Jun_14_1401,body_behavioural,3.0.4,59.981604842409226,
4,"Her sales target, Ms. Morrison, was the senior product manager for a corporate grocer and she had a say in the products distributed in stores across the West Coast.",1.0,1.0,None,,,,,,0,4,4,4,,,,,0,5,5,5,,,,,,,,,,,,,,,,,,,,,,,,,,,,,,,,,,,1,19.304025878023822,,,,,,,,,,,,,,,,,,,,,,,,,,,,061419_p1,001,2019_Jun_14_1401,body_behavioural,3.0.4,59.981604842409226,
4,"Ms. Morrison was also known for doing things unconventionally: for example, she said that she liked to make deals with suppliers in the place where the products were sold- “to keep their minds focused on what’s important.” ",1.0,1.0,None,,,,,,0,4,4,4,,,,,0,6,6,6,,,,,,,,,,,,,,,,,,,,,,,,,,,,,,,,,,,9,7.853936992003582,,,,,,,,,,,,,,,,,,,,,,,,,,,,061419_p1,001,2019_Jun_14_1401,body_behavioural,3.0.4,59.981604842409226,
4,"In the cheese section of the grocery store, Ms. Morrison motioned to the parmesan.",2.0,1.0,None,,,,,,0,4,4,4,,,,,0,7,7,7,,,,,,,,,,,,,,,,,,,,,,,,,,,,,,,,,,,9,6.503517905017361,,,,,,,,,,,,,,,,,,,,,,,,,,,,061419_p1,001,2019_Jun_14_1401,body_behavioural,3.0.4,59.981604842409226,
4,“We have quite a selection here.,2.0,1.0,None,,,,,,0,4,4,4,,,,,0,8,8,8,,,,,,,,,,,,,,,,,,,,,,,,,,,,,,,,,,,1,1.2528122649528086,,,,,,,,,,,,,,,,,,,,,,,,,,,,061419_p1,001,2019_Jun_14_1401,body_behavioural,3.0.4,59.981604842409226,
4,I don’t know that we need an additional section for gourmet cheeses.” ,2.0,1.0,None,,,,,,0,4,4,4,,,,,0,9,9,9,,,,,,,,,,,,,,,,,,,,,,,,,,,,,,,,,,,1,2.253207234025467,,,,,,,,,,,,,,,,,,,,,,,,,,,,061419_p1,001,2019_Jun_14_1401,body_behavioural,3.0.4,59.981604842409226,
4," Ms. Bianchi did not hesitate but launched into her pitch: “Ms. Morrison, I think you would agree that selling food is more than just providing variety, but also about providing the highest quality.",2.0,2.0,None,,,,,,0,4,4,4,,,,,0,10,10,10,,,,,,,,,,,,,,,,,,,,,,,,,,,,,,,,,,,1,7.570369769993704,,,,,,,,,,,,,,,,,,,,,,,,,,,,061419_p1,001,2019_Jun_14_1401,body_behavioural,3.0.4,59.981604842409226,
4,You don’t have cheeses made in America that are like ours- it is true.,2.0,2.0,None,,,,,,0,4,4,4,,,,,0,11,11,11,,,,,,,,,,,,,,,,,,,,,,,,,,,,,,,,,,,1,4.153261890052818,,,,,,,,,,,,,,,,,,,,,,,,,,,,061419_p1,001,2019_Jun_14_1401,body_behavioural,3.0.4,59.981604842409226,
4,The availability of a product of excellent quality leads to the appreciation of the product.,2.0,2.0,None,,,,,,0,4,4,4,,,,,0,12,12,12,,,,,,,,,,,,,,,,,,,,,,,,,,,,,,,,,,,1,4.236617440008558,,,,,,,,,,,,,,,,,,,,,,,,,,,,061419_p1,001,2019_Jun_14_1401,body_behavioural,3.0.4,59.981604842409226,
4,"Your consumers will want to buy other, finer products to compliment that first ingredient, and suddenly your customer will be consuming in a new, more profitable way.",2.0,2.0,None,,,,,,0,4,4,4,,,,,0,13,13,13,,,,,,,,,,,,,,,,,,,,,,,,,,,,,,,,,,,1,8.070170356018934,,,,,,,,,,,,,,,,,,,,,,,,,,,,061419_p1,001,2019_Jun_14_1401,body_behavioural,3.0.4,59.981604842409226,
4,"I propose that you give it a shot: buy $1500 worth of cheese products for a few stores, and see how the sales increase not only in our cheeses but also in products related to cheeses: crackers, jams, olives.”",2.0,2.0,None,,,,,,0,4,4,4,,,,,0,14,14,14,,,,,,,,,,,,,,,,,,,,,,,,,,,,,,,,,,,1,6.986890072003007,,,,,,,,,,,,,,,,,,,,,,,,,,,,061419_p1,001,2019_Jun_14_1401,body_behavioural,3.0.4,59.981604842409226,
4,"Ms. Bianchi picked up a box of crackers by the cheese section, and said, “Here, I will buy these, and we can try some of our cheeses that I've brought with me.”",2.0,2.0,None,,,,,,0,4,4,4,,,,,0,15,15,15,,,,,,,,,,,,,,,,,,,,,,,,,,,,,,,,,,,9,4.034051260037813,,,,,,,,,,,,,,,,,,,,,,,,,,,,061419_p1,001,2019_Jun_14_1401,body_behavioural,3.0.4,59.981604842409226,
4,"Ms. Morrison, who was thinking about the proposed offer, nodded in agreement and said, “That sounds like a great idea, but those crackers are on me.”",2.0,2.0,None,,,,,,0,4,4,4,,,,,0,16,16,16,,,,,,,,,,,,,,,,,,,,,,,,,,,,,,,,,,,1,4.534514908038545,,,,,,,,,,,,,,,,,,,,,,,,,,,,061419_p1,001,2019_Jun_14_1401,body_behavioural,3.0.4,59.981604842409226,
4,She took the crackers from Ms. Bianchi and also picked up a bottle of ketchup and a case of sparkling water “for later.”,2.0,2.0,None,,,,,,0,4,4,4,,,,,0,17,17,17,,,,,,,,,,,,,,,,,,,,,,,,,,,,,,,,,,,1,4.386586468026508,,,,,,,,,,,,,,,,,,,,,,,,,,,,061419_p1,001,2019_Jun_14_1401,body_behavioural,3.0.4,59.981604842409226,
4,It was very busy in the checkout area.,3.0,2.0,None,,,,,,0,4,4,4,,,,,0,18,18,18,,,,,,,,,,,,,,,,,,,,,,,,,,,,,,,,,,,9,1.619843624997884,,,,,,,,,,,,,,,,,,,,,,,,,,,,061419_p1,001,2019_Jun_14_1401,body_behavioural,3.0.4,59.981604842409226,
4,"People were stocking up for Halloween parties and trick-or-treating, and there were 10 aisles open. ",3.0,2.0,None,,,,,,0,4,4,4,,,,,0,19,19,19,,,,,,,,,,,,,,,,,,,,,,,,,,,,,,,,,,,1,3.1863171049626544,,,,,,,,,,,,,,,,,,,,,,,,,,,,061419_p1,001,2019_Jun_14_1401,body_behavioural,3.0.4,59.981604842409226,
4,They stepped into lane 6 and waited.,3.0,2.0,None,,,,,,0,4,4,4,,,,,0,20,20,20,,,,,,,,,,,,,,,,,,,,,,,,,,,,,,,,,,,1,3.5532735149608925,,,,,,,,,,,,,,,,,,,,,,,,,,,,061419_p1,001,2019_Jun_14_1401,body_behavioural,3.0.4,59.981604842409226,
4,Ms. Bianchi handed to Ms. Morrison a packet with printed graphs of the increase in profits that several other stores in Italy had seen after starting to carry their products.,3.0,2.0,None,,,,,,0,4,4,4,,,,,0,21,21,21,,,,,,,,,,,,,,,,,,,,,,,,,,,,,,,,,,,9,8.70277359499596,,,,,,,,,,,,,,,,,,,,,,,,,,,,061419_p1,001,2019_Jun_14_1401,body_behavioural,3.0.4,59.981604842409226,
4,"After a couple minutes of thinking, Ms. Morrison widened her eyes and said confidently, “You know what, I think you've convinced me that this could work. ",3.0,3.0,None,,,,,,0,4,4,4,,,,,0,22,22,22,,,,,,,,,,,,,,,,,,,,,,,,,,,,,,,,,,,1,5.803616409015376,,,,,,,,,,,,,,,,,,,,,,,,,,,,061419_p1,001,2019_Jun_14_1401,body_behavioural,3.0.4,59.981604842409226,
4,We've been trying to find a way to add a little European cachet to our stores.,3.0,3.0,None,,,,,,0,4,4,4,,,,,0,23,23,23,,,,,,,,,,,,,,,,,,,,,,,,,,,,,,,,,,,1,4.586157229030505,,,,,,,,,,,,,,,,,,,,,,,,,,,,061419_p1,001,2019_Jun_14_1401,body_behavioural,3.0.4,59.981604842409226,
4,"Our competitor, Orange Grocers, hasn’t expanded in this direction yet, and I’d like to beat them to it. ",3.0,3.0,None,,,,,,0,4,4,4,,,,,0,24,24,24,,,,,,,,,,,,,,,,,,,,,,,,,,,,,,,,,,,1,3.4856573499855585,,,,,,,,,,,,,,,,,,,,,,,,,,,,061419_p1,001,2019_Jun_14_1401,body_behavioural,3.0.4,59.981604842409226,
