4,There's still a problem though- I'm worried we'll be paying out the nose for the import taxes.,3.0,3.0,None,,,,,,0,4,4,4,,,,,0,25,25,25,,,,,,,,,,,,,,,,,,,,,,,,,,,,,,,,,,,1,3.8371459739864804,,,,,,,,,,,,,,,,,,,,,,,,,,,,061419_p1,001,2019_Jun_14_1401,body_behavioural,3.0.4,59.981604842409226,
4,Is that the case?",3.0,3.0,None,,,,,,0,4,4,4,,,,,0,26,26,26,,,,,,,,,,,,,,,,,,,,,,,,,,,,,,,,,,,1,1.686295359977521,,,,,,,,,,,,,,,,,,,,,,,,,,,,061419_p1,001,2019_Jun_14_1401,body_behavioural,3.0.4,59.981604842409226,
4,"It was Ms. Morrison’s turn to check out, and the cashier chatted with Ms. Morrison as she scanned the items.",4.0,3.0,None,,,,,,0,4,4,4,,,,,0,27,27,27,,,,,,,,,,,,,,,,,,,,,,,,,,,,,,,,,,,9,5.753430051961914,,,,,,,,,,,,,,,,,,,,,,,,,,,,061419_p1,001,2019_Jun_14_1401,body_behavioural,3.0.4,59.981604842409226,
4,Ms. Morrison was also distinguished for knowing most of the employees personally. ,None,None,None,,,,,,0,4,4,4,,,,,0,28,28,28,,,,,,,,,,,,,,,,,,,,,,,,,,,,,,,,,,,1,4.744407882972155,,,,,,,,,,,,,,,,,,,,,,,,,,,,061419_p1,001,2019_Jun_14_1401,body_behavioural,3.0.4,59.981604842409226,
4,Ms. Bianchi watched in amusement as Ms. Morrison paid the $23 price by writing a check. ,4.0,3.0,None,,,,,,0,4,4,4,,,,,0,29,29,29,,,,,,,,,,,,,,,,,,,,,,,,,,,,,,,,,,,1,4.186219009978231,,,,,,,,,,,,,,,,,,,,,,,,,,,,061419_p1,001,2019_Jun_14_1401,body_behavioural,3.0.4,59.981604842409226,
4,"After Ms. Bianci addressed Ms. Morrison’s concerns, they came to an agreement and would have enough cheese shipments, $20,000 worth, to different stores to qualify for a subsidized import tax. ",4.0,4.0,None,,,,,,0,4,4,4,,,,,0,30,30,30,,,,,,,,,,,,,,,,,,,,,,,,,,,,,,,,,,,9,9.504182901000604,,,,,,,,,,,,,,,,,,,,,,,,,,,,061419_p1,001,2019_Jun_14_1401,body_behavioural,3.0.4,59.981604842409226,
4,"Ms. Morrison had had a small bottle of champagne in her purse, and she pulled it out and popped it in celebration of their deal. ",4.0,4.0,None,,,,,,0,4,4,4,,,,,0,31,31,31,,,,,,,,,,,,,,,,,,,,,,,,,,,,,,,,,,,1,2.8705207830062136,,,,,,,,,,,,,,,,,,,,,,,,,,,,061419_p1,001,2019_Jun_14_1401,body_behavioural,3.0.4,59.981604842409226,
4,Ms. Bianchi decided that she loved doing business with Americans. ,4.0,4.0,None,,,,,,0,4,4,4,,,,,0,32,32,32,,,,,,,,,,,,,,,,,,,,,,,,,,,,,,,,,,,1,2.5035196629469283,,,,,,,,,,,,,,,,,,,,,,,,,,,,061419_p1,001,2019_Jun_14_1401,body_behavioural,3.0.4,59.981604842409226,
4,,,,,,,,,,0,4,4,4,,,,,,,,,,,,,,,,,,,,,,,,,,,,,,,,,,,,,,,,,,,,,,,,,,,,,,,,,,,,,,,,,,,,,,,,061419_p1,001,2019_Jun_14_1401,body_behavioural,3.0.4,59.981604842409226,
5,,,,,,,,,,0,5,5,5,0,0,0,0,,,,,,,,,,,,,,,,,,,,,,,,,,,,,space,3.3007034769980237,space,0.5033045830205083,space,0.7036949089961126,,,,,,,,,,,,,,,,,,,,,,,,,,,,,,,,,,061419_p1,001,2019_Jun_14_1401,body_behavioural,3.0.4,59.981604842409226,
5,"Sven and Isabel walked hurriedly from the cab into the Barcelona Airport after an incredible week with Isabel’s family, and this had wiped away any doubts Sven had had about his decision to propose. ",1,1,22.0,,,,,,0,5,5,5,,,,,0,0,0,0,,,,,,,,,,,,,,,,,,,,,,,,,,,,,,,space,1.9530717830057256,space,1.1191634850110859,1,11.600950021005701,,,,,,,,,,,,,,,,,,,,,,,,,,,,061419_p1,001,2019_Jun_14_1401,body_behavioural,3.0.4,59.981604842409226,
5,They had only been dating for 11 months so this was the first time he had met her family. ,1,1,None,,,,,,0,5,5,5,,,,,0,1,1,1,,,,,,,,,,,,,,,,,,,,,,,,,,,,,,,,,,,1,2.4538182169781066,,,,,,,,,,,,,,,,,,,,,,,,,,,,061419_p1,001,2019_Jun_14_1401,body_behavioural,3.0.4,59.981604842409226,
5,"They were pressed for time at the airport, with an hour and 15 minutes until their flight would take off to go back to the US, but they already had their online boarding passes and no checked luggage. ",1,1,None,,,,,,0,5,5,5,,,,,0,2,2,2,,,,,,,,,,,,,,,,,,,,,,,,,,,,,,,,,,,9,8.73442991200136,,,,,,,,,,,,,,,,,,,,,,,,,,,,061419_p1,001,2019_Jun_14_1401,body_behavioural,3.0.4,59.981604842409226,
5,"Isabel stopped to rummage through her purse to look for her phone, and meanwhile Sven turned his back to her and took the velvet box out of his backpack, opening it to look at the ring he had bought her.",1,2,None,,,,,,0,5,5,5,,,,,0,3,3,3,,,,,,,,,,,,,,,,,,,,,,,,,,,,,,,,,,,1,4.893936969980132,,,,,,,,,,,,,,,,,,,,,,,,,,,,061419_p1,001,2019_Jun_14_1401,body_behavioural,3.0.4,59.981604842409226,
5,"He had received her parents’ blessing during the trip, and he was almost giddy with excitement. ",1,2,None,,,,,,0,5,5,5,,,,,0,4,4,4,,,,,,,,,,,,,,,,,,,,,,,,,,,,,,,,,,,1,1.803246819996275,,,,,,,,,,,,,,,,,,,,,,,,,,,,061419_p1,001,2019_Jun_14_1401,body_behavioural,3.0.4,59.981604842409226,
5,"He tilted the ring backward and forward, despite having already studied it daily since purchasing it a few weeks ago. ",1,2,None,,,,,,0,5,5,5,,,,,0,5,5,5,,,,,,,,,,,,,,,,,,,,,,,,,,,,,,,,,,,1,2.1374752830015495,,,,,,,,,,,,,,,,,,,,,,,,,,,,061419_p1,001,2019_Jun_14_1401,body_behavioural,3.0.4,59.981604842409226,
5,"It was a simple design, with two pink diamonds on a silver band.",1,2,None,,,,,,0,5,5,5,,,,,0,6,6,6,,,,,,,,,,,,,,,,,,,,,,,,,,,,,,,,,,,1,2.7695555849932134,,,,,,,,,,,,,,,,,,,,,,,,,,,,061419_p1,001,2019_Jun_14_1401,body_behavioural,3.0.4,59.981604842409226,
5,"“Sven, I’m good,” Isabel said. ",1,2,None,,,,,,0,5,5,5,,,,,0,7,7,7,,,,,,,,,,,,,,,,,,,,,,,,,,,,,,,,,,,9,6.036670361994766,,,,,,,,,,,,,,,,,,,,,,,,,,,,061419_p1,001,2019_Jun_14_1401,body_behavioural,3.0.4,59.981604842409226,
5,Sven closed the box and discretely put it in his pocket.,1,2,None,,,,,,0,5,5,5,,,,,0,8,8,8,,,,,,,,,,,,,,,,,,,,,,,,,,,,,,,,,,,1,2.886612501984928,,,,,,,,,,,,,,,,,,,,,,,,,,,,061419_p1,001,2019_Jun_14_1401,body_behavioural,3.0.4,59.981604842409226,
5,"They entered the security line, weaving through the roped walkways to the front. ",2,2,None,,,,,,0,5,5,5,,,,,0,9,9,9,,,,,,,,,,,,,,,,,,,,,,,,,,,,,,,,,,,9,6.503559075004887,,,,,,,,,,,,,,,,,,,,,,,,,,,,061419_p1,001,2019_Jun_14_1401,body_behavioural,3.0.4,59.981604842409226,
5,"When they were up, Isabel realized her laptop was buried somewhere in her duffle bag. ",2,2,None,,,,,,0,5,5,5,,,,,0,10,10,10,,,,,,,,,,,,,,,,,,,,,,,,,,,,,,,,,,,1,7.469649805978406,,,,,,,,,,,,,,,,,,,,,,,,,,,,061419_p1,001,2019_Jun_14_1401,body_behavioural,3.0.4,59.981604842409226,
5,"Luckily, at the same time, there was a stall in the line because someone ahead of them had a suspicious amount of metal pieces on his person. ",2,2,None,,,,,,0,5,5,5,,,,,0,11,11,11,,,,,,,,,,,,,,,,,,,,,,,,,,,,,,,,,,,1,5.436820778006222,,,,,,,,,,,,,,,,,,,,,,,,,,,,061419_p1,001,2019_Jun_14_1401,body_behavioural,3.0.4,59.981604842409226,
5,Sven had to hold the growing mound of objects Isabel pulled from her bag until she unearthed the laptop and set it in a bin.,2,2,None,,,,,,0,5,5,5,,,,,0,12,12,12,,,,,,,,,,,,,,,,,,,,,,,,,,,,,,,,,,,1,10.270532029971946,,,,,,,,,,,,,,,,,,,,,,,,,,,,061419_p1,001,2019_Jun_14_1401,body_behavioural,3.0.4,59.981604842409226,
5,"She then gave her bag to Sven, unstrapped her heels, and took the bag back from Sven.",2,2,None,,,,,,0,5,5,5,,,,,0,13,13,13,,,,,,,,,,,,,,,,,,,,,,,,,,,,,,,,,,,1,5.6040664309985,,,,,,,,,,,,,,,,,,,,,,,,,,,,061419_p1,001,2019_Jun_14_1401,body_behavioural,3.0.4,59.981604842409226,
5,"Sven, relieved of his holding duties, hurriedly deposited his own backpack on the belt, and took off his shoes. ",2,2,None,,,,,,0,5,5,5,,,,,0,14,14,14,,,,,,,,,,,,,,,,,,,,,,,,,,,,,,,,,,,1,2.754119874967728,,,,,,,,,,,,,,,,,,,,,,,,,,,,061419_p1,001,2019_Jun_14_1401,body_behavioural,3.0.4,59.981604842409226,
5,"Sven went into the millimeter wave scanner after Isabel, put his hands up, and the metal bars whirled around him.",2,2,None,,,,,,0,5,5,5,,,,,0,15,15,15,,,,,,,,,,,,,,,,,,,,,,,,,,,,,,,,,,,1,3.384252354968339,,,,,,,,,,,,,,,,,,,,,,,,,,,,061419_p1,001,2019_Jun_14_1401,body_behavioural,3.0.4,59.981604842409226,
5,The security guard asked Sven to wait. ,2,2,None,,,,,,0,5,5,5,,,,,0,16,16,16,,,,,,,,,,,,,,,,,,,,,,,,,,,,,,,,,,,1,1.200742631976027,,,,,,,,,,,,,,,,,,,,,,,,,,,,061419_p1,001,2019_Jun_14_1401,body_behavioural,3.0.4,59.981604842409226,
5,"After looking at the monitor, the security guard said, “Sir, please empty your pockets,”.",2,2,None,,,,,,0,5,5,5,,,,,0,17,17,17,,,,,,,,,,,,,,,,,,,,,,,,,,,,,,,,,,,9,4.169709515990689,,,,,,,,,,,,,,,,,,,,,,,,,,,,061419_p1,001,2019_Jun_14_1401,body_behavioural,3.0.4,59.981604842409226,
5,"Isabel, shoeless and wrinkling her eyebrows at Sven, looked at him expectantly.",2,2,None,,,,,,0,5,5,5,,,,,0,18,18,18,,,,,,,,,,,,,,,,,,,,,,,,,,,,,,,,,,,1,10.703702285012696,,,,,,,,,,,,,,,,,,,,,,,,,,,,061419_p1,001,2019_Jun_14_1401,body_behavioural,3.0.4,59.981604842409226,
5,"Realizing that he had forgotten the ring in his pocket, he grabbed Isabel’s, got down on one knee, and opening the velvet box, said, “Isabel, this isn't quite how I'd planned this, but - will you marry me?”",2,3,None,,,,,,0,5,5,5,,,,,0,19,19,19,,,,,,,,,,,,,,,,,,,,,,,,,,,,,,,,,,,1,7.303565307985991,,,,,,,,,,,,,,,,,,,,,,,,,,,,061419_p1,001,2019_Jun_14_1401,body_behavioural,3.0.4,59.981604842409226,
5,He held the ring up to her. ,2,3,None,,,,,,0,5,5,5,,,,,0,20,20,20,,,,,,,,,,,,,,,,,,,,,,,,,,,,,,,,,,,1,4.953486515034456,,,,,,,,,,,,,,,,,,,,,,,,,,,,061419_p1,001,2019_Jun_14_1401,body_behavioural,3.0.4,59.981604842409226,
5,The security guard stood shocked.,2,3,None,,,,,,0,5,5,5,,,,,0,21,21,21,,,,,,,,,,,,,,,,,,,,,,,,,,,,,,,,,,,1,2.0038424840313382,,,,,,,,,,,,,,,,,,,,,,,,,,,,061419_p1,001,2019_Jun_14_1401,body_behavioural,3.0.4,59.981604842409226,
5,All the people who were putting their shoes back on and gathering their belongings stopped and walked closer to the couple.,2,3,None,,,,,,0,5,5,5,,,,,0,22,22,22,,,,,,,,,,,,,,,,,,,,,,,,,,,,,,,,,,,1,4.0533482049941085,,,,,,,,,,,,,,,,,,,,,,,,,,,,061419_p1,001,2019_Jun_14_1401,body_behavioural,3.0.4,59.981604842409226,
5,Isabel didn’t know what to do since she was far too shy to respond in front of all the people around.,2,3,None,,,,,,0,5,5,5,,,,,0,23,23,23,,,,,,,,,,,,,,,,,,,,,,,,,,,,,,,,,,,9,3.685584689024836,,,,,,,,,,,,,,,,,,,,,,,,,,,,061419_p1,001,2019_Jun_14_1401,body_behavioural,3.0.4,59.981604842409226,
5,"Without responding to Sven, she frantically grabbed her and Sven’s shoes, leaving Sven to retrieve the rest, and she quickly walked onto the concourse.",3,3,None,,,,,,0,5,5,5,,,,,0,24,24,24,,,,,,,,,,,,,,,,,,,,,,,,,,,,,,,,,,,1,10.053781550028361,,,,,,,,,,,,,,,,,,,,,,,,,,,,061419_p1,001,2019_Jun_14_1401,body_behavioural,3.0.4,59.981604842409226,
5,"Sven, terrified, grabbed everything and hurried after Isabel onto the concourse shoeless.",3,3,None,,,,,,0,5,5,5,,,,,0,25,25,25,,,,,,,,,,,,,,,,,,,,,,,,,,,,,,,,,,,1,4.253599327988923,,,,,,,,,,,,,,,,,,,,,,,,,,,,061419_p1,001,2019_Jun_14_1401,body_behavioural,3.0.4,59.981604842409226,
5,Sven eventually caught up to her with their bags and the open ring box.,3,3,None,,,,,,0,5,5,5,,,,,0,26,26,26,,,,,,,,,,,,,,,,,,,,,,,,,,,,,,,,,,,1,3.652726939995773,,,,,,,,,,,,,,,,,,,,,,,,,,,,061419_p1,001,2019_Jun_14_1401,body_behavioural,3.0.4,59.981604842409226,
5,"She stopped and with wide, excited eyes, shouted, “Of course yes, Sven!” ",3,4,None,,,,,,0,5,5,5,,,,,0,27,27,27,,,,,,,,,,,,,,,,,,,,,,,,,,,,,,,,,,,1,3.7529208560008556,,,,,,,,,,,,,,,,,,,,,,,,,,,,061419_p1,001,2019_Jun_14_1401,body_behavioural,3.0.4,59.981604842409226,
5,"They dropped their belongings and hugged, and Sven put the ring onto Isabel’s finger. ",3,4,None,,,,,,0,5,5,5,,,,,0,28,28,28,,,,,,,,,,,,,,,,,,,,,,,,,,,,,,,,,,,1,2.286459802999161,,,,,,,,,,,,,,,,,,,,,,,,,,,,061419_p1,001,2019_Jun_14_1401,body_behavioural,3.0.4,59.981604842409226,
5,"“Isabel, you scared me!” he said. ",3,4,None,,,,,,0,5,5,5,,,,,0,29,29,29,,,,,,,,,,,,,,,,,,,,,,,,,,,,,,,,,,,1,2.0531679849955253,,,,,,,,,,,,,,,,,,,,,,,,,,,,061419_p1,001,2019_Jun_14_1401,body_behavioural,3.0.4,59.981604842409226,
5,"After getting their shoes back on, they practically floated to gate C40.",3,4,None,,,,,,0,5,5,5,,,,,0,30,30,30,,,,,,,,,,,,,,,,,,,,,,,,,,,,,,,,,,,1,2.134014425042551,,,,,,,,,,,,,,,,,,,,,,,,,,,,061419_p1,001,2019_Jun_14_1401,body_behavioural,3.0.4,59.981604842409226,
5,Sven was so happy he even high-fived a confused shoe-shine attendant as they passed.,3,4,None,,,,,,0,5,5,5,,,,,0,31,31,31,,,,,,,,,,,,,,,,,,,,,,,,,,,,,,,,,,,1,3.6865398479858413,,,,,,,,,,,,,,,,,,,,,,,,,,,,061419_p1,001,2019_Jun_14_1401,body_behavioural,3.0.4,59.981604842409226,
5,Isabel texted her best friend telling her the news as they walked. ,3,4,None,,,,,,0,5,5,5,,,,,0,32,32,32,,,,,,,,,,,,,,,,,,,,,,,,,,,,,,,,,,,1,2.3700357970083132,,,,,,,,,,,,,,,,,,,,,,,,,,,,061419_p1,001,2019_Jun_14_1401,body_behavioural,3.0.4,59.981604842409226,
5,"Having arrived at their gate, they waited, until the attendant called for passengers, and they scanned their tickets to board the plane.",4,4,None,,,,,,0,5,5,5,,,,,0,33,33,33,,,,,,,,,,,,,,,,,,,,,,,,,,,,,,,,,,,9,8.553622427978553,,,,,,,,,,,,,,,,,,,,,,,,,,,,061419_p1,001,2019_Jun_14_1401,body_behavioural,3.0.4,59.981604842409226,
5,"They walked through the connecting tunnel to the plane and sat together in first class, in seats 2A and 2B.",4,4,None,,,,,,0,5,5,5,,,,,0,34,34,34,,,,,,,,,,,,,,,,,,,,,,,,,,,,,,,,,,,1,3.8864350559888408,,,,,,,,,,,,,,,,,,,,,,,,,,,,061419_p1,001,2019_Jun_14_1401,body_behavioural,3.0.4,59.981604842409226,
5,"Some of their neighboring passengers who had witnessed the proposal at security congratulated them, and a woman next to them showed them that she had been live-tweeting the whole event and that it was already going viral online.",4,4,None,,,,,,0,5,5,5,,,,,0,35,35,35,,,,,,,,,,,,,,,,,,,,,,,,,,,,,,,,,,,1,4.969589595042635,,,,,,,,,,,,,,,,,,,,,,,,,,,,061419_p1,001,2019_Jun_14_1401,body_behavioural,3.0.4,59.981604842409226,
5,"Isabel slid down in her seat with her hands over her face, embarrassed and overjoyed at the same time.
",4,4,None,,,,,,0,5,5,5,,,,,0,36,36,36,,,,,,,,,,,,,,,,,,,,,,,,,,,,,,,,,,,1,2.387436898017768,,,,,,,,,,,,,,,,,,,,,,,,,,,,061419_p1,001,2019_Jun_14_1401,body_behavioural,3.0.4,59.981604842409226,
5,,,,,,,,,,0,5,5,5,,,,,,,,,,,,,,,,,,,,,,,,,,,,,,,,,,,,,,,,,,,,,,,,,,,,,,,,,,,,,,,,,,,,,,,,061419_p1,001,2019_Jun_14_1401,body_behavioural,3.0.4,59.981604842409226,
6,,,,,,,,,,0,6,6,6,0,0,0,0,,,,,,,,,,,,,,,,,,,,,,,,,,,,,space,4.8196221250109375,space,0.8701677800272591,space,0.769071084971074,,,,,,,,,,,,,,,,,,,,,,,,,,,,,,,,,,061419_p1,001,2019_Jun_14_1401,body_behavioural,3.0.4,59.981604842409226,
6,"Thomas, dreading the approaching breakup conversation he was about to start, got to Annika’s Finer Diner late but Sadie, his girlfriend, was not there yet.",1,1,11.0,None,None,None,None,,0,6,6,6,,,,,0,0,0,0,,,,,,,,,,,,,,,,,,,,,,,,,,,,,,,space,0.7530457899556495,space,1.0369121030089445,1,20.237571227014996,,,,,,,,,,,,,,,,,,,,,,,,,,,,061419_p1,001,2019_Jun_14_1401,body_behavioural,3.0.4,59.981604842409226,
6,Thomas had been thinking about breaking up with her for 2 months now.,1,1,None,None,None,1.0,None,,0,6,6,6,,,,,0,1,1,1,,,,,,,,,,,,,,,,,,,,,,,,,,,,,,,,,,,1,1.9191557869780809,,,,,,,,,,,,,,,,,,,,,,,,,,,,061419_p1,001,2019_Jun_14_1401,body_behavioural,3.0.4,59.981604842409226,
6,"The restaurant he had chosen to meet at was reminiscent of a diner from the 70’s; there was black and white checkerboard tiling on the floor, a long bar in the front, and booths and stools with red, leather upholstery. ",1,1,None,None,None,None,1.0,,0,6,6,6,,,,,0,2,2,2,,,,,,,,,,,,,,,,,,,,,,,,,,,,,,,,,,,9,4.136046641971916,,,,,,,,,,,,,,,,,,,,,,,,,,,,061419_p1,001,2019_Jun_14_1401,body_behavioural,3.0.4,59.981604842409226,
6,"A bell chimed as the door swung open, and Sadie entered to find Thomas ruminating at the bar.",1,1,None,None,None,None,None,,0,6,6,6,,,,,0,3,3,3,,,,,,,,,,,,,,,,,,,,,,,,,,,,,,,,,,,9,13.036061897000764,,,,,,,,,,,,,,,,,,,,,,,,,,,,061419_p1,001,2019_Jun_14_1401,body_behavioural,3.0.4,59.981604842409226,
6,"He stood up and gave her a side hug, asking quickly, “How was your day?”",1,1,None,None,None,None,None,,0,6,6,6,,,,,0,4,4,4,,,,,,,,,,,,,,,,,,,,,,,,,,,,,,,,,,,1,1.6338191700051539,,,,,,,,,,,,,,,,,,,,,,,,,,,,061419_p1,001,2019_Jun_14_1401,body_behavioural,3.0.4,59.981604842409226,
6,"She clung onto him, “It was okay- I missed you today.”",1,1,None,None,None,None,None,,0,6,6,6,,,,,0,5,5,5,,,,,,,,,,,,,,,,,,,,,,,,,,,,,,,,,,,1,3.3041565180174075,,,,,,,,,,,,,,,,,,,,,,,,,,,,061419_p1,001,2019_Jun_14_1401,body_behavioural,3.0.4,59.981604842409226,
6,"He looked away and addressed the hostess coming towards them, “Can we have a booth in the back?”",1,1,None,None,None,None,None,,0,6,6,6,,,,,0,6,6,6,,,,,,,,,,,,,,,,,,,,,,,,,,,,,,,,,,,1,2.119816018966958,,,,,,,,,,,,,,,,,,,,,,,,,,,,061419_p1,001,2019_Jun_14_1401,body_behavioural,3.0.4,59.981604842409226,
6,"She shrugged and after loudly popping her bubblegum replied, “Sure, honey.”",1,1,None,9.0,None,None,None,,0,6,6,6,,,,,0,7,7,7,,,,,,,,,,,,,,,,,,,,,,,,,,,,,,,,,,,1,2.769369896966964,,,,,,,,,,,,,,,,,,,,,,,,,,,,061419_p1,001,2019_Jun_14_1401,body_behavioural,3.0.4,59.981604842409226,
6,She seated them at a booth in the back corner of the diner.  ,2,1,None,None,None,None,None,,0,6,6,6,,,,,0,8,8,8,,,,,,,,,,,,,,,,,,,,,,,,,,,,,,,,,,,1,2.1507664149976335,,,,,,,,,,,,,,,,,,,,,,,,,,,,061419_p1,001,2019_Jun_14_1401,body_behavioural,3.0.4,59.981604842409226,
6,Sadie slipped into the cushioned seat and grabbed Thomas’ hand.,2,1,None,None,None,None,None,,0,6,6,6,,,,,0,9,9,9,,,,,,,,,,,,,,,,,,,,,,,,,,,,,,,,,,,1,2.4704804979846813,,,,,,,,,,,,,,,,,,,,,,,,,,,,061419_p1,001,2019_Jun_14_1401,body_behavioural,3.0.4,59.981604842409226,
6,“Tell me about your day!” she sang.,2,1,None,None,None,None,None,,0,6,6,6,,,,,0,10,10,10,,,,,,,,,,,,,,,,,,,,,,,,,,,,,,,,,,,1,0.9372823600424454,,,,,,,,,,,,,,,,,,,,,,,,,,,,061419_p1,001,2019_Jun_14_1401,body_behavioural,3.0.4,59.981604842409226,
6,He looked at her silently and pulled his hand slowly from hers as a puzzled look grew on Sadie’s face. ,2,1,None,None,None,None,None,,0,6,6,6,,,,,0,11,11,11,,,,,,,,,,,,,,,,,,,,,,,,,,,,,,,,,,,9,11.170473200036213,,,,,,,,,,,,,,,,,,,,,,,,,,,,061419_p1,001,2019_Jun_14_1401,body_behavioural,3.0.4,59.981604842409226,
6,Thomas looked away and took a deep breath. ,2,1,None,None,None,None,None,,0,6,6,6,,,,,0,12,12,12,,,,,,,,,,,,,,,,,,,,,,,,,,,,,,,,,,,1,2.5009013439994305,,,,,,,,,,,,,,,,,,,,,,,,,,,,061419_p1,001,2019_Jun_14_1401,body_behavioural,3.0.4,59.981604842409226,
6,"Sadie asked, “What’s wrong?” ",2,1,None,None,None,None,None,,0,6,6,6,,,,,0,13,13,13,,,,,,,,,,,,,,,,,,,,,,,,,,,,,,,,,,,1,0.7197512650163844,,,,,,,,,,,,,,,,,,,,,,,,,,,,061419_p1,001,2019_Jun_14_1401,body_behavioural,3.0.4,59.981604842409226,
6,Thomas picked at his fingernails.,2,1,None,None,22.0,None,None,,0,6,6,6,,,,,0,14,14,14,,,,,,,,,,,,,,,,,,,,,,,,,,,,,,,,,,,1,4.6510006680036895,,,,,,,,,,,,,,,,,,,,,,,,,,,,061419_p1,001,2019_Jun_14_1401,body_behavioural,3.0.4,59.981604842409226,
6,"After a few moments, Thomas let out a deep breath and said, “Sadie, I’ve been thinking, and I need a break from this relationship because I need to figure out my career path on my own.”",2,2,None,None,None,None,None,,0,6,6,6,,,,,0,15,15,15,,,,,,,,,,,,,,,,,,,,,,,,,,,,,,,,,,,1,4.686959337966982,,,,,,,,,,,,,,,,,,,,,,,,,,,,061419_p1,001,2019_Jun_14_1401,body_behavioural,3.0.4,59.981604842409226,
6,Sadie sat back in her seat.,2,2,None,None,None,None,None,,0,6,6,6,,,,,0,16,16,16,,,,,,,,,,,,,,,,,,,,,,,,,,,,,,,,,,,1,0.8035661099711433,,,,,,,,,,,,,,,,,,,,,,,,,,,,061419_p1,001,2019_Jun_14_1401,body_behavioural,3.0.4,59.981604842409226,
6,"Thomas continued, “Things have been really picking up at work, and I’m not sure that this is the job I want to do anymore.",2,2,None,None,None,None,None,,0,6,6,6,,,,,0,17,17,17,,,,,,,,,,,,,,,,,,,,,,,,,,,,,,,,,,,1,4.686828689009417,,,,,,,,,,,,,,,,,,,,,,,,,,,,061419_p1,001,2019_Jun_14_1401,body_behavioural,3.0.4,59.981604842409226,
6,"Plus, it’s been really overwhelming between working and figuring out if I should change careers, and I really feel like I need more time to figure it out.” ",2,2,None,17.0,None,None,None,,0,6,6,6,,,,,0,18,18,18,,,,,,,,,,,,,,,,,,,,,,,,,,,,,,,,,,,1,3.9698710249504074,,,,,,,,,,,,,,,,,,,,,,,,,,,,061419_p1,001,2019_Jun_14_1401,body_behavioural,3.0.4,59.981604842409226,
6,"The waiter appeared and cheerily asked, “Have you decided what you would like?”",3,2,None,None,None,None,None,,0,6,6,6,,,,,0,19,19,19,,,,,,,,,,,,,,,,,,,,,,,,,,,,,,,,,,,1,2.4698225549655035,,,,,,,,,,,,,,,,,,,,,,,,,,,,061419_p1,001,2019_Jun_14_1401,body_behavioural,3.0.4,59.981604842409226,
6,"Thomas and Sadie realized there were menus on the table, and they glanced at them quickly.",3,2,None,None,None,None,None,,0,6,6,6,,,,,0,20,20,20,,,,,,,,,,,,,,,,,,,,,,,,,,,,,,,,,,,1,5.9034055719967,,,,,,,,,,,,,,,,,,,,,,,,,,,,061419_p1,001,2019_Jun_14_1401,body_behavioural,3.0.4,59.981604842409226,
6,"The menus were laminated posters with silly names for all the foods, and since they didn’t want to read through each item description, they settled on familiar orders.",3,2,None,None,None,None,None,,0,6,6,6,,,,,0,21,21,21,,,,,,,,,,,,,,,,,,,,,,,,,,,,,,,,,,,1,5.470620589971077,,,,,,,,,,,,,,,,,,,,,,,,,,,,061419_p1,001,2019_Jun_14_1401,body_behavioural,3.0.4,59.981604842409226,
6,"“I’ll have a burger, no tomatoes,” Thomas said.",3,2,None,None,None,None,None,,0,6,6,6,,,,,0,22,22,22,,,,,,,,,,,,,,,,,,,,,,,,,,,,,,,,,,,1,1.6706972329993732,,,,,,,,,,,,,,,,,,,,,,,,,,,,061419_p1,001,2019_Jun_14_1401,body_behavioural,3.0.4,59.981604842409226,
6,"Sadie asked about the reuben, and the waiter told her it was excellent.",3,2,None,None,None,None,None,,0,6,6,6,,,,,0,23,23,23,,,,,,,,,,,,,,,,,,,,,,,,,,,,,,,,,,,1,5.919822137977462,,,,,,,,,,,,,,,,,,,,,,,,,,,,061419_p1,001,2019_Jun_14_1401,body_behavioural,3.0.4,59.981604842409226,
6,"Confirming that that was all they’d like, the waiter walked away. ",3,2,None,None,None,None,None,,0,6,6,6,,,,,0,24,24,24,,,,,,,,,,,,,,,,,,,,,,,,,,,,,,,,,,,1,1.9174487839918584,,,,,,,,,,,,,,,,,,,,,,,,,,,,061419_p1,001,2019_Jun_14_1401,body_behavioural,3.0.4,59.981604842409226,
6,Sadie- not so quietly- burst into tears. ,3,3,None,None,None,None,None,,0,6,6,6,,,,,0,25,25,25,,,,,,,,,,,,,,,,,,,,,,,,,,,,,,,,,,,9,1.3365660330164246,,,,,,,,,,,,,,,,,,,,,,,,,,,,061419_p1,001,2019_Jun_14_1401,body_behavioural,3.0.4,59.981604842409226,
6,People sitting at the bar looked over and quickly averted their gaze when they figured what was happening. ,3,3,None,None,None,None,None,,0,6,6,6,,,,,0,26,26,26,,,,,,,,,,,,,,,,,,,,,,,,,,,,,,,,,,,1,4.653747588978149,,,,,,,,,,,,,,,,,,,,,,,,,,,,061419_p1,001,2019_Jun_14_1401,body_behavioural,3.0.4,59.981604842409226,
6,"She whispered, “Is this really what you want?",3,3,None,None,None,None,None,,0,6,6,6,,,,,0,27,27,27,,,,,,,,,,,,,,,,,,,,,,,,,,,,,,,,,,,1,1.1200768810231239,,,,,,,,,,,,,,,,,,,,,,,,,,,,061419_p1,001,2019_Jun_14_1401,body_behavioural,3.0.4,59.981604842409226,
6,"I don’t understand- things were fine, I thought. ",3,3,None,None,None,None,None,,0,6,6,6,,,,,0,28,28,28,,,,,,,,,,,,,,,,,,,,,,,,,,,,,,,,,,,1,1.5364742079982534,,,,,,,,,,,,,,,,,,,,,,,,,,,,061419_p1,001,2019_Jun_14_1401,body_behavioural,3.0.4,59.981604842409226,
6,I think we should stay together because we can change how much we hang out. ,3,3,None,None,None,None,None,,0,6,6,6,,,,,0,29,29,29,,,,,,,,,,,,,,,,,,,,,,,,,,,,,,,,,,,1,4.003047681006137,,,,,,,,,,,,,,,,,,,,,,,,,,,,061419_p1,001,2019_Jun_14_1401,body_behavioural,3.0.4,59.981604842409226,
6,"We don’t have to hang out all the time, or as much as we do now.”",3,3,None,None,None,None,None,,0,6,6,6,,,,,0,30,30,30,,,,,,,,,,,,,,,,,,,,,,,,,,,,,,,,,,,1,2.286274585989304,,,,,,,,,,,,,,,,,,,,,,,,,,,,061419_p1,001,2019_Jun_14_1401,body_behavioural,3.0.4,59.981604842409226,
6,Thomas chewed on his bottom lip and picked at his now bleeding hangnail. ,3,3,None,20.0,None,None,None,,0,6,6,6,,,,,0,31,31,31,,,,,,,,,,,,,,,,,,,,,,,,,,,,,,,,,,,1,2.5199158279574476,,,,,,,,,,,,,,,,,,,,,,,,,,,,061419_p1,001,2019_Jun_14_1401,body_behavioural,3.0.4,59.981604842409226,
6,The waiter appeared with the burger and reuben and set them in front of them.,4,3,None,None,None,None,None,,0,6,6,6,,,,,0,32,32,32,,,,,,,,,,,,,,,,,,,,,,,,,,,,,,,,,,,1,4.437460507964715,,,,,,,,,,,,,,,,,,,,,,,,,,,,061419_p1,001,2019_Jun_14_1401,body_behavioural,3.0.4,59.981604842409226,
6,“Is there anything else I can get for you two?,4,3,None,None,None,None,None,,0,6,6,6,,,,,0,33,33,33,,,,,,,,,,,,,,,,,,,,,,,,,,,,,,,,,,,9,4.0700356920133345,,,,,,,,,,,,,,,,,,,,,,,,,,,,061419_p1,001,2019_Jun_14_1401,body_behavioural,3.0.4,59.981604842409226,
6,Will you be getting dessert tonight?” he asked.,4,3,None,None,None,None,None,,0,6,6,6,,,,,0,34,34,34,,,,,,,,,,,,,,,,,,,,,,,,,,,,,,,,,,,1,3.4033341969479807,,,,,,,,,,,,,,,,,,,,,,,,,,,,061419_p1,001,2019_Jun_14_1401,body_behavioural,3.0.4,59.981604842409226,
6,"“Oh no, we’re good, thanks,” Thomas said blankly.",4,3,None,None,None,None,None,,0,6,6,6,,,,,0,35,35,35,,,,,,,,,,,,,,,,,,,,,,,,,,,,,,,,,,,9,5.370048375043552,,,,,,,,,,,,,,,,,,,,,,,,,,,,061419_p1,001,2019_Jun_14_1401,body_behavioural,3.0.4,59.981604842409226,
6," With the waiter gone, Sadie suddenly stood up, grabbed half of the reuben, and shook it at him as she growled, “Don’t follow me, and don’t talk to me anymore!",4,4,None,None,None,None,None,,0,6,6,6,,,,,0,36,36,36,,,,,,,,,,,,,,,,,,,,,,,,,,,,,,,,,,,1,4.519591593008954,,,,,,,,,,,,,,,,,,,,,,,,,,,,061419_p1,001,2019_Jun_14_1401,body_behavioural,3.0.4,59.981604842409226,
6,"Also, I want my polaroid camera and Beatles poster back!”",4,4,None,None,None,None,None,,0,6,6,6,,,,,0,37,37,37,,,,,,,,,,,,,,,,,,,,,,,,,,,,,,,,,,,1,2.11977188201854,,,,,,,,,,,,,,,,,,,,,,,,,,,,061419_p1,001,2019_Jun_14_1401,body_behavioural,3.0.4,59.981604842409226,
6,"She stormed off, and the bell above the door jingled cheerfully as the door closed behind her.",4,4,None,None,None,None,None,,0,6,6,6,,,,,0,38,38,38,,,,,,,,,,,,,,,,,,,,,,,,,,,,,,,,,,,1,1.919797760026995,,,,,,,,,,,,,,,,,,,,,,,,,,,,061419_p1,001,2019_Jun_14_1401,body_behavioural,3.0.4,59.981604842409226,
