,jobphotos/acem.jpg,,"When the clients arrive at the airport, how much time do they have until their flight departs?
",What is the reason for the hold-up at security?,"Toward which gate are the clients walking?
","What section and seat does each client sit in on the plane?
",Are the security guards friendly or rude?,Are the airport restrooms clean?,Airport Customer Experience Manager,,,,,,,,,,,,,,,,,,,,,,,,,,,,,,,,,,,,,0,4,4,4,0,0,0,0,,,,,,,,,,,,,,,,,,,,,,,,,,,,,,,,,,,space,2.069939279987011,,,062619_p1,001,2019_Jun_26_1711,part1_subjective_segmentation,3.0.4,59.71604222101696,
,jobphotos/acem.jpg,,"When the clients arrive at the airport, how much time do they have until their flight departs?
",What is the reason for the hold-up at security?,"Toward which gate are the clients walking?
","What section and seat does each client sit in on the plane?
",Are the security guards friendly or rude?,Are the airport restrooms clean?,Airport Customer Experience Manager,,,,,,,,,,,,,,,,,,,,,,,,,,,,,,,,,,,,,0,4,4,4,,,,,,,,,,,,,,,,,,,,,,,,,,,,,,,,,,,,,,,,,,,062619_p1,001,2019_Jun_26_1711,part1_subjective_segmentation,3.0.4,59.71604222101696,
,jobphotos/gscem.jpg,,"What is the grocery store like upon entering?
","What items do the clients pick out?
","How many checkout lanes are open and which one do the clients step into?
","How much are the groceries and what method of payment do the clients use?
",How long does it take for the cashier to scan all of the customers’ groceries?,What type of grocery bags do the clients use?,"Grocery Store Customer Experience Manager
",,,,,,,,,,,,,,,,,,,,,,,,,,,,,,,,,,,,,0,5,5,5,0,0,0,0,,,,,,,,,,,,,,,,,,,,,,,,,,,,,,,,,,,space,0.6002866550115868,,,062619_p1,001,2019_Jun_26_1711,part1_subjective_segmentation,3.0.4,59.71604222101696,
,jobphotos/gscem.jpg,,"What is the grocery store like upon entering?
","What items do the clients pick out?
","How many checkout lanes are open and which one do the clients step into?
","How much are the groceries and what method of payment do the clients use?
",How long does it take for the cashier to scan all of the customers’ groceries?,What type of grocery bags do the clients use?,"Grocery Store Customer Experience Manager
",,,,,,,,,,,,,,,,,,,,,,,,,,,,,,,,,,,,,0,5,5,5,,,,,,,,,,,,,,,,,,,,,,,,,,,,,,,,,,,,,,,,,,,062619_p1,001,2019_Jun_26_1711,part1_subjective_segmentation,3.0.4,59.71604222101696,
,jobphotos/dean.jpg,,"What is the lecture hall like?
","What class are the students in and what is the day’s lecture about?
","What is something taught in lecture?
",What is the next assessment/assignment in class and when is it scheduled/due?,Are the students paying attention?,Are the desks comfortable?,Dean of Academic Studies,,,,,,,,,,,,,,,,,,,,,,,,,,,,,,,,,,,,,0,6,6,6,0,0,0,0,,,,,,,,,,,,,,,,,,,,,,,,,,,,,,,,,,,space,1.1696833070018329,,,062619_p1,001,2019_Jun_26_1711,part1_subjective_segmentation,3.0.4,59.71604222101696,
,jobphotos/dean.jpg,,"What is the lecture hall like?
","What class are the students in and what is the day’s lecture about?
","What is something taught in lecture?
",What is the next assessment/assignment in class and when is it scheduled/due?,Are the students paying attention?,Are the desks comfortable?,Dean of Academic Studies,,,,,,,,,,,,,,,,,,,,,,,,,,,,,,,,,,,,,0,6,6,6,,,,,,,,,,,,,,,,,,,,,,,,,,,,,,,,,,,,,,,,,,,062619_p1,001,2019_Jun_26_1711,part1_subjective_segmentation,3.0.4,59.71604222101696,
,jobphotos/couples.jpg,,For how long has the initiator of the breakup been thinking about breaking up with his/her partner?,"What is the initial reason stated by the initiator for why he/she is breaking up?
",Does the person who is being broken up with want to break up and what’s the reason stated by the person being broken up with that he/she does or does not want to break up?,What objects do either partner want back?,Does the person being broken up with expect that this is coming?,Who witnesses the breakup?,"Couples Therapist
",,,,,,,,,,,,,,,,,,,,,,,,,,,,,,,,,,,,,0,7,7,7,0,0,0,0,,,,,,,,,,,,,,,,,,,,,,,,,,,,,,,,,,,space,0.9525308849988505,,,062619_p1,001,2019_Jun_26_1711,part1_subjective_segmentation,3.0.4,59.71604222101696,
,jobphotos/couples.jpg,,For how long has the initiator of the breakup been thinking about breaking up with his/her partner?,"What is the initial reason stated by the initiator for why he/she is breaking up?
",Does the person who is being broken up with want to break up and what’s the reason stated by the person being broken up with that he/she does or does not want to break up?,What objects do either partner want back?,Does the person being broken up with expect that this is coming?,Who witnesses the breakup?,"Couples Therapist
",,,,,,,,,,,,,,,,,,,,,,,,,,,,,,,,,,,,,0,7,7,7,,,,,,,,,,,,,,,,,,,,,,,,,,,,,,,,,,,,,,,,,,,062619_p1,001,2019_Jun_26_1711,part1_subjective_segmentation,3.0.4,59.71604222101696,
Great job! You’ve finished the quizzes and Part 1. Please notify the researcher that you have finished. ,,,,,,,,,,,,,,,,,,,,,,,,,,,,,,,,,,,,,,,,,,,,,,,,,,,,,,0,0,0,0,,,space,125.58562816199264,,,,,,,,,,,,,,,,,,,,,,,,,,,,,,,062619_p1,001,2019_Jun_26_1711,part1_subjective_segmentation,3.0.4,59.71604222101696,
Let's begin Part 2! ,,,,,,,,,,,,,,,,,,,,,,,,,,,,,,,,,,,,,,,,,,,,,,,,,,,,,,0,1,1,1,,,space,1.4530491069890559,,,,,,,,,,,,,,,,,,,,,,,,,,,,,,,062619_p1,001,2019_Jun_26_1711,part1_subjective_segmentation,3.0.4,59.71604222101696,
You are about to begin the second part of the experiment where you will read short stories. ,,,,,,,,,,,,,,,,,,,,,,,,,,,,,,,,,,,,,,,,,,,,,,,,,,,,,,0,2,2,2,,,space,3.9698766299989074,,,,,,,,,,,,,,,,,,,,,,,,,,,,,,,062619_p1,001,2019_Jun_26_1711,part1_subjective_segmentation,3.0.4,59.71604222101696,
"The stories will be presented to you sentence by sentence, such that each sentence is read individually. ",,,,,,,,,,,,,,,,,,,,,,,,,,,,,,,,,,,,,,,,,,,,,,,,,,,,,,0,3,3,3,,,space,6.002992867026478,,,,,,,,,,,,,,,,,,,,,,,,,,,,,,,062619_p1,001,2019_Jun_26_1711,part1_subjective_segmentation,3.0.4,59.71604222101696,
"As a reminder, you'll be assigned a perspective and given the corresponding quiz before each story. ",,,,,,,,,,,,,,,,,,,,,,,,,,,,,,,,,,,,,,,,,,,,,,,,,,,,,,0,4,4,4,,,space,5.836706375004724,,,,,,,,,,,,,,,,,,,,,,,,,,,,,,,062619_p1,001,2019_Jun_26_1711,part1_subjective_segmentation,3.0.4,59.71604222101696,
"IMPORTANT! While reading each story, you will additionally have to make a judgement about each sentence in order to advance to the next sentence. ",,,,,,,,,,,,,,,,,,,,,,,,,,,,,,,,,,,,,,,,,,,,,,,,,,,,,,0,5,5,5,,,space,8.553297684993595,,,,,,,,,,,,,,,,,,,,,,,,,,,,,,,062619_p1,001,2019_Jun_26_1711,part1_subjective_segmentation,3.0.4,59.71604222101696,
Some people feel that the stories have natural “parts.” We want you to make a judgement about when you think the story has transitioned from one “part” to another. ,,,,,,,,,,,,,,,,,,,,,,,,,,,,,,,,,,,,,,,,,,,,,,,,,,,,,,0,6,6,6,,,space,8.137439879006706,,,,,,,,,,,,,,,,,,,,,,,,,,,,,,,062619_p1,001,2019_Jun_26_1711,part1_subjective_segmentation,3.0.4,59.71604222101696,
Please press “9” if you think the sentence you are reading has begun a new “part” of the story. ,,,,,,,,,,,,,,,,,,,,,,,,,,,,,,,,,,,,,,,,,,,,,,,,,,,,,,0,7,7,7,,,space,6.219778947008308,,,,,,,,,,,,,,,,,,,,,,,,,,,,,,,062619_p1,001,2019_Jun_26_1711,part1_subjective_segmentation,3.0.4,59.71604222101696,
"For example, you should press “9” at the beginning of a story and when you think a different “part” in the story is beginning. ",,,,,,,,,,,,,,,,,,,,,,,,,,,,,,,,,,,,,,,,,,,,,,,,,,,,,,0,8,8,8,,,space,6.086515426984988,,,,,,,,,,,,,,,,,,,,,,,,,,,,,,,062619_p1,001,2019_Jun_26_1711,part1_subjective_segmentation,3.0.4,59.71604222101696,
Please press “1” if you think the sentence is in the same “part” as the sentence before. ,,,,,,,,,,,,,,,,,,,,,,,,,,,,,,,,,,,,,,,,,,,,,,,,,,,,,,0,9,9,9,,,space,5.42012252099812,,,,,,,,,,,,,,,,,,,,,,,,,,,,,,,062619_p1,001,2019_Jun_26_1711,part1_subjective_segmentation,3.0.4,59.71604222101696,
There are no “right” answers. We want to see what you think these transitions are. ,,,,,,,,,,,,,,,,,,,,,,,,,,,,,,,,,,,,,,,,,,,,,,,,,,,,,,0,10,10,10,,,space,4.0035288850194775,,,,,,,,,,,,,,,,,,,,,,,,,,,,,,,062619_p1,001,2019_Jun_26_1711,part1_subjective_segmentation,3.0.4,59.71604222101696,
"When you press "1" or "9", you will not be able to go back to previous sentences or change the judgement you made about a previous sentence. ",,,,,,,,,,,,,,,,,,,,,,,,,,,,,,,,,,,,,,,,,,,,,,,,,,,,,,0,11,11,11,,,space,7.136783439986175,,,,,,,,,,,,,,,,,,,,,,,,,,,,,,,062619_p1,001,2019_Jun_26_1711,part1_subjective_segmentation,3.0.4,59.71604222101696,
"Please use both index fingers during the story reading, with one resting on the “1” and the other on the “9.”",,,,,,,,,,,,,,,,,,,,,,,,,,,,,,,,,,,,,,,,,,,,,,,,,,,,,,0,12,12,12,,,space,6.719620649993885,,,,,,,,,,,,,,,,,,,,,,,,,,,,,,,062619_p1,001,2019_Jun_26_1711,part1_subjective_segmentation,3.0.4,59.71604222101696,
Questions?,,,,,,,,,,,,,,,,,,,,,,,,,,,,,,,,,,,,,,,,,,,,,,,,,,,,,,0,13,13,13,,,space,4.2863200930005405,,,,,,,,,,,,,,,,,,,,,,,,,,,,,,,062619_p1,001,2019_Jun_26_1711,part1_subjective_segmentation,3.0.4,59.71604222101696,
,,,,,,,,,,,,,,,,,,,,,,,,,,,,,,,,,,,,,,,,,,,,,,,,,,,,,,,,,,,,,,,,,,,,,,,,,,,,,,,,,,,,,,,,,,space,0.8861479549959768,062619_p1,001,2019_Jun_26_1711,part1_subjective_segmentation,3.0.4,59.71604222101696,
