4,He dropped it back on his plate and wondered if the restaurant was responsible for the foul taste. ,4,4,None,13.0,5.0,None,None,,0,4,4,4,,,,,0,41,41,41,,,,,,,,,,,,,,,,,,,,,,,,,,,,,,,,,,,1,2.6209080169792287,,,,,,,,,,,,,,,,,,,,,,,,,,,,070219_p2,001,2019_Jul_02_1148,body_behavioural,3.0.4,59.9683365958585,
4,,,,,,,,,,0,4,4,4,,,,,,,,,,,,,,,,,,,,,,,,,,,,,,,,,,,,,,,,,,,,,,,,,,,,,,,,,,,,,,,,,,,,,,,,070219_p2,001,2019_Jul_02_1148,body_behavioural,3.0.4,59.9683365958585,
5,,,,,,,,,,0,5,5,5,0,0,0,0,,,,,,,,,,,,,,,,,,,,,,,,,,,,,space,1.2879984499886632,space,0.5546620520181023,space,0.4879222279996611,,,,,,,,,,,,,,,,,,,,,,,,,,,,,,,,,,070219_p2,001,2019_Jul_02_1148,body_behavioural,3.0.4,59.9683365958585,
5,"Lana walked into lecture holding hands with her boyfriend, Aaron, who was trying to contain his excitement about proposing to Lana in this class.",1,1,24.0,,,,,,0,5,5,5,,,,,0,0,0,0,,,,,,,,,,,,,,,,,,,,,,,,,,,,,,,space,15.88863992196275,space,1.6037494220072404,9,7.687327890016604,,,,,,,,,,,,,,,,,,,,,,,,,,,,070219_p2,001,2019_Jul_02_1148,body_behavioural,3.0.4,59.9683365958585,
5,"Lana was lost in thought, puzzling over an integral on her problem set for another class.",1,1,None,,,,,,0,5,5,5,,,,,0,1,1,1,,,,,,,,,,,,,,,,,,,,,,,,,,,,,,,,,,,1,2.5217497299890965,,,,,,,,,,,,,,,,,,,,,,,,,,,,070219_p2,001,2019_Jul_02_1148,body_behavioural,3.0.4,59.9683365958585,
5,"The lecture hall they had entered was the fanciest one at Princeton, with chandeliers, high ceilings, wood floors, and a large projector screen where chalkboards used to be. ",1,1,None,,,,,,0,5,5,5,,,,,0,2,2,2,,,,,,,,,,,,,,,,,,,,,,,,,,,,,,,,,,,1,3.821258630952798,,,,,,,,,,,,,,,,,,,,,,,,,,,,070219_p2,001,2019_Jul_02_1148,body_behavioural,3.0.4,59.9683365958585,
5,Aaron and Lana had met when they first started dating three years ago in freshman year.,1,1,None,,,,,,0,5,5,5,,,,,0,3,3,3,,,,,,,,,,,,,,,,,,,,,,,,,,,,,,,,,,,9,4.020939083013218,,,,,,,,,,,,,,,,,,,,,,,,,,,,070219_p2,001,2019_Jul_02_1148,body_behavioural,3.0.4,59.9683365958585,
5,They coincidentally had another class together in this same lecture hall. ,1,1,None,,,,,,0,5,5,5,,,,,0,4,4,4,,,,,,,,,,,,,,,,,,,,,,,,,,,,,,,,,,,1,2.3208918609889224,,,,,,,,,,,,,,,,,,,,,,,,,,,,070219_p2,001,2019_Jul_02_1148,body_behavioural,3.0.4,59.9683365958585,
5,The professor caught Aaron's eye as he walked up to the front of the classroom and gave him a wink before the lecture began. ,1,1,None,,,,,,0,5,5,5,,,,,0,5,5,5,,,,,,,,,,,,,,,,,,,,,,,,,,,,,,,,,,,1,2.621512418030761,,,,,,,,,,,,,,,,,,,,,,,,,,,,070219_p2,001,2019_Jul_02_1148,body_behavioural,3.0.4,59.9683365958585,
5,Aaron flashed him a half-smile and nodded. ,1,1,None,,,,,,0,5,5,5,,,,,0,6,6,6,,,,,,,,,,,,,,,,,,,,,,,,,,,,,,,,,,,1,1.5339633169933222,,,,,,,,,,,,,,,,,,,,,,,,,,,,070219_p2,001,2019_Jul_02_1148,body_behavioural,3.0.4,59.9683365958585,
5,"The professor cleared his throat and said,“Alright, good afternoon, everyone!",2,1,None,,,,,,0,5,5,5,,,,,0,7,7,7,,,,,,,,,,,,,,,,,,,,,,,,,,,,,,,,,,,1,2.8391046230099164,,,,,,,,,,,,,,,,,,,,,,,,,,,,070219_p2,001,2019_Jul_02_1148,body_behavioural,3.0.4,59.9683365958585,
5,Welcome to another week of Introduction to Chemistry,2,1,None,,,,,,0,5,5,5,,,,,0,8,8,8,,,,,,,,,,,,,,,,,,,,,,,,,,,,,,,,,,,1,1.271340108010918,,,,,,,,,,,,,,,,,,,,,,,,,,,,070219_p2,001,2019_Jul_02_1148,body_behavioural,3.0.4,59.9683365958585,
5,This week the topic is ions.,2,1,None,,,,,,0,5,5,5,,,,,0,9,9,9,,,,,,,,,,,,,,,,,,,,,,,,,,,,,,,,,,,1,0.7714732089661993,,,,,,,,,,,,,,,,,,,,,,,,,,,,070219_p2,001,2019_Jul_02_1148,body_behavioural,3.0.4,59.9683365958585,
5,"Now, let me get my computer set up, and while I do that, does anyone want to tell me what makes elements definitionally distinct from one another.”",2,1,None,,,,,,0,5,5,5,,,,,0,10,10,10,,,,,,,,,,,,,,,,,,,,,,,,,,,,,,,,,,,1,3.03776990697952,,,,,,,,,,,,,,,,,,,,,,,,,,,,070219_p2,001,2019_Jul_02_1148,body_behavioural,3.0.4,59.9683365958585,
5,Lana pulled out the problem set she was thinking about as Aaron unzipped the small pocket in his backpack and pulled out the ring.,2,2,None,,,,,,0,5,5,5,,,,,0,11,11,11,,,,,,,,,,,,,,,,,,,,,,,,,,,,,,,,,,,1,4.022804999956861,,,,,,,,,,,,,,,,,,,,,,,,,,,,070219_p2,001,2019_Jul_02_1148,body_behavioural,3.0.4,59.9683365958585,
5,"Turning away from her, he looked it over yet again. ",2,2,None,,,,,,0,5,5,5,,,,,0,12,12,12,,,,,,,,,,,,,,,,,,,,,,,,,,,,,,,,,,,1,1.7547874239971861,,,,,,,,,,,,,,,,,,,,,,,,,,,,070219_p2,001,2019_Jul_02_1148,body_behavioural,3.0.4,59.9683365958585,
5,"Instead of one large diamond, there were 5 red diamonds embedded in a thick band. ",2,2,None,,,,,,0,5,5,5,,,,,0,13,13,13,,,,,,,,,,,,,,,,,,,,,,,,,,,,,,,,,,,1,2.1340995829668827,,,,,,,,,,,,,,,,,,,,,,,,,,,,070219_p2,001,2019_Jul_02_1148,body_behavioural,3.0.4,59.9683365958585,
5,He knew Lana would like this because her style was more avant-garde than traditional.,2,2,None,,,,,,0,5,5,5,,,,,0,14,14,14,,,,,,,,,,,,,,,,,,,,,,,,,,,,,,,,,,,1,5.554675614985172,,,,,,,,,,,,,,,,,,,,,,,,,,,,070219_p2,001,2019_Jul_02_1148,body_behavioural,3.0.4,59.9683365958585,
5,"The professor said, “Remember, class, that the number of protons determines the identity of the element. ",3,2,None,,,,,,0,5,5,5,,,,,0,15,15,15,,,,,,,,,,,,,,,,,,,,,,,,,,,,,,,,,,,1,2.8868210719665512,,,,,,,,,,,,,,,,,,,,,,,,,,,,070219_p2,001,2019_Jul_02_1148,body_behavioural,3.0.4,59.9683365958585,
5,"So for example, all atoms of sodium have 11 protons in the nucleus. ",3,2,None,,,,,,0,5,5,5,,,,,0,16,16,16,,,,,,,,,,,,,,,,,,,,,,,,,,,,,,,,,,,1,1.7533685250091366,,,,,,,,,,,,,,,,,,,,,,,,,,,,070219_p2,001,2019_Jul_02_1148,body_behavioural,3.0.4,59.9683365958585,
5,"And if you look on the periodic table, the atomic number for sodium, the symbol is Na, is eleven.",3,2,None,,,,,,0,5,5,5,,,,,0,17,17,17,,,,,,,,,,,,,,,,,,,,,,,,,,,,,,,,,,,1,4.770337416965049,,,,,,,,,,,,,,,,,,,,,,,,,,,,070219_p2,001,2019_Jul_02_1148,body_behavioural,3.0.4,59.9683365958585,
5,"An ion retains the same number of protons despite losing electrons, and therefore keeps the same identity in the periodic table. ",3,2,None,,,,,,0,5,5,5,,,,,0,18,18,18,,,,,,,,,,,,,,,,,,,,,,,,,,,,,,,,,,,1,3.652746253006626,,,,,,,,,,,,,,,,,,,,,,,,,,,,070219_p2,001,2019_Jul_02_1148,body_behavioural,3.0.4,59.9683365958585,
5,Lana and Aaron tried to take notes during the lecture.,3,2,None,,,,,,0,5,5,5,,,,,0,19,19,19,,,,,,,,,,,,,,,,,,,,,,,,,,,,,,,,,,,1,3.369949359970633,,,,,,,,,,,,,,,,,,,,,,,,,,,,070219_p2,001,2019_Jul_02_1148,body_behavioural,3.0.4,59.9683365958585,
5,"Right after talking about how two ions bond into one stable molecule by covalent bonds, the professor stopped the lecture, gave another wink to Aaron, and asked Lana to come to the front of the class to do a demonstration. ",3,3,None,,,,,,0,5,5,5,,,,,0,20,20,20,,,,,,,,,,,,,,,,,,,,,,,,,,,,,,,,,,,1,6.003408880031202,,,,,,,,,,,,,,,,,,,,,,,,,,,,070219_p2,001,2019_Jul_02_1148,body_behavioural,3.0.4,59.9683365958585,
5,"She walked to the front of the class confused, and the professor asked her to stand in the middle of the stage.",3,3,None,,,,,,0,5,5,5,,,,,0,21,21,21,,,,,,,,,,,,,,,,,,,,,,,,,,,,,,,,,,,1,2.853125963010825,,,,,,,,,,,,,,,,,,,,,,,,,,,,070219_p2,001,2019_Jul_02_1148,body_behavioural,3.0.4,59.9683365958585,
5,"Then Aaron walked up and, taking Lana’s hand, got down on one knee. ",3,3,None,,,,,,0,5,5,5,,,,,0,22,22,22,,,,,,,,,,,,,,,,,,,,,,,,,,,,,,,,,,,1,1.8364675649791025,,,,,,,,,,,,,,,,,,,,,,,,,,,,070219_p2,001,2019_Jul_02_1148,body_behavioural,3.0.4,59.9683365958585,
5,The professor quickly switched to the last slide on the powerpoint which was a photo collage Aaron had sent him of pictures of Aaron and Lana. ,3,3,None,,,,,,0,5,5,5,,,,,0,23,23,23,,,,,,,,,,,,,,,,,,,,,,,,,,,,,,,,,,,1,3.752979803015478,,,,,,,,,,,,,,,,,,,,,,,,,,,,070219_p2,001,2019_Jul_02_1148,body_behavioural,3.0.4,59.9683365958585,
5,"“It's time for us to make a bond of our own, Lana.”",3,3,None,,,,,,0,5,5,5,,,,,0,24,24,24,,,,,,,,,,,,,,,,,,,,,,,,,,,,,,,,,,,1,1.7838133269688115,,,,,,,,,,,,,,,,,,,,,,,,,,,,070219_p2,001,2019_Jul_02_1148,body_behavioural,3.0.4,59.9683365958585,
5,He opened the small notebook he had in his hand and the ring was sitting on the page. ,3,3,None,,,,,,0,5,5,5,,,,,0,25,25,25,,,,,,,,,,,,,,,,,,,,,,,,,,,,,,,,,,,1,2.9008870300021954,,,,,,,,,,,,,,,,,,,,,,,,,,,,070219_p2,001,2019_Jul_02_1148,body_behavioural,3.0.4,59.9683365958585,
5,“Will you marry me?” ,3,3,None,,,,,,0,5,5,5,,,,,0,26,26,26,,,,,,,,,,,,,,,,,,,,,,,,,,,,,,,,,,,1,0.9363656000350602,,,,,,,,,,,,,,,,,,,,,,,,,,,,070219_p2,001,2019_Jul_02_1148,body_behavioural,3.0.4,59.9683365958585,
5,"Lana had put her hand over her mouth and tears were streaming down her face, but finally, she said, “Yes!”",3,4,None,,,,,,0,5,5,5,,,,,0,27,27,27,,,,,,,,,,,,,,,,,,,,,,,,,,,,,,,,,,,1,2.835472241975367,,,,,,,,,,,,,,,,,,,,,,,,,,,,070219_p2,001,2019_Jul_02_1148,body_behavioural,3.0.4,59.9683365958585,
5,"Aaron put the ring on her finger, and they hugged while the whole class applauded and cheered. ",3,4,None,,,,,,0,5,5,5,,,,,0,28,28,28,,,,,,,,,,,,,,,,,,,,,,,,,,,,,,,,,,,1,1.8360771689913236,,,,,,,,,,,,,,,,,,,,,,,,,,,,070219_p2,001,2019_Jul_02_1148,body_behavioural,3.0.4,59.9683365958585,
5,"Their friends, who had been secretly waiting outside, came into the class and embraced both of them.",3,4,None,,,,,,0,5,5,5,,,,,0,29,29,29,,,,,,,,,,,,,,,,,,,,,,,,,,,,,,,,,,,1,2.7694141379906796,,,,,,,,,,,,,,,,,,,,,,,,,,,,070219_p2,001,2019_Jul_02_1148,body_behavioural,3.0.4,59.9683365958585,
5,The professor gave Aaron a celebratory handshake.,3,4,None,,,,,,0,5,5,5,,,,,0,30,30,30,,,,,,,,,,,,,,,,,,,,,,,,,,,,,,,,,,,1,1.1697414600057527,,,,,,,,,,,,,,,,,,,,,,,,,,,,070219_p2,001,2019_Jul_02_1148,body_behavioural,3.0.4,59.9683365958585,
5,"They made their way back to their seats, and Lana pulled out her phone to text her sister",3,4,None,,,,,,0,5,5,5,,,,,0,31,31,31,,,,,,,,,,,,,,,,,,,,,,,,,,,,,,,,,,,1,2.502670534013305,,,,,,,,,,,,,,,,,,,,,,,,,,,,070219_p2,001,2019_Jul_02_1148,body_behavioural,3.0.4,59.9683365958585,
5,"The professor dismissed the class, saying, “That was enough excitement for today!",4,4,None,,,,,,0,5,5,5,,,,,0,32,32,32,,,,,,,,,,,,,,,,,,,,,,,,,,,,,,,,,,,1,2.570853262033779,,,,,,,,,,,,,,,,,,,,,,,,,,,,070219_p2,001,2019_Jul_02_1148,body_behavioural,3.0.4,59.9683365958585,
5,Don’t forget there’s a midterm exam next week on Monday on the material covered in the first 4 weeks of the semester.,4,4,None,,,,,,0,5,5,5,,,,,0,33,33,33,,,,,,,,,,,,,,,,,,,,,,,,,,,,,,,,,,,1,3.0036689519765787,,,,,,,,,,,,,,,,,,,,,,,,,,,,070219_p2,001,2019_Jul_02_1148,body_behavioural,3.0.4,59.9683365958585,
5,"As everyone was packing up their notebooks and leaving, Lana and Aaron were surrounded by their friends eager to get a glimpse of the ring and congratulate them. ",4,4,None,,,,,,0,5,5,5,,,,,0,34,34,34,,,,,,,,,,,,,,,,,,,,,,,,,,,,,,,,,,,1,3.269554207974579,,,,,,,,,,,,,,,,,,,,,,,,,,,,070219_p2,001,2019_Jul_02_1148,body_behavioural,3.0.4,59.9683365958585,
5,,,,,,,,,,0,5,5,5,,,,,,,,,,,,,,,,,,,,,,,,,,,,,,,,,,,,,,,,,,,,,,,,,,,,,,,,,,,,,,,,,,,,,,,,070219_p2,001,2019_Jul_02_1148,body_behavioural,3.0.4,59.9683365958585,
6,,,,,,,,,,0,6,6,6,0,0,0,0,,,,,,,,,,,,,,,,,,,,,,,,,,,,,space,1.6696422569802962,space,0.4529848030069843,space,0.7693193060113117,,,,,,,,,,,,,,,,,,,,,,,,,,,,,,,,,,070219_p2,001,2019_Jul_02_1148,body_behavioural,3.0.4,59.9683365958585,
6,,,,,,,,,,0,6,6,6,1,0,1,0,,,,,,,,,,,,,,,,,,,,,,,,,,,,,,,,,space,0.7858555470011197,,,,,,,,,,,,,,,,,,,,,,,,,,,,,,,,,,070219_p2,001,2019_Jul_02_1148,body_behavioural,3.0.4,59.9683365958585,
6,Mr. Shelton and Mr. Gordon shook hands inside the waiting area of the restaurant: lunch today was about big business. ,1,1,31.0,,,,,,0,6,6,6,,,,,0,0,0,0,,,,,,,,,,,,,,,,,,,,,,,,,,,,,,,space,0.4198139850050211,space,0.45289913297165185,9,3.3533223379636183,,,,,,,,,,,,,,,,,,,,,,,,,,,,070219_p2,001,2019_Jul_02_1148,body_behavioural,3.0.4,59.9683365958585,
6,They were both in the airplane manufacturing industry.,1,1,None,,,,,,0,6,6,6,,,,,0,1,1,1,,,,,,,,,,,,,,,,,,,,,,,,,,,,,,,,,,,1,2.1864509470178746,,,,,,,,,,,,,,,,,,,,,,,,,,,,070219_p2,001,2019_Jul_02_1148,body_behavioural,3.0.4,59.9683365958585,
6,"Mr. Shelton was the CFO of a larger, well-established company and had been in the aviation business for decades.",1,1,None,,,,,,0,6,6,6,,,,,0,2,2,2,,,,,,,,,,,,,,,,,,,,,,,,,,,,,,,,,,,1,1.302960050990805,,,,,,,,,,,,,,,,,,,,,,,,,,,,070219_p2,001,2019_Jul_02_1148,body_behavioural,3.0.4,59.9683365958585,
6,Mr. Gordon was the CEO of a smaller but technologically-advanced company that was projected to disrupt the airplane manufacturing market. ,1,1,None,,,,,,0,6,6,6,,,,,0,3,3,3,,,,,,,,,,,,,,,,,,,,,,,,,,,,,,,,,,,1,2.153157097985968,,,,,,,,,,,,,,,,,,,,,,,,,,,,070219_p2,001,2019_Jul_02_1148,body_behavioural,3.0.4,59.9683365958585,
6,"They chose to meet at an old steakhouse with dark wood paneling on the floor and ceilings, taxidermy animals on the walls, and a candelabra on every table.",1,1,None,,,,,,0,6,6,6,,,,,0,4,4,4,,,,,,,,,,,,,,,,,,,,,,,,,,,,,,,,,,,1,2.603178215038497,,,,,,,,,,,,,,,,,,,,,,,,,,,,070219_p2,001,2019_Jul_02_1148,body_behavioural,3.0.4,59.9683365958585,
6,The waitress seated them at their table in the back. ,2,1,None,,,,,,0,6,6,6,,,,,0,5,5,5,,,,,,,,,,,,,,,,,,,,,,,,,,,,,,,,,,,1,1.4697380770230666,,,,,,,,,,,,,,,,,,,,,,,,,,,,070219_p2,001,2019_Jul_02_1148,body_behavioural,3.0.4,59.9683365958585,
6,"She brought out the menus, and they briefly chatted about personal happenings. ",2,1,None,,,,,,0,6,6,6,,,,,0,6,6,6,,,,,,,,,,,,,,,,,,,,,,,,,,,,,,,,,,,1,1.9342255789670162,,,,,,,,,,,,,,,,,,,,,,,,,,,,070219_p2,001,2019_Jul_02_1148,body_behavioural,3.0.4,59.9683365958585,
6,"Mr. Gordon took out a picture of his daughter and talked about her recent engagement, and Mr. Gordon mentioned his purchase of a Tesla. ",2,1,None,,,,,,0,6,6,6,,,,,0,7,7,7,,,,,,,,,,,,,,,,,,,,,,,,,,,,,,,,,,,1,2.2531564550008625,,,,,,,,,,,,,,,,,,,,,,,,,,,,070219_p2,001,2019_Jul_02_1148,body_behavioural,3.0.4,59.9683365958585,
6,They also looked over the menus which were heavy and covered in felt.,2,1,None,,,,,,0,6,6,6,,,,,0,8,8,8,,,,,,,,,,,,,,,,,,,,,,,,,,,,,,,,,,,1,1.7194910010439344,,,,,,,,,,,,,,,,,,,,,,,,,,,,070219_p2,001,2019_Jul_02_1148,body_behavioural,3.0.4,59.9683365958585,
6,Flipping to the back of the menu brought one to a lengthy drink selection.,2,1,None,,,,,,0,6,6,6,,,,,0,9,9,9,,,,,,,,,,,,,,,,,,,,,,,,,,,,,,,,,,,1,1.4025990099762566,,,,,,,,,,,,,,,,,,,,,,,,,,,,070219_p2,001,2019_Jul_02_1148,body_behavioural,3.0.4,59.9683365958585,
6,Mr. Shelton got serious and brought the conversation around to business.,2,2,None,,,,,,0,6,6,6,,,,,0,10,10,10,,,,,,,,,,,,,,,,,,,,,,,,,,,,,,,,,,,1,1.250767849967815,,,,,,,,,,,,,,,,,,,,,,,,,,,,070219_p2,001,2019_Jul_02_1148,body_behavioural,3.0.4,59.9683365958585,
6,"“Mr. Gordon, we really admire what you’re doing at your company.",2,2,None,,,,,,0,6,6,6,,,,,0,11,11,11,,,,,,,,,,,,,,,,,,,,,,,,,,,,,,,,,,,1,1.3864622949622571,,,,,,,,,,,,,,,,,,,,,,,,,,,,070219_p2,001,2019_Jul_02_1148,body_behavioural,3.0.4,59.9683365958585,
6,We think it’s genius; we want to support your vision and make this tiny company of yours internationally known.,2,2,None,,,,,,0,6,6,6,,,,,0,12,12,12,,,,,,,,,,,,,,,,,,,,,,,,,,,,,,,,,,,1,1.1364358449936844,,,,,,,,,,,,,,,,,,,,,,,,,,,,070219_p2,001,2019_Jul_02_1148,body_behavioural,3.0.4,59.9683365958585,
6,"But honestly, your company doesn’t have the resources to reach international markets right now.",2,2,None,,,,,,0,6,6,6,,,,,0,13,13,13,,,,,,,,,,,,,,,,,,,,,,,,,,,,,,,,,,,1,2.3698260569944978,,,,,,,,,,,,,,,,,,,,,,,,,,,,070219_p2,001,2019_Jul_02_1148,body_behavioural,3.0.4,59.9683365958585,
6,"Maybe in a few years you could, but by that time, other companies may have already filled your niche.",2,2,None,,,,,,0,6,6,6,,,,,0,14,14,14,,,,,,,,,,,,,,,,,,,,,,,,,,,,,,,,,,,1,1.4196293950080872,,,,,,,,,,,,,,,,,,,,,,,,,,,,070219_p2,001,2019_Jul_02_1148,body_behavioural,3.0.4,59.9683365958585,
6,I think we should join forces.”,2,2,None,,,,,,0,6,6,6,,,,,0,15,15,15,,,,,,,,,,,,,,,,,,,,,,,,,,,,,,,,,,,1,7.386545635992661,,,,,,,,,,,,,,,,,,,,,,,,,,,,070219_p2,001,2019_Jul_02_1148,body_behavioural,3.0.4,59.9683365958585,
6,The waitress arrived and asked if they were ready to order.,3,2,None,,,,,,0,6,6,6,,,,,0,16,16,16,,,,,,,,,,,,,,,,,,,,,,,,,,,,,,,,,,,1,1.4031007190351374,,,,,,,,,,,,,,,,,,,,,,,,,,,,070219_p2,001,2019_Jul_02_1148,body_behavioural,3.0.4,59.9683365958585,
6,"Mr. Gordon chose the medium-rare steak and a martini, and Mr. Shelton ordered the veal and a manhattan. ",3,2,None,,,,,,0,6,6,6,,,,,0,17,17,17,,,,,,,,,,,,,,,,,,,,,,,,,,,,,,,,,,,1,0.9190730229602195,,,,,,,,,,,,,,,,,,,,,,,,,,,,070219_p2,001,2019_Jul_02_1148,body_behavioural,3.0.4,59.9683365958585,
6,"Then Mr. Shelton continued, “Look, I’ve talked to other members of the board, and we are prepared to offer $600 million to buy your company. ",3,2,None,,,,,,0,6,6,6,,,,,0,18,18,18,,,,,,,,,,,,,,,,,,,,,,,,,,,,,,,,,,,1,2.1196064929827116,,,,,,,,,,,,,,,,,,,,,,,,,,,,070219_p2,001,2019_Jul_02_1148,body_behavioural,3.0.4,59.9683365958585,
6,"We'd keep on all of your current employees, and you would join as the director of your company branch.” ",3,2,None,,,,,,0,6,6,6,,,,,0,19,19,19,,,,,,,,,,,,,,,,,,,,,,,,,,,,,,,,,,,1,1.3535712080192752,,,,,,,,,,,,,,,,,,,,,,,,,,,,070219_p2,001,2019_Jul_02_1148,body_behavioural,3.0.4,59.9683365958585,
6,"Mr. Gordon looked at Mr. Shelton skeptically for a few moments considering his response until he said, “Mr. Shelton, I think that you make a compelling offer, but there are definitely some disadvantages to attaching our small, streamlined productions to a large company like yours.",3,3,None,,,,,,0,6,6,6,,,,,0,20,20,20,,,,,,,,,,,,,,,,,,,,,,,,,,,,,,,,,,,1,1.4197564289788716,,,,,,,,,,,,,,,,,,,,,,,,,,,,070219_p2,001,2019_Jul_02_1148,body_behavioural,3.0.4,59.9683365958585,
6,"We operate in a very different way than a large company, and the kind of administrative complexity that makes the scale of your productions possible would suffocate our business.",3,3,None,,,,,,0,6,6,6,,,,,0,21,21,21,,,,,,,,,,,,,,,,,,,,,,,,,,,,,,,,,,,1,2.1701621600077488,,,,,,,,,,,,,,,,,,,,,,,,,,,,070219_p2,001,2019_Jul_02_1148,body_behavioural,3.0.4,59.9683365958585,
6,"With our product, scaling-up doesn’t necessarily make sense.” ",3,3,None,,,,,,0,6,6,6,,,,,0,22,22,22,,,,,,,,,,,,,,,,,,,,,,,,,,,,,,,,,,,1,1.7194195039919578,,,,,,,,,,,,,,,,,,,,,,,,,,,,070219_p2,001,2019_Jul_02_1148,body_behavioural,3.0.4,59.9683365958585,
6,Mr. Shelton had expected this response and had come prepared.,3,3,None,,,,,,0,6,6,6,,,,,0,23,23,23,,,,,,,,,,,,,,,,,,,,,,,,,,,,,,,,,,,1,2.2540239159716293,,,,,,,,,,,,,,,,,,,,,,,,,,,,070219_p2,001,2019_Jul_02_1148,body_behavioural,3.0.4,59.9683365958585,
6,He began laying out the details of how he had handled similar acquisitions successfully in the past.,3,3,None,,,,,,0,6,6,6,,,,,0,24,24,24,,,,,,,,,,,,,,,,,,,,,,,,,,,,,,,,,,,1,3.169466299994383,,,,,,,,,,,,,,,,,,,,,,,,,,,,070219_p2,001,2019_Jul_02_1148,body_behavioural,3.0.4,59.9683365958585,
6,"He also played out projections of how Mr. Gordon’s company could out-compete their own main competitor in the industry, TechJet, by using the resources of a larger corporation. ",3,3,None,,,,,,0,6,6,6,,,,,0,25,25,25,,,,,,,,,,,,,,,,,,,,,,,,,,,,,,,,,,,1,4.219751162978355,,,,,,,,,,,,,,,,,,,,,,,,,,,,070219_p2,001,2019_Jul_02_1148,body_behavioural,3.0.4,59.9683365958585,
6,"Mr. Gordon was impressed, and they went back and forth hashing out what the company configuration would look like post-merger. ",3,3,None,,,,,,0,6,6,6,,,,,0,26,26,26,,,,,,,,,,,,,,,,,,,,,,,,,,,,,,,,,,,1,2.2870111350202933,,,,,,,,,,,,,,,,,,,,,,,,,,,,070219_p2,001,2019_Jul_02_1148,body_behavioural,3.0.4,59.9683365958585,
6,The waitress brought out their food on a large tray.,4,3,None,,,,,,0,6,6,6,,,,,0,27,27,27,,,,,,,,,,,,,,,,,,,,,,,,,,,,,,,,,,,1,2.036870561016258,,,,,,,,,,,,,,,,,,,,,,,,,,,,070219_p2,001,2019_Jul_02_1148,body_behavioural,3.0.4,59.9683365958585,
6,“Oh this looks so good!” Mr. Gordon said. ,4,3,None,,,,,,0,6,6,6,,,,,0,28,28,28,,,,,,,,,,,,,,,,,,,,,,,,,,,,,,,,,,,1,0.8027417880366556,,,,,,,,,,,,,,,,,,,,,,,,,,,,070219_p2,001,2019_Jul_02_1148,body_behavioural,3.0.4,59.9683365958585,
6,“Can I get you anything else?” the waitress asked.,4,3,None,,,,,,0,6,6,6,,,,,0,29,29,29,,,,,,,,,,,,,,,,,,,,,,,,,,,,,,,,,,,1,0.9864146999898367,,,,,,,,,,,,,,,,,,,,,,,,,,,,070219_p2,001,2019_Jul_02_1148,body_behavioural,3.0.4,59.9683365958585,
6,They declined and began to eat. ,4,3,None,,,,,,0,6,6,6,,,,,0,30,30,30,,,,,,,,,,,,,,,,,,,,,,,,,,,,,,,,,,,1,0.8864601000095718,,,,,,,,,,,,,,,,,,,,,,,,,,,,070219_p2,001,2019_Jul_02_1148,body_behavioural,3.0.4,59.9683365958585,
6,The meal was subpar- they both found the meat to be overcooked and dry. ,4,3,None,,,,,,0,6,6,6,,,,,0,31,31,31,,,,,,,,,,,,,,,,,,,,,,,,,,,,,,,,,,,1,3.069888204045128,,,,,,,,,,,,,,,,,,,,,,,,,,,,070219_p2,001,2019_Jul_02_1148,body_behavioural,3.0.4,59.9683365958585,
6,"Mr. Gordon, after taking a contemplative bite and swallowing, said, “Mr. Shelton, I think we have a deal. ",4,4,None,,,,,,0,6,6,6,,,,,0,32,32,32,,,,,,,,,,,,,,,,,,,,,,,,,,,,,,,,,,,1,2.503251771966461,,,,,,,,,,,,,,,,,,,,,,,,,,,,070219_p2,001,2019_Jul_02_1148,body_behavioural,3.0.4,59.9683365958585,
6,"If you can guarantee that I can still have the final say in all the work done by my team, I think this could be beneficial for both of us.",4,4,None,,,,,,0,6,6,6,,,,,0,33,33,33,,,,,,,,,,,,,,,,,,,,,,,,,,,,,,,,,,,1,5.436487252009101,,,,,,,,,,,,,,,,,,,,,,,,,,,,070219_p2,001,2019_Jul_02_1148,body_behavioural,3.0.4,59.9683365958585,
6,I propose a toast to the merging of our companies.”,4,4,None,,,,,,0,6,6,6,,,,,0,34,34,34,,,,,,,,,,,,,,,,,,,,,,,,,,,,,,,,,,,1,1.5032286149798892,,,,,,,,,,,,,,,,,,,,,,,,,,,,070219_p2,001,2019_Jul_02_1148,body_behavioural,3.0.4,59.9683365958585,
6,Mr. Shelton grinned and lifted his martini to clink glasses.,4,4,None,,,,,,0,6,6,6,,,,,0,35,35,35,,,,,,,,,,,,,,,,,,,,,,,,,,,,,,,,,,,1,1.9526370649691671,,,,,,,,,,,,,,,,,,,,,,,,,,,,070219_p2,001,2019_Jul_02_1148,body_behavioural,3.0.4,59.9683365958585,
6,"He said, “Cheers to a lifelong partnership and to the growth of our company.” ",4,4,None,,,,,,0,6,6,6,,,,,0,36,36,36,,,,,,,,,,,,,,,,,,,,,,,,,,,,,,,,,,,1,1.0865434260340407,,,,,,,,,,,,,,,,,,,,,,,,,,,,070219_p2,001,2019_Jul_02_1148,body_behavioural,3.0.4,59.9683365958585,
6,,,,,,,,,,0,6,6,6,,,,,,,,,,,,,,,,,,,,,,,,,,,,,,,,,,,,,,,,,,,,,,,,,,,,,,,,,,,,,,,,,,,,,,,,070219_p2,001,2019_Jul_02_1148,body_behavioural,3.0.4,59.9683365958585,
7,,,,,,,,,,0,7,7,7,0,0,0,0,,,,,,,,,,,,,,,,,,,,,,,,,,,,,space,1.2534557749750093,space,0.6691969709936529,space,0.5866518349503167,,,,,,,,,,,,,,,,,,,,,,,,,,,,,,,,,,070219_p2,001,2019_Jul_02_1148,body_behavioural,3.0.4,59.9683365958585,
7,"Alex was a distracted, sweaty mess as he walked into the grocery store with Chloe, and he was hoping that she wouldn't suspect that he was about to propose.",1,1,23.0,,,,,,0,7,7,7,,,,,0,0,0,0,,,,,,,,,,,,,,,,,,,,,,,,,,,,,,,space,0.6525906559545547,space,0.5197949600405991,9,10.803328118985519,,,,,,,,,,,,,,,,,,,,,,,,,,,,070219_p2,001,2019_Jul_02_1148,body_behavioural,3.0.4,59.9683365958585,
7,The grocery store was brightly lit with sunshine pouring in through glass walls at the front of the store.,1,1,None,,,,,,0,7,7,7,,,,,0,1,1,1,,,,,,,,,,,,,,,,,,,,,,,,,,,,,,,,,,,1,1.4029825530014932,,,,,,,,,,,,,,,,,,,,,,,,,,,,070219_p2,001,2019_Jul_02_1148,body_behavioural,3.0.4,59.9683365958585,
7,Also in the front area were large posters advertising thanksgiving promotions.,1,1,None,,,,,,0,7,7,7,,,,,0,2,2,2,,,,,,,,,,,,,,,,,,,,,,,,,,,,,,,,,,,1,1.1364005750510842,,,,,,,,,,,,,,,,,,,,,,,,,,,,070219_p2,001,2019_Jul_02_1148,body_behavioural,3.0.4,59.9683365958585,
7,"The store was buzzing with activity because the next day was Thanksgiving Day, and most shoppers had carts piled high with turkey, stuffing, and pies.",1,1,None,,,,,,0,7,7,7,,,,,0,3,3,3,,,,,,,,,,,,,,,,,,,,,,,,,,,,,,,,,,,1,3.103150829032529,,,,,,,,,,,,,,,,,,,,,,,,,,,,070219_p2,001,2019_Jul_02_1148,body_behavioural,3.0.4,59.9683365958585,
7,Alex wanted to propose here because he knew Chloe would be wonderfully surprised. ,1,1,None,,,,,,0,7,7,7,,,,,0,4,4,4,,,,,,,,,,,,,,,,,,,,,,,,,,,,,,,,,,,1,2.419682545005344,,,,,,,,,,,,,,,,,,,,,,,,,,,,070219_p2,001,2019_Jul_02_1148,body_behavioural,3.0.4,59.9683365958585,
7,"After 23 months of dating, Alex knew one of the things Chloe loved most was surprises. ",1,1,None,,,,,,0,7,7,7,,,,,0,5,5,5,,,,,,,,,,,,,,,,,,,,,,,,,,,,,,,,,,,1,2.185800400970038,,,,,,,,,,,,,,,,,,,,,,,,,,,,070219_p2,001,2019_Jul_02_1148,body_behavioural,3.0.4,59.9683365958585,
7,"Chloe perused the canned goods aisle, and said, “Alex, we need a couple things.”",2,1,None,,,,,,0,7,7,7,,,,,0,6,6,6,,,,,,,,,,,,,,,,,,,,,,,,,,,,,,,,,,,1,1.353078195010312,,,,,,,,,,,,,,,,,,,,,,,,,,,,070219_p2,001,2019_Jul_02_1148,body_behavioural,3.0.4,59.9683365958585,
7,"He didn’t hear her and was fanning himself, and Chloe asked him if he was okay.",2,1,None,,,,,,0,7,7,7,,,,,0,7,7,7,,,,,,,,,,,,,,,,,,,,,,,,,,,,,,,,,,,1,2.6531690200208686,,,,,,,,,,,,,,,,,,,,,,,,,,,,070219_p2,001,2019_Jul_02_1148,body_behavioural,3.0.4,59.9683365958585,
7,"“Oh yeah, for sure,” he said, unconvincingly. ",2,1,None,,,,,,0,7,7,7,,,,,0,8,8,8,,,,,,,,,,,,,,,,,,,,,,,,,,,,,,,,,,,1,0.8030530349933542,,,,,,,,,,,,,,,,,,,,,,,,,,,,070219_p2,001,2019_Jul_02_1148,body_behavioural,3.0.4,59.9683365958585,
7,"She chuckled, “Alright, whatever you say.” ",2,1,None,,,,,,0,7,7,7,,,,,0,9,9,9,,,,,,,,,,,,,,,,,,,,,,,,,,,,,,,,,,,1,0.8530672380002216,,,,,,,,,,,,,,,,,,,,,,,,,,,,070219_p2,001,2019_Jul_02_1148,body_behavioural,3.0.4,59.9683365958585,
7,She had a can of pumpkin puree and a bottle of vinegar picked out and was now mulling over the different cans of cranberry sauce.,2,1,None,,,,,,0,7,7,7,,,,,0,10,10,10,,,,,,,,,,,,,,,,,,,,,,,,,,,,,,,,,,,1,1.7197962899808772,,,,,,,,,,,,,,,,,,,,,,,,,,,,070219_p2,001,2019_Jul_02_1148,body_behavioural,3.0.4,59.9683365958585,
