count,storyText,locationEvent,socialEvent,story,locationEventSize,socialEventSize,socialAnswer,locationAnswer,instructText,trials.thisRepN,trials.thisTrialN,trials.thisN,trials.thisIndex,trials_7.thisRepN,trials_7.thisTrialN,trials_7.thisN,trials_7.thisIndex,trials_2.thisRepN,trials_2.thisTrialN,trials_2.thisN,trials_2.thisIndex,trials_3.thisRepN,trials_3.thisTrialN,trials_3.thisN,trials_3.thisIndex,trials_4.thisRepN,trials_4.thisTrialN,trials_4.thisN,trials_4.thisIndex,trials_5.thisRepN,trials_5.thisTrialN,trials_5.thisN,trials_5.thisIndex,trials_6.thisRepN,trials_6.thisTrialN,trials_6.thisN,trials_6.thisIndex,trials_8.thisRepN,trials_8.thisTrialN,trials_8.thisN,trials_8.thisIndex,order of stories,order of perspectives,participant 2 order - stories,participant 2 order  - schemas types,key_resp_8.keys,key_resp_8.rt,key_resp_5.keys,key_resp_5.rt,key_resp_7.keys,key_resp_7.rt,key_resp_15.keys,key_resp_15.rt,key_resp_14.keys,key_resp_14.rt,story_presses.keys,story_presses.rt,story time,key_resp_6.keys,key_resp_6.rt,key_resp_2.keys,key_resp_2.rt,key_resp_10.keys,key_resp_10.rt,recall time,key_resp_12.keys,key_resp_12.rt,key_resp_3.keys,key_resp_3.rt,key_resp_11.keys,key_resp_11.rt,recall,question1_answer,order of question,question2_answer,question3_answer,question4_answer,question5_answer,question6_answer,question7_answer,question8_answer,questions time,key_resp_13.keys,key_resp_13.rt,participant,session,date,expName,psychopyVersion,frameRate,
0,,,,,,,,,,0,0,0,0,0,0,0,0,,,,,,,,,,,,,,,,,,,,,,,,,[32 12 44 43 11 24 31 23 34 42 41 21 14 13 22 33],"['Social' 'Location' 'Location' 'Social' 'Social' 'Social' 'Location'
 'Location' 'Social' 'Location' 'Social' 'Location' 'Location' 'Social'
 'Social' 'Location']",[34 42 41 21 14 13 22 33],"['Social' 'Location' 'Social' 'Location' 'Location' 'Social' 'Social'
 'Location']",space,16.101798927003983,space,1.9193713340209797,space,2.000721315969713,,,,,,,,,,,,,,,,,,,,,,,,,,,,,,,,,,070219_p2,001,2019_Jul_02_1148,body_behavioural,3.0.4,59.9683365958585,
0,,,,,,,,,,0,0,0,0,1,0,1,0,,,,,,,,,,,,,,,,,,,,,,,,,,,,,,,,,space,0.583850616007112,,,,,,,,,,,,,,,,,,,,,,,,,,,,,,,,,,070219_p2,001,2019_Jul_02_1148,body_behavioural,3.0.4,59.9683365958585,
0,"Jeff, hoping that today would be a pivotal day for his company, had only been waiting inside the entrance of the airport for a few minutes when he saw William and eagerly waved him over. ",1,1,32.0,,,,,,0,0,0,0,,,,,0,0,0,0,,,,,,,,,,,,,,,,,,,,,,,,,,,,,,,space,0.6699077149969526,space,2.753226899949368,9,15.434659702004865,,,,,,,,,,,,,,,,,,,,,,,,,,,,070219_p2,001,2019_Jul_02_1148,body_behavioural,3.0.4,59.9683365958585,
0,William checked his watch and was pleased to see that the two of them had two hours to discuss business before their flights left Boston.,1,1,None,,,,,,0,0,0,0,,,,,0,1,1,1,,,,,,,,,,,,,,,,,,,,,,,,,,,,,,,,,,,1,12.501398402964696,,,,,,,,,,,,,,,,,,,,,,,,,,,,070219_p2,001,2019_Jul_02_1148,body_behavioural,3.0.4,59.9683365958585,
0,Jeff and William had met the night before in line for the bathroom at a local bar. ,1,1,None,,,,,,0,0,0,0,,,,,0,2,2,2,,,,,,,,,,,,,,,,,,,,,,,,,,,,,,,,,,,9,11.034761559974868,,,,,,,,,,,,,,,,,,,,,,,,,,,,070219_p2,001,2019_Jul_02_1148,body_behavioural,3.0.4,59.9683365958585,
0,Jeff had delivered some surprisingly-detailed complaints to William about the wine selection.,1,1,None,,,,,,0,0,0,0,,,,,0,3,3,3,,,,,,,,,,,,,,,,,,,,,,,,,,,,,,,,,,,1,8.053577770013362,,,,,,,,,,,,,,,,,,,,,,,,,,,,070219_p2,001,2019_Jul_02_1148,body_behavioural,3.0.4,59.9683365958585,
0,"They quickly learned that they were both in the wine industry: Jeff was a sales associate for wine vineyards in the Northeast, and William was a wine buyer for corporate events.",1,1,None,,,,,,0,0,0,0,,,,,0,4,4,4,,,,,,,,,,,,,,,,,,,,,,,,,,,,,,,,,,,1,11.387761207995936,,,,,,,,,,,,,,,,,,,,,,,,,,,,070219_p2,001,2019_Jul_02_1148,body_behavioural,3.0.4,59.9683365958585,
0,"Since they both had flights out of Boston at the same time, they had agreed to meet at the airport and talk about doing business together. ",1,1,None,,,,,,0,0,0,0,,,,,0,5,5,5,,,,,,,,,,,,,,,,,,,,,,,,,,,,,,,,,,,1,5.786671109963208,,,,,,,,,,,,,,,,,,,,,,,,,,,,070219_p2,001,2019_Jul_02_1148,body_behavioural,3.0.4,59.9683365958585,
0,They waited in line at security.,2,1,None,,,,,,0,0,0,0,,,,,0,6,6,6,,,,,,,,,,,,,,,,,,,,,,,,,,,,,,,,,,,1,2.453503897006158,,,,,,,,,,,,,,,,,,,,,,,,,,,,070219_p2,001,2019_Jul_02_1148,body_behavioural,3.0.4,59.9683365958585,
0,"“It’s crazy that we met last night,” William said.",2,1,None,,,,,,0,0,0,0,,,,,0,7,7,7,,,,,,,,,,,,,,,,,,,,,,,,,,,,,,,,,,,1,2.8693989930325188,,,,,,,,,,,,,,,,,,,,,,,,,,,,070219_p2,001,2019_Jul_02_1148,body_behavioural,3.0.4,59.9683365958585,
0,"“I am flying out right now to meet my boss, and was worried that I was going to show up empty handed without anything to show for the East Coast.” ",2,1,None,,,,,,0,0,0,0,,,,,0,8,8,8,,,,,,,,,,,,,,,,,,,,,,,,,,,,,,,,,,,1,5.570072715985589,,,,,,,,,,,,,,,,,,,,,,,,,,,,070219_p2,001,2019_Jul_02_1148,body_behavioural,3.0.4,59.9683365958585,
0,"“I know, what are the chances, right?” Jeff replied.",2,1,None,,,,,,0,0,0,0,,,,,0,9,9,9,,,,,,,,,,,,,,,,,,,,,,,,,,,,,,,,,,,1,2.853204242011998,,,,,,,,,,,,,,,,,,,,,,,,,,,,070219_p2,001,2019_Jul_02_1148,body_behavioural,3.0.4,59.9683365958585,
0,"William laughed and said, “I’m glad our complaining can come in handy.”",2,1,None,,,,,,0,0,0,0,,,,,0,10,10,10,,,,,,,,,,,,,,,,,,,,,,,,,,,,,,,,,,,1,3.1865559649886563,,,,,,,,,,,,,,,,,,,,,,,,,,,,070219_p2,001,2019_Jul_02_1148,body_behavioural,3.0.4,59.9683365958585,
0,"William got focused and, shifting gears, said, “I know this is fast, but I'd like to get right down to business since time is a limiting factor.",2,2,None,,,,,,0,0,0,0,,,,,0,11,11,11,,,,,,,,,,,,,,,,,,,,,,,,,,,,,,,,,,,1,7.503384743002243,,,,,,,,,,,,,,,,,,,,,,,,,,,,070219_p2,001,2019_Jul_02_1148,body_behavioural,3.0.4,59.9683365958585,
0,I'd really like to order a couple of sample shipments from you and present them to our clients: I think they’d really love to have some East Coast variety. ,2,2,None,,,,,,0,0,0,0,,,,,0,12,12,12,,,,,,,,,,,,,,,,,,,,,,,,,,,,,,,,,,,1,6.970301807974465,,,,,,,,,,,,,,,,,,,,,,,,,,,,070219_p2,001,2019_Jul_02_1148,body_behavioural,3.0.4,59.9683365958585,
0,"Now, typically we expect to get these kinds of samples at a steep discount, at least half-off the label price.",2,2,None,,,,,,0,0,0,0,,,,,0,13,13,13,,,,,,,,,,,,,,,,,,,,,,,,,,,,,,,,,,,1,5.836780638026539,,,,,,,,,,,,,,,,,,,,,,,,,,,,070219_p2,001,2019_Jul_02_1148,body_behavioural,3.0.4,59.9683365958585,
0,This small loss is well worth the profit you’d be making if even a single client makes a contract.,2,2,None,,,,,,0,0,0,0,,,,,0,14,14,14,,,,,,,,,,,,,,,,,,,,,,,,,,,,,,,,,,,1,4.817810626002029,,,,,,,,,,,,,,,,,,,,,,,,,,,,070219_p2,001,2019_Jul_02_1148,body_behavioural,3.0.4,59.9683365958585,
0,"So, I propose that you send us 5 crates of your select wines for $800.”",2,2,None,,,,,,0,0,0,0,,,,,0,15,15,15,,,,,,,,,,,,,,,,,,,,,,,,,,,,,,,,,,,1,4.734223612991627,,,,,,,,,,,,,,,,,,,,,,,,,,,,070219_p2,001,2019_Jul_02_1148,body_behavioural,3.0.4,59.9683365958585,
0,"Before going through the metal detector, there was a pause in the security line to roll out the empty bin cart and roll in a filled one. ",2,2,None,,,,,,0,0,0,0,,,,,0,16,16,16,,,,,,,,,,,,,,,,,,,,,,,,,,,,,,,,,,,9,7.169981034996454,,,,,,,,,,,,,,,,,,,,,,,,,,,,070219_p2,001,2019_Jul_02_1148,body_behavioural,3.0.4,59.9683365958585,
0,They placed everything in their bins. ,2,2,None,,,,,,0,0,0,0,,,,,0,17,17,17,,,,,,,,,,,,,,,,,,,,,,,,,,,,,,,,,,,1,3.2528721669805236,,,,,,,,,,,,,,,,,,,,,,,,,,,,070219_p2,001,2019_Jul_02_1148,body_behavioural,3.0.4,59.9683365958585,
0,"Jeff mulled over the offer, nodding noncommittally to William's pitch as they proceeded through the metal detector.",2,2,None,,,,,,0,0,0,0,,,,,0,18,18,18,,,,,,,,,,,,,,,,,,,,,,,,,,,,,,,,,,,1,4.319958815001883,,,,,,,,,,,,,,,,,,,,,,,,,,,,070219_p2,001,2019_Jul_02_1148,body_behavioural,3.0.4,59.9683365958585,
0,"Having recovered from the security check, they began to walk through the concourse toward Jeff’s gate, B8, and William handed some printed spreadsheets to Jeff.",3,2,None,,,,,,0,0,0,0,,,,,0,19,19,19,,,,,,,,,,,,,,,,,,,,,,,,,,,,,,,,,,,1,5.653359768970404,,,,,,,,,,,,,,,,,,,,,,,,,,,,070219_p2,001,2019_Jul_02_1148,body_behavioural,3.0.4,59.9683365958585,
0,"Jeff, weaving through the crowd of travelers, squinted at William's rosy projections of the number of bottles he would purchase in the future.",3,2,None,,,,,,0,0,0,0,,,,,0,20,20,20,,,,,,,,,,,,,,,,,,,,,,,,,,,,,,,,,,,1,5.5201193850371055,,,,,,,,,,,,,,,,,,,,,,,,,,,,070219_p2,001,2019_Jul_02_1148,body_behavioural,3.0.4,59.9683365958585,
0,"After thinking for a couple minutes, Jeff said, “I am not sure about this since we’re not coming from a corporate vineyard and gambling with sample shipments at this rate is the kind of risk we can’t necessarily make. ",3,3,None,,,,,,0,0,0,0,,,,,0,21,21,21,,,,,,,,,,,,,,,,,,,,,,,,,,,,,,,,,,,1,9.903738870983943,,,,,,,,,,,,,,,,,,,,,,,,,,,,070219_p2,001,2019_Jul_02_1148,body_behavioural,3.0.4,59.9683365958585,
0,These corporate purchases would have to be huge and practically guaranteed to offset the loss from selling sample shipments at a price like you suggest.”,3,3,None,,,,,,0,0,0,0,,,,,0,22,22,22,,,,,,,,,,,,,,,,,,,,,,,,,,,,,,,,,,,1,7.087226574018132,,,,,,,,,,,,,,,,,,,,,,,,,,,,070219_p2,001,2019_Jul_02_1148,body_behavioural,3.0.4,59.9683365958585,
0,"William told Jeff that they had made the same offer to their competitor, Yankee Vines, who had refused and that they would make a better offer to Jeff and his company.",3,3,None,,,,,,0,0,0,0,,,,,0,23,23,23,,,,,,,,,,,,,,,,,,,,,,,,,,,,,,,,,,,1,6.503252867027186,,,,,,,,,,,,,,,,,,,,,,,,,,,,070219_p2,001,2019_Jul_02_1148,body_behavioural,3.0.4,59.9683365958585,
0,"They walked to the gates very slowly, barely registering the hubbub of the airport.",3,3,None,,,,,,0,0,0,0,,,,,0,24,24,24,,,,,,,,,,,,,,,,,,,,,,,,,,,,,,,,,,,1,3.2007027200306766,,,,,,,,,,,,,,,,,,,,,,,,,,,,070219_p2,001,2019_Jul_02_1148,body_behavioural,3.0.4,59.9683365958585,
0,"William and Jeff came to an agreement on a compromise rate on the sample shipment, paying $400 for a $600 shipment of wine samples, and they finalized the deal with a handshake. ",3,4,None,,,,,,0,0,0,0,,,,,0,25,25,25,,,,,,,,,,,,,,,,,,,,,,,,,,,,,,,,,,,1,8.553441533993464,,,,,,,,,,,,,,,,,,,,,,,,,,,,070219_p2,001,2019_Jul_02_1148,body_behavioural,3.0.4,59.9683365958585,
0,"“Well, what a tremendous pleasure to do business with you and to have all this work out,” William said.",3,4,None,,,,,,0,0,0,0,,,,,0,26,26,26,,,,,,,,,,,,,,,,,,,,,,,,,,,,,,,,,,,1,3.7534826429910026,,,,,,,,,,,,,,,,,,,,,,,,,,,,070219_p2,001,2019_Jul_02_1148,body_behavioural,3.0.4,59.9683365958585,
0,"Jeff nodded enthusiastically, and responded, “Likewise- this has been great.  ",3,4,None,,,,,,0,0,0,0,,,,,0,27,27,27,,,,,,,,,,,,,,,,,,,,,,,,,,,,,,,,,,,1,3.603803813981358,,,,,,,,,,,,,,,,,,,,,,,,,,,,070219_p2,001,2019_Jul_02_1148,body_behavioural,3.0.4,59.9683365958585,
0,I'll let you get to your gate.,3,4,None,,,,,,0,0,0,0,,,,,0,28,28,28,,,,,,,,,,,,,,,,,,,,,,,,,,,,,,,,,,,1,1.1697561019682325,,,,,,,,,,,,,,,,,,,,,,,,,,,,070219_p2,001,2019_Jul_02_1148,body_behavioural,3.0.4,59.9683365958585,
0,"Once we’re both back on the ground, we can work out all the official documentation and get this in the books.”",3,4,None,,,,,,0,0,0,0,,,,,0,29,29,29,,,,,,,,,,,,,,,,,,,,,,,,,,,,,,,,,,,1,4.954425609961618,,,,,,,,,,,,,,,,,,,,,,,,,,,,070219_p2,001,2019_Jul_02_1148,body_behavioural,3.0.4,59.9683365958585,
0,"Jeff jogged to his gate, scanned his boarding pass, and walked onto the plane.",4,4,None,,,,,,0,0,0,0,,,,,0,30,30,30,,,,,,,,,,,,,,,,,,,,,,,,,,,,,,,,,,,1,2.286342032952234,,,,,,,,,,,,,,,,,,,,,,,,,,,,070219_p2,001,2019_Jul_02_1148,body_behavioural,3.0.4,59.9683365958585,
0,He sat down in seat 4A in the business class section and typed out a quick email on his phone letting the rest of his team know the good news. ,4,4,None,,,,,,0,0,0,0,,,,,0,31,31,31,,,,,,,,,,,,,,,,,,,,,,,,,,,,,,,,,,,1,4.253788342990447,,,,,,,,,,,,,,,,,,,,,,,,,,,,070219_p2,001,2019_Jul_02_1148,body_behavioural,3.0.4,59.9683365958585,
0,"When the flight attendant came by, he ordered a glass of champagne to celebrate.",4,4,None,,,,,,0,0,0,0,,,,,0,32,32,32,,,,,,,,,,,,,,,,,,,,,,,,,,,,,,,,,,,1,1.9532480019843206,,,,,,,,,,,,,,,,,,,,,,,,,,,,070219_p2,001,2019_Jul_02_1148,body_behavioural,3.0.4,59.9683365958585,
0,,,,,,,,,,0,0,0,0,,,,,,,,,,,,,,,,,,,,,,,,,,,,,,,,,,,,,,,,,,,,,,,,,,,,,,,,,,,,,,,,,,,,,,,,070219_p2,001,2019_Jul_02_1148,body_behavioural,3.0.4,59.9683365958585,
1,,,,,,,,,,0,1,1,1,0,0,0,0,,,,,,,,,,,,,,,,,,,,,,,,,,,,,space,2.136334293987602,space,1.0527851909864694,space,2.119370438042097,,,,,,,,,,,,,,,,,,,,,,,,,,,,,,,,,,070219_p2,001,2019_Jul_02_1148,body_behavioural,3.0.4,59.9683365958585,
1,"It didn’t help the situation that Calvin and Jessie were running late to the airport, since Jessie had already been fuming at Calvin and preparing to end the relationship with him.",1,1,12.0,,,,,,0,1,1,1,,,,,0,0,0,0,,,,,,,,,,,,,,,,,,,,,,,,,,,,,,,space,1.186340661952272,space,1.169475179980509,9,6.47026656800881,,,,,,,,,,,,,,,,,,,,,,,,,,,,070219_p2,001,2019_Jul_02_1148,body_behavioural,3.0.4,59.9683365958585,
1,"Upon arriving at their terminal, they only had 45 minutes until their international flight would depart from Jamaica for the US.",1,1,None,,,,,,0,1,1,1,,,,,0,1,1,1,,,,,,,,,,,,,,,,,,,,,,,,,,,,,,,,,,,1,5.3033953250269406,,,,,,,,,,,,,,,,,,,,,,,,,,,,070219_p2,001,2019_Jul_02_1148,body_behavioural,3.0.4,59.9683365958585,
1,"It had been a tough vacation, which was planned well before Jessie began to think of breaking up with Calvin 6 weeks ago.  ",1,1,None,,,,,,0,1,1,1,,,,,0,2,2,2,,,,,,,,,,,,,,,,,,,,,,,,,,,,,,,,,,,1,5.120104643981904,,,,,,,,,,,,,,,,,,,,,,,,,,,,070219_p2,001,2019_Jul_02_1148,body_behavioural,3.0.4,59.9683365958585,
1,"Calvin knew that Jessie was upset, but wasn't sure what to do besides attempt to carry on as normal.",1,1,None,,,,,,0,1,1,1,,,,,0,3,3,3,,,,,,,,,,,,,,,,,,,,,,,,,,,,,,,,,,,1,2.936888632015325,,,,,,,,,,,,,,,,,,,,,,,,,,,,070219_p2,001,2019_Jul_02_1148,body_behavioural,3.0.4,59.9683365958585,
1,"The security line was very short, and once the online boarding passes were scanned, they put their bags on the conveyor belt.",2,1,None,,,,,,0,1,1,1,,,,,0,4,4,4,,,,,,,,,,,,,,,,,,,,,,,,,,,,,,,,,,,1,3.0029521829565056,,,,,,,,,,,,,,,,,,,,,,,,,,,,070219_p2,001,2019_Jul_02_1148,body_behavioural,3.0.4,59.9683365958585,
1,Calvin also took off his belt and watch.,2,1,None,,,,,,0,1,1,1,,,,,0,5,5,5,,,,,,,,,,,,,,,,,,,,,,,,,,,,,,,,,,,1,1.5340327680460177,,,,,,,,,,,,,,,,,,,,,,,,,,,,070219_p2,001,2019_Jul_02_1148,body_behavioural,3.0.4,59.9683365958585,
1,"There was a short halt in security proceedings so that the security guards could change shifts, but, once everything was back in order, they were ushered quickly through the metal detector. ",2,1,None,,,,,,0,1,1,1,,,,,0,6,6,6,,,,,,,,,,,,,,,,,,,,,,,,,,,,,,,,,,,1,4.386244796041865,,,,,,,,,,,,,,,,,,,,,,,,,,,,070219_p2,001,2019_Jul_02_1148,body_behavioural,3.0.4,59.9683365958585,
1,"“The infrastructure of this airport is really quite poor," said Calvin as they waited for their bags to emerge from the x-ray machine.",2,1,None,,,,,,0,1,1,1,,,,,0,7,7,7,,,,,,,,,,,,,,,,,,,,,,,,,,,,,,,,,,,1,2.9196150610223413,,,,,,,,,,,,,,,,,,,,,,,,,,,,070219_p2,001,2019_Jul_02_1148,body_behavioural,3.0.4,59.9683365958585,
1,“I could've hidden something in my shoes easily.” ,2,1,None,,,,,,0,1,1,1,,,,,0,8,8,8,,,,,,,,,,,,,,,,,,,,,,,,,,,,,,,,,,,1,1.4359196780133061,,,,,,,,,,,,,,,,,,,,,,,,,,,,070219_p2,001,2019_Jul_02_1148,body_behavioural,3.0.4,59.9683365958585,
1,"Jessie, exasperated, scowled at the conveyor belt.",2,1,None,,,,,,0,1,1,1,,,,,0,9,9,9,,,,,,,,,,,,,,,,,,,,,,,,,,,,,,,,,,,1,2.200755450001452,,,,,,,,,,,,,,,,,,,,,,,,,,,,070219_p2,001,2019_Jul_02_1148,body_behavioural,3.0.4,59.9683365958585,
1,“What?” he asked.,2,1,None,,,,,,0,1,1,1,,,,,0,10,10,10,,,,,,,,,,,,,,,,,,,,,,,,,,,,,,,,,,,1,0.7029780439916067,,,,,,,,,,,,,,,,,,,,,,,,,,,,070219_p2,001,2019_Jul_02_1148,body_behavioural,3.0.4,59.9683365958585,
1,"Balling up her fists and turning to him angrily, she said, “Calvin, I really don’t think I can do this anymore because I don’t think our personalities are compatible. ",2,2,None,,,,,,0,1,1,1,,,,,0,11,11,11,,,,,,,,,,,,,,,,,,,,,,,,,,,,,,,,,,,1,5.18657570501091,,,,,,,,,,,,,,,,,,,,,,,,,,,,070219_p2,001,2019_Jul_02_1148,body_behavioural,3.0.4,59.9683365958585,
1,I think it’s best that once we get to the States we part ways for good.” ,2,2,None,,,,,,0,1,1,1,,,,,0,12,12,12,,,,,,,,,,,,,,,,,,,,,,,,,,,,,,,,,,,1,4.653220135020092,,,,,,,,,,,,,,,,,,,,,,,,,,,,070219_p2,001,2019_Jul_02_1148,body_behavioural,3.0.4,59.9683365958585,
1,Calvin said nothing as he grabbed his bag and walked down the concourse.,3,2,None,,,,,,0,1,1,1,,,,,0,13,13,13,,,,,,,,,,,,,,,,,,,,,,,,,,,,,,,,,,,1,2.120518448005896,,,,,,,,,,,,,,,,,,,,,,,,,,,,070219_p2,001,2019_Jul_02_1148,body_behavioural,3.0.4,59.9683365958585,
1,Jessie trailed behind him as they hurried their way quickly toward gate A28.,3,2,None,,,,,,0,1,1,1,,,,,0,14,14,14,,,,,,,,,,,,,,,,,,,,,,,,,,,,,,,,,,,1,2.1030703780124895,,,,,,,,,,,,,,,,,,,,,,,,,,,,070219_p2,001,2019_Jul_02_1148,body_behavioural,3.0.4,59.9683365958585,
1,“So now you have nothing to say?” Jessie said. ,3,2,None,,,,,,0,1,1,1,,,,,0,15,15,15,,,,,,,,,,,,,,,,,,,,,,,,,,,,,,,,,,,1,1.4673810550011694,,,,,,,,,,,,,,,,,,,,,,,,,,,,070219_p2,001,2019_Jul_02_1148,body_behavioural,3.0.4,59.9683365958585,
1,"Calvin didn't answer, gritting his teeth and staring straight ahead. ",3,2,None,,,,,,0,1,1,1,,,,,0,16,16,16,,,,,,,,,,,,,,,,,,,,,,,,,,,,,,,,,,,1,0.9359607390360907,,,,,,,,,,,,,,,,,,,,,,,,,,,,070219_p2,001,2019_Jul_02_1148,body_behavioural,3.0.4,59.9683365958585,
1,"He was very frustrated that he felt he had been trying to appease Jessie for the entirety of the vacation, and it seemed to be completed unappreciated. ",3,2,None,,,,,,0,1,1,1,,,,,0,17,17,17,,,,,,,,,,,,,,,,,,,,,,,,,,,,,,,,,,,1,3.953061059000902,,,,,,,,,,,,,,,,,,,,,,,,,,,,070219_p2,001,2019_Jul_02_1148,body_behavioural,3.0.4,59.9683365958585,
1,"Their silence was punctuated only by the rapid, rhythmic clacking of their suitcase wheels over the tile floor as they continued power-walking through the terminal. ",3,2,None,,,,,,0,1,1,1,,,,,0,18,18,18,,,,,,,,,,,,,,,,,,,,,,,,,,,,,,,,,,,1,3.219933547952678,,,,,,,,,,,,,,,,,,,,,,,,,,,,070219_p2,001,2019_Jul_02_1148,body_behavioural,3.0.4,59.9683365958585,
1,"Calvin finally turned to address her as they continued walking: “Jessie, this makes perfect sense. ",3,3,None,,,,,,0,1,1,1,,,,,0,19,19,19,,,,,,,,,,,,,,,,,,,,,,,,,,,,,,,,,,,1,3.936431063048076,,,,,,,,,,,,,,,,,,,,,,,,,,,,070219_p2,001,2019_Jul_02_1148,body_behavioural,3.0.4,59.9683365958585,
1,"If you feel this way, then I think we should break up because I don’t want to keep boring you.",3,3,None,,,,,,0,1,1,1,,,,,0,20,20,20,,,,,,,,,,,,,,,,,,,,,,,,,,,,,,,,,,,1,2.2533157580182888,,,,,,,,,,,,,,,,,,,,,,,,,,,,070219_p2,001,2019_Jul_02_1148,body_behavioural,3.0.4,59.9683365958585,
1,"I agree, let’s part ways once we make it back.",3,3,None,,,,,,0,1,1,1,,,,,0,21,21,21,,,,,,,,,,,,,,,,,,,,,,,,,,,,,,,,,,,1,1.8697350950096734,,,,,,,,,,,,,,,,,,,,,,,,,,,,070219_p2,001,2019_Jul_02_1148,body_behavioural,3.0.4,59.9683365958585,
1,You should’ve spoken up about my apparent intolerability before you decided to plan this vacation.”,3,3,None,,,,,,0,1,1,1,,,,,0,22,22,22,,,,,,,,,,,,,,,,,,,,,,,,,,,,,,,,,,,1,3.7704134130035527,,,,,,,,,,,,,,,,,,,,,,,,,,,,070219_p2,001,2019_Jul_02_1148,body_behavioural,3.0.4,59.9683365958585,
1,"He was very hurt, even though he didn’t want to show it. ",3,3,None,,,,,,0,1,1,1,,,,,0,23,23,23,,,,,,,,,,,,,,,,,,,,,,,,,,,,,,,,,,,1,2.0862999689998105,,,,,,,,,,,,,,,,,,,,,,,,,,,,070219_p2,001,2019_Jul_02_1148,body_behavioural,3.0.4,59.9683365958585,
1,"Having made it to their gate, they scanned their tickets, and the annoyed flight attendant shooed them onto the jet bridge and then closed the plane door behind them.",4,3,None,,,,,,0,1,1,1,,,,,0,24,24,24,,,,,,,,,,,,,,,,,,,,,,,,,,,,,,,,,,,1,5.103785456973128,,,,,,,,,,,,,,,,,,,,,,,,,,,,070219_p2,001,2019_Jul_02_1148,body_behavioural,3.0.4,59.9683365958585,
1,"Luckily, they had forgotten to arrange seats next to each other on the flight back.",4,3,None,,,,,,0,1,1,1,,,,,0,25,25,25,,,,,,,,,,,,,,,,,,,,,,,,,,,,,,,,,,,1,5.4029828339698724,,,,,,,,,,,,,,,,,,,,,,,,,,,,070219_p2,001,2019_Jul_02_1148,body_behavioural,3.0.4,59.9683365958585,
1,"They were both in economy, but Jessie was headed for seat 33A while Calvin's seat was 33F. ",4,3,None,,,,,,0,1,1,1,,,,,0,26,26,26,,,,,,,,,,,,,,,,,,,,,,,,,,,,,,,,,,,1,3.2174598750425503,,,,,,,,,,,,,,,,,,,,,,,,,,,,070219_p2,001,2019_Jul_02_1148,body_behavioural,3.0.4,59.9683365958585,
1,"Before Jessie sat down, she took a deep breath, calmed her emotions, and then awkwardly shook Calvin’s hand, mumbling, “Have a nice flight. ",4,4,None,,,,,,0,1,1,1,,,,,0,27,27,27,,,,,,,,,,,,,,,,,,,,,,,,,,,,,,,,,,,1,3.187481081986334,,,,,,,,,,,,,,,,,,,,,,,,,,,,070219_p2,001,2019_Jul_02_1148,body_behavioural,3.0.4,59.9683365958585,
1,"Oh, and when you get a chance, could you send me back all the philosophy books I lent you?”",4,4,None,,,,,,0,1,1,1,,,,,0,28,28,28,,,,,,,,,,,,,,,,,,,,,,,,,,,,,,,,,,,1,2.7865795249817893,,,,,,,,,,,,,,,,,,,,,,,,,,,,070219_p2,001,2019_Jul_02_1148,body_behavioural,3.0.4,59.9683365958585,
1,He laughed in disbelief and walked to his window seat three rows back to get ready for takeoff.,4,4,None,,,,,,0,1,1,1,,,,,0,29,29,29,,,,,,,,,,,,,,,,,,,,,,,,,,,,,,,,,,,1,2.8360789159778506,,,,,,,,,,,,,,,,,,,,,,,,,,,,070219_p2,001,2019_Jul_02_1148,body_behavioural,3.0.4,59.9683365958585,
1,Both were upset but glad that they would have this flight in solitude.,4,4,None,,,,,,0,1,1,1,,,,,0,30,30,30,,,,,,,,,,,,,,,,,,,,,,,,,,,,,,,,,,,1,2.1702717080479488,,,,,,,,,,,,,,,,,,,,,,,,,,,,070219_p2,001,2019_Jul_02_1148,body_behavioural,3.0.4,59.9683365958585,
1,,,,,,,,,,0,1,1,1,,,,,,,,,,,,,,,,,,,,,,,,,,,,,,,,,,,,,,,,,,,,,,,,,,,,,,,,,,,,,,,,,,,,,,,,070219_p2,001,2019_Jul_02_1148,body_behavioural,3.0.4,59.9683365958585,
2,,,,,,,,,,0,2,2,2,0,0,0,0,,,,,,,,,,,,,,,,,,,,,,,,,,,,,space,1.4696543399477378,space,1.1363618050236255,space,0.8195224170340225,,,,,,,,,,,,,,,,,,,,,,,,,,,,,,,,,,070219_p2,001,2019_Jul_02_1148,body_behavioural,3.0.4,59.9683365958585,
2,"Ariana hurried into the classroom, and Leon did a double-take when he saw her, almost dropping the eraser he had in his hand. ",1.0,1.0,44.0,,,,,,0,2,2,2,,,,,0,0,0,0,,,,,,,,,,,,,,,,,,,,,,,,,,,,,,,space,0.51968357199803,space,1.0524905000347644,9,10.08708096499322,,,,,,,,,,,,,,,,,,,,,,,,,,,,070219_p2,001,2019_Jul_02_1148,body_behavioural,3.0.4,59.9683365958585,
2,"This was his first day in college, and he had assumed that he wouldn’t know anyone on campus, but he had a strong feeling that he had seen her somewhere before. ",1.0,1.0,None,,,,,,0,2,2,2,,,,,0,1,1,1,,,,,,,,,,,,,,,,,,,,,,,,,,,,,,,,,,,1,6.253425344009884,,,,,,,,,,,,,,,,,,,,,,,,,,,,070219_p2,001,2019_Jul_02_1148,body_behavioural,3.0.4,59.9683365958585,
2,They were in a small classroom with rows of chairs with foldable desks.,1.0,1.0,None,,,,,,0,2,2,2,,,,,0,2,2,2,,,,,,,,,,,,,,,,,,,,,,,,,,,,,,,,,,,1,2.253435062011704,,,,,,,,,,,,,,,,,,,,,,,,,,,,070219_p2,001,2019_Jul_02_1148,body_behavioural,3.0.4,59.9683365958585,
2,These faced the speaker’s podium and a blackboard on wheels. ,None,None,None,,,,,,0,2,2,2,,,,,0,3,3,3,,,,,,,,,,,,,,,,,,,,,,,,,,,,,,,,,,,1,2.152528286969755,,,,,,,,,,,,,,,,,,,,,,,,,,,,070219_p2,001,2019_Jul_02_1148,body_behavioural,3.0.4,59.9683365958585,
2,"There were no windows in the room, since they were down in the basement of the History Department.",1.0,1.0,None,,,,,,0,2,2,2,,,,,0,4,4,4,,,,,,,,,,,,,,,,,,,,,,,,,,,,,,,,,,,1,7.752279146981891,,,,,,,,,,,,,,,,,,,,,,,,,,,,070219_p2,001,2019_Jul_02_1148,body_behavioural,3.0.4,59.9683365958585,
2,"Leon, trying to figure out where he had seen her before, could not stop looking over at Ariana.",1.0,1.0,None,,,,,,0,2,2,2,,,,,0,5,5,5,,,,,,,,,,,,,,,,,,,,,,,,,,,,,,,,,,,1,6.653581434045918,,,,,,,,,,,,,,,,,,,,,,,,,,,,070219_p2,001,2019_Jul_02_1148,body_behavioural,3.0.4,59.9683365958585,
2,Ariana was oblivious to Leon’s gaze and was only focused on getting ready for class. ,1.0,1.0,None,,,,,,0,2,2,2,,,,,0,6,6,6,,,,,,,,,,,,,,,,,,,,,,,,,,,,,,,,,,,1,2.902699821977876,,,,,,,,,,,,,,,,,,,,,,,,,,,,070219_p2,001,2019_Jul_02_1148,body_behavioural,3.0.4,59.9683365958585,
2,"“Good morning, everyone,” the professor began.",2.0,1.0,None,,,,,,0,2,2,2,,,,,0,7,7,7,,,,,,,,,,,,,,,,,,,,,,,,,,,,,,,,,,,1,1.619976210000459,,,,,,,,,,,,,,,,,,,,,,,,,,,,070219_p2,001,2019_Jul_02_1148,body_behavioural,3.0.4,59.9683365958585,
2,“Welcome to History of Egypt. ,2.0,1.0,None,,,,,,0,2,2,2,,,,,0,8,8,8,,,,,,,,,,,,,,,,,,,,,,,,,,,,,,,,,,,1,2.3360523199662566,,,,,,,,,,,,,,,,,,,,,,,,,,,,070219_p2,001,2019_Jul_02_1148,body_behavioural,3.0.4,59.9683365958585,
2,"Today we will be talking about mummification, one of the most famous and often misunderstood customs in ancient Egyptian society.”",2.0,1.0,None,,,,,,0,2,2,2,,,,,0,9,9,9,,,,,,,,,,,,,,,,,,,,,,,,,,,,,,,,,,,1,2.55318777798675,,,,,,,,,,,,,,,,,,,,,,,,,,,,070219_p2,001,2019_Jul_02_1148,body_behavioural,3.0.4,59.9683365958585,
2,Leon and Ariana began taking notes. ,2.0,1.0,None,,,,,,0,2,2,2,,,,,0,10,10,10,,,,,,,,,,,,,,,,,,,,,,,,,,,,,,,,,,,1,1.2028628150001168,,,,,,,,,,,,,,,,,,,,,,,,,,,,070219_p2,001,2019_Jul_02_1148,body_behavioural,3.0.4,59.9683365958585,
2,"Within a few minutes, though, Leon found his attention wandering from the lecture and back to Ariana, and he decided to do something about it by putting a note on her desk.",2.0,2.0,None,,,,,,0,2,2,2,,,,,0,11,11,11,,,,,,,,,,,,,,,,,,,,,,,,,,,,,,,,,,,1,4.036431379034184,,,,,,,,,,,,,,,,,,,,,,,,,,,,070219_p2,001,2019_Jul_02_1148,body_behavioural,3.0.4,59.9683365958585,
