2,"“Are you from LA?” it read, “Sorry to distract you from mummies, but you look really familiar.”",2.0,2.0,None,,,,,,0,2,2,2,,,,,0,12,12,12,,,,,,,,,,,,,,,,,,,,,,,,,,,,,,,,,,,1,2.6698210000176914,,,,,,,,,,,,,,,,,,,,,,,,,,,,070219_p2,001,2019_Jul_02_1148,body_behavioural,3.0.4,59.9683365958585,
2,"She looked at the note with surprise, and then turned to notice Leon for the first time. ",2.0,2.0,None,,,,,,0,2,2,2,,,,,0,13,13,13,,,,,,,,,,,,,,,,,,,,,,,,,,,,,,,,,,,1,2.4531311750179157,,,,,,,,,,,,,,,,,,,,,,,,,,,,070219_p2,001,2019_Jul_02_1148,body_behavioural,3.0.4,59.9683365958585,
2,She instantly liked him when she saw him.,2.0,2.0,None,,,,,,0,2,2,2,,,,,0,14,14,14,,,,,,,,,,,,,,,,,,,,,,,,,,,,,,,,,,,1,1.4361501749954186,,,,,,,,,,,,,,,,,,,,,,,,,,,,070219_p2,001,2019_Jul_02_1148,body_behavioural,3.0.4,59.9683365958585,
2,She thought he looked trustworthy and genuine.,2.0,2.0,None,,,,,,0,2,2,2,,,,,0,15,15,15,,,,,,,,,,,,,,,,,,,,,,,,,,,,,,,,,,,1,1.7531902019982226,,,,,,,,,,,,,,,,,,,,,,,,,,,,070219_p2,001,2019_Jul_02_1148,body_behavioural,3.0.4,59.9683365958585,
2,"Ariana passed the note back to Leon, and she had replied, “No, but maybe my twin and I were separated at birth.”",2.0,2.0,None,,,,,,0,2,2,2,,,,,0,16,16,16,,,,,,,,,,,,,,,,,,,,,,,,,,,,,,,,,,,1,4.98668919201009,,,,,,,,,,,,,,,,,,,,,,,,,,,,070219_p2,001,2019_Jul_02_1148,body_behavioural,3.0.4,59.9683365958585,
2,"The professor continued, “One may well question why the ancient Egyptians spent so much time and effort on their funerary practices.",3.0,2.0,None,,,,,,0,2,2,2,,,,,0,17,17,17,,,,,,,,,,,,,,,,,,,,,,,,,,,,,,,,,,,1,3.2698665060452186,,,,,,,,,,,,,,,,,,,,,,,,,,,,070219_p2,001,2019_Jul_02_1148,body_behavioural,3.0.4,59.9683365958585,
2,"Not only was the mummification process itself a complicated affair, but there were also elaborate rituals before, during, and after death.",3.0,2.0,None,,,,,,0,2,2,2,,,,,0,18,18,18,,,,,,,,,,,,,,,,,,,,,,,,,,,,,,,,,,,1,2.77062600600766,,,,,,,,,,,,,,,,,,,,,,,,,,,,070219_p2,001,2019_Jul_02_1148,body_behavioural,3.0.4,59.9683365958585,
2,The practice required teams of experts with years of training and took a total of 70 days to complete.” ,3.0,2.0,None,,,,,,0,2,2,2,,,,,0,19,19,19,,,,,,,,,,,,,,,,,,,,,,,,,,,,,,,,,,,1,2.269702569989022,,,,,,,,,,,,,,,,,,,,,,,,,,,,070219_p2,001,2019_Jul_02_1148,body_behavioural,3.0.4,59.9683365958585,
2,"They passed notes back and forth the whole class like they were in high school, and Leon wrote in one, “Would you like to go on a walk this evening?”",3.0,3.0,None,,,,,,0,2,2,2,,,,,0,20,20,20,,,,,,,,,,,,,,,,,,,,,,,,,,,,,,,,,,,1,2.7364313100115396,,,,,,,,,,,,,,,,,,,,,,,,,,,,070219_p2,001,2019_Jul_02_1148,body_behavioural,3.0.4,59.9683365958585,
2,"When Ariana read this, she looked at him and nodded her head",3.0,3.0,None,,,,,,0,2,2,2,,,,,0,21,21,21,,,,,,,,,,,,,,,,,,,,,,,,,,,,,,,,,,,1,1.3359991629840806,,,,,,,,,,,,,,,,,,,,,,,,,,,,070219_p2,001,2019_Jul_02_1148,body_behavioural,3.0.4,59.9683365958585,
2,"She wrote back on the slip of paper, “Let’s meet at 8 in front of my dorm, Patton Hall.”",3.0,3.0,None,,,,,,0,2,2,2,,,,,0,22,22,22,,,,,,,,,,,,,,,,,,,,,,,,,,,,,,,,,,,1,2.6032218519831076,,,,,,,,,,,,,,,,,,,,,,,,,,,,070219_p2,001,2019_Jul_02_1148,body_behavioural,3.0.4,59.9683365958585,
2,The professor ended the lecture and announced to the class that they would have their first quiz next class on Friday on mummification. ,4.0,3.0,None,,,,,,0,2,2,2,,,,,0,23,23,23,,,,,,,,,,,,,,,,,,,,,,,,,,,,,,,,,,,1,3.5507837350014597,,,,,,,,,,,,,,,,,,,,,,,,,,,,070219_p2,001,2019_Jul_02_1148,body_behavioural,3.0.4,59.9683365958585,
2,Everyone packed up and filed out of the classroom except for Ariana and Leon. ,4.0,3.0,None,,,,,,0,2,2,2,,,,,0,24,24,24,,,,,,,,,,,,,,,,,,,,,,,,,,,,,,,,,,,1,1.4196352349827066,,,,,,,,,,,,,,,,,,,,,,,,,,,,070219_p2,001,2019_Jul_02_1148,body_behavioural,3.0.4,59.9683365958585,
2,"Ariana spoke first, “I have to go to my next class.”",4.0,4.0,None,,,,,,0,2,2,2,,,,,0,25,25,25,,,,,,,,,,,,,,,,,,,,,,,,,,,,,,,,,,,1,1.9526052169967443,,,,,,,,,,,,,,,,,,,,,,,,,,,,070219_p2,001,2019_Jul_02_1148,body_behavioural,3.0.4,59.9683365958585,
2,"She looked at the clock which read noon and headed for the door saying, “I should run, but I’ll see you later tonight!” ",4.0,4.0,None,,,,,,0,2,2,2,,,,,0,26,26,26,,,,,,,,,,,,,,,,,,,,,,,,,,,,,,,,,,,1,4.234224544954486,,,,,,,,,,,,,,,,,,,,,,,,,,,,070219_p2,001,2019_Jul_02_1148,body_behavioural,3.0.4,59.9683365958585,
2,"She waved as she ran out the door, and Leon was still pondering where he had met her before, even more convinced of his conviction that they had previously met after hearing her voice.",4.0,4.0,None,,,,,,0,2,2,2,,,,,0,27,27,27,,,,,,,,,,,,,,,,,,,,,,,,,,,,,,,,,,,1,4.936834377993364,,,,,,,,,,,,,,,,,,,,,,,,,,,,070219_p2,001,2019_Jul_02_1148,body_behavioural,3.0.4,59.9683365958585,
2,,,,,,,,,,0,2,2,2,,,,,,,,,,,,,,,,,,,,,,,,,,,,,,,,,,,,,,,,,,,,,,,,,,,,,,,,,,,,,,,,,,,,,,,,070219_p2,001,2019_Jul_02_1148,body_behavioural,3.0.4,59.9683365958585,
3,,,,,,,,,,0,3,3,3,0,0,0,0,,,,,,,,,,,,,,,,,,,,,,,,,,,,,space,1.86979855800746,space,1.1359221800230443,space,0.9029158750199713,,,,,,,,,,,,,,,,,,,,,,,,,,,,,,,,,,070219_p2,001,2019_Jul_02_1148,body_behavioural,3.0.4,59.9683365958585,
3,"Carina and Simon, both distracted in thought, nearly ran into each other as they walked into the grocery store. ",1,1,43.0,,,,,,0,3,3,3,,,,,0,0,0,0,,,,,,,,,,,,,,,,,,,,,,,,,,,,,,,space,0.38622688001487404,space,0.9864425500272773,9,4.220138819946442,,,,,,,,,,,,,,,,,,,,,,,,,,,,070219_p2,001,2019_Jul_02_1148,body_behavioural,3.0.4,59.9683365958585,
3,She almost dropped the keys she was holding. ,1,1,None,,,,,,0,3,3,3,,,,,0,1,1,1,,,,,,,,,,,,,,,,,,,,,,,,,,,,,,,,,,,1,8.253527569992002,,,,,,,,,,,,,,,,,,,,,,,,,,,,070219_p2,001,2019_Jul_02_1148,body_behavioural,3.0.4,59.9683365958585,
3,"The store they had entered looked like a warehouse, with high, black ceilings, industrial lights, and large packages of food. ",1,1,None,,,,,,0,3,3,3,,,,,0,2,2,2,,,,,,,,,,,,,,,,,,,,,,,,,,,,,,,,,,,1,2.0199280030210502,,,,,,,,,,,,,,,,,,,,,,,,,,,,070219_p2,001,2019_Jul_02_1148,body_behavioural,3.0.4,59.9683365958585,
3,"In the meat section, Carina and Simon were looking over the same cuts of meat, because they were both preparing for barbecues.",2,1,None,,,,,,0,3,3,3,,,,,0,3,3,3,,,,,,,,,,,,,,,,,,,,,,,,,,,,,,,,,,,9,4.670035406947136,,,,,,,,,,,,,,,,,,,,,,,,,,,,070219_p2,001,2019_Jul_02_1148,body_behavioural,3.0.4,59.9683365958585,
3,"Simon had wanted to talk to Carina, and Carina had wanted to say something to Simon, but they felt embarrassed striking up a conversation with a stranger.",2,1,None,,,,,,0,3,3,3,,,,,0,4,4,4,,,,,,,,,,,,,,,,,,,,,,,,,,,,,,,,,,,1,3.75293141201837,,,,,,,,,,,,,,,,,,,,,,,,,,,,070219_p2,001,2019_Jul_02_1148,body_behavioural,3.0.4,59.9683365958585,
3,"Carina mustered the courage, turned to Simon and, pointing at a Cornish hen, asked, “Isn’t this meat cute?”",2,2,None,,,,,,0,3,3,3,,,,,0,5,5,5,,,,,,,,,,,,,,,,,,,,,,,,,,,,,,,,,,,1,2.3532542110187933,,,,,,,,,,,,,,,,,,,,,,,,,,,,070219_p2,001,2019_Jul_02_1148,body_behavioural,3.0.4,59.9683365958585,
3,"He laughed, and said, “It is very cute.",2,2,None,,,,,,0,3,3,3,,,,,0,6,6,6,,,,,,,,,,,,,,,,,,,,,,,,,,,,,,,,,,,1,1.0690030510304496,,,,,,,,,,,,,,,,,,,,,,,,,,,,070219_p2,001,2019_Jul_02_1148,body_behavioural,3.0.4,59.9683365958585,
3,"Probably the younger brother of this guy,” and he picked up a regular-sized chicken.",2,2,None,,,,,,0,3,3,3,,,,,0,7,7,7,,,,,,,,,,,,,,,,,,,,,,,,,,,,,,,,,,,1,1.269823879993055,,,,,,,,,,,,,,,,,,,,,,,,,,,,070219_p2,001,2019_Jul_02_1148,body_behavioural,3.0.4,59.9683365958585,
3,"“Unlucky family,” she responded as she shook her head. ",2,2,None,,,,,,0,3,3,3,,,,,0,8,8,8,,,,,,,,,,,,,,,,,,,,,,,,,,,,,,,,,,,1,1.786132198991254,,,,,,,,,,,,,,,,,,,,,,,,,,,,070219_p2,001,2019_Jul_02_1148,body_behavioural,3.0.4,59.9683365958585,
3,They chatted as they picked out a few last-minute groceries.,2,2,None,,,,,,0,3,3,3,,,,,0,9,9,9,,,,,,,,,,,,,,,,,,,,,,,,,,,,,,,,,,,1,1.9696798080112785,,,,,,,,,,,,,,,,,,,,,,,,,,,,070219_p2,001,2019_Jul_02_1148,body_behavioural,3.0.4,59.9683365958585,
3,"Simon helped Carina select the best ribs and his personal favorite barbecue sauce, and she helped him choose red peppers and spices for a vegetable kabob she recommended.",2,2,None,,,,,,0,3,3,3,,,,,0,10,10,10,,,,,,,,,,,,,,,,,,,,,,,,,,,,,,,,,,,1,5.580255115986802,,,,,,,,,,,,,,,,,,,,,,,,,,,,070219_p2,001,2019_Jul_02_1148,body_behavioural,3.0.4,59.9683365958585,
3,"In the checkout area, there were three lines open, and they went to the one labeled “8.”",3,2,None,,,,,,0,3,3,3,,,,,0,11,11,11,,,,,,,,,,,,,,,,,,,,,,,,,,,,,,,,,,,1,3.6045315980445594,,,,,,,,,,,,,,,,,,,,,,,,,,,,070219_p2,001,2019_Jul_02_1148,body_behavioural,3.0.4,59.9683365958585,
3,"Carina and Simon made jokes about the magazine covers while waiting in line, and they were laughing so hard their stomachs hurt. ",3,2,None,,,,,,0,3,3,3,,,,,0,12,12,12,,,,,,,,,,,,,,,,,,,,,,,,,,,,,,,,,,,1,3.5212187170400284,,,,,,,,,,,,,,,,,,,,,,,,,,,,070219_p2,001,2019_Jul_02_1148,body_behavioural,3.0.4,59.9683365958585,
3,"Simon turned to face Carina and, while looking at her straight in the eyes, asked, “Would you like to go out to dinner with me?",3,3,None,,,,,,0,3,3,3,,,,,0,13,13,13,,,,,,,,,,,,,,,,,,,,,,,,,,,,,,,,,,,1,2.38928337499965,,,,,,,,,,,,,,,,,,,,,,,,,,,,070219_p2,001,2019_Jul_02_1148,body_behavioural,3.0.4,59.9683365958585,
3,Next Saturday we could tour around Harvard Square and get something to eat.,3,3,None,,,,,,0,3,3,3,,,,,0,14,14,14,,,,,,,,,,,,,,,,,,,,,,,,,,,,,,,,,,,1,2.4881812799721956,,,,,,,,,,,,,,,,,,,,,,,,,,,,070219_p2,001,2019_Jul_02_1148,body_behavioural,3.0.4,59.9683365958585,
3,"There are a lot of great places around there, and it’s really nice during the summer.”",3,3,None,,,,,,0,3,3,3,,,,,0,15,15,15,,,,,,,,,,,,,,,,,,,,,,,,,,,,,,,,,,,1,1.5877869009855203,,,,,,,,,,,,,,,,,,,,,,,,,,,,070219_p2,001,2019_Jul_02_1148,body_behavioural,3.0.4,59.9683365958585,
3,"Carina smiled, “I’d love to.",3,3,None,,,,,,0,3,3,3,,,,,0,16,16,16,,,,,,,,,,,,,,,,,,,,,,,,,,,,,,,,,,,1,0.9214426220278256,,,,,,,,,,,,,,,,,,,,,,,,,,,,070219_p2,001,2019_Jul_02_1148,body_behavioural,3.0.4,59.9683365958585,
3,That sounds great!”,3,3,None,,,,,,0,3,3,3,,,,,0,17,17,17,,,,,,,,,,,,,,,,,,,,,,,,,,,,,,,,,,,1,0.5543822480249219,,,,,,,,,,,,,,,,,,,,,,,,,,,,070219_p2,001,2019_Jul_02_1148,body_behavioural,3.0.4,59.9683365958585,
3,The cashier scanned Carina’s groceries.,4,3,None,,,,,,0,3,3,3,,,,,0,18,18,18,,,,,,,,,,,,,,,,,,,,,,,,,,,,,,,,,,,1,1.3367584039806388,,,,,,,,,,,,,,,,,,,,,,,,,,,,070219_p2,001,2019_Jul_02_1148,body_behavioural,3.0.4,59.9683365958585,
3,"Simon lifted up the divider on the conveyor belt and said to the cashier, “Actually, these are together.",4,3,None,,,,,,0,3,3,3,,,,,0,19,19,19,,,,,,,,,,,,,,,,,,,,,,,,,,,,,,,,,,,1,2.7882654099958017,,,,,,,,,,,,,,,,,,,,,,,,,,,,070219_p2,001,2019_Jul_02_1148,body_behavioural,3.0.4,59.9683365958585,
3,"Carina, I’ve got it.",4,3,None,,,,,,0,3,3,3,,,,,0,20,20,20,,,,,,,,,,,,,,,,,,,,,,,,,,,,,,,,,,,1,1.2540258429944515,,,,,,,,,,,,,,,,,,,,,,,,,,,,070219_p2,001,2019_Jul_02_1148,body_behavioural,3.0.4,59.9683365958585,
3,This was kind-of a date today.”,4,3,None,,,,,,0,3,3,3,,,,,0,21,21,21,,,,,,,,,,,,,,,,,,,,,,,,,,,,,,,,,,,1,2.8845030600205064,,,,,,,,,,,,,,,,,,,,,,,,,,,,070219_p2,001,2019_Jul_02_1148,body_behavioural,3.0.4,59.9683365958585,
3,Carina blushed and laughed; she thought this was ridiculous but also very sweet. ,4,3,None,,,,,,0,3,3,3,,,,,0,22,22,22,,,,,,,,,,,,,,,,,,,,,,,,,,,,,,,,,,,1,2.1209943090216257,,,,,,,,,,,,,,,,,,,,,,,,,,,,070219_p2,001,2019_Jul_02_1148,body_behavioural,3.0.4,59.9683365958585,
3,"The cashier rolled her eyes when they weren’t looking, and she scanned the rest of his items. ",4,3,None,,,,,,0,3,3,3,,,,,0,23,23,23,,,,,,,,,,,,,,,,,,,,,,,,,,,,,,,,,,,1,2.556120426976122,,,,,,,,,,,,,,,,,,,,,,,,,,,,070219_p2,001,2019_Jul_02_1148,body_behavioural,3.0.4,59.9683365958585,
3,"The total came to $52, and he paid with his credit card.",4,3,None,,,,,,0,3,3,3,,,,,0,24,24,24,,,,,,,,,,,,,,,,,,,,,,,,,,,,,,,,,,,1,1.704094588989392,,,,,,,,,,,,,,,,,,,,,,,,,,,,070219_p2,001,2019_Jul_02_1148,body_behavioural,3.0.4,59.9683365958585,
3,"Seeing that it was 4:30 PM on her phone, Carina gasped because she realized she was late for her own barbecue. ",4,4,None,,,,,,0,3,3,3,,,,,0,25,25,25,,,,,,,,,,,,,,,,,,,,,,,,,,,,,,,,,,,1,3.371123766992241,,,,,,,,,,,,,,,,,,,,,,,,,,,,070219_p2,001,2019_Jul_02_1148,body_behavioural,3.0.4,59.9683365958585,
3,Carina thanked Simon and took her groceries and ran. ,4,4,None,,,,,,0,3,3,3,,,,,0,26,26,26,,,,,,,,,,,,,,,,,,,,,,,,,,,,,,,,,,,1,1.721568607026711,,,,,,,,,,,,,,,,,,,,,,,,,,,,070219_p2,001,2019_Jul_02_1148,body_behavioural,3.0.4,59.9683365958585,
3,"“I hope her guests aren’t hungry,” the cashier remarked.",4,4,None,,,,,,0,3,3,3,,,,,0,27,27,27,,,,,,,,,,,,,,,,,,,,,,,,,,,,,,,,,,,1,2.1379125470411964,,,,,,,,,,,,,,,,,,,,,,,,,,,,070219_p2,001,2019_Jul_02_1148,body_behavioural,3.0.4,59.9683365958585,
3,Simon was thoroughly charmed and barely heard the comment as he watched her go. ,4,4,None,,,,,,0,3,3,3,,,,,0,28,28,28,,,,,,,,,,,,,,,,,,,,,,,,,,,,,,,,,,,1,2.5559381479979493,,,,,,,,,,,,,,,,,,,,,,,,,,,,070219_p2,001,2019_Jul_02_1148,body_behavioural,3.0.4,59.9683365958585,
3,,,,,,,,,,0,3,3,3,,,,,,,,,,,,,,,,,,,,,,,,,,,,,,,,,,,,,,,,,,,,,,,,,,,,,,,,,,,,,,,,,,,,,,,,070219_p2,001,2019_Jul_02_1148,body_behavioural,3.0.4,59.9683365958585,
4,,,,,,,,,,0,4,4,4,0,0,0,0,,,,,,,,,,,,,,,,,,,,,,,,,,,,,space,1.3551872100215405,space,0.6220845910138451,space,0.8372467799927108,,,,,,,,,,,,,,,,,,,,,,,,,,,,,,,,,,070219_p2,001,2019_Jul_02_1148,body_behavioural,3.0.4,59.9683365958585,
4,"Thomas, dreading the approaching breakup conversation he was about to start, got to Annika’s Finer Diner late but Sadie, his girlfriend, was not there yet.",1,1,11.0,None,None,None,None,,0,4,4,4,,,,,0,0,0,0,,,,,,,,,,,,,,,,,,,,,,,,,,,,,,,space,0.9545490450109355,space,1.2721525799715891,9,21.006403305043932,,,,,,,,,,,,,,,,,,,,,,,,,,,,070219_p2,001,2019_Jul_02_1148,body_behavioural,3.0.4,59.9683365958585,
4,Thomas had been thinking about breaking up with her for 2 months now.,1,1,None,None,None,1.0,None,,0,4,4,4,,,,,0,1,1,1,,,,,,,,,,,,,,,,,,,,,,,,,,,,,,,,,,,1,7.166972064995207,,,,,,,,,,,,,,,,,,,,,,,,,,,,070219_p2,001,2019_Jul_02_1148,body_behavioural,3.0.4,59.9683365958585,
4,"The restaurant he had chosen to meet at was reminiscent of a diner from the 70’s with black and white checkerboard tiling on the floor, a long bar in the front, and booths and stools with red, leather upholstery. ",1,1,None,None,None,None,1.0,,0,4,4,4,,,,,0,2,2,2,,,,,,,,,,,,,,,,,,,,,,,,,,,,,,,,,,,1,3.872181369981263,,,,,,,,,,,,,,,,,,,,,,,,,,,,070219_p2,001,2019_Jul_02_1148,body_behavioural,3.0.4,59.9683365958585,
4,"A bell chimed as the door swung open, and Sadie entered to find Thomas ruminating at the bar.",1,1,None,None,None,None,None,,0,4,4,4,,,,,0,3,3,3,,,,,,,,,,,,,,,,,,,,,,,,,,,,,,,,,,,1,2.537160378007684,,,,,,,,,,,,,,,,,,,,,,,,,,,,070219_p2,001,2019_Jul_02_1148,body_behavioural,3.0.4,59.9683365958585,
4,"He stood up and gave her a side hug, asking quickly, “How was your day?”",1,1,None,None,None,None,None,,0,4,4,4,,,,,0,4,4,4,,,,,,,,,,,,,,,,,,,,,,,,,,,,,,,,,,,1,2.0875329760019667,,,,,,,,,,,,,,,,,,,,,,,,,,,,070219_p2,001,2019_Jul_02_1148,body_behavioural,3.0.4,59.9683365958585,
4,"She clung onto him, “It was okay- I missed you today.”",1,1,None,None,None,None,None,,0,4,4,4,,,,,0,5,5,5,,,,,,,,,,,,,,,,,,,,,,,,,,,,,,,,,,,1,1.7712599549558945,,,,,,,,,,,,,,,,,,,,,,,,,,,,070219_p2,001,2019_Jul_02_1148,body_behavioural,3.0.4,59.9683365958585,
4,"He looked away and addressed the hostess coming towards them, “Can we have a booth in the back?”",1,1,None,None,None,None,None,,0,4,4,4,,,,,0,6,6,6,,,,,,,,,,,,,,,,,,,,,,,,,,,,,,,,,,,1,3.353668683033902,,,,,,,,,,,,,,,,,,,,,,,,,,,,070219_p2,001,2019_Jul_02_1148,body_behavioural,3.0.4,59.9683365958585,
4,"She shrugged and after loudly popping her bubblegum replied, “Sure, honey.”",1,1,None,9.0,None,None,None,,0,4,4,4,,,,,0,7,7,7,,,,,,,,,,,,,,,,,,,,,,,,,,,,,,,,,,,1,2.4042666319874115,,,,,,,,,,,,,,,,,,,,,,,,,,,,070219_p2,001,2019_Jul_02_1148,body_behavioural,3.0.4,59.9683365958585,
4,She seated them at a booth in the back corner of the diner.  ,2,1,None,None,None,None,None,,0,4,4,4,,,,,0,8,8,8,,,,,,,,,,,,,,,,,,,,,,,,,,,,,,,,,,,1,2.6882411979604512,,,,,,,,,,,,,,,,,,,,,,,,,,,,070219_p2,001,2019_Jul_02_1148,body_behavioural,3.0.4,59.9683365958585,
4,Sadie slipped into the cushioned seat and grabbed Thomas’ hand.,2,1,None,None,None,None,None,,0,4,4,4,,,,,0,9,9,9,,,,,,,,,,,,,,,,,,,,,,,,,,,,,,,,,,,1,4.587980574986432,,,,,,,,,,,,,,,,,,,,,,,,,,,,070219_p2,001,2019_Jul_02_1148,body_behavioural,3.0.4,59.9683365958585,
4,“Tell me about your day!” she sang.,2,1,None,None,None,None,None,,0,4,4,4,,,,,0,10,10,10,,,,,,,,,,,,,,,,,,,,,,,,,,,,,,,,,,,1,3.405597007018514,,,,,,,,,,,,,,,,,,,,,,,,,,,,070219_p2,001,2019_Jul_02_1148,body_behavioural,3.0.4,59.9683365958585,
4,He looked at her silently and pulled his hand slowly from hers as a puzzled look grew on Sadie’s face. ,2,1,None,None,None,None,None,,0,4,4,4,,,,,0,11,11,11,,,,,,,,,,,,,,,,,,,,,,,,,,,,,,,,,,,1,2.6883108480251394,,,,,,,,,,,,,,,,,,,,,,,,,,,,070219_p2,001,2019_Jul_02_1148,body_behavioural,3.0.4,59.9683365958585,
4,Thomas looked away and took a deep breath. ,2,1,None,None,None,None,None,,0,4,4,4,,,,,0,12,12,12,,,,,,,,,,,,,,,,,,,,,,,,,,,,,,,,,,,1,2.504800978000276,,,,,,,,,,,,,,,,,,,,,,,,,,,,070219_p2,001,2019_Jul_02_1148,body_behavioural,3.0.4,59.9683365958585,
4,"Sadie asked, “What’s wrong?” ",2,1,None,None,None,None,None,,0,4,4,4,,,,,0,13,13,13,,,,,,,,,,,,,,,,,,,,,,,,,,,,,,,,,,,1,2.1047446969896555,,,,,,,,,,,,,,,,,,,,,,,,,,,,070219_p2,001,2019_Jul_02_1148,body_behavioural,3.0.4,59.9683365958585,
4,Thomas picked at his fingernails.,2,1,None,None,22.0,None,None,,0,4,4,4,,,,,0,14,14,14,,,,,,,,,,,,,,,,,,,,,,,,,,,,,,,,,,,1,2.270670155005064,,,,,,,,,,,,,,,,,,,,,,,,,,,,070219_p2,001,2019_Jul_02_1148,body_behavioural,3.0.4,59.9683365958585,
4,"After a few moments, Thomas let out a deep breath and said, “Sadie, I’ve been thinking, and I need a break from this relationship because I need to figure out my career path on my own.”",2,2,None,None,None,None,None,,0,4,4,4,,,,,0,15,15,15,,,,,,,,,,,,,,,,,,,,,,,,,,,,,,,,,,,1,2.754853043006733,,,,,,,,,,,,,,,,,,,,,,,,,,,,070219_p2,001,2019_Jul_02_1148,body_behavioural,3.0.4,59.9683365958585,
4,Sadie sat back in her seat.,2,2,None,None,None,None,None,,0,4,4,4,,,,,0,16,16,16,,,,,,,,,,,,,,,,,,,,,,,,,,,,,,,,,,,1,1.1880236379802227,,,,,,,,,,,,,,,,,,,,,,,,,,,,070219_p2,001,2019_Jul_02_1148,body_behavioural,3.0.4,59.9683365958585,
4,"Thomas continued, “Things have been really picking up at work, and I’m not sure that this is the job I want to do anymore.",2,2,None,None,None,None,None,,0,4,4,4,,,,,0,17,17,17,,,,,,,,,,,,,,,,,,,,,,,,,,,,,,,,,,,1,4.471856763993856,,,,,,,,,,,,,,,,,,,,,,,,,,,,070219_p2,001,2019_Jul_02_1148,body_behavioural,3.0.4,59.9683365958585,
4,"Plus, it’s been really overwhelming between working and figuring out if I should change careers, and I really feel like I need more time to figure it out.” ",2,2,None,17.0,None,None,None,,0,4,4,4,,,,,0,18,18,18,,,,,,,,,,,,,,,,,,,,,,,,,,,,,,,,,,,1,3.888063579041045,,,,,,,,,,,,,,,,,,,,,,,,,,,,070219_p2,001,2019_Jul_02_1148,body_behavioural,3.0.4,59.9683365958585,
4,"The waiter appeared and cheerily asked, “Have you decided what you would like?”",3,2,None,None,None,None,None,,0,4,4,4,,,,,0,19,19,19,,,,,,,,,,,,,,,,,,,,,,,,,,,,,,,,,,,1,1.7707406400004402,,,,,,,,,,,,,,,,,,,,,,,,,,,,070219_p2,001,2019_Jul_02_1148,body_behavioural,3.0.4,59.9683365958585,
4,"Thomas and Sadie realized there were menus on the table, and they glanced at them quickly.",3,2,None,None,None,None,None,,0,4,4,4,,,,,0,20,20,20,,,,,,,,,,,,,,,,,,,,,,,,,,,,,,,,,,,1,2.4041211070143618,,,,,,,,,,,,,,,,,,,,,,,,,,,,070219_p2,001,2019_Jul_02_1148,body_behavioural,3.0.4,59.9683365958585,
4,"The menus were laminated posters with silly names for all the foods, and since they didn’t want to read through each item description, they settled on familiar orders.",3,2,None,None,None,None,None,,0,4,4,4,,,,,0,21,21,21,,,,,,,,,,,,,,,,,,,,,,,,,,,,,,,,,,,1,5.554647726006806,,,,,,,,,,,,,,,,,,,,,,,,,,,,070219_p2,001,2019_Jul_02_1148,body_behavioural,3.0.4,59.9683365958585,
4,"“I’ll have a burger, no tomatoes,” Thomas said.",3,2,None,None,None,None,None,,0,4,4,4,,,,,0,22,22,22,,,,,,,,,,,,,,,,,,,,,,,,,,,,,,,,,,,1,1.6379635899793357,,,,,,,,,,,,,,,,,,,,,,,,,,,,070219_p2,001,2019_Jul_02_1148,body_behavioural,3.0.4,59.9683365958585,
4,"Sadie asked about the reuben, and the waiter told her it was excellent.",3,2,None,None,None,None,None,,0,4,4,4,,,,,0,23,23,23,,,,,,,,,,,,,,,,,,,,,,,,,,,,,,,,,,,1,1.8547206069924869,,,,,,,,,,,,,,,,,,,,,,,,,,,,070219_p2,001,2019_Jul_02_1148,body_behavioural,3.0.4,59.9683365958585,
4,"Confirming that that was all they’d like, the waiter walked away. ",3,2,None,None,None,None,None,,0,4,4,4,,,,,0,24,24,24,,,,,,,,,,,,,,,,,,,,,,,,,,,,,,,,,,,1,1.6505824470077641,,,,,,,,,,,,,,,,,,,,,,,,,,,,070219_p2,001,2019_Jul_02_1148,body_behavioural,3.0.4,59.9683365958585,
4,Sadie- not so quietly- burst into tears. ,3,3,None,None,None,None,None,,0,4,4,4,,,,,0,25,25,25,,,,,,,,,,,,,,,,,,,,,,,,,,,,,,,,,,,1,1.0042122439481318,,,,,,,,,,,,,,,,,,,,,,,,,,,,070219_p2,001,2019_Jul_02_1148,body_behavioural,3.0.4,59.9683365958585,
4,People sitting at the bar looked over and quickly averted their gaze when they figured what was happening. ,3,3,None,None,None,None,None,,0,4,4,4,,,,,0,26,26,26,,,,,,,,,,,,,,,,,,,,,,,,,,,,,,,,,,,1,3.0882164270151407,,,,,,,,,,,,,,,,,,,,,,,,,,,,070219_p2,001,2019_Jul_02_1148,body_behavioural,3.0.4,59.9683365958585,
4,"She whispered, “Is this really what you want?",3,3,None,None,None,None,None,,0,4,4,4,,,,,0,27,27,27,,,,,,,,,,,,,,,,,,,,,,,,,,,,,,,,,,,1,2.0208675150061026,,,,,,,,,,,,,,,,,,,,,,,,,,,,070219_p2,001,2019_Jul_02_1148,body_behavioural,3.0.4,59.9683365958585,
4,"I don’t understand- things were fine, I thought. ",3,3,None,None,None,None,None,,0,4,4,4,,,,,0,28,28,28,,,,,,,,,,,,,,,,,,,,,,,,,,,,,,,,,,,1,1.470724913990125,,,,,,,,,,,,,,,,,,,,,,,,,,,,070219_p2,001,2019_Jul_02_1148,body_behavioural,3.0.4,59.9683365958585,
4,I think we should stay together because we can change how much we hang out. ,3,3,None,None,None,None,None,,0,4,4,4,,,,,0,29,29,29,,,,,,,,,,,,,,,,,,,,,,,,,,,,,,,,,,,1,2.3551658790092915,,,,,,,,,,,,,,,,,,,,,,,,,,,,070219_p2,001,2019_Jul_02_1148,body_behavioural,3.0.4,59.9683365958585,
4,"We don’t have to hang out all the time, or as much as we do now.”",3,3,None,None,None,None,None,,0,4,4,4,,,,,0,30,30,30,,,,,,,,,,,,,,,,,,,,,,,,,,,,,,,,,,,1,2.5382078669499606,,,,,,,,,,,,,,,,,,,,,,,,,,,,070219_p2,001,2019_Jul_02_1148,body_behavioural,3.0.4,59.9683365958585,
4,Thomas chewed on his bottom lip and picked at his now bleeding hangnail. ,3,3,None,20.0,None,None,None,,0,4,4,4,,,,,0,31,31,31,,,,,,,,,,,,,,,,,,,,,,,,,,,,,,,,,,,1,1.8840110000455752,,,,,,,,,,,,,,,,,,,,,,,,,,,,070219_p2,001,2019_Jul_02_1148,body_behavioural,3.0.4,59.9683365958585,
4,The waiter appeared with the burger and reuben and set them in front of them.,4,3,None,None,None,None,None,,0,4,4,4,,,,,0,32,32,32,,,,,,,,,,,,,,,,,,,,,,,,,,,,,,,,,,,1,2.638253277982585,,,,,,,,,,,,,,,,,,,,,,,,,,,,070219_p2,001,2019_Jul_02_1148,body_behavioural,3.0.4,59.9683365958585,
4,“Is there anything else I can get for you two?,4,3,None,None,None,None,None,,0,4,4,4,,,,,0,33,33,33,,,,,,,,,,,,,,,,,,,,,,,,,,,,,,,,,,,1,1.1207079369924031,,,,,,,,,,,,,,,,,,,,,,,,,,,,070219_p2,001,2019_Jul_02_1148,body_behavioural,3.0.4,59.9683365958585,
4,Will you be getting dessert tonight?” he asked.,4,3,None,None,None,None,None,,0,4,4,4,,,,,0,34,34,34,,,,,,,,,,,,,,,,,,,,,,,,,,,,,,,,,,,1,1.5702833849936724,,,,,,,,,,,,,,,,,,,,,,,,,,,,070219_p2,001,2019_Jul_02_1148,body_behavioural,3.0.4,59.9683365958585,
4,"“Oh no, we’re good, thanks,” Thomas said blankly.",4,3,None,None,None,None,None,,0,4,4,4,,,,,0,35,35,35,,,,,,,,,,,,,,,,,,,,,,,,,,,,,,,,,,,1,1.5378851169953123,,,,,,,,,,,,,,,,,,,,,,,,,,,,070219_p2,001,2019_Jul_02_1148,body_behavioural,3.0.4,59.9683365958585,
4," With the waiter gone, Sadie suddenly stood up, grabbed half of the reuben, and shook it at him as she growled, “Don’t follow me, and don’t talk to me anymore!",4,4,None,None,None,None,None,,0,4,4,4,,,,,0,36,36,36,,,,,,,,,,,,,,,,,,,,,,,,,,,,,,,,,,,1,4.521636048972141,,,,,,,,,,,,,,,,,,,,,,,,,,,,070219_p2,001,2019_Jul_02_1148,body_behavioural,3.0.4,59.9683365958585,
4,"Also, I want my polaroid camera and Beatles poster back!”",4,4,None,None,None,None,None,,0,4,4,4,,,,,0,37,37,37,,,,,,,,,,,,,,,,,,,,,,,,,,,,,,,,,,,1,1.9374894800130278,,,,,,,,,,,,,,,,,,,,,,,,,,,,070219_p2,001,2019_Jul_02_1148,body_behavioural,3.0.4,59.9683365958585,
4,"She stormed off, and the bell above the door jingled cheerfully as the door closed behind her.",4,4,None,None,None,None,None,,0,4,4,4,,,,,0,38,38,38,,,,,,,,,,,,,,,,,,,,,,,,,,,,,,,,,,,1,2.088334097992629,,,,,,,,,,,,,,,,,,,,,,,,,,,,070219_p2,001,2019_Jul_02_1148,body_behavioural,3.0.4,59.9683365958585,
4,Thomas sat there for awhile surprised at how quickly everything had transpired. ,4,4,None,None,None,None,None,,0,4,4,4,,,,,0,39,39,39,,,,,,,,,,,,,,,,,,,,,,,,,,,,,,,,,,,1,1.237565640010871,,,,,,,,,,,,,,,,,,,,,,,,,,,,070219_p2,001,2019_Jul_02_1148,body_behavioural,3.0.4,59.9683365958585,
4,"He grabbed his burger and took a bite of it, which created a dry and fishy taste in his mouth.",4,4,None,None,None,None,None,,0,4,4,4,,,,,0,40,40,40,,,,,,,,,,,,,,,,,,,,,,,,,,,,,,,,,,,1,3.221891058026813,,,,,,,,,,,,,,,,,,,,,,,,,,,,070219_p2,001,2019_Jul_02_1148,body_behavioural,3.0.4,59.9683365958585,
