count,storyText,locationEvent,socialEvent,locationEventSize,socialEventSize,instructText,trials.thisRepN,trials.thisTrialN,trials.thisN,trials.thisIndex,trials_2.thisRepN,trials_2.thisTrialN,trials_2.thisN,trials_2.thisIndex,trials_3.thisRepN,trials_3.thisTrialN,trials_3.thisN,trials_3.thisIndex,trials_4.thisRepN,trials_4.thisTrialN,trials_4.thisN,trials_4.thisIndex,trials_5.thisRepN,trials_5.thisTrialN,trials_5.thisN,trials_5.thisIndex,trials_6.thisRepN,trials_6.thisTrialN,trials_6.thisN,trials_6.thisIndex,order of stories,order of perspectives,story_presses.keys,story_presses.rt,key_resp_2.keys,key_resp_2.rt,key_resp_3.keys,key_resp_3.rt,key_resp_4.keys,key_resp_4.rt,participant,session,date,expName,frameRate,
0,23,,,,,,0,0,0,0,0,0,0,0,,,,,,,,,,,,,,,,,[23 11 44 21 13 32 34 42 22 31 14 41 33 43 12 24],"['Location' 'Location' 'Social' 'Social' 'Social' 'Social' 'Location'
 'Location' 'Location' 'Location' 'Location' 'Social' 'Social' 'Location'
 'Social' 'Social']",1,1.3192350280005485,,,,,,,',001,2019_Jan_18_1327,body_behavioural,59.99391541127639,
0,Grocery shopping Proposal,,,,,,0,0,0,0,0,1,1,1,,,,,,,,,,,,,,,,,,,9,0.20206739997956902,,,,,,,',001,2019_Jan_18_1327,body_behavioural,59.99391541127639,
0,,,,,,,0,0,0,0,,,,,,,,,,,,,,,,,,,,,,,,,,,,,,,',001,2019_Jan_18_1327,body_behavioural,59.99391541127639,
1,"Thomas got to Annika’s Finer Diner early, dreading the conversation he was about to have.",1,1,None,None,,0,1,1,1,0,0,0,0,,,,,,,,,,,,,,,,,,,1,0.8180956810247153,,,,,,,',001,2019_Jan_18_1327,body_behavioural,59.99391541127639,
1,The restaurant had a kitschy charm and was reminiscent of a diner from the 70’s. ,1,1,None,None,,0,1,1,1,0,1,1,1,,,,,,,,,,,,,,,,,,,1,0.8016738230362535,,,,,,,',001,2019_Jan_18_1327,body_behavioural,59.99391541127639,
1,"A bell chimed as the door swung open, and Sadie entered to find him deep in thought on a bench by the door.",1,1,None,None,,0,1,1,1,0,2,2,2,,,,,,,,,,,,,,,,,,,1,0.10211905906908214,,,,,,,',001,2019_Jan_18_1327,body_behavioural,59.99391541127639,
1, Thomas jumped up and gave her a side hug. ,1,1,None,None,,0,1,1,1,0,3,3,3,,,,,,,,,,,,,,,,,,,1,0.13443514402024448,,,,,,,',001,2019_Jan_18_1327,body_behavioural,59.99391541127639,
1,“How was your day?” he asked.,1,1,None,None,,0,1,1,1,0,4,4,4,,,,,,,,,,,,,,,,,,,1,0.11763186799362302,,,,,,,',001,2019_Jan_18_1327,body_behavioural,59.99391541127639,
1,"She clung onto him, “It was okay. I missed you today.”",1,1,None,None,,0,1,1,1,0,5,5,5,,,,,,,,,,,,,,,,,,,1,0.11745101492851973,,,,,,,',001,2019_Jan_18_1327,body_behavioural,59.99391541127639,
1,He looked at the hostess coming toward them.,1,1,None,None,,0,1,1,1,0,6,6,6,,,,,,,,,,,,,,,,,,,1,0.13465361099224538,,,,,,,',001,2019_Jan_18_1327,body_behavioural,59.99391541127639,
1,“Can we have a table in the back?” Thomas asked.,1,1,None,None,,0,1,1,1,0,7,7,7,,,,,,,,,,,,,,,,,,,9,0.03491772501729429,,,,,,,',001,2019_Jan_18_1327,body_behavioural,59.99391541127639,
1,"She shrugged and, as she loudly popped her bubblegum, replied, "Sure honey, this way."",1,1,9.0,None,,0,1,1,1,0,8,8,8,,,,,,,,,,,,,,,,,,,1,0.1017745960270986,,,,,,,',001,2019_Jan_18_1327,body_behavioural,59.99391541127639,
1,"She led them to the back of the restaurant, where there were dimly lit tables. ",2,1,None,None,,0,1,1,1,0,9,9,9,,,,,,,,,,,,,,,,,,,9,0.0017390979919582605,,,,,,,',001,2019_Jan_18_1327,body_behavioural,59.99391541127639,
1,“Is this alright?” the hostess asked.,2,1,None,None,,0,1,1,1,0,10,10,10,,,,,,,,,,,,,,,,,,,9,0.10206365399062634,,,,,,,',001,2019_Jan_18_1327,body_behavioural,59.99391541127639,
1,Thomas cleared his throat and tried not to grimace at the stained fabric that lined the booth.,2,1,None,None,,0,1,1,1,0,11,11,11,,,,,,,,,,,,,,,,,,,9,0.11665498104412109,,,,,,,',001,2019_Jan_18_1327,body_behavioural,59.99391541127639,
1,“This is great.,2,1,None,None,,0,1,1,1,0,12,12,12,,,,,,,,,,,,,,,,,,,9,0.1191449110629037,,,,,,,',001,2019_Jan_18_1327,body_behavioural,59.99391541127639,
1," Thank you,” Thomas said.",2,1,None,None,,0,1,1,1,0,13,13,13,,,,,,,,,,,,,,,,,,,1,0.018187779001891613,,,,,,,',001,2019_Jan_18_1327,body_behavioural,59.99391541127639,
1,Sadie slipped into the cushioned seat and grabbed Thomas’ hand.,2,1,None,None,,0,1,1,1,0,14,14,14,,,,,,,,,,,,,,,,,,,9,0.051875736098736525,,,,,,,',001,2019_Jan_18_1327,body_behavioural,59.99391541127639,
1,“Tell me about your day!” Sadie sang as Thomas sat down.,2,1,None,None,,0,1,1,1,0,15,15,15,,,,,,,,,,,,,,,,,,,1,0.05129143793601543,,,,,,,',001,2019_Jan_18_1327,body_behavioural,59.99391541127639,
1,"He looked at her silently, pulling his hand slowly from hers.",2,1,None,None,,0,1,1,1,0,16,16,16,,,,,,,,,,,,,,,,,,,9,0.033440061029978096,,,,,,,',001,2019_Jan_18_1327,body_behavioural,59.99391541127639,
1,Sadie gave him a puzzled look.,2,1,None,None,,0,1,1,1,0,17,17,17,,,,,,,,,,,,,,,,,,,1,0.08536704198922962,,,,,,,',001,2019_Jan_18_1327,body_behavioural,59.99391541127639,
1,"Thomas looked away, and took a deep breath. ",2,1,None,None,,0,1,1,1,0,18,18,18,,,,,,,,,,,,,,,,,,,9,0.1355867200763896,,,,,,,',001,2019_Jan_18_1327,body_behavioural,59.99391541127639,
1,"Sadie asked, “What’s wrong?” ",2,1,None,None,,0,1,1,1,0,19,19,19,,,,,,,,,,,,,,,,,,,9,0.08507161901798099,,,,,,,',001,2019_Jan_18_1327,body_behavioural,59.99391541127639,
1,Thomas picked at his fingernails.,2,1,None,22.0,,0,1,1,1,0,20,20,20,,,,,,,,,,,,,,,,,,,1,0.01802266703452915,,,,,,,',001,2019_Jan_18_1327,body_behavioural,59.99391541127639,
1,"“Look, Sadie, I’ve been thinking, and I need to figure out some stuff… on my own.”",2,2,None,None,,0,1,1,1,0,21,21,21,,,,,,,,,,,,,,,,,,,9,0.06910275598056614,,,,,,,',001,2019_Jan_18_1327,body_behavioural,59.99391541127639,
1,"Sadie’s mouth popped open for a moment, then she swallowed and shifted back in her seat.",2,2,None,None,,0,1,1,1,0,22,22,22,,,,,,,,,,,,,,,,,,,1,0.018120573018677533,,,,,,,',001,2019_Jan_18_1327,body_behavioural,59.99391541127639,
1,“Things have been really picking up at work.,2,2,None,None,,0,1,1,1,0,23,23,23,,,,,,,,,,,,,,,,,,,9,0.0682665309868753,,,,,,,',001,2019_Jan_18_1327,body_behavioural,59.99391541127639,
1,And I’m not sure that this is the job I want to do anymore.,2,2,None,None,,0,1,1,1,0,24,24,24,,,,,,,,,,,,,,,,,,,1,0.034151526051573455,,,,,,,',001,2019_Jan_18_1327,body_behavioural,59.99391541127639,
1,It’s been really overwhelming between working and figuring out if I should change careers.” ,2,2,17.0,None,,0,1,1,1,0,25,25,25,,,,,,,,,,,,,,,,,,,9,0.051046065986156464,,,,,,,',001,2019_Jan_18_1327,body_behavioural,59.99391541127639,
1,The waiter appeared and interrupted the speech Thomas had been practicing.,3,2,None,None,,0,1,1,1,0,26,26,26,,,,,,,,,,,,,,,,,,,1,0.06918946094810963,,,,,,,',001,2019_Jan_18_1327,body_behavioural,59.99391541127639,
1,“Hello you two!,3,2,None,None,,0,1,1,1,0,27,27,27,,,,,,,,,,,,,,,,,,,9,0.052087450050748885,,,,,,,',001,2019_Jan_18_1327,body_behavioural,59.99391541127639,
1,Have you decided what you would like?”,3,2,None,None,,0,1,1,1,0,28,28,28,,,,,,,,,,,,,,,,,,,9,0.11882458999752998,,,,,,,',001,2019_Jan_18_1327,body_behavioural,59.99391541127639,
1,"Thomas and Sadie realized there were menus on the table, and they glanced at the lengthy list quickly.",3,2,None,None,,0,1,1,1,0,29,29,29,,,,,,,,,,,,,,,,,,,9,0.1182160449679941,,,,,,,',001,2019_Jan_18_1327,body_behavioural,59.99391541127639,
1,"There were so many strange dishes they had never heard of before, so they settled on familiar orders.",3,2,None,None,,0,1,1,1,0,30,30,30,,,,,,,,,,,,,,,,,,,9,0.15166045597288758,,,,,,,',001,2019_Jan_18_1327,body_behavioural,59.99391541127639,
1,"“I’ll have a burger, no tomatoes,” Thomas said.",3,2,None,None,,0,1,1,1,0,31,31,31,,,,,,,,,,,,,,,,,,,1,0.05186879902612418,,,,,,,',001,2019_Jan_18_1327,body_behavioural,59.99391541127639,
1,"Sadie asked about the reuben, and the waiter told her it was excellent.",3,2,None,None,,0,1,1,1,0,32,32,32,,,,,,,,,,,,,,,,,,,9,0.034512620070017874,,,,,,,',001,2019_Jan_18_1327,body_behavioural,59.99391541127639,
1," Once she agreed to get that, he walked away. ",3,2,None,None,,0,1,1,1,0,33,33,33,,,,,,,,,,,,,,,,,,,1,0.06845307000912726,,,,,,,',001,2019_Jan_18_1327,body_behavioural,59.99391541127639,
1,Sadie and Thomas looked at each other. ,3,2,None,None,,0,1,1,1,0,34,34,34,,,,,,,,,,,,,,,,,,,9,0.034377955948002636,,,,,,,',001,2019_Jan_18_1327,body_behavioural,59.99391541127639,
1,“So what are you saying?” Sadie asked. ,3,2,None,None,,0,1,1,1,0,35,35,35,,,,,,,,,,,,,,,,,,,9,0.1357348089804873,,,,,,,',001,2019_Jan_18_1327,body_behavioural,59.99391541127639,
1,"Thomas replied, “I want to take a break for awhile.",3,2,None,None,,0,1,1,1,0,36,36,36,,,,,,,,,,,,,,,,,,,9,0.11872923001646996,,,,,,,',001,2019_Jan_18_1327,body_behavioural,59.99391541127639,
1,"You know, take space to figure out what I’m supposed to be doing.”",3,2,None,17.0,,0,1,1,1,0,37,37,37,,,,,,,,,,,,,,,,,,,1,0.06694915192201734,,,,,,,',001,2019_Jan_18_1327,body_behavioural,59.99391541127639,
1,Sadie quietly burst into tears. ,3,3,None,None,,0,1,1,1,0,38,38,38,,,,,,,,,,,,,,,,,,,9,0.0685483340639621,,,,,,,',001,2019_Jan_18_1327,body_behavioural,59.99391541127639,
1,"Nevertheless, people sitting at the adjacent table looked over, and then averted their gaze as they realized what was happening. ",3,3,None,None,,0,1,1,1,0,39,39,39,,,,,,,,,,,,,,,,,,,1,0.13565544201992452,,,,,,,',001,2019_Jan_18_1327,body_behavioural,59.99391541127639,
1,“Is this really what you want?,3,3,None,None,,0,1,1,1,0,40,40,40,,,,,,,,,,,,,,,,,,,9,0.05269980407319963,,,,,,,',001,2019_Jan_18_1327,body_behavioural,59.99391541127639,
1,I don’t understand.,3,3,None,None,,0,1,1,1,0,41,41,41,,,,,,,,,,,,,,,,,,,9,0.1693644030019641,,,,,,,',001,2019_Jan_18_1327,body_behavioural,59.99391541127639,
1,I don’t understand.,3,3,None,None,,0,1,1,1,0,42,42,42,,,,,,,,,,,,,,,,,,,1,0.0018613409483805299,,,,,,,',001,2019_Jan_18_1327,body_behavioural,59.99391541127639,
1,Things were fine. ,3,3,None,None,,0,1,1,1,0,43,43,43,,,,,,,,,,,,,,,,,,,9,0.1178340339101851,,,,,,,',001,2019_Jan_18_1327,body_behavioural,59.99391541127639,
1,"We don’t have to hang out all the time, or as much as we do now.”",3,3,None,None,,0,1,1,1,0,44,44,44,,,,,,,,,,,,,,,,,,,1,0.03420376207213849,,,,,,,',001,2019_Jan_18_1327,body_behavioural,59.99391541127639,
1,Thomas chewed on his bottom lip and picked at his now bleeding hangnail. ,3,3,20.0,None,,0,1,1,1,0,45,45,45,,,,,,,,,,,,,,,,,,,9,0.1009264950407669,,,,,,,',001,2019_Jan_18_1327,body_behavioural,59.99391541127639,
1,"At that moment, the waiter arrived with the burger and reuben, and set them on the table.",4,3,None,None,,0,1,1,1,0,46,46,46,,,,,,,,,,,,,,,,,,,1,0.05085951299406588,,,,,,,',001,2019_Jan_18_1327,body_behavioural,59.99391541127639,
1, “Is there anything else I can get for you two?,4,3,None,None,,0,1,1,1,0,47,47,47,,,,,,,,,,,,,,,,,,,9,0.06904403702355921,,,,,,,',001,2019_Jan_18_1327,body_behavioural,59.99391541127639,
1,Will you be getting desserts tonight?” he asked.,4,3,None,None,,0,1,1,1,0,48,48,48,,,,,,,,,,,,,,,,,,,1,0.06925524398684502,,,,,,,',001,2019_Jan_18_1327,body_behavioural,59.99391541127639,
1,"“Oh no, we’re good, thanks.” Thomas said.",4,3,None,None,,0,1,1,1,0,49,49,49,,,,,,,,,,,,,,,,,,,9,0.033033423009328544,,,,,,,',001,2019_Jan_18_1327,body_behavioural,59.99391541127639,
1,"Once the waiter had quickly walked away, Thomas sighed and said, “Sadie, I’m sorry.",4,3,None,None,,0,1,1,1,0,50,50,50,,,,,,,,,,,,,,,,,,,1,0.08438182203099132,,,,,,,',001,2019_Jan_18_1327,body_behavioural,59.99391541127639,
1,"You are so great, and I love hanging out with you.",4,3,None,None,,0,1,1,1,0,51,51,51,,,,,,,,,,,,,,,,,,,9,0.16763602604623884,,,,,,,',001,2019_Jan_18_1327,body_behavioural,59.99391541127639,
1,"But I need some time, I’m so sorry.”",4,3,None,None,,0,1,1,1,0,52,52,52,,,,,,,,,,,,,,,,,,,9,0.13492316799238324,,,,,,,',001,2019_Jan_18_1327,body_behavioural,59.99391541127639,
1,"He grabbed her hand, and she pulled it out of his.",4,3,None,None,,0,1,1,1,0,53,53,53,,,,,,,,,,,,,,,,,,,9,0.28296643297653645,,,,,,,',001,2019_Jan_18_1327,body_behavioural,59.99391541127639,
1,"“Sadie,” he said.",4,3,None,17.0,,0,1,1,1,0,54,54,54,,,,,,,,,,,,,,,,,,,1,0.13462928403168917,,,,,,,',001,2019_Jan_18_1327,body_behavioural,59.99391541127639,
1," She stood up, grabbed half the reuben, and shook it at him as she growled, “Don’t follow me and don’t talk to me anymore.”",4,4,None,None,,0,1,1,1,0,55,55,55,,,,,,,,,,,,,,,,,,,1,0.34069555799942464,,,,,,,',001,2019_Jan_18_1327,body_behavioural,59.99391541127639,
1,"Sadie's heels clacked loudly against the black and white linoleum, and the bell above the door jingled cheerfully as the door closed behind her.",4,4,None,None,,0,1,1,1,0,56,56,56,,,,,,,,,,,,,,,,,,,1,0.20830976695287973,,,,,,,',001,2019_Jan_18_1327,body_behavioural,59.99391541127639,
1,"Thomas sat there for awhile, in shock at how quickly everything transpired. ",4,4,None,None,,0,1,1,1,0,57,57,57,,,,,,,,,,,,,,,,,,,9,0.25199904199689627,,,,,,,',001,2019_Jan_18_1327,body_behavioural,59.99391541127639,
1,"He grabbed his burger, and took a bite of it, but it tasted dry and fishy.",4,4,None,None,,0,1,1,1,0,58,58,58,,,,,,,,,,,,,,,,,,,1,0.2019168530823663,,,,,,,',001,2019_Jan_18_1327,body_behavioural,59.99391541127639,
1,"He dropped it back on his plate, wondering if the restaurant was responsible for the foul taste in his mouth. ",4,4,13.0,5.0,,0,1,1,1,0,59,59,59,,,,,,,,,,,,,,,,,,,1,0.21738283499144018,,,,,,,',001,2019_Jan_18_1327,body_behavioural,59.99391541127639,
1,,,,,,,0,1,1,1,,,,,,,,,,,,,,,,,,,,,,,,,,,,,,,',001,2019_Jan_18_1327,body_behavioural,59.99391541127639,
,,,,,,The next task in the experiment is to recall each story to the best of your ability.,,,,,,,,,0,0,0,0,,,,,,,,,,,,,,,,,space,1.2691787499934435,,,,,',001,2019_Jan_18_1327,body_behavioural,59.99391541127639,
,,,,,,"You will be presented with the story title, names, the images, and a blank text box for each story.",,,,,,,,,0,1,1,1,,,,,,,,,,,,,,,,,space,0.38595625397283584,,,,,',001,2019_Jan_18_1327,body_behavioural,59.99391541127639,
,,,,,,Describe the story with as many details as you can remember in the space provided. ,,,,,,,,,0,2,2,2,,,,,,,,,,,,,,,,,space,0.31879511394072324,,,,,',001,2019_Jan_18_1327,body_behavioural,59.99391541127639,
,,,,,,"When you are finished recalling one story, to move onto the next one hit ‘return’. ",,,,,,,,,0,3,3,3,,,,,,,,,,,,,,,,,space,0.36792605998925865,,,,,',001,2019_Jan_18_1327,body_behavioural,59.99391541127639,
,,,,,,There is no time limit for your responses. ,,,,,,,,,0,4,4,4,,,,,,,,,,,,,,,,,space,0.367536737001501,,,,,',001,2019_Jan_18_1327,body_behavioural,59.99391541127639,
0,,,,,,,,,,,,,,,,,,,0,0,0,0,,,,,,,,,,,,,,,,,,,',001,2019_Jan_18_1327,body_behavioural,59.99391541127639,
,,,,,,The next part of the task is to answer questions about each story.,,,,,,,,,,,,,,,,,0,0,0,0,,,,,,,,,,,space,1.002070919959806,,,',001,2019_Jan_18_1327,body_behavioural,59.99391541127639,
,,,,,,The next part of the task is to answer questions about each story.,,,,,,,,,,,,,,,,,0,0,0,0,,,,,,,,,,,,,,,',001,2019_Jan_18_1327,body_behavioural,59.99391541127639,
,,,,,,You will be asked the questions you were asked to remember for the job simulated during each story.,,,,,,,,,,,,,,,,,0,1,1,1,,,,,,,,,,,space,0.43522223795298487,,,',001,2019_Jan_18_1327,body_behavioural,59.99391541127639,
,,,,,,You will be asked the questions you were asked to remember for the job simulated during each story.,,,,,,,,,,,,,,,,,0,1,1,1,,,,,,,,,,,,,,,',001,2019_Jan_18_1327,body_behavioural,59.99391541127639,
,,,,,,You will also be asked questions that we didn’t tell you to think of for that story.,,,,,,,,,,,,,,,,,0,2,2,2,,,,,,,,,,,space,0.3996370800305158,,,',001,2019_Jan_18_1327,body_behavioural,59.99391541127639,
,,,,,,You will also be asked questions that we didn’t tell you to think of for that story.,,,,,,,,,,,,,,,,,0,2,2,2,,,,,,,,,,,,,,,',001,2019_Jan_18_1327,body_behavioural,59.99391541127639,
,,,,,,"We realize that we did not tell you to think of these questions during the story, but do your best to answer all these questions. ",,,,,,,,,,,,,,,,,0,3,3,3,,,,,,,,,,,space,0.4185109440004453,,,',001,2019_Jan_18_1327,body_behavioural,59.99391541127639,
,,,,,,"We realize that we did not tell you to think of these questions during the story, but do your best to answer all these questions. ",,,,,,,,,,,,,,,,,0,3,3,3,,,,,,,,,,,,,,,',001,2019_Jan_18_1327,body_behavioural,59.99391541127639,
,,,,,,Hit enter to submit your answer and move onto the next question. ,,,,,,,,,,,,,,,,,0,4,4,4,,,,,,,,,,,space,0.3834228999912739,,,',001,2019_Jan_18_1327,body_behavioural,59.99391541127639,
,,,,,,Hit enter to submit your answer and move onto the next question. ,,,,,,,,,,,,,,,,,0,4,4,4,,,,,,,,,,,,,,,',001,2019_Jan_18_1327,body_behavioural,59.99391541127639,
,,,,,,,,,,,,,,,,,,,,,,,,,,,,,,,,,,,,,,,space,0.7674423140706494,,,,,,
