5,"I try to, but it seems like I always get in the way!” ",2,1,,,,0,5,5,5,,,,,0,9,9,9,,,,,,,,,,,,,,,,,,,,,,,,,,,1,0.2031516749993898,,,,,,,,,,,,,,,,,,,,,',001,2019_Feb_08_1238,body_behavioural,3.0.3,59.97551799347096,
5,"Emmanuella angrily threw the pasta into the cart, losing her temper.",2,1,,,,0,5,5,5,,,,,0,10,10,10,,,,,,,,,,,,,,,,,,,,,,,,,,,9,0.11915030000091065,,,,,,,,,,,,,,,,,,,,,',001,2019_Feb_08_1238,body_behavioural,3.0.3,59.97551799347096,
5," “Liam, you don’t even try!",2,1,,,,0,5,5,5,,,,,0,11,11,11,,,,,,,,,,,,,,,,,,,,,,,,,,,9,0.135842692998267,,,,,,,,,,,,,,,,,,,,,',001,2019_Feb_08_1238,body_behavioural,3.0.3,59.97551799347096,
5,You know what?,2,1,,,,0,5,5,5,,,,,0,12,12,12,,,,,,,,,,,,,,,,,,,,,,,,,,,9,0.13394727999911993,,,,,,,,,,,,,,,,,,,,,',001,2019_Feb_08_1238,body_behavioural,3.0.3,59.97551799347096,
5,I don’t think I can do this anymore. ,2,2,,,,0,5,5,5,,,,,0,13,13,13,,,,,,,,,,,,,,,,,,,,,,,,,,,1,0.18408536499919137,,,,,,,,,,,,,,,,,,,,,',001,2019_Feb_08_1238,body_behavioural,3.0.3,59.97551799347096,
5,"I was going to wait until after this unfortunately-timed dinner party tonight to talk about this, but I might as well say it now: I don’t want to be in a relationship with you anymore.",2,2,,,,0,5,5,5,,,,,0,14,14,14,,,,,,,,,,,,,,,,,,,,,,,,,,,9,0.06769618700127467,,,,,,,,,,,,,,,,,,,,,',001,2019_Feb_08_1238,body_behavioural,3.0.3,59.97551799347096,
5," I’m tired of the constant fighting, and I feel like when we try to do anything fun anymore it ends up unpleasant for the stupidest reasons, and I am just past  trying to work things out.”",2,2,,,,0,5,5,5,,,,,0,15,15,15,,,,,,,,,,,,,,,,,,,,,,,,,,,9,0.10074588499992387,,,,,,,,,,,,,,,,,,,,,',001,2019_Feb_08_1238,body_behavioural,3.0.3,59.97551799347096,
5,"Liam refused to look at her as she picked out sauces for the pasta, and then she threw up her hands, saying, “You know what, if this party is still happening we are going to just eat pasta.”",2,2,,,,0,5,5,5,,,,,0,16,16,16,,,,,,,,,,,,,,,,,,,,,,,,,,,1,0.019236839998484356,,,,,,,,,,,,,,,,,,,,,',001,2019_Feb_08_1238,body_behavioural,3.0.3,59.97551799347096,
5,They headed to the checkout area where there was only one station open but it was not crowded at all.,3,2,,,,0,5,5,5,,,,,0,17,17,17,,,,,,,,,,,,,,,,,,,,,,,,,,,9,0.019819329998426838,,,,,,,,,,,,,,,,,,,,,',001,2019_Feb_08_1238,body_behavioural,3.0.3,59.97551799347096,
5,Emmanuella sighed and got in line while Liam pretended to be interested in the magazine racks as he thought. ,3,2,,,,0,5,5,5,,,,,0,18,18,18,,,,,,,,,,,,,,,,,,,,,,,,,,,1,0.06921896999847377,,,,,,,,,,,,,,,,,,,,,',001,2019_Feb_08_1238,body_behavioural,3.0.3,59.97551799347096,
5,"Finally he turned to her and sighed, “Yes, I was thinking the same thing - I think we could definitely be happier with other people.” ",3,3,,,,0,5,5,5,,,,,0,19,19,19,,,,,,,,,,,,,,,,,,,,,,,,,,,9,0.17160879500079318,,,,,,,,,,,,,,,,,,,,,',001,2019_Feb_08_1238,body_behavioural,3.0.3,59.97551799347096,
5,"As if she hadn't heard him, Emmanuella looked at their cart and said, “I'm not sure this will be enough, could you grab another box of pasta?”",3,3,,,,0,5,5,5,,,,,0,20,20,20,,,,,,,,,,,,,,,,,,,,,,,,,,,9,0.10072228699937114,,,,,,,,,,,,,,,,,,,,,',001,2019_Feb_08_1238,body_behavioural,3.0.3,59.97551799347096,
5, Liam scoffed and walked off to quickly get it.,3,3,,,,0,5,5,5,,,,,0,21,21,21,,,,,,,,,,,,,,,,,,,,,,,,,,,9,0.13645479299884755,,,,,,,,,,,,,,,,,,,,,',001,2019_Feb_08_1238,body_behavioural,3.0.3,59.97551799347096,
5,"As Emmanuella waited in line, she took a moment to compose herself, deciding that there was no reason to continue making a scene in the store. ",3,3,,,,0,5,5,5,,,,,0,22,22,22,,,,,,,,,,,,,,,,,,,,,,,,,,,1,0.02258157200049027,,,,,,,,,,,,,,,,,,,,,',001,2019_Feb_08_1238,body_behavioural,3.0.3,59.97551799347096,
5," Right when Liam came back with the pasta, the cashier started scanning their groceries.",4,3,,,,0,5,5,5,,,,,0,23,23,23,,,,,,,,,,,,,,,,,,,,,,,,,,,9,0.06953229999999166,,,,,,,,,,,,,,,,,,,,,',001,2019_Feb_08_1238,body_behavioural,3.0.3,59.97551799347096,
5,"The cost came to $30, and Emmanuella paid with her credit card.",4,3,,,,0,5,5,5,,,,,0,24,24,24,,,,,,,,,,,,,,,,,,,,,,,,,,,1,0.019784607000474352,,,,,,,,,,,,,,,,,,,,,',001,2019_Feb_08_1238,body_behavioural,3.0.3,59.97551799347096,
5,"She asked Liam politely to take the bags, and he obliged, following her to toward the exit. ",4,3,,,,0,5,5,5,,,,,0,25,25,25,,,,,,,,,,,,,,,,,,,,,,,,,,,9,0.05287448300077813,,,,,,,,,,,,,,,,,,,,,',001,2019_Feb_08_1238,body_behavioural,3.0.3,59.97551799347096,
5,"“Liam, I think we are making the right decision.",4,4,,,,0,5,5,5,,,,,0,26,26,26,,,,,,,,,,,,,,,,,,,,,,,,,,,1,0.06982584799698088,,,,,,,,,,,,,,,,,,,,,',001,2019_Feb_08_1238,body_behavioural,3.0.3,59.97551799347096,
5,This is good.” ,4,4,,,,0,5,5,5,,,,,0,27,27,27,,,,,,,,,,,,,,,,,,,,,,,,,,,9,0.020031255997309927,,,,,,,,,,,,,,,,,,,,,',001,2019_Feb_08_1238,body_behavioural,3.0.3,59.97551799347096,
5,"“I agree,” he said, visibly relieved at the thought that they had gotten through the last fight they would ever need to have.",4,4,,,,0,5,5,5,,,,,0,28,28,28,,,,,,,,,,,,,,,,,,,,,,,,,,,1,0.10260449300039909,,,,,,,,,,,,,,,,,,,,,',001,2019_Feb_08_1238,body_behavioural,3.0.3,59.97551799347096,
5,"“I think we can still host this dinner tonight, as long as you're still on board,” Emmanuella said.",4,4,,,,0,5,5,5,,,,,0,29,29,29,,,,,,,,,,,,,,,,,,,,,,,,,,,1,0.16952490000039688,,,,,,,,,,,,,,,,,,,,,',001,2019_Feb_08_1238,body_behavioural,3.0.3,59.97551799347096,
5,"Liam nodded, “Yes, let’s just not tell anyone yet.” ",4,4,,,,0,5,5,5,,,,,0,30,30,30,,,,,,,,,,,,,,,,,,,,,,,,,,,9,0.15299506800147356,,,,,,,,,,,,,,,,,,,,,',001,2019_Feb_08_1238,body_behavioural,3.0.3,59.97551799347096,
5,"Emmanuella laughed, “Whoever leaks it loses their rights to the cat.”",4,4,,,,0,5,5,5,,,,,0,31,31,31,,,,,,,,,,,,,,,,,,,,,,,,,,,1,0.15298885000083828,,,,,,,,,,,,,,,,,,,,,',001,2019_Feb_08_1238,body_behavioural,3.0.3,59.97551799347096,
5,"Liam rolled his eyes and managed a weak chuckle, knowing the cat would be a whole other issue to sort out later.
",4,4,,,,0,5,5,5,,,,,0,32,32,32,,,,,,,,,,,,,,,,,,,,,,,,,,,9,0.11965334999695187,,,,,,,,,,,,,,,,,,,,,',001,2019_Feb_08_1238,body_behavioural,3.0.3,59.97551799347096,
5,,,,,,,0,5,5,5,,,,,,,,,,,,,,,,,,,,,,,,,,,,,,,,,,,,,,,,,,,,,,,,,,,,,,,,,',001,2019_Feb_08_1238,body_behavioural,3.0.3,59.97551799347096,
6,,,,,,,0,6,6,6,0,0,0,0,,,,,,,,,,,,,,,,,,,,,,,,,space,0.584056308001891,space,0.3027592699982051,space,0.4365110430007917,,,,,,,,,,,,,,,,,,,,,,,',001,2019_Feb_08_1238,body_behavioural,3.0.3,59.97551799347096,
6,"Leon and  Ariana hurried into the classroom at the same time, and Leon did a double-take when he saw her. ",1,1,,,,0,6,6,6,,,,,0,0,0,0,,,,,,,,,,,,,,,,,,,,,,,,,,,9,0.8529561629984528,,,,,,,,,,,,,,,,,,,,,',001,2019_Feb_08_1238,body_behavioural,3.0.3,59.97551799347096,
6,"This was his first day after transferring to this university, and he had assumed that he wouldn’t know anyone on campus, but he couldn't shake the nagging feeling  that he had seen her somewhere before. ",1,1,,,,0,6,6,6,,,,,0,1,1,1,,,,,,,,,,,,,,,,,,,,,,,,,,,9,0.11975574000098277,,,,,,,,,,,,,,,,,,,,,',001,2019_Feb_08_1238,body_behavioural,3.0.3,59.97551799347096,
6,"They were both a bit late, so they quickly slid into seats next to each other in the back of the small classroom.",1,1,,,,0,6,6,6,,,,,0,2,2,2,,,,,,,,,,,,,,,,,,,,,,,,,,,1,0.00313205500060576,,,,,,,,,,,,,,,,,,,,,',001,2019_Feb_08_1238,body_behavioural,3.0.3,59.97551799347096,
6,"This room was usually used for small meetings, but had been rearranged with the table pushed to the side and chairs set up in rows to face the projector screen. ",1,1,,,,0,6,6,6,,,,,0,3,3,3,,,,,,,,,,,,,,,,,,,,,,,,,,,9,0.050652927999180974,,,,,,,,,,,,,,,,,,,,,',001,2019_Feb_08_1238,body_behavioural,3.0.3,59.97551799347096,
6,"There were no windows in the room, since they were down in the sub-basement of the history department.",1,1,,,,0,6,6,6,,,,,0,4,4,4,,,,,,,,,,,,,,,,,,,,,,,,,,,1,0.017079174998798408,,,,,,,,,,,,,,,,,,,,,',001,2019_Feb_08_1238,body_behavioural,3.0.3,59.97551799347096,
6,"Leon, trying to figure out where he had seen her before, could not stop looking over at Ariana.",1,1,,,,0,6,6,6,,,,,0,5,5,5,,,,,,,,,,,,,,,,,,,,,,,,,,,9,0.03636628000094788,,,,,,,,,,,,,,,,,,,,,',001,2019_Feb_08_1238,body_behavioural,3.0.3,59.97551799347096,
6,Ariana was oblivious to Leon’s gaze and was only focused on getting ready for class. ,1,1,,,,0,6,6,6,,,,,0,6,6,6,,,,,,,,,,,,,,,,,,,,,,,,,,,1,0.0339378749995376,,,,,,,,,,,,,,,,,,,,,',001,2019_Feb_08_1238,body_behavioural,3.0.3,59.97551799347096,
6,"“Good afternoon class,” the professor began.",2,1,,,,0,6,6,6,,,,,0,7,7,7,,,,,,,,,,,,,,,,,,,,,,,,,,,9,0.036777347999304766,,,,,,,,,,,,,,,,,,,,,',001,2019_Feb_08_1238,body_behavioural,3.0.3,59.97551799347096,
6,“Welcome to Egyptian Cultural Studies. ,2,1,,,,0,6,6,6,,,,,0,8,8,8,,,,,,,,,,,,,,,,,,,,,,,,,,,1,0.06961560499985353,,,,,,,,,,,,,,,,,,,,,',001,2019_Feb_08_1238,body_behavioural,3.0.3,59.97551799347096,
6,"Today we will be talking about mummification, one of the most famous and often misunderstood customs in ancient Egyptian society.”",2,1,,,,0,6,6,6,,,,,0,9,9,9,,,,,,,,,,,,,,,,,,,,,,,,,,,9,0.003097598000749713,,,,,,,,,,,,,,,,,,,,,',001,2019_Feb_08_1238,body_behavioural,3.0.3,59.97551799347096,
6,Leon pulled out his notebook and tried to concentrate on the class.,2,1,,,,0,6,6,6,,,,,0,10,10,10,,,,,,,,,,,,,,,,,,,,,,,,,,,1,0.05289980499946978,,,,,,,,,,,,,,,,,,,,,',001,2019_Feb_08_1238,body_behavioural,3.0.3,59.97551799347096,
6,Within a few minutes though he found his attention wandering back to Ariana.,2,1,,,,0,6,6,6,,,,,0,11,11,11,,,,,,,,,,,,,,,,,,,,,,,,,,,1,0.1552914799976861,,,,,,,,,,,,,,,,,,,,,',001,2019_Feb_08_1238,body_behavioural,3.0.3,59.97551799347096,
6,"He decided to do something about his hunch so he ripped off a corner of a page in his notebook, wrote a note, and set it on her desk.",2,1,,,,0,6,6,6,,,,,0,12,12,12,,,,,,,,,,,,,,,,,,,,,,,,,,,9,0.13626878500144812,,,,,,,,,,,,,,,,,,,,,',001,2019_Feb_08_1238,body_behavioural,3.0.3,59.97551799347096,
6,"“Hi, sorry to distract you from mummies, but you look really familiar," it read.",2,2,,,,0,6,6,6,,,,,0,13,13,13,,,,,,,,,,,,,,,,,,,,,,,,,,,9,0.13469090899889125,,,,,,,,,,,,,,,,,,,,,',001,2019_Feb_08_1238,body_behavioural,3.0.3,59.97551799347096,
6,It continued: “Do I know you from somewhere?”,2,2,,,,0,6,6,6,,,,,0,14,14,14,,,,,,,,,,,,,,,,,,,,,,,,,,,1,0.03690627200194285,,,,,,,,,,,,,,,,,,,,,',001,2019_Feb_08_1238,body_behavioural,3.0.3,59.97551799347096,
6,"She looked at the note with surprise, and then turned to notice Leon for the first time. ",2,2,,,,0,6,6,6,,,,,0,15,15,15,,,,,,,,,,,,,,,,,,,,,,,,,,,9,0.05297288799920352,,,,,,,,,,,,,,,,,,,,,',001,2019_Feb_08_1238,body_behavioural,3.0.3,59.97551799347096,
6,"She instantly liked him when she saw him; he had very soft eyes and sharp features, a combination that made him seem  trustworthy and genuine.",2,2,,,,0,6,6,6,,,,,0,16,16,16,,,,,,,,,,,,,,,,,,,,,,,,,,,1,0.050475474999984726,,,,,,,,,,,,,,,,,,,,,',001,2019_Feb_08_1238,body_behavioural,3.0.3,59.97551799347096,
6,He smiled at her and she flashed him a smile back.,2,2,,,,0,6,6,6,,,,,0,17,17,17,,,,,,,,,,,,,,,,,,,,,,,,,,,9,0.05321788799847127,,,,,,,,,,,,,,,,,,,,,',001,2019_Feb_08_1238,body_behavioural,3.0.3,59.97551799347096,
6,Then she turned the note over to the back and started to write a reply.,2,2,,,,0,6,6,6,,,,,0,18,18,18,,,,,,,,,,,,,,,,,,,,,,,,,,,1,0.10010443999999552,,,,,,,,,,,,,,,,,,,,,',001,2019_Feb_08_1238,body_behavioural,3.0.3,59.97551799347096,
6,"Meanwhile the professor continued, “One may well question why the ancient Egyptians spent so much time and effort on their funerary practices.",3,2,,,,0,6,6,6,,,,,0,19,19,19,,,,,,,,,,,,,,,,,,,,,,,,,,,1,0.18871283499902347,,,,,,,,,,,,,,,,,,,,,',001,2019_Feb_08_1238,body_behavioural,3.0.3,59.97551799347096,
6,"Not only was the mummification process itself a complicated affair, but there were also elaborate rituals before, during, and after death.",3,2,,,,0,6,6,6,,,,,0,20,20,20,,,,,,,,,,,,,,,,,,,,,,,,,,,1,0.17173140699742362,,,,,,,,,,,,,,,,,,,,,',001,2019_Feb_08_1238,body_behavioural,3.0.3,59.97551799347096,
6,The practice required teams of experts with years of training and took a total of 70 days to complete.” ,3,2,,,,0,6,6,6,,,,,0,21,21,21,,,,,,,,,,,,,,,,,,,,,,,,,,,9,0.13650593000056688,,,,,,,,,,,,,,,,,,,,,',001,2019_Feb_08_1238,body_behavioural,3.0.3,59.97551799347096,
6,"Ariana passed the note back to Leon, and she had replied, “No, but maybe my twin and I were separated at birth.”",3,2,,,,0,6,6,6,,,,,0,22,22,22,,,,,,,,,,,,,,,,,,,,,,,,,,,1,0.15339039899845375,,,,,,,,,,,,,,,,,,,,,',001,2019_Feb_08_1238,body_behavioural,3.0.3,59.97551799347096,
6,They passed notes back and forth the whole class like they were back in high school.,3,2,,,,0,6,6,6,,,,,0,23,23,23,,,,,,,,,,,,,,,,,,,,,,,,,,,9,0.17213697699844488,,,,,,,,,,,,,,,,,,,,,',001,2019_Feb_08_1238,body_behavioural,3.0.3,59.97551799347096,
6,"Near the end of the lecture, Leon wrote, “Would you like to go to dinner tonight?” ",3,3,,,,0,6,6,6,,,,,0,24,24,24,,,,,,,,,,,,,,,,,,,,,,,,,,,9,0.169247269997868,,,,,,,,,,,,,,,,,,,,,',001,2019_Feb_08_1238,body_behavioural,3.0.3,59.97551799347096,
6,"Ariana read the note, and looked at him and nodded her head",3,3,,,,0,6,6,6,,,,,0,25,25,25,,,,,,,,,,,,,,,,,,,,,,,,,,,9,0.16969895500005805,,,,,,,,,,,,,,,,,,,,,',001,2019_Feb_08_1238,body_behavioural,3.0.3,59.97551799347096,
6,"She wrote back on the slip of paper, “Pick me up at 6 in front of Patton Hall.”",3,3,,,,0,6,6,6,,,,,0,26,26,26,,,,,,,,,,,,,,,,,,,,,,,,,,,1,0.2196456979982031,,,,,,,,,,,,,,,,,,,,,',001,2019_Feb_08_1238,body_behavioural,3.0.3,59.97551799347096,
6,Then the professor ended the lecture and announced to the class that they would have their first quiz next class on Friday on mummification. ,4,3,,,,0,6,6,6,,,,,0,27,27,27,,,,,,,,,,,,,,,,,,,,,,,,,,,9,0.2030819829997199,,,,,,,,,,,,,,,,,,,,,',001,2019_Feb_08_1238,body_behavioural,3.0.3,59.97551799347096,
6,"Everyone packed up and started heading out, as well as Sophie and Leon.",4,3,,,,0,6,6,6,,,,,0,28,28,28,,,,,,,,,,,,,,,,,,,,,,,,,,,1,0.2198082200011413,,,,,,,,,,,,,,,,,,,,,',001,2019_Feb_08_1238,body_behavioural,3.0.3,59.97551799347096,
6,"They approached each other smiling, and Leon said, “Well it was great to meet you, again, or maybe not again, but regardless it was great to meet you.” ",4,3,,,,0,6,6,6,,,,,0,29,29,29,,,,,,,,,,,,,,,,,,,,,,,,,,,9,0.0346397329994943,,,,,,,,,,,,,,,,,,,,,',001,2019_Feb_08_1238,body_behavioural,3.0.3,59.97551799347096,
6,"She replied, “Yes, it was.",4,4,,,,0,6,6,6,,,,,0,30,30,30,,,,,,,,,,,,,,,,,,,,,,,,,,,1,0.06965926799966837,,,,,,,,,,,,,,,,,,,,,',001,2019_Feb_08_1238,body_behavioural,3.0.3,59.97551799347096,
6,"I have to run to my next class, but I’ll see you later tonight.” ",4,4,,,,0,6,6,6,,,,,0,31,31,31,,,,,,,,,,,,,,,,,,,,,,,,,,,9,0.05163388499931898,,,,,,,,,,,,,,,,,,,,,',001,2019_Feb_08_1238,body_behavioural,3.0.3,59.97551799347096,
6,"She waved as they parted ways outside of the door of the classroom, and Leon was still trying to figure out where he had seen her before as he watched her go. ",4,4,,,,0,6,6,6,,,,,0,32,32,32,,,,,,,,,,,,,,,,,,,,,,,,,,,1,0.05266539500007639,,,,,,,,,,,,,,,,,,,,,',001,2019_Feb_08_1238,body_behavioural,3.0.3,59.97551799347096,
6,,,,,,,0,6,6,6,,,,,,,,,,,,,,,,,,,,,,,,,,,,,,,,,,,,,,,,,,,,,,,,,,,,,,,,,',001,2019_Feb_08_1238,body_behavioural,3.0.3,59.97551799347096,
7,,,,,,,0,7,7,7,0,0,0,0,,,,,,,,,,,,,,,,,,,,,,,,,space,0.6365401620023476,space,1.8530456650005362,space,0.8361901479984226,,,,,,,,,,,,,,,,,,,,,,,',001,2019_Feb_08_1238,body_behavioural,3.0.3,59.97551799347096,
7,"Ms. Bianchi and Ms. Morrison walked into the grocery store at the same time, and, after a moment of mutual recognition, greeted each other and shook hands.",1,1,,,,0,7,7,7,,,,,0,0,0,0,,,,,,,,,,,,,,,,,,,,,,,,,,,1,0.3859551530003955,,,,,,,,,,,,,,,,,,,,,',001,2019_Feb_08_1238,body_behavioural,3.0.3,59.97551799347096,
7,""Thank you again for inviting me here to discuss my business proposal," said Ms. Bianchi, “And it’s a pleasure to be out of the office." ",1,1,,,,0,7,7,7,,,,,0,1,1,1,,,,,,,,,,,,,,,,,,,,,,,,,,,9,0.03672856499906629,,,,,,,,,,,,,,,,,,,,,',001,2019_Feb_08_1238,body_behavioural,3.0.3,59.97551799347096,
7,"As a salesperson for an Italian cheese company that was trying to expand its outreach to more mainstream grocery stores, this meeting could be a big break for her.",1,1,,,,0,7,7,7,,,,,0,2,2,2,,,,,,,,,,,,,,,,,,,,,,,,,,,1,0.08654127300178516,,,,,,,,,,,,,,,,,,,,,',001,2019_Feb_08_1238,body_behavioural,3.0.3,59.97551799347096,
7,"Her sales target, Ms. Morrison,  who had a reputation for being a bit quirky, was a corporate buyer for a large chain grocery store. ",1,1,,,,0,7,7,7,,,,,0,3,3,3,,,,,,,,,,,,,,,,,,,,,,,,,,,9,0.020294019999710144,,,,,,,,,,,,,,,,,,,,,',001,2019_Feb_08_1238,body_behavioural,3.0.3,59.97551799347096,
7,"She was known for doing things unconventionally: for example, she said that she liked to make deals with suppliers in the place where the products were sold- “to keep their minds focused on what’s important.” ",1,1,,,,0,7,7,7,,,,,0,4,4,4,,,,,,,,,,,,,,,,,,,,,,,,,,,1,0.07005928199941991,,,,,,,,,,,,,,,,,,,,,',001,2019_Feb_08_1238,body_behavioural,3.0.3,59.97551799347096,
7,"They chatted a little in the front of the grocery store, which was surrounded by pumpkins and halloween decorations set up in special displays for the holiday season.",1,1,,,,0,7,7,7,,,,,0,5,5,5,,,,,,,,,,,,,,,,,,,,,,,,,,,9,0.2030029769994144,,,,,,,,,,,,,,,,,,,,,',001,2019_Feb_08_1238,body_behavioural,3.0.3,59.97551799347096,
7,"Ms. Bianchi and Ms. Morrison walked to the cheese section, and Ms. Morrison picked up a block of parmesan.",2,1,,,,0,7,7,7,,,,,0,6,6,6,,,,,,,,,,,,,,,,,,,,,,,,,,,9,0.13626833300077124,,,,,,,,,,,,,,,,,,,,,',001,2019_Feb_08_1238,body_behavioural,3.0.3,59.97551799347096,
7,“We have quite a selection here.,2,1,,,,0,7,7,7,,,,,0,7,7,7,,,,,,,,,,,,,,,,,,,,,,,,,,,1,0.0030931430010241456,,,,,,,,,,,,,,,,,,,,,',001,2019_Feb_08_1238,body_behavioural,3.0.3,59.97551799347096,
7,I don’t know that it needs an additional section for more gourmet cheeses.” ,2,1,,,,0,7,7,7,,,,,0,8,8,8,,,,,,,,,,,,,,,,,,,,,,,,,,,9,0.07011043800230254,,,,,,,,,,,,,,,,,,,,,',001,2019_Feb_08_1238,body_behavioural,3.0.3,59.97551799347096,
7,"Ms. Bianchi's confidence faltered for a minute at this remark, but then she launched into her prepared pitch.",2,1,,,,0,7,7,7,,,,,0,9,9,9,,,,,,,,,,,,,,,,,,,,,,,,,,,1,0.03625038500103983,,,,,,,,,,,,,,,,,,,,,',001,2019_Feb_08_1238,body_behavioural,3.0.3,59.97551799347096,
7," “Ms. Morrison, I think you would agree that selling food is more than just providing variety, but also about providing the highest quality.",2,2,,,,0,7,7,7,,,,,0,10,10,10,,,,,,,,,,,,,,,,,,,,,,,,,,,9,0.036236754996934906,,,,,,,,,,,,,,,,,,,,,',001,2019_Feb_08_1238,body_behavioural,3.0.3,59.97551799347096,
7,"You don’t have cheeses made in America that are like ours, it is true.",2,2,,,,0,7,7,7,,,,,0,11,11,11,,,,,,,,,,,,,,,,,,,,,,,,,,,1,0.06920724299925496,,,,,,,,,,,,,,,,,,,,,',001,2019_Feb_08_1238,body_behavioural,3.0.3,59.97551799347096,
7,Your store could be providing American consumers with a dimension in taste that they've never known before with our product.,2,2,,,,0,7,7,7,,,,,0,12,12,12,,,,,,,,,,,,,,,,,,,,,,,,,,,9,0.002995175000251038,,,,,,,,,,,,,,,,,,,,,',001,2019_Feb_08_1238,body_behavioural,3.0.3,59.97551799347096,
7,"I propose that you give it a shot, buy $1000 worth of cheese products for a few stores, and see how the sales increase not only in our cheeses but also in products related to cheeses: crackers, jams, olives. ",2,2,,,,0,7,7,7,,,,,0,13,13,13,,,,,,,,,,,,,,,,,,,,,,,,,,,1,0.06961067299926071,,,,,,,,,,,,,,,,,,,,,',001,2019_Feb_08_1238,body_behavioural,3.0.3,59.97551799347096,
7,"The availability of a finer product leads to the appreciation of the product, and your consumers will start to consume in a new, more profitable way.”",2,2,,,,0,7,7,7,,,,,0,14,14,14,,,,,,,,,,,,,,,,,,,,,,,,,,,1,0.1359420200024033,,,,,,,,,,,,,,,,,,,,,',001,2019_Feb_08_1238,body_behavioural,3.0.3,59.97551799347096,
7,"Ms. Bianchi picked up a box of crackers by the cheese section, and said, “Here, I will buy these, and we can try some of our cheeses that I've brought with me.”",3,2,,,,0,7,7,7,,,,,0,15,15,15,,,,,,,,,,,,,,,,,,,,,,,,,,,1,0.15293249000023934,,,,,,,,,,,,,,,,,,,,,',001,2019_Feb_08_1238,body_behavioural,3.0.3,59.97551799347096,
7,"Ms. Morrison, who was thinking, nodded in agreement and said, “That sounds like a great idea.",3,2,,,,0,7,7,7,,,,,0,16,16,16,,,,,,,,,,,,,,,,,,,,,,,,,,,9,0.11969230199974845,,,,,,,,,,,,,,,,,,,,,',001,2019_Feb_08_1238,body_behavioural,3.0.3,59.97551799347096,
7,"Let’s head to check out, and those crackers are on me.” ",3,2,,,,0,7,7,7,,,,,0,17,17,17,,,,,,,,,,,,,,,,,,,,,,,,,,,9,0.167799990002095,,,,,,,,,,,,,,,,,,,,,',001,2019_Feb_08_1238,body_behavioural,3.0.3,59.97551799347096,
7,They walked over to the checkout area.,3,2,,,,0,7,7,7,,,,,0,18,18,18,,,,,,,,,,,,,,,,,,,,,,,,,,,9,0.16949779000060516,,,,,,,,,,,,,,,,,,,,,',001,2019_Feb_08_1238,body_behavioural,3.0.3,59.97551799347096,
7,"There was a very long line, and it was very busy in the checkout area as people were stocking up for Halloween parties and trick-or-treating. ",3,2,,,,0,7,7,7,,,,,0,19,19,19,,,,,,,,,,,,,,,,,,,,,,,,,,,9,0.16986250999980257,,,,,,,,,,,,,,,,,,,,,',001,2019_Feb_08_1238,body_behavioural,3.0.3,59.97551799347096,
7,"Since they had almost a 10 minute wait in line, Ms. Bianchi handed a sheet with printed graphs to Ms. Morrison the increase in profits that several other stores had seen after starting to carry their products.",3,2,,,,0,7,7,7,,,,,0,20,20,20,,,,,,,,,,,,,,,,,,,,,,,,,,,1,0.003089235000516055,,,,,,,,,,,,,,,,,,,,,',001,2019_Feb_08_1238,body_behavioural,3.0.3,59.97551799347096,
7,"Eventually, Ms. Morrison replied, “You know what, I think you've convinced me that this could work. ",3,3,,,,0,7,7,7,,,,,0,21,21,21,,,,,,,,,,,,,,,,,,,,,,,,,,,9,0.05330110800059629,,,,,,,,,,,,,,,,,,,,,',001,2019_Feb_08_1238,body_behavioural,3.0.3,59.97551799347096,
7,We've been trying to find a way to add a little European cachet to our stores.,3,3,,,,0,7,7,7,,,,,0,22,22,22,,,,,,,,,,,,,,,,,,,,,,,,,,,1,0.13399399500121945,,,,,,,,,,,,,,,,,,,,,',001,2019_Feb_08_1238,body_behavioural,3.0.3,59.97551799347096,
7,There's still a problem though - I'm worried we'll be paying out the nose for the import taxes.,3,3,,,,0,7,7,7,,,,,0,23,23,23,,,,,,,,,,,,,,,,,,,,,,,,,,,9,0.16974864000076195,,,,,,,,,,,,,,,,,,,,,',001,2019_Feb_08_1238,body_behavioural,3.0.3,59.97551799347096,
7,Is that the case?",3,3,,,,0,7,7,7,,,,,0,24,24,24,,,,,,,,,,,,,,,,,,,,,,,,,,,1,0.13637252199987415,,,,,,,,,,,,,,,,,,,,,',001,2019_Feb_08_1238,body_behavioural,3.0.3,59.97551799347096,
7,"It was Ms. Morrison’s turn to checkout, and the two businesswomen continued to talk back and forth as she did so. ",4,3,,,,0,7,7,7,,,,,0,25,25,25,,,,,,,,,,,,,,,,,,,,,,,,,,,9,0.10284732000218355,,,,,,,,,,,,,,,,,,,,,',001,2019_Feb_08_1238,body_behavioural,3.0.3,59.97551799347096,
7,"The cashier scanned the crackers, and Ms. Bianchi watched in amusement as Ms. Morrison paid the $6 price entirely in quarters from a wallet bulging with change.",4,3,,,,0,7,7,7,,,,,0,26,26,26,,,,,,,,,,,,,,,,,,,,,,,,,,,1,0.11989154299953952,,,,,,,,,,,,,,,,,,,,,',001,2019_Feb_08_1238,body_behavioural,3.0.3,59.97551799347096,
7,"They shortly came to an agreement and would have enough cheese shipments, $5000 worth, to different stores to qualify for a subsidized import tax. ",4,4,,,,0,7,7,7,,,,,0,27,27,27,,,,,,,,,,,,,,,,,,,,,,,,,,,9,0.10306203499931144,,,,,,,,,,,,,,,,,,,,,',001,2019_Feb_08_1238,body_behavioural,3.0.3,59.97551799347096,
7,"Ms. Bianchi retrieved some of her samples from her car, and they toasted their new deal with crackers topped with fresh mozzarella. ",4,4,,,,0,7,7,7,,,,,0,28,28,28,,,,,,,,,,,,,,,,,,,,,,,,,,,1,0.08633021000059671,,,,,,,,,,,,,,,,,,,,,',001,2019_Feb_08_1238,body_behavioural,3.0.3,59.97551799347096,
7,,,,,,,0,7,7,7,,,,,,,,,,,,,,,,,,,,,,,,,,,,,,,,,,,,,,,,,,,,,,,,,,,,,,,,,',001,2019_Feb_08_1238,body_behavioural,3.0.3,59.97551799347096,
,,,,,,The next task in the experiment is to recall each story to the best of your ability.,,,,,,,,,,,,,0,0,0,0,,,,,,,,,,,,,,,,,,,,,,,,,space,0.5859028730010323,,,,,,,,,,,,,,,,,,,',001,2019_Feb_08_1238,body_behavioural,3.0.3,59.97551799347096,
,,,,,,"You will be presented with the story title, names, the images, and a blank text box for each story.",,,,,,,,,,,,,0,1,1,1,,,,,,,,,,,,,,,,,,,,,,,,,space,2.936508930000855,,,,,,,,,,,,,,,,,,,',001,2019_Feb_08_1238,body_behavioural,3.0.3,59.97551799347096,
,,,,,,Describe the story with as many details as you can remember in the space provided. ,,,,,,,,,,,,,0,2,2,2,,,,,,,,,,,,,,,,,,,,,,,,,space,1.0526915830014332,,,,,,,,,,,,,,,,,,,',001,2019_Feb_08_1238,body_behavioural,3.0.3,59.97551799347096,
,,,,,,"When you are finished recalling one story, to move onto the next one hit ‘return’. ",,,,,,,,,,,,,0,3,3,3,,,,,,,,,,,,,,,,,,,,,,,,,space,0.4030311630012875,,,,,,,,,,,,,,,,,,,',001,2019_Feb_08_1238,body_behavioural,3.0.3,59.97551799347096,
,,,,,,There is no time limit for your responses. ,,,,,,,,,,,,,0,4,4,4,,,,,,,,,,,,,,,,,,,,,,,,,space,0.5007184949972725,,,,,,,,,,,,,,,,,,,',001,2019_Feb_08_1238,body_behavioural,3.0.3,59.97551799347096,
0,,,,,,,,,,,,,,,,,,,,,,,0,0,0,0,,,,,,,,,,,,,,,,,,,,,,,space,2.5698737599996093,L,,,,,,,,,,,,,,,,',001,2019_Feb_08_1238,body_behavioural,3.0.3,59.97551799347096,
1,,,,,,,,,,,,,,,,,,,,,,,0,1,1,1,,,,,,,,,,,,,,,,,,,,,,,space,3.4675079549997463,Rcommandrcommand,,,,,,,,,,,,,,,,',001,2019_Feb_08_1238,body_behavioural,3.0.3,59.97551799347096,
2,,,,,,,,,,,,,,,,,,,,,,,0,2,2,2,,,,,,,,,,,,,,,,,,,,,,,space,0.553294551998988,,,,,,,,,,,,,,,,,',001,2019_Feb_08_1238,body_behavioural,3.0.3,59.97551799347096,
