7,He laughed in disbelief and walked to his window seat three rows back to get ready for takeoff.,4,4,,0,7,7,7,,,,,0,30,30,30,,,,,,,,,,,,,,,,,,,,,,,,,,,1,3.403184923000026,,,,,,,,,,,,,,,,,,,021119_p1,001,2019_Feb_11_1420,body_behavioural,3.0.3,59.989808931262935,
7,Both were upset but glad that they would have this flight to mull things over and recenter. ,4,4,,0,7,7,7,,,,,0,31,31,31,,,,,,,,,,,,,,,,,,,,,,,,,,,9,5.469975284999919,,,,,,,,,,,,,,,,,,,021119_p1,001,2019_Feb_11_1420,body_behavioural,3.0.3,59.989808931262935,
7,,,,,0,7,7,7,,,,,,,,,,,,,,,,,,,,,,,,,,,,,,,,,,,,,,,,,,,,,,,,,,,,,,,021119_p1,001,2019_Feb_11_1420,body_behavioural,3.0.3,59.989808931262935,
,,,,The next task in the experiment is to recall each story to the best of your ability.,,,,,,,,,,,,,0,0,0,0,,,,,,,,,,,,,,,,,,,,,,,,,space,3.119733704999817,,,,,,,,,,,,,,,,,021119_p1,001,2019_Feb_11_1420,body_behavioural,3.0.3,59.989808931262935,
,,,,"You will be presented with the story title, names, the images, and a blank text box for each story.",,,,,,,,,,,,,0,1,1,1,,,,,,,,,,,,,,,,,,,,,,,,,space,5.053268310000021,,,,,,,,,,,,,,,,,021119_p1,001,2019_Feb_11_1420,body_behavioural,3.0.3,59.989808931262935,
,,,,Describe the story with as many details as you can remember in the space provided. ,,,,,,,,,,,,,0,2,2,2,,,,,,,,,,,,,,,,,,,,,,,,,space,2.519700970000031,,,,,,,,,,,,,,,,,021119_p1,001,2019_Feb_11_1420,body_behavioural,3.0.3,59.989808931262935,
,,,,"When you are finished recalling one story, to move onto the next one hit ‘return’. ",,,,,,,,,,,,,0,3,3,3,,,,,,,,,,,,,,,,,,,,,,,,,space,4.453231269999833,,,,,,,,,,,,,,,,,021119_p1,001,2019_Feb_11_1420,body_behavioural,3.0.3,59.989808931262935,
,,,,There is no time limit for your responses. ,,,,,,,,,,,,,0,4,4,4,,,,,,,,,,,,,,,,,,,,,,,,,space,1.4696121879999282,,,,,,,,,,,,,,,,,021119_p1,001,2019_Feb_11_1420,body_behavioural,3.0.3,59.989808931262935,
0,,,,,,,,,,,,,,,,,,,,,0,0,0,0,,,,,,,,,,,,,,,,,,,,,,,space,0.8864994400000796,Aaron walked into chemistry class with lana planning to ask her to marry him. lana was thinking about her uncompleted calc homework. while walking to their seats aaron smiled at the professor who smiled right back. they took their seat before and lana started work on her unfinished homework while aaron texted his friends preparing them for the big moment. the teacher began lecturing about atoms and pulled lana up for an unexpected class demonstartion. at this time aaron proposed to lana in fron of the entire class who celebrated as she said yes. the professor then ended the class saying thats enough excitement for today he additionally reminded the students of an upcoming homework assignment.l,,,,,,,,,,,,,,021119_p1,001,2019_Feb_11_1420,body_behavioural,3.0.3,59.989808931262935,
1,,,,,,,,,,,,,,,,,,,,,0,1,1,1,,,,,,,,,,,,,,,,,,,,,,,space,1.8530969830003414,,,,,,,,,,,,,,,021119_p1,001,2019_Feb_11_1420,body_behavioural,3.0.3,59.989808931262935,
2,,,,,,,,,,,,,,,,,,,,,0,2,2,2,,,,,,,,,,,,,,,,,,,,,,,space,8.920356777000052,"Mr shelton and mr gordon attended a lunch meeting in hopes of making a merger for their airplane manufacturing companies . mr, shelton was a well known and succesful buisnessman while mr gordon owned a much smaller company. they engaged in small talk while looking over the italian resturants menu. it contained classics like tiramsu and carbanara. mr shelton offered mr gordon 500 million dollars and a position at his company in exchange for his buisness. gordon voiced his complaints mainly that the type of manufacturing they do was about quality and not purely profit. they both ordered cuts of meat and an alcoholic beverage. shelton was able to ease gordans concerns and make a deal",,,,,,,,,,,,,,021119_p1,001,2019_Feb_11_1420,body_behavioural,3.0.3,59.989808931262935,
3,,,,,,,,,,,,,,,,,,,,,0,3,3,3,,,,,,,,,,,,,,,,,,,,,,,space,0.6529267050000271,"Ms. bianchi and ms. morrison met in a grocery store for a buisness meeting regarding imported cheeses. morrison was trying to convince bianchi to buy his foreign cheese as it could boost not only her cheese sales but the sales of related items like crackers, olives, and jams. to convice her she suggested she buy only $2000 worth of her product and see how it sold in some of her stores. bianchi remained hesitant and morrsion then bought crackers that were nearby to try some of the samples she brought along. they waited in a long line at the checkout in which she showed projected graphs on how her sales could increase. ",,,,,,,,,,,,,,021119_p1,001,2019_Feb_11_1420,body_behavioural,3.0.3,59.989808931262935,
4,,,,,,,,,,,,,,,,,,,,,0,4,4,4,,,,,,,,,,,,,,,,,,,,,,,space,0.6695499729999028,James noticed teresa as soon as he saw her. teresa was burried in her phone and walked into the glass door of the resturant both were attending. james and teresa waited to be seated in the wood cabin themed diner and eventually were escorted to seats at the counter. they sat on a wood log style bench and james nervously looked over the menu while thinking about what to say to teresa. teresa on the other hand pulled out a book and started to read. james eventually wored up the courage to ask teresa your forehead ok to which she replied have you ever been bitten by a scorpion. james replied no to which she said since she had been things like that dont bother her much. they enjoyed pleasent converstaion and james invited her to a concert he was attneding that night. teresa agreed anf both left happy. during their meal james had pancakes and coffee while teresa had an omlete,,,,,,,,,,,,,,021119_p1,001,2019_Feb_11_1420,body_behavioural,3.0.3,59.989808931262935,
5,,,,,,,,,,,,,,,,,,,,,0,5,5,5,,,,,,,,,,,,,,,,,,,,,,,space,0.4529008699996666,Maria and henry were attending their ancient philosophy course in which maria intended to break up with henry. the lecuture hall was large and the professor struggled to connect the projector. the lecture of the day was on aristotle. maria would be leaving for a semster abroad soon and although she didnt want to end things with henry she knew she could not do long distance. maria tells henry during the lecture and he is upsetsaying that he truly does not want to end things and will visit her. maria refuses and they sit through the rest of lecture both sad. the professor ends the class reminding everyone of their final nect tuesday or an alternative 20 oage writting assignment and the two rush out before the rest of the class leaves. they embrace and say goodbye. maria leaves to pack her things and henry watches ,,,,,,,,,,,,,,021119_p1,001,2019_Feb_11_1420,body_behavioural,3.0.3,59.989808931262935,
6,,,,,,,,,,,,,,,,,,,,,0,6,6,6,,,,,,,,,,,,,,,,,,,,,,,space,0.6193459799997072,Sven and isabel arrive at the airport in barcelona from a trip visitng isabels family. sven is so excited because he recived their blessing to marry isabel and he feels the ring in his pocket excitedly. as they approach security isabel realizes that she forgot her laptop in her bag and must dig through her bag making sven hold everything. she gets it out and removes her boots and goes through security. sven folllows but as he is xrayed the officer asks him to please step aside. in horror sven relaizes he left the ring in his pcoket and will have to reveal it so he sezies the moment and grabs isabels hand. he asks her to marry him and isabel is so overwhelmed by the public spectacle and for holding up the line that she runs shoeless with sven pursuing. she says yes and they run giddy to their gate. sven high fives a confused shoe shiner. they make great time to the gate and sit in first class where they are shown that the whole event was recorded and is now trending on twitter,,,,,,,,,,,,,,021119_p1,001,2019_Feb_11_1420,body_behavioural,3.0.3,59.989808931262935,
7,,,,,,,,,,,,,,,,,,,,,0,7,7,7,,,,,,,,,,,,,,,,,,,,,,,space,0.5526081180000801,Calvin and jessie prepare to fly back to the us from jamica. jessie is also prepared to break up with calvin because she cannot take his stories about golf any longer. they head to the security line and calvin comments on the poor design of the airport and how easily he could have snuck something through in his shoe. annoyed at his need to voice every thought in his head jessie tells him that they should go their seperate ways once they reach the states . calvin turns his back to jessu and walks away while jessie pursues screaming at him. they arrive just in time at the gate and thsankfully have booked seats not next to one another in first classs. calvin tells jessie he wishes she would have just told him sooner that she was so annoyed,,,,,,,,,,,,,,021119_p1,001,2019_Feb_11_1420,body_behavioural,3.0.3,59.989808931262935,
,,,,The next part of the task is to answer 8 questions about each story.,,,,,,,,,,,,,,,,,,,,,0,0,0,0,,,,,,,,,,,,,,,,,,,,,,space,1301.1765720850003,,,,,,,,,,,,021119_p1,001,2019_Feb_11_1420,body_behavioural,3.0.3,59.989808931262935,
,,,,Some of the questions are not related to the perspective you were asked to assume.,,,,,,,,,,,,,,,,,,,,,0,1,1,1,,,,,,,,,,,,,,,,,,,,,,space,1.1363802249998116,,,,,,,,,,,,021119_p1,001,2019_Feb_11_1420,body_behavioural,3.0.3,59.989808931262935,
,,,,"We realize that we did not tell you to think of these questions during the story, but do your best to answer them.",,,,,,,,,,,,,,,,,,,,,0,2,2,2,,,,,,,,,,,,,,,,,,,,,,space,0.2338357199996608,,,,,,,,,,,,021119_p1,001,2019_Feb_11_1420,body_behavioural,3.0.3,59.989808931262935,
,,,,"When you have finished typing your answer, hit ‘return’ to submit your answer and move onto the next question. ",,,,,,,,,,,,,,,,,,,,,0,3,3,3,,,,,,,,,,,,,,,,,,,,,,space,0.28651815000011993,,,,,,,,,,,,021119_p1,001,2019_Feb_11_1420,body_behavioural,3.0.3,59.989808931262935,
0,,,,,,,,,,,,,,,,,,,,,,,,,,,,,0,0,0,0,,,,,,,,,,,,,,,,,,,,space,0.15306790300019202,,primed first,,,,,,,,021119_p1,001,2019_Feb_11_1420,body_behavioural,3.0.3,59.989808931262935,
1,,,,,,,,,,,,,,,,,,,,,,,,,,,,,0,1,1,1,,,,,,,,,,,,,,,,,,,,space,0.36968155999966257, ,primed first,,,,,,,,021119_p1,001,2019_Feb_11_1420,body_behavioural,3.0.3,59.989808931262935,
2,,,,,,,,,,,,,,,,,,,,,,,,,,,,,0,2,2,2,,,,,,,,,,,,,,,,,,,,space,0.33644524499959516,,primed first,,,,,,,,021119_p1,001,2019_Feb_11_1420,body_behavioural,3.0.3,59.989808931262935,
3,,,,,,,,,,,,,,,,,,,,,,,,,,,,,0,3,3,3,,,,,,,,,,,,,,,,,,,,space,0.4028428699994038,,non-primed first,,,,,,,,021119_p1,001,2019_Feb_11_1420,body_behavioural,3.0.3,59.989808931262935,
4,,,,,,,,,,,,,,,,,,,,,,,,,,,,,0,4,4,4,,,,,,,,,,,,,,,,,,,,space,0.3864403580000726, ,primed first,,,,,,,,021119_p1,001,2019_Feb_11_1420,body_behavioural,3.0.3,59.989808931262935,
5,,,,,,,,,,,,,,,,,,,,,,,,,,,,,0,5,5,5,,,,,,,,,,,,,,,,,,,,space,0.4365826930006733,,non-primed first,,,,,,,,021119_p1,001,2019_Feb_11_1420,body_behavioural,3.0.3,59.989808931262935,
6,,,,,,,,,,,,,,,,,,,,,,,,,,,,,0,6,6,6,,,,,,,,,,,,,,,,,,,,space,0.5698509279991413,,non-primed first,,,,,,,,021119_p1,001,2019_Feb_11_1420,body_behavioural,3.0.3,59.989808931262935,
7,,,,,,,,,,,,,,,,,,,,,,,,,,,,,0,7,7,7,,,,,,,,,,,,,,,,,,,,space,0.35290457300015987,,primed first,,,,,,,,021119_p1,001,2019_Feb_11_1420,body_behavioural,3.0.3,59.989808931262935,
