5,"“Henry,” Maria whispered.",2,1,,0,5,5,5,,,,,0,8,8,8,,,,,,,,,,,,,,,,,,,,,,,,,,,9,4.319885738000039,,,,,,,,,,,,,,,,,,,021119_p1,001,2019_Feb_11_1420,body_behavioural,3.0.3,59.989808931262935,
5,"“Hmm?” he replied, distracted.",2,1,,0,5,5,5,,,,,0,9,9,9,,,,,,,,,,,,,,,,,,,,,,,,,,,1,1.969775213000048,,,,,,,,,,,,,,,,,,,021119_p1,001,2019_Feb_11_1420,body_behavioural,3.0.3,59.989808931262935,
5,"“Henry, I need to tell you something really important, and I don’t know when else I’ll have a chance to do it,” she said.",2,1,,0,5,5,5,,,,,0,10,10,10,,,,,,,,,,,,,,,,,,,,,,,,,,,1,4.386490883000079,,,,,,,,,,,,,,,,,,,021119_p1,001,2019_Feb_11_1420,body_behavioural,3.0.3,59.989808931262935,
5,"“Okay, what's up?”, he said, tilting his head close to her. ",2,1,,0,5,5,5,,,,,0,11,11,11,,,,,,,,,,,,,,,,,,,,,,,,,,,1,5.119994647000112,,,,,,,,,,,,,,,,,,,021119_p1,001,2019_Feb_11_1420,body_behavioural,3.0.3,59.989808931262935,
5," “Henry, I don’t think I can do long distance.",2,2,,0,5,5,5,,,,,0,12,12,12,,,,,,,,,,,,,,,,,,,,,,,,,,,1,2.5197852220001096,,,,,,,,,,,,,,,,,,,021119_p1,001,2019_Feb_11_1420,body_behavioural,3.0.3,59.989808931262935,
5,"I think what we have here is great, but I think it will be really hard when we are so far apart for such an extended period.",2,2,,0,5,5,5,,,,,0,13,13,13,,,,,,,,,,,,,,,,,,,,,,,,,,,1,5.534394934999909,,,,,,,,,,,,,,,,,,,021119_p1,001,2019_Feb_11_1420,body_behavioural,3.0.3,59.989808931262935,
5,"I’m sorry I’m telling you now in lecture, but I'm out of time, and it’s taken me awhile to come to this decision.",2,2,,0,5,5,5,,,,,0,14,14,14,,,,,,,,,,,,,,,,,,,,,,,,,,,1,4.870718440000019,,,,,,,,,,,,,,,,,,,021119_p1,001,2019_Feb_11_1420,body_behavioural,3.0.3,59.989808931262935,
5,"I really think this is best, and who knows what will happen when I get back from my study abroad.” ",2,2,,0,5,5,5,,,,,0,15,15,15,,,,,,,,,,,,,,,,,,,,,,,,,,,1,4.38624945499987,,,,,,,,,,,,,,,,,,,021119_p1,001,2019_Feb_11_1420,body_behavioural,3.0.3,59.989808931262935,
5,"While Henry tried to think of what to say, he and Maria stared unlistening at the professor as he started the lecture, “First we will talk about Aristotle’s work, The Categories, which is about the kinds, or categories, of things that there are.",3,2,,0,5,5,5,,,,,0,16,16,16,,,,,,,,,,,,,,,,,,,,,,,,,,,9,13.404009201999997,,,,,,,,,,,,,,,,,,,021119_p1,001,2019_Feb_11_1420,body_behavioural,3.0.3,59.989808931262935,
5,"In fact, our term category comes from this Aristotelian context.” ",3,2,,0,5,5,5,,,,,0,17,17,17,,,,,,,,,,,,,,,,,,,,,,,,,,,1,3.536466193000024,,,,,,,,,,,,,,,,,,,021119_p1,001,2019_Feb_11_1420,body_behavioural,3.0.3,59.989808931262935,
5,"Henry felt horrible, like the wind had just been knocked out of him.",3,2,,0,5,5,5,,,,,0,18,18,18,,,,,,,,,,,,,,,,,,,,,,,,,,,9,3.119785370000045,,,,,,,,,,,,,,,,,,,021119_p1,001,2019_Feb_11_1420,body_behavioural,3.0.3,59.989808931262935,
5,"A few tears started to fall down his cheeks as he whispered back, “Maria, I think we can make it work.",3,3,,0,5,5,5,,,,,0,19,19,19,,,,,,,,,,,,,,,,,,,,,,,,,,,1,7.469813907999878,,,,,,,,,,,,,,,,,,,021119_p1,001,2019_Feb_11_1420,body_behavioural,3.0.3,59.989808931262935,
5,I’ll come visit you.,3,3,,0,5,5,5,,,,,0,20,20,20,,,,,,,,,,,,,,,,,,,,,,,,,,,1,0.9197297499999877,,,,,,,,,,,,,,,,,,,021119_p1,001,2019_Feb_11_1420,body_behavioural,3.0.3,59.989808931262935,
5,It will be fine.,3,3,,0,5,5,5,,,,,0,21,21,21,,,,,,,,,,,,,,,,,,,,,,,,,,,1,0.6359268830001383,,,,,,,,,,,,,,,,,,,021119_p1,001,2019_Feb_11_1420,body_behavioural,3.0.3,59.989808931262935,
5,I don’t want to break up.”,3,3,,0,5,5,5,,,,,0,22,22,22,,,,,,,,,,,,,,,,,,,,,,,,,,,1,0.6360461429999305,,,,,,,,,,,,,,,,,,,021119_p1,001,2019_Feb_11_1420,body_behavioural,3.0.3,59.989808931262935,
5,"Maria felt so guilty that she nearly gave in, but forced herself to hold her ground, knowing that this would make things much easier for both of them in the future.",3,3,,0,5,5,5,,,,,0,23,23,23,,,,,,,,,,,,,,,,,,,,,,,,,,,1,6.486404067999956,,,,,,,,,,,,,,,,,,,021119_p1,001,2019_Feb_11_1420,body_behavioural,3.0.3,59.989808931262935,
5,"She gave his hand a squeeze but shook her head sadly, before turning back to her laptop and half-heartedly taking notes on the lecture which they sat through in painful silence.",3,3,,0,5,5,5,,,,,0,24,24,24,,,,,,,,,,,,,,,,,,,,,,,,,,,1,6.253285770000048,,,,,,,,,,,,,,,,,,,021119_p1,001,2019_Feb_11_1420,body_behavioural,3.0.3,59.989808931262935,
5,"Finally, the professor was wrapping up, “This is what Aristotle means when he says that an animal’s or plant’s form rather than its matter is its nature. ",4,3,,0,5,5,5,,,,,0,25,25,25,,,,,,,,,,,,,,,,,,,,,,,,,,,9,12.07050538999988,,,,,,,,,,,,,,,,,,,021119_p1,001,2019_Feb_11_1420,body_behavioural,3.0.3,59.989808931262935,
5,"Alright class, that’s all for today. ",4,3,,0,5,5,5,,,,,0,26,26,26,,,,,,,,,,,,,,,,,,,,,,,,,,,1,1.219649089999848,,,,,,,,,,,,,,,,,,,021119_p1,001,2019_Feb_11_1420,body_behavioural,3.0.3,59.989808931262935,
5,"Remember the final exam is coming up next week on Tuesday on the Pre-Socratics, Plato, and Aristotle, so feel free to come by office hours to discuss if you have the inspiration.",4,3,,0,5,5,5,,,,,0,27,27,27,,,,,,,,,,,,,,,,,,,,,,,,,,,1,6.534542917999943,,,,,,,,,,,,,,,,,,,021119_p1,001,2019_Feb_11_1420,body_behavioural,3.0.3,59.989808931262935,
5,"And if anyone is doing the 20 page paper in lieu of the final, that’s due next Tuesday as well.",4,3,,0,5,5,5,,,,,0,28,28,28,,,,,,,,,,,,,,,,,,,,,,,,,,,1,5.0508633229999305,,,,,,,,,,,,,,,,,,,021119_p1,001,2019_Feb_11_1420,body_behavioural,3.0.3,59.989808931262935,
5,"Have a good day, folks.” ",4,3,,0,5,5,5,,,,,0,29,29,29,,,,,,,,,,,,,,,,,,,,,,,,,,,1,2.836456519999956,,,,,,,,,,,,,,,,,,,021119_p1,001,2019_Feb_11_1420,body_behavioural,3.0.3,59.989808931262935,
5,"Maria and Henry packed up hurriedly, and slipped quickly out of the class before the rest of the crowd. ",4,3,,0,5,5,5,,,,,0,30,30,30,,,,,,,,,,,,,,,,,,,,,,,,,,,9,3.669845384999917,,,,,,,,,,,,,,,,,,,021119_p1,001,2019_Feb_11_1420,body_behavioural,3.0.3,59.989808931262935,
5,"They hugged outside, and both of them were crying. ",4,4,,0,5,5,5,,,,,0,31,31,31,,,,,,,,,,,,,,,,,,,,,,,,,,,1,1.8363631950001036,,,,,,,,,,,,,,,,,,,021119_p1,001,2019_Feb_11_1420,body_behavioural,3.0.3,59.989808931262935,
5,"“Maria, I don’t want you to leave.",4,4,,0,5,5,5,,,,,0,32,32,32,,,,,,,,,,,,,,,,,,,,,,,,,,,1,1.2363264049999998,,,,,,,,,,,,,,,,,,,021119_p1,001,2019_Feb_11_1420,body_behavioural,3.0.3,59.989808931262935,
5,I don’t want this to end. ,4,4,,0,5,5,5,,,,,0,33,33,33,,,,,,,,,,,,,,,,,,,,,,,,,,,1,1.8031589529998655,,,,,,,,,,,,,,,,,,,021119_p1,001,2019_Feb_11_1420,body_behavioural,3.0.3,59.989808931262935,
5,"But if this is what you think is best, I can’t make it otherwise.” ",4,4,,0,5,5,5,,,,,0,34,34,34,,,,,,,,,,,,,,,,,,,,,,,,,,,1,3.7031007149998914,,,,,,,,,,,,,,,,,,,021119_p1,001,2019_Feb_11_1420,body_behavioural,3.0.3,59.989808931262935,
5,"They hugged one last time, and Maria ran off to get her things from her dorm.",4,4,,0,5,5,5,,,,,0,35,35,35,,,,,,,,,,,,,,,,,,,,,,,,,,,1,3.067541970000093,,,,,,,,,,,,,,,,,,,021119_p1,001,2019_Feb_11_1420,body_behavioural,3.0.3,59.989808931262935,
5,Henry sadly watched her go. ,4,4,,0,5,5,5,,,,,0,36,36,36,,,,,,,,,,,,,,,,,,,,,,,,,,,1,1.3198037330000716,,,,,,,,,,,,,,,,,,,021119_p1,001,2019_Feb_11_1420,body_behavioural,3.0.3,59.989808931262935,
5,,,,,0,5,5,5,,,,,,,,,,,,,,,,,,,,,,,,,,,,,,,,,,,,,,,,,,,,,,,,,,,,,,,021119_p1,001,2019_Feb_11_1420,body_behavioural,3.0.3,59.989808931262935,
6,,,,,0,6,6,6,0,0,0,0,,,,,,,,,,,,,,,,,,,,,,,,,space,0.7864155130000654,space,0.7695521749999443,space,1.2007247830001688,,,,,,,,,,,,,,,,,,,,,021119_p1,001,2019_Feb_11_1420,body_behavioural,3.0.3,59.989808931262935,
6,"Sven and Isabel walked hurriedly from the cab into the Barcelona Airport after an incredible weekend with Isabel’s family, which had wiped away any doubts Sven had had about his decision to propose. ",1,1,,0,6,6,6,,,,,0,0,0,0,,,,,,,,,,,,,,,,,,,,,,,,,,,9,12.070644509999966,,,,,,,,,,,,,,,,,,,021119_p1,001,2019_Feb_11_1420,body_behavioural,3.0.3,59.989808931262935,
6,"They were a little pressed for time, with only a little over an hour until their flight would take off to go back to the US, but they already had their online boarding passes and no checked luggage. ",1,1,,0,6,6,6,,,,,0,1,1,1,,,,,,,,,,,,,,,,,,,,,,,,,,,9,13.920595025000011,,,,,,,,,,,,,,,,,,,021119_p1,001,2019_Feb_11_1420,body_behavioural,3.0.3,59.989808931262935,
6,"When Isabel stopped to rummage through her purse looking for her phone, Sven turned his back to her and took the velvet box out of his backpack, opening it to look at the ring he bought her.",1,2,,0,6,6,6,,,,,0,2,2,2,,,,,,,,,,,,,,,,,,,,,,,,,,,1,6.653398118000041,,,,,,,,,,,,,,,,,,,021119_p1,001,2019_Feb_11_1420,body_behavioural,3.0.3,59.989808931262935,
6,"He had received her parents’ blessing during the trip, and he was almost giddy with excitement. ",1,2,,0,6,6,6,,,,,0,3,3,3,,,,,,,,,,,,,,,,,,,,,,,,,,,1,8.220142340000166,,,,,,,,,,,,,,,,,,,021119_p1,001,2019_Feb_11_1420,body_behavioural,3.0.3,59.989808931262935,
6,"He tilted the ring backward and forward, despite having already studied it daily since he had purchased it a few weeks ago. ",1,2,,0,6,6,6,,,,,0,4,4,4,,,,,,,,,,,,,,,,,,,,,,,,,,,1,4.119525559999829,,,,,,,,,,,,,,,,,,,021119_p1,001,2019_Feb_11_1420,body_behavioural,3.0.3,59.989808931262935,
6,"It was a simple design, with a clear, white diamond on a thin silver band.",1,2,,0,6,6,6,,,,,0,5,5,5,,,,,,,,,,,,,,,,,,,,,,,,,,,1,4.169981589999907,,,,,,,,,,,,,,,,,,,021119_p1,001,2019_Feb_11_1420,body_behavioural,3.0.3,59.989808931262935,
6,"“Sven, let’s go! ” Isabel said. ",1,2,,0,6,6,6,,,,,0,6,6,6,,,,,,,,,,,,,,,,,,,,,,,,,,,9,1.4197260680000454,,,,,,,,,,,,,,,,,,,021119_p1,001,2019_Feb_11_1420,body_behavioural,3.0.3,59.989808931262935,
6,Sven discretely closed the box and put it in his pocket.,1,2,,0,6,6,6,,,,,0,7,7,7,,,,,,,,,,,,,,,,,,,,,,,,,,,9,4.68428605500003,,,,,,,,,,,,,,,,,,,021119_p1,001,2019_Feb_11_1420,body_behavioural,3.0.3,59.989808931262935,
6," They entered the security line, weaving through the roped walkways to the front. ",2,2,,0,6,6,6,,,,,0,8,8,8,,,,,,,,,,,,,,,,,,,,,,,,,,,1,7.903463959999954,,,,,,,,,,,,,,,,,,,021119_p1,001,2019_Feb_11_1420,body_behavioural,3.0.3,59.989808931262935,
6,"When they were up, Isabel realized her laptop was buried somewhere in her duffle bag. ",2,2,,0,6,6,6,,,,,0,9,9,9,,,,,,,,,,,,,,,,,,,,,,,,,,,1,4.33625452299998,,,,,,,,,,,,,,,,,,,021119_p1,001,2019_Feb_11_1420,body_behavioural,3.0.3,59.989808931262935,
6,Sven had to hold the growing mound of objects she pulled from her bag until she unearthed the laptop.,2,2,,0,6,6,6,,,,,0,10,10,10,,,,,,,,,,,,,,,,,,,,,,,,,,,1,9.36788093500013,,,,,,,,,,,,,,,,,,,021119_p1,001,2019_Feb_11_1420,body_behavioural,3.0.3,59.989808931262935,
6,She set it into a bin and then had to unstrap her leather boots and put everything else into the bins.,2,2,,0,6,6,6,,,,,0,11,11,11,,,,,,,,,,,,,,,,,,,,,,,,,,,1,5.67009529500001,,,,,,,,,,,,,,,,,,,021119_p1,001,2019_Feb_11_1420,body_behavioural,3.0.3,59.989808931262935,
6,"Finally, she relieved Sven of his holding duties, and he hurriedly deposited his own backpack on the belt as the people behind them glared without shame. ",2,2,,0,6,6,6,,,,,0,12,12,12,,,,,,,,,,,,,,,,,,,,,,,,,,,1,3.934227247999843,,,,,,,,,,,,,,,,,,,021119_p1,001,2019_Feb_11_1420,body_behavioural,3.0.3,59.989808931262935,
6,"Sven went into the millimeter wave scanner after Isabel, put his hands up, and the metal bars whirled around him.",2,2,,0,6,6,6,,,,,0,13,13,13,,,,,,,,,,,,,,,,,,,,,,,,,,,1,5.2200637930000084,,,,,,,,,,,,,,,,,,,021119_p1,001,2019_Feb_11_1420,body_behavioural,3.0.3,59.989808931262935,
6,"“Sir, please step to the side.",2,2,,0,6,6,6,,,,,0,14,14,14,,,,,,,,,,,,,,,,,,,,,,,,,,,1,1.0527298550000523,,,,,,,,,,,,,,,,,,,021119_p1,001,2019_Feb_11_1420,body_behavioural,3.0.3,59.989808931262935,
6,"You need to empty your pockets,” the security guard said.",2,2,,0,6,6,6,,,,,0,15,15,15,,,,,,,,,,,,,,,,,,,,,,,,,,,1,2.586541377000003,,,,,,,,,,,,,,,,,,,021119_p1,001,2019_Feb_11_1420,body_behavioural,3.0.3,59.989808931262935,
6,"With a sinking feeling Sven realized the mistake he had made forgetting to put the ring back in his bag, as Isabel and the guard both looked at him expectantly.",2,2,,0,6,6,6,,,,,0,16,16,16,,,,,,,,,,,,,,,,,,,,,,,,,,,1,5.3676938480000445,,,,,,,,,,,,,,,,,,,021119_p1,001,2019_Feb_11_1420,body_behavioural,3.0.3,59.989808931262935,
6,"Sven,  deciding he would make the best of the situation, grabbed Isabel's hand as he reached into his pocket.",2,2,,0,6,6,6,,,,,0,17,17,17,,,,,,,,,,,,,,,,,,,,,,,,,,,1,6.253362724999988,,,,,,,,,,,,,,,,,,,021119_p1,001,2019_Feb_11_1420,body_behavioural,3.0.3,59.989808931262935,
6,"He got down on one knee and, giggling slightly at her confused look, said, “Isabel, this isn't quite how I'd planned this, but - will you marry me?”",2,3,,0,6,6,6,,,,,0,18,18,18,,,,,,,,,,,,,,,,,,,,,,,,,,,1,5.069989764999946,,,,,,,,,,,,,,,,,,,021119_p1,001,2019_Feb_11_1420,body_behavioural,3.0.3,59.989808931262935,
6,The security guard gasped.,2,3,,0,6,6,6,,,,,0,19,19,19,,,,,,,,,,,,,,,,,,,,,,,,,,,1,2.4694448750001357,,,,,,,,,,,,,,,,,,,021119_p1,001,2019_Feb_11_1420,body_behavioural,3.0.3,59.989808931262935,
6,All the people who were putting their shoes back on and gathering their belongings stopped what they were doing and walked closer to the couple.,2,3,,0,6,6,6,,,,,0,20,20,20,,,,,,,,,,,,,,,,,,,,,,,,,,,1,4.084243564999952,,,,,,,,,,,,,,,,,,,021119_p1,001,2019_Feb_11_1420,body_behavioural,3.0.3,59.989808931262935,
6,"Isabel was astonished, and far too shy to respond in front of the backup of passengers waiting behind them.",2,3,,0,6,6,6,,,,,0,21,21,21,,,,,,,,,,,,,,,,,,,,,,,,,,,1,3.4862084649998906,,,,,,,,,,,,,,,,,,,021119_p1,001,2019_Feb_11_1420,body_behavioural,3.0.3,59.989808931262935,
6,"She attempted to stammer a response as she frantically grabbed her and Sven’s shoes, leaving Sven to retrieve their bags.",2,3,,0,6,6,6,,,,,0,22,22,22,,,,,,,,,,,,,,,,,,,,,,,,,,,1,6.367747007999924,,,,,,,,,,,,,,,,,,,021119_p1,001,2019_Feb_11_1420,body_behavioural,3.0.3,59.989808931262935,
6,"Both of them slipping in their socked feet, she fled onto the concourse with Sven trying to catch up behind her.",3,3,,0,6,6,6,,,,,0,23,23,23,,,,,,,,,,,,,,,,,,,,,,,,,,,9,14.220414090000077,,,,,,,,,,,,,,,,,,,021119_p1,001,2019_Feb_11_1420,body_behavioural,3.0.3,59.989808931262935,
6,"Everyone in the terminal was looking at them with confusion as Sven, holding the bags in one hand and the open ring box in the other, finally caught up to her.",3,3,,0,6,6,6,,,,,0,24,24,24,,,,,,,,,,,,,,,,,,,,,,,,,,,1,4.469971205000093,,,,,,,,,,,,,,,,,,,021119_p1,001,2019_Feb_11_1420,body_behavioural,3.0.3,59.989808931262935,
6,“Isabel?”,3,3,,0,6,6,6,,,,,0,25,25,25,,,,,,,,,,,,,,,,,,,,,,,,,,,1,1.0863304950000838,,,,,,,,,,,,,,,,,,,021119_p1,001,2019_Feb_11_1420,body_behavioural,3.0.3,59.989808931262935,
6,"He watched her face as she turned, trying to read her expression.",3,3,,0,6,6,6,,,,,0,26,26,26,,,,,,,,,,,,,,,,,,,,,,,,,,,1,3.0202747949999775,,,,,,,,,,,,,,,,,,,021119_p1,001,2019_Feb_11_1420,body_behavioural,3.0.3,59.989808931262935,
6,"Her eyes were wide, but she was smiling as she hyperventilated, “Of course yes, Sven, yes!” ",3,4,,0,6,6,6,,,,,0,27,27,27,,,,,,,,,,,,,,,,,,,,,,,,,,,1,2.7698289700001624,,,,,,,,,,,,,,,,,,,021119_p1,001,2019_Feb_11_1420,body_behavioural,3.0.3,59.989808931262935,
6,"They dropped their belongings and hugged, and Sven slipped the ring onto Isabel’s finger. ",3,4,,0,6,6,6,,,,,0,28,28,28,,,,,,,,,,,,,,,,,,,,,,,,,,,1,2.4197696630001246,,,,,,,,,,,,,,,,,,,021119_p1,001,2019_Feb_11_1420,body_behavioural,3.0.3,59.989808931262935,
6,"After getting their shoes back on, they practically skipped to the gate, filled with joy.",3,4,,0,6,6,6,,,,,0,29,29,29,,,,,,,,,,,,,,,,,,,,,,,,,,,9,2.953191383000103,,,,,,,,,,,,,,,,,,,021119_p1,001,2019_Feb_11_1420,body_behavioural,3.0.3,59.989808931262935,
6,Sven high-fived a confused shoe-shine attendant as they passed.,3,4,,0,6,6,6,,,,,0,30,30,30,,,,,,,,,,,,,,,,,,,,,,,,,,,1,2.353242942999941,,,,,,,,,,,,,,,,,,,021119_p1,001,2019_Feb_11_1420,body_behavioural,3.0.3,59.989808931262935,
6,"They sat down outside their gate, having actually made good time, until the attendant called for passengers.",3,4,,0,6,6,6,,,,,0,31,31,31,,,,,,,,,,,,,,,,,,,,,,,,,,,9,3.0698683330001586,,,,,,,,,,,,,,,,,,,021119_p1,001,2019_Feb_11_1420,body_behavioural,3.0.3,59.989808931262935,
6,"They boarded, sitting together in first class, and had a glass of champagne to celebrate the departure into their new life together.",4,4,,0,6,6,6,,,,,0,32,32,32,,,,,,,,,,,,,,,,,,,,,,,,,,,1,5.03665854299993,,,,,,,,,,,,,,,,,,,021119_p1,001,2019_Feb_11_1420,body_behavioural,3.0.3,59.989808931262935,
6,"Some of their neighboring passengers who had witnessed the proposal congratulated them, and a woman next to them showed them that she had been live-tweeting the whole event and that it was already going viral online.",4,4,,0,6,6,6,,,,,0,33,33,33,,,,,,,,,,,,,,,,,,,,,,,,,,,9,7.784480699999904,,,,,,,,,,,,,,,,,,,021119_p1,001,2019_Feb_11_1420,body_behavioural,3.0.3,59.989808931262935,
6,"Isabel slid down in her seat with her hands over her face, both embarrassed and overjoyed at the same time.
",4,4,,0,6,6,6,,,,,0,34,34,34,,,,,,,,,,,,,,,,,,,,,,,,,,,1,5.63654812499999,,,,,,,,,,,,,,,,,,,021119_p1,001,2019_Feb_11_1420,body_behavioural,3.0.3,59.989808931262935,
6,,,,,0,6,6,6,,,,,,,,,,,,,,,,,,,,,,,,,,,,,,,,,,,,,,,,,,,,,,,,,,,,,,,021119_p1,001,2019_Feb_11_1420,body_behavioural,3.0.3,59.989808931262935,
7,,,,,0,7,7,7,0,0,0,0,,,,,,,,,,,,,,,,,,,,,,,,,space,0.7695822819998739,space,0.4695766500001355,space,1.5697067400001288,,,,,,,,,,,,,,,,,,,,,021119_p1,001,2019_Feb_11_1420,body_behavioural,3.0.3,59.989808931262935,
7,"It didn’t help the situation that Calvin and Jessie were running late to the airport, since Jessie had already been fuming at Calvin and preparing to end things with him.",1,1,,0,7,7,7,,,,,0,0,0,0,,,,,,,,,,,,,,,,,,,,,,,,,,,9,9.720484299999953,,,,,,,,,,,,,,,,,,,021119_p1,001,2019_Feb_11_1420,body_behavioural,3.0.3,59.989808931262935,
7,"Upon arriving, they had only 45 minutes until their international flight would depart from Jamaica for the US.",1,1,,0,7,7,7,,,,,0,1,1,1,,,,,,,,,,,,,,,,,,,,,,,,,,,1,11.553698237999924,,,,,,,,,,,,,,,,,,,021119_p1,001,2019_Feb_11_1420,body_behavioural,3.0.3,59.989808931262935,
7,It had been a tough vacation for them.,1,1,,0,7,7,7,,,,,0,2,2,2,,,,,,,,,,,,,,,,,,,,,,,,,,,1,1.5030916180000986,,,,,,,,,,,,,,,,,,,021119_p1,001,2019_Feb_11_1420,body_behavioural,3.0.3,59.989808931262935,
7,"Jessie had really had it with Calvin’s constant ramblings about the same excruciatingly boring golfing and work stories, which he insisted on repeating to her regardless of how little interest she showed.",1,1,,0,7,7,7,,,,,0,3,3,3,,,,,,,,,,,,,,,,,,,,,,,,,,,1,7.50312556300014,,,,,,,,,,,,,,,,,,,021119_p1,001,2019_Feb_11_1420,body_behavioural,3.0.3,59.989808931262935,
7,"Calvin knew that Jessie was upset, but wasn't sure what to do besides attempting to carry on as normal and tell stories that took up the silence. ",1,1,,0,7,7,7,,,,,0,4,4,4,,,,,,,,,,,,,,,,,,,,,,,,,,,1,3.553264752999894,,,,,,,,,,,,,,,,,,,021119_p1,001,2019_Feb_11_1420,body_behavioural,3.0.3,59.989808931262935,
7,"The security line was luckily very short, and once the online boarding passes were scanned they were ushered quickly through the metal detector, not having to take off their shoes or remove the liquids from their bags.",2,1,,0,7,7,7,,,,,0,5,5,5,,,,,,,,,,,,,,,,,,,,,,,,,,,9,6.0367094369998995,,,,,,,,,,,,,,,,,,,021119_p1,001,2019_Feb_11_1420,body_behavioural,3.0.3,59.989808931262935,
7,"“The infrastructure of this airport is really quite poor," said Calvin as they waited for their bags to emerge from the x-ray machine.",2,1,,0,7,7,7,,,,,0,6,6,6,,,,,,,,,,,,,,,,,,,,,,,,,,,1,7.753521723000176,,,,,,,,,,,,,,,,,,,021119_p1,001,2019_Feb_11_1420,body_behavioural,3.0.3,59.989808931262935,
7,“I really could've hidden something in my shoes quite easily.” ,2,1,,0,7,7,7,,,,,0,7,7,7,,,,,,,,,,,,,,,,,,,,,,,,,,,1,4.58433438499992,,,,,,,,,,,,,,,,,,,021119_p1,001,2019_Feb_11_1420,body_behavioural,3.0.3,59.989808931262935,
7,"Jessie, exasperated at his need to broadcast his every inner thought, scowled at the conveyor belt.",2,1,,0,7,7,7,,,,,0,8,8,8,,,,,,,,,,,,,,,,,,,,,,,,,,,1,3.686570472000085,,,,,,,,,,,,,,,,,,,021119_p1,001,2019_Feb_11_1420,body_behavioural,3.0.3,59.989808931262935,
7,"“What?”, he asked.",2,1,,0,7,7,7,,,,,0,9,9,9,,,,,,,,,,,,,,,,,,,,,,,,,,,1,0.8363448929999322,,,,,,,,,,,,,,,,,,,021119_p1,001,2019_Feb_11_1420,body_behavioural,3.0.3,59.989808931262935,
7,She balled up her fists and turned to face him.,2,1,,0,7,7,7,,,,,0,10,10,10,,,,,,,,,,,,,,,,,,,,,,,,,,,1,1.5530403049999677,,,,,,,,,,,,,,,,,,,021119_p1,001,2019_Feb_11_1420,body_behavioural,3.0.3,59.989808931262935,
7,"“Calvin, I really don’t think I can do this anymore.",2,2,,0,7,7,7,,,,,0,11,11,11,,,,,,,,,,,,,,,,,,,,,,,,,,,1,3.986364298000126,,,,,,,,,,,,,,,,,,,021119_p1,001,2019_Feb_11_1420,body_behavioural,3.0.3,59.989808931262935,
7,I think it’s best that once we get to the States we part ways for good.” ,2,2,,0,7,7,7,,,,,0,12,12,12,,,,,,,,,,,,,,,,,,,,,,,,,,,1,3.4864667869999266,,,,,,,,,,,,,,,,,,,021119_p1,001,2019_Feb_11_1420,body_behavioural,3.0.3,59.989808931262935,
7,Calvin said nothing as he grabbed his bag and quickly walked away.,2,2,,0,7,7,7,,,,,0,13,13,13,,,,,,,,,,,,,,,,,,,,,,,,,,,1,3.6032793280000988,,,,,,,,,,,,,,,,,,,021119_p1,001,2019_Feb_11_1420,body_behavioural,3.0.3,59.989808931262935,
7,"Jessie trailed behind him as they made their way quickly toward their gate, shouting at his back in hopes of getting a response.",3,2,,0,7,7,7,,,,,0,14,14,14,,,,,,,,,,,,,,,,,,,,,,,,,,,1,5.8362098529999,,,,,,,,,,,,,,,,,,,021119_p1,001,2019_Feb_11_1420,body_behavioural,3.0.3,59.989808931262935,
7,“So now you have nothing to say?,3,2,,0,7,7,7,,,,,0,15,15,15,,,,,,,,,,,,,,,,,,,,,,,,,,,1,1.9030975299999682,,,,,,,,,,,,,,,,,,,021119_p1,001,2019_Feb_11_1420,body_behavioural,3.0.3,59.989808931262935,
7,"Every time we talk, you are just looking for a way to steer the conversation back into your stories.”",3,2,,0,7,7,7,,,,,0,16,16,16,,,,,,,,,,,,,,,,,,,,,,,,,,,1,4.30364428300004,,,,,,,,,,,,,,,,,,,021119_p1,001,2019_Feb_11_1420,body_behavioural,3.0.3,59.989808931262935,
7,"Calvin didn't slow his pace, gritting his teeth and staring straight ahead. ",3,2,,0,7,7,7,,,,,0,17,17,17,,,,,,,,,,,,,,,,,,,,,,,,,,,1,3.9700161030000345,,,,,,,,,,,,,,,,,,,021119_p1,001,2019_Feb_11_1420,body_behavioural,3.0.3,59.989808931262935,
7,He was very frustrated that he had been trying to appease Jessie this whole time and this was how she responded. ,3,2,,0,7,7,7,,,,,0,18,18,18,,,,,,,,,,,,,,,,,,,,,,,,,,,9,5.370046969999976,,,,,,,,,,,,,,,,,,,021119_p1,001,2019_Feb_11_1420,body_behavioural,3.0.3,59.989808931262935,
7,The silence was punctuated only by the rapid rhythmic clacking of their suitcase wheels over the tile floor as they continued power-walking through the terminal. ,3,2,,0,7,7,7,,,,,0,19,19,19,,,,,,,,,,,,,,,,,,,,,,,,,,,1,5.469968914999981,,,,,,,,,,,,,,,,,,,021119_p1,001,2019_Feb_11_1420,body_behavioural,3.0.3,59.989808931262935,
7,"“Well?” Jessie said, and Calvin finally turned to her.",3,2,,0,7,7,7,,,,,0,20,20,20,,,,,,,,,,,,,,,,,,,,,,,,,,,1,2.3864528520000476,,,,,,,,,,,,,,,,,,,021119_p1,001,2019_Feb_11_1420,body_behavioural,3.0.3,59.989808931262935,
7,"“Well, Jessie, this makes perfect sense. ",3,3,,0,7,7,7,,,,,0,21,21,21,,,,,,,,,,,,,,,,,,,,,,,,,,,1,1.6698032880001392,,,,,,,,,,,,,,,,,,,021119_p1,001,2019_Feb_11_1420,body_behavioural,3.0.3,59.989808931262935,
7,"If you feel this way, then I don’t want to keep boring you, and I agree, let’s part ways once we make it back.",3,3,,0,7,7,7,,,,,0,22,22,22,,,,,,,,,,,,,,,,,,,,,,,,,,,1,5.803240955000092,,,,,,,,,,,,,,,,,,,021119_p1,001,2019_Feb_11_1420,body_behavioural,3.0.3,59.989808931262935,
7,You should’ve spoken up about my apparent intolerability before you decided to plan this vacation.”,3,3,,0,7,7,7,,,,,0,23,23,23,,,,,,,,,,,,,,,,,,,,,,,,,,,1,3.4694782679998752,,,,,,,,,,,,,,,,,,,021119_p1,001,2019_Feb_11_1420,body_behavioural,3.0.3,59.989808931262935,
7,"He was clearly hurt, but thought it was pointless to argue. ",3,3,,0,7,7,7,,,,,0,24,24,24,,,,,,,,,,,,,,,,,,,,,,,,,,,9,3.1532722699998885,,,,,,,,,,,,,,,,,,,021119_p1,001,2019_Feb_11_1420,body_behavioural,3.0.3,59.989808931262935,
7,"They finally made it to the gate, just as they heard the final call for passengers boarding their flight.",3,3,,0,7,7,7,,,,,0,25,25,25,,,,,,,,,,,,,,,,,,,,,,,,,,,1,3.7194282250000015,,,,,,,,,,,,,,,,,,,021119_p1,001,2019_Feb_11_1420,body_behavioural,3.0.3,59.989808931262935,
7,"They scanned their tickets, and the annoyed flight attendant shooed them onto the jet bridge and then closed the door behind them.",4,3,,0,7,7,7,,,,,0,26,26,26,,,,,,,,,,,,,,,,,,,,,,,,,,,1,4.103196879999814,,,,,,,,,,,,,,,,,,,021119_p1,001,2019_Feb_11_1420,body_behavioural,3.0.3,59.989808931262935,
7,"Luckily, they had forgotten to arrange seats next to each other on the flight back.",4,3,,0,7,7,7,,,,,0,27,27,27,,,,,,,,,,,,,,,,,,,,,,,,,,,1,3.3697385299999496,,,,,,,,,,,,,,,,,,,021119_p1,001,2019_Feb_11_1420,body_behavioural,3.0.3,59.989808931262935,
7,"They both had first-class tickets, but Jessie was headed for seat 1B while Calvin's seat was 4F. ",4,3,,0,7,7,7,,,,,0,28,28,28,,,,,,,,,,,,,,,,,,,,,,,,,,,1,11.27049042800013,,,,,,,,,,,,,,,,,,,021119_p1,001,2019_Feb_11_1420,body_behavioural,3.0.3,59.989808931262935,
7,"Before Jessie sat down, she took a deep breath and then awkwardly shook Calvin’s hand, mumbling, “Well, have a nice flight.” ",4,4,,0,7,7,7,,,,,0,29,29,29,,,,,,,,,,,,,,,,,,,,,,,,,,,1,7.853152635000015,,,,,,,,,,,,,,,,,,,021119_p1,001,2019_Feb_11_1420,body_behavioural,3.0.3,59.989808931262935,
