count,storyText,locationEvent,socialEvent,instructText,trials.thisRepN,trials.thisTrialN,trials.thisN,trials.thisIndex,trials_7.thisRepN,trials_7.thisTrialN,trials_7.thisN,trials_7.thisIndex,trials_2.thisRepN,trials_2.thisTrialN,trials_2.thisN,trials_2.thisIndex,trials_3.thisRepN,trials_3.thisTrialN,trials_3.thisN,trials_3.thisIndex,trials_4.thisRepN,trials_4.thisTrialN,trials_4.thisN,trials_4.thisIndex,trials_5.thisRepN,trials_5.thisTrialN,trials_5.thisN,trials_5.thisIndex,trials_6.thisRepN,trials_6.thisTrialN,trials_6.thisN,trials_6.thisIndex,order of stories,order of perspectives,participant 2 order - stories,participant 2 order  - schemas types,key_resp_8.keys,key_resp_8.rt,key_resp_5.keys,key_resp_5.rt,key_resp_7.keys,key_resp_7.rt,story_presses.keys,story_presses.rt,key_resp_2.keys,key_resp_2.rt,key_resp_10.keys,key_resp_10.rt,recall,key_resp_3.keys,key_resp_3.rt,key_resp_11.keys,key_resp_11.rt,question1_answer,order of question,question2_answer,question3_answer,question4_answer,question5_answer,question6_answer,question7_answer,question8_answer,participant,session,date,expName,psychopyVersion,frameRate,
0,,,,,0,0,0,0,0,0,0,0,,,,,,,,,,,,,,,,,,,,,[24 43 31 33 41 14 22 12 44 34 42 21 11 23 32 13],"['Location' 'Location' 'Location' 'Social' 'Social' 'Social' 'Social'
 'Location' 'Social' 'Location' 'Location' 'Location' 'Social' 'Social'
 'Social' 'Location']",[44 34 42 21 11 23 32 13],"['Social' 'Location' 'Location' 'Location' 'Social' 'Social' 'Social'
 'Location']",space,17.376653505000007,space,9.30345503000001,space,3.3541466270000058,,,,,,,,,,,,,,,,,,,,,021119_p1,001,2019_Feb_11_1420,body_behavioural,3.0.3,59.989808931262935,
0,"Lana walked into lecture holding hands with her boyfriend, Aaron, who was trying to contain his excitement and anticipation for proposing to Lana in this class. ",1,1,,0,0,0,0,,,,,0,0,0,0,,,,,,,,,,,,,,,,,,,,,,,,,,,9,44.43909899900001,,,,,,,,,,,,,,,,,,,021119_p1,001,2019_Feb_11_1420,body_behavioural,3.0.3,59.989808931262935,
0,"Lana was lost in thought, still puzzling over a calculus problem on her problem set due that night.",1,1,,0,0,0,0,,,,,0,1,1,1,,,,,,,,,,,,,,,,,,,,,,,,,,,9,6.486229281999982,,,,,,,,,,,,,,,,,,,021119_p1,001,2019_Feb_11_1420,body_behavioural,3.0.3,59.989808931262935,
0,"The lecture hall was the fanciest one at Princeton, with chandeliers, high ceilings, wood floors and double-decker chalkboards.",1,1,,0,0,0,0,,,,,0,2,2,2,,,,,,,,,,,,,,,,,,,,,,,,,,,1,15.836802026000015,,,,,,,,,,,,,,,,,,,021119_p1,001,2019_Feb_11_1420,body_behavioural,3.0.3,59.989808931262935,
0,"This is where Aaron and Lana had met two years ago during an economics class, and now they were back together in the same lecture hall for their Chemistry class. ",1,1,,0,0,0,0,,,,,0,3,3,3,,,,,,,,,,,,,,,,,,,,,,,,,,,1,6.402882828999992,,,,,,,,,,,,,,,,,,,021119_p1,001,2019_Feb_11_1420,body_behavioural,3.0.3,59.989808931262935,
0,The professor caught Aaron's eye as he walked up to the front of the classroom and gave him a wink before the lecture began. ,1,1,,0,0,0,0,,,,,0,4,4,4,,,,,,,,,,,,,,,,,,,,,,,,,,,1,6.085706275000007,,,,,,,,,,,,,,,,,,,021119_p1,001,2019_Feb_11_1420,body_behavioural,3.0.3,59.989808931262935,
0,Aaron responded with a huge grin. ,1,1,,0,0,0,0,,,,,0,5,5,5,,,,,,,,,,,,,,,,,,,,,,,,,,,1,2.153751982999978,,,,,,,,,,,,,,,,,,,021119_p1,001,2019_Feb_11_1420,body_behavioural,3.0.3,59.989808931262935,
0,"The professor cleared his throat and said,“Alright, good afternoon, everyone!",2,1,,0,0,0,0,,,,,0,6,6,6,,,,,,,,,,,,,,,,,,,,,,,,,,,9,15.886551512000011,,,,,,,,,,,,,,,,,,,021119_p1,001,2019_Feb_11_1420,body_behavioural,3.0.3,59.989808931262935,
0,"Last week we talked about the structure of the periodic table, and this week the topic is ions.",2,1,,0,0,0,0,,,,,0,7,7,7,,,,,,,,,,,,,,,,,,,,,,,,,,,1,3.7526345220000223,,,,,,,,,,,,,,,,,,,021119_p1,001,2019_Feb_11_1420,body_behavioural,3.0.3,59.989808931262935,
0,These are atoms or molecules in which the number of electrons does not equal the number of protons.,2,1,,0,0,0,0,,,,,0,8,8,8,,,,,,,,,,,,,,,,,,,,,,,,,,,1,4.552650242999988,,,,,,,,,,,,,,,,,,,021119_p1,001,2019_Feb_11_1420,body_behavioural,3.0.3,59.989808931262935,
0,"Now, let me get my computer set up, one moment, class.”",2,1,,0,0,0,0,,,,,0,9,9,9,,,,,,,,,,,,,,,,,,,,,,,,,,,1,6.636840740000025,,,,,,,,,,,,,,,,,,,021119_p1,001,2019_Feb_11_1420,body_behavioural,3.0.3,59.989808931262935,
0,Lana pulled out her Calculus problem set and puzzled over it.,2,1,,0,0,0,0,,,,,0,10,10,10,,,,,,,,,,,,,,,,,,,,,,,,,,,9,4.336228758000004,,,,,,,,,,,,,,,,,,,021119_p1,001,2019_Feb_11_1420,body_behavioural,3.0.3,59.989808931262935,
0,"While she was distracted, Aaron unzipped the small pocket in his backpack and pulled out the ring box.",2,2,,0,0,0,0,,,,,0,11,11,11,,,,,,,,,,,,,,,,,,,,,,,,,,,1,11.054203252000008,,,,,,,,,,,,,,,,,,,021119_p1,001,2019_Feb_11_1420,body_behavioural,3.0.3,59.989808931262935,
0,He opened it up and looked at the ring.,2,2,,0,0,0,0,,,,,0,12,12,12,,,,,,,,,,,,,,,,,,,,,,,,,,,1,3.317379865000021,,,,,,,,,,,,,,,,,,,021119_p1,001,2019_Feb_11_1420,body_behavioural,3.0.3,59.989808931262935,
0,"Instead of one large diamond, there were 5 diamonds embedded in a thick band. ",2,2,,0,0,0,0,,,,,0,13,13,13,,,,,,,,,,,,,,,,,,,,,,,,,,,1,6.853500554999982,,,,,,,,,,,,,,,,,,,021119_p1,001,2019_Feb_11_1420,body_behavioural,3.0.3,59.989808931262935,
0,He knew Lana would like this because her style was not flashy but more about simple elegance.,2,2,,0,0,0,0,,,,,0,14,14,14,,,,,,,,,,,,,,,,,,,,,,,,,,,1,3.8362687600000527,,,,,,,,,,,,,,,,,,,021119_p1,001,2019_Feb_11_1420,body_behavioural,3.0.3,59.989808931262935,
0,Aaron put the ring back into the bag as the professor began the lecture. ,3,2,,0,0,0,0,,,,,0,15,15,15,,,,,,,,,,,,,,,,,,,,,,,,,,,1,4.169892148000031,,,,,,,,,,,,,,,,,,,021119_p1,001,2019_Feb_11_1420,body_behavioural,3.0.3,59.989808931262935,
0,“Recall from previous lectures that the number of protons determines the identity of the element. ,3,2,,0,0,0,0,,,,,0,16,16,16,,,,,,,,,,,,,,,,,,,,,,,,,,,9,6.669823863000033,,,,,,,,,,,,,,,,,,,021119_p1,001,2019_Feb_11_1420,body_behavioural,3.0.3,59.989808931262935,
0,"So for example, all atoms of sodium have 11 protons in the nucleus. ",3,2,,0,0,0,0,,,,,0,17,17,17,,,,,,,,,,,,,,,,,,,,,,,,,,,1,4.5198954450000315,,,,,,,,,,,,,,,,,,,021119_p1,001,2019_Feb_11_1420,body_behavioural,3.0.3,59.989808931262935,
0,"And if you look on the periodic table, the atomic number for sodium, the symbol is Na, is eleven.”",3,2,,0,0,0,0,,,,,0,18,18,18,,,,,,,,,,,,,,,,,,,,,,,,,,,1,5.920084485000018,,,,,,,,,,,,,,,,,,,021119_p1,001,2019_Feb_11_1420,body_behavioural,3.0.3,59.989808931262935,
0,Lana was taking notes while Aaron was texting all of his friends in the class to get ready for the proposal. ,3,2,,0,0,0,0,,,,,0,19,19,19,,,,,,,,,,,,,,,,,,,,,,,,,,,9,7.469780100000037,,,,,,,,,,,,,,,,,,,021119_p1,001,2019_Feb_11_1420,body_behavioural,3.0.3,59.989808931262935,
0,"Right after talking about how two ions bond into one stable molecule by covalent bonds, the professor stopped the lecture and asked Lana to come to the front of the class to do a demonstration. ",3,2,,0,0,0,0,,,,,0,20,20,20,,,,,,,,,,,,,,,,,,,,,,,,,,,1,10.937212760000023,,,,,,,,,,,,,,,,,,,021119_p1,001,2019_Feb_11_1420,body_behavioural,3.0.3,59.989808931262935,
0,"She walked to the front of the class confused, and the professor asked her to stand in the middle of the stage.",3,2,,0,0,0,0,,,,,0,21,21,21,,,,,,,,,,,,,,,,,,,,,,,,,,,1,4.436106994999989,,,,,,,,,,,,,,,,,,,021119_p1,001,2019_Feb_11_1420,body_behavioural,3.0.3,59.989808931262935,
0,"Then Aaron walked up and, taking Lana’s hand, got down on one knee. ",3,3,,0,0,0,0,,,,,0,22,22,22,,,,,,,,,,,,,,,,,,,,,,,,,,,1,2.303185452999969,,,,,,,,,,,,,,,,,,,021119_p1,001,2019_Feb_11_1420,body_behavioural,3.0.3,59.989808931262935,
0,"“It's time for us to make a bond of our own, Lana.",3,3,,0,0,0,0,,,,,0,23,23,23,,,,,,,,,,,,,,,,,,,,,,,,,,,1,3.2021161239999856,,,,,,,,,,,,,,,,,,,021119_p1,001,2019_Feb_11_1420,body_behavioural,3.0.3,59.989808931262935,
0,Will you marry me?” ,3,3,,0,0,0,0,,,,,0,24,24,24,,,,,,,,,,,,,,,,,,,,,,,,,,,1,1.4694472450000262,,,,,,,,,,,,,,,,,,,021119_p1,001,2019_Feb_11_1420,body_behavioural,3.0.3,59.989808931262935,
0,Lana gasped and put her other hand to her mouth and started looking around the room as if trying to convince herself that this was really happening.,3,3,,0,0,0,0,,,,,0,25,25,25,,,,,,,,,,,,,,,,,,,,,,,,,,,9,10.837183691999996,,,,,,,,,,,,,,,,,,,021119_p1,001,2019_Feb_11_1420,body_behavioural,3.0.3,59.989808931262935,
0,For a few moments everyone was in suspense waiting for the Lana’s shock to wear off and for her to answer. ,3,3,,0,0,0,0,,,,,0,26,26,26,,,,,,,,,,,,,,,,,,,,,,,,,,,1,5.620954433999998,,,,,,,,,,,,,,,,,,,021119_p1,001,2019_Feb_11_1420,body_behavioural,3.0.3,59.989808931262935,
0,"Finally, she said, “Yes!”",3,4,,0,0,0,0,,,,,0,27,27,27,,,,,,,,,,,,,,,,,,,,,,,,,,,1,1.3690939699999944,,,,,,,,,,,,,,,,,,,021119_p1,001,2019_Feb_11_1420,body_behavioural,3.0.3,59.989808931262935,
0,"Aaron put the ring on her finger, and they hugged while the whole class clapped. ",3,4,,0,0,0,0,,,,,0,28,28,28,,,,,,,,,,,,,,,,,,,,,,,,,,,1,3.486827278000021,,,,,,,,,,,,,,,,,,,021119_p1,001,2019_Feb_11_1420,body_behavioural,3.0.3,59.989808931262935,
0,"Their friends came up and hugged both of them, and the professor gave Aaron a celebratory handshake.",3,4,,0,0,0,0,,,,,0,29,29,29,,,,,,,,,,,,,,,,,,,,,,,,,,,1,2.7860961239999824,,,,,,,,,,,,,,,,,,,021119_p1,001,2019_Feb_11_1420,body_behavioural,3.0.3,59.989808931262935,
0,"They made their way back to their seats, Lana and Aaron hand-in-hand and beaming. ",3,4,,0,0,0,0,,,,,0,30,30,30,,,,,,,,,,,,,,,,,,,,,,,,,,,1,5.687035037999976,,,,,,,,,,,,,,,,,,,021119_p1,001,2019_Feb_11_1420,body_behavioural,3.0.3,59.989808931262935,
0,"The professor then dismissed the class, saying, “That was enough excitement for today!",4,4,,0,0,0,0,,,,,0,31,31,31,,,,,,,,,,,,,,,,,,,,,,,,,,,1,6.418527805999986,,,,,,,,,,,,,,,,,,,021119_p1,001,2019_Feb_11_1420,body_behavioural,3.0.3,59.989808931262935,
0,Don’t forget there’s an exam next week on the first two chapters of the textbook.”,4,4,,0,0,0,0,,,,,0,32,32,32,,,,,,,,,,,,,,,,,,,,,,,,,,,1,4.436606822999977,,,,,,,,,,,,,,,,,,,021119_p1,001,2019_Feb_11_1420,body_behavioural,3.0.3,59.989808931262935,
0,"As everyone was packing up their notebooks and leaving, Lana was already on her phone calling her family members to tell them the exciting news.",4,4,,0,0,0,0,,,,,0,33,33,33,,,,,,,,,,,,,,,,,,,,,,,,,,,9,6.767850137999972,,,,,,,,,,,,,,,,,,,021119_p1,001,2019_Feb_11_1420,body_behavioural,3.0.3,59.989808931262935,
0,,,,,0,0,0,0,,,,,,,,,,,,,,,,,,,,,,,,,,,,,,,,,,,,,,,,,,,,,,,,,,,,,,,021119_p1,001,2019_Feb_11_1420,body_behavioural,3.0.3,59.989808931262935,
1,,,,,0,1,1,1,0,0,0,0,,,,,,,,,,,,,,,,,,,,,,,,,space,1.1341161000000284,space,2.385956759999999,space,3.5868941850000056,,,,,,,,,,,,,,,,,,,,,021119_p1,001,2019_Feb_11_1420,body_behavioural,3.0.3,59.989808931262935,
1,"Simon and Carina noticed each other as they walked into the grocery store at the same time, their carts nearly colliding as they squeezed into the entrance.",1,1,,0,1,1,1,,,,,0,0,0,0,,,,,,,,,,,,,,,,,,,,,,,,,,,9,17.487486312999977,,,,,,,,,,,,,,,,,,,021119_p1,001,2019_Feb_11_1420,body_behavioural,3.0.3,59.989808931262935,
1,"They were both new to the Boston area, and this was their first time in this store. ",1,1,,0,1,1,1,,,,,0,1,1,1,,,,,,,,,,,,,,,,,,,,,,,,,,,1,3.735015073999989,,,,,,,,,,,,,,,,,,,021119_p1,001,2019_Feb_11_1420,body_behavioural,3.0.3,59.989808931262935,
1,"It kind of looked like a large warehouse, with high unfurnished ceilings, industrial lights, and large packages of food. ",1,1,,0,1,1,1,,,,,0,2,2,2,,,,,,,,,,,,,,,,,,,,,,,,,,,1,5.303953387999968,,,,,,,,,,,,,,,,,,,021119_p1,001,2019_Feb_11_1420,body_behavioural,3.0.3,59.989808931262935,
1,"They went off along separate routes, but soon ended up back together in the meat section. ",2,1,,0,1,1,1,,,,,0,3,3,3,,,,,,,,,,,,,,,,,,,,,,,,,,,1,14.52060939300003,,,,,,,,,,,,,,,,,,,021119_p1,001,2019_Feb_11_1420,body_behavioural,3.0.3,59.989808931262935,
1,"They were both preparing for barbecues, so they were looking over the same cuts of meat. ",2,1,,0,1,1,1,,,,,0,4,4,4,,,,,,,,,,,,,,,,,,,,,,,,,,,1,3.5031537579999963,,,,,,,,,,,,,,,,,,,021119_p1,001,2019_Feb_11_1420,body_behavioural,3.0.3,59.989808931262935,
1,"Simon really wanted to talk to Carina, and Carina really wanted to say something to Simon, but they felt embarrassed striking up a conversation with a stranger.",2,1,,0,1,1,1,,,,,0,5,5,5,,,,,,,,,,,,,,,,,,,,,,,,,,,9,7.469950034999954,,,,,,,,,,,,,,,,,,,021119_p1,001,2019_Feb_11_1420,body_behavioural,3.0.3,59.989808931262935,
1,"Carina suddenly turned to Simon and, pointing at a Cornish hen, asked, “Isn’t this meat cute?”",2,2,,0,1,1,1,,,,,0,6,6,6,,,,,,,,,,,,,,,,,,,,,,,,,,,1,5.686369044999992,,,,,,,,,,,,,,,,,,,021119_p1,001,2019_Feb_11_1420,body_behavioural,3.0.3,59.989808931262935,
1,"He laughed, and said, “It is very cute.",2,2,,0,1,1,1,,,,,0,7,7,7,,,,,,,,,,,,,,,,,,,,,,,,,,,1,2.1031060280000133,,,,,,,,,,,,,,,,,,,021119_p1,001,2019_Feb_11_1420,body_behavioural,3.0.3,59.989808931262935,
1,"Probably the younger brother of this guy,” and he picked up a regular-sized chicken.",2,2,,0,1,1,1,,,,,0,8,8,8,,,,,,,,,,,,,,,,,,,,,,,,,,,1,3.2697831880000194,,,,,,,,,,,,,,,,,,,021119_p1,001,2019_Feb_11_1420,body_behavioural,3.0.3,59.989808931262935,
1,"“Unlucky family,” she responded. ",2,2,,0,1,1,1,,,,,0,9,9,9,,,,,,,,,,,,,,,,,,,,,,,,,,,1,3.086548295,,,,,,,,,,,,,,,,,,,021119_p1,001,2019_Feb_11_1420,body_behavioural,3.0.3,59.989808931262935,
1,They continued to chat as they picked out their groceries.,2,2,,0,1,1,1,,,,,0,10,10,10,,,,,,,,,,,,,,,,,,,,,,,,,,,9,4.317642844999966,,,,,,,,,,,,,,,,,,,021119_p1,001,2019_Feb_11_1420,body_behavioural,3.0.3,59.989808931262935,
1,"Simon helped Carina pick out the best ribs and his personal favorite barbeque sauce, and she helped him gather the  peppers, onions, and spices for a vegetable kabob she recommended.",2,2,,0,1,1,1,,,,,0,11,11,11,,,,,,,,,,,,,,,,,,,,,,,,,,,1,7.969863205000024,,,,,,,,,,,,,,,,,,,021119_p1,001,2019_Feb_11_1420,body_behavioural,3.0.3,59.989808931262935,
1,"When they were both finished shopping, they went to the checkout area.",3,2,,0,1,1,1,,,,,0,12,12,12,,,,,,,,,,,,,,,,,,,,,,,,,,,1,3.9695432099999834,,,,,,,,,,,,,,,,,,,021119_p1,001,2019_Feb_11_1420,body_behavioural,3.0.3,59.989808931262935,
1,"Simon was disappointed to see that the lines were short, since he had been hoping for an excuse to spend more time with Carina.",3,2,,0,1,1,1,,,,,0,13,13,13,,,,,,,,,,,,,,,,,,,,,,,,,,,1,10.936994924999965,,,,,,,,,,,,,,,,,,,021119_p1,001,2019_Feb_11_1420,body_behavioural,3.0.3,59.989808931262935,
1,"They had real chemistry, and both of them could definitely see a future together despite having just met.",3,2,,0,1,1,1,,,,,0,14,14,14,,,,,,,,,,,,,,,,,,,,,,,,,,,1,3.536386092999976,,,,,,,,,,,,,,,,,,,021119_p1,001,2019_Feb_11_1420,body_behavioural,3.0.3,59.989808931262935,
1,"“So you haven’t been around the city much?”, Simon asked. ",3,2,,0,1,1,1,,,,,0,15,15,15,,,,,,,,,,,,,,,,,,,,,,,,,,,1,3.5198184080000487,,,,,,,,,,,,,,,,,,,021119_p1,001,2019_Feb_11_1420,body_behavioural,3.0.3,59.989808931262935,
1,"“No, not really.",3,2,,0,1,1,1,,,,,0,16,16,16,,,,,,,,,,,,,,,,,,,,,,,,,,,1,0.7673163230000455,,,,,,,,,,,,,,,,,,,021119_p1,001,2019_Feb_11_1420,body_behavioural,3.0.3,59.989808931262935,
1,I’ve mainly been working and setting up my apartment.”,3,2,,0,1,1,1,,,,,0,17,17,17,,,,,,,,,,,,,,,,,,,,,,,,,,,1,3.7197948629999473,,,,,,,,,,,,,,,,,,,021119_p1,001,2019_Feb_11_1420,body_behavioural,3.0.3,59.989808931262935,
1,"Simon asked her, “Ok well, if you’d like I could pick you up next weekend, and we could go around Harvard Square and get dinner.",3,3,,0,1,1,1,,,,,0,18,18,18,,,,,,,,,,,,,,,,,,,,,,,,,,,1,6.303435749999949,,,,,,,,,,,,,,,,,,,021119_p1,001,2019_Feb_11_1420,body_behavioural,3.0.3,59.989808931262935,
1,"There are a lot of great places around there, and it’s really nice during the summer.",3,3,,0,1,1,1,,,,,0,19,19,19,,,,,,,,,,,,,,,,,,,,,,,,,,,1,3.236295688000041,,,,,,,,,,,,,,,,,,,021119_p1,001,2019_Feb_11_1420,body_behavioural,3.0.3,59.989808931262935,
1,The Harvard campus is also beautiful.” ,3,3,,0,1,1,1,,,,,0,20,20,20,,,,,,,,,,,,,,,,,,,,,,,,,,,1,2.7026847349999343,,,,,,,,,,,,,,,,,,,021119_p1,001,2019_Feb_11_1420,body_behavioural,3.0.3,59.989808931262935,
1,"Carina smiled, “I’d love to: that sounds great!”",3,3,,0,1,1,1,,,,,0,21,21,21,,,,,,,,,,,,,,,,,,,,,,,,,,,1,1.7864308629999641,,,,,,,,,,,,,,,,,,,021119_p1,001,2019_Feb_11_1420,body_behavioural,3.0.3,59.989808931262935,
1,"She quickly entered her number in his phone, since they only had to wait a couple minutes in line.",3,3,,0,1,1,1,,,,,0,22,22,22,,,,,,,,,,,,,,,,,,,,,,,,,,,1,8.686855027000092,,,,,,,,,,,,,,,,,,,021119_p1,001,2019_Feb_11_1420,body_behavioural,3.0.3,59.989808931262935,
1,Then it was her turn to check out with the cashier. ,4,3,,0,1,1,1,,,,,0,23,23,23,,,,,,,,,,,,,,,,,,,,,,,,,,,9,5.403314417999923,,,,,,,,,,,,,,,,,,,021119_p1,001,2019_Feb_11_1420,body_behavioural,3.0.3,59.989808931262935,
1,"Simon, wanting to make a gesture of his affection, lifted up the divider on the conveyor belt and said to the cashier, “Actually these are together.",4,3,,0,1,1,1,,,,,0,24,24,24,,,,,,,,,,,,,,,,,,,,,,,,,,,1,7.501146400000039,,,,,,,,,,,,,,,,,,,021119_p1,001,2019_Feb_11_1420,body_behavioural,3.0.3,59.989808931262935,
1,"Carina, I’ve got it.",4,3,,0,1,1,1,,,,,0,25,25,25,,,,,,,,,,,,,,,,,,,,,,,,,,,1,1.769803343000035,,,,,,,,,,,,,,,,,,,021119_p1,001,2019_Feb_11_1420,body_behavioural,3.0.3,59.989808931262935,
1,This was kind-of a date today.”,4,3,,0,1,1,1,,,,,0,26,26,26,,,,,,,,,,,,,,,,,,,,,,,,,,,1,3.6175369349999755,,,,,,,,,,,,,,,,,,,021119_p1,001,2019_Feb_11_1420,body_behavioural,3.0.3,59.989808931262935,
1,Carina blushed and laughed; she thought this was ridiculous but also very sweet. ,4,3,,0,1,1,1,,,,,0,27,27,27,,,,,,,,,,,,,,,,,,,,,,,,,,,1,2.6695127080000702,,,,,,,,,,,,,,,,,,,021119_p1,001,2019_Feb_11_1420,body_behavioural,3.0.3,59.989808931262935,
1,"The cashier rolled her eyes when they weren’t looking, and she scanned the rest of his items. ",4,3,,0,1,1,1,,,,,0,28,28,28,,,,,,,,,,,,,,,,,,,,,,,,,,,1,5.486769322999976,,,,,,,,,,,,,,,,,,,021119_p1,001,2019_Feb_11_1420,body_behavioural,3.0.3,59.989808931262935,
1,"The total came to $120, and he paid with his credit card.",4,3,,0,1,1,1,,,,,0,29,29,29,,,,,,,,,,,,,,,,,,,,,,,,,,,9,2.5864830799999936,,,,,,,,,,,,,,,,,,,021119_p1,001,2019_Feb_11_1420,body_behavioural,3.0.3,59.989808931262935,
1,"Carina thanked him, and they took the groceries and walked out.",4,3,,0,1,1,1,,,,,0,30,30,30,,,,,,,,,,,,,,,,,,,,,,,,,,,1,3.1030604600000515,,,,,,,,,,,,,,,,,,,021119_p1,001,2019_Feb_11_1420,body_behavioural,3.0.3,59.989808931262935,
1,"As they were walking towards the exit, Carina reluctantly said goodbye since she was running late for the barbeque she was hosting that afternoon.",4,4,,0,1,1,1,,,,,0,31,31,31,,,,,,,,,,,,,,,,,,,,,,,,,,,1,7.15337119000003,,,,,,,,,,,,,,,,,,,021119_p1,001,2019_Feb_11_1420,body_behavioural,3.0.3,59.989808931262935,
1,"They hugged and parted ways, stealing glances at each other as they both walked back to their cars.",4,4,,0,1,1,1,,,,,0,32,32,32,,,,,,,,,,,,,,,,,,,,,,,,,,,1,2.619886483000073,,,,,,,,,,,,,,,,,,,021119_p1,001,2019_Feb_11_1420,body_behavioural,3.0.3,59.989808931262935,
1,,,,,0,1,1,1,,,,,,,,,,,,,,,,,,,,,,,,,,,,,,,,,,,,,,,,,,,,,,,,,,,,,,,021119_p1,001,2019_Feb_11_1420,body_behavioural,3.0.3,59.989808931262935,
2,,,,,0,2,2,2,0,0,0,0,,,,,,,,,,,,,,,,,,,,,,,,,space,1.236309848000019,space,1.219721095000068,space,2.1364213550000386,,,,,,,,,,,,,,,,,,,,,021119_p1,001,2019_Feb_11_1420,body_behavioural,3.0.3,59.989808931262935,
2,Mr. Shelton and Mr. Gordon shook hands inside the foyer of the restaurant: lunch today was about big business. ,1,1,,0,2,2,2,,,,,0,0,0,0,,,,,,,,,,,,,,,,,,,,,,,,,,,9,8.403812783000035,,,,,,,,,,,,,,,,,,,021119_p1,001,2019_Feb_11_1420,body_behavioural,3.0.3,59.989808931262935,
2,Mr. Shelton and Mr. Gordon both were CEOs of airplane manufacturing companies.,1,1,,0,2,2,2,,,,,0,1,1,1,,,,,,,,,,,,,,,,,,,,,,,,,,,1,3.403193146999911,,,,,,,,,,,,,,,,,,,021119_p1,001,2019_Feb_11_1420,body_behavioural,3.0.3,59.989808931262935,
2,"Mr. Shelton was in charge of a larger, well-established company and had been in the aviation business for decades, whereas Mr. Gordon led a smaller but technologically-advanced company that was projected to disrupt the airplane manufacturing market. ",1,1,,0,2,2,2,,,,,0,2,2,2,,,,,,,,,,,,,,,,,,,,,,,,,,,1,13.087107570000057,,,,,,,,,,,,,,,,,,,021119_p1,001,2019_Feb_11_1420,body_behavioural,3.0.3,59.989808931262935,
2,"The restaurant they chose to meet at was old and fancy with high ceilings, dark wood paneling, and crystal chandeliers.",1,1,,0,2,2,2,,,,,0,3,3,3,,,,,,,,,,,,,,,,,,,,,,,,,,,9,5.586481189999972,,,,,,,,,,,,,,,,,,,021119_p1,001,2019_Feb_11_1420,body_behavioural,3.0.3,59.989808931262935,
2,"The waitress led them to their table in the back, and they settled into a private table in the corner by the fireplace. ",2,1,,0,2,2,2,,,,,0,4,4,4,,,,,,,,,,,,,,,,,,,,,,,,,,,1,6.270042815000011,,,,,,,,,,,,,,,,,,,021119_p1,001,2019_Feb_11_1420,body_behavioural,3.0.3,59.989808931262935,
2,The waitress brought out the menus and they broke the ice with some small talk.,2,1,,0,2,2,2,,,,,0,5,5,5,,,,,,,,,,,,,,,,,,,,,,,,,,,1,3.584250460000021,,,,,,,,,,,,,,,,,,,021119_p1,001,2019_Feb_11_1420,body_behavioural,3.0.3,59.989808931262935,
2,"Mr. Gordon took out a picture of his daughter and talked about her recent engagement, and Mr. Gordon boasted about his purchase of a Tesla. ",2,1,,0,2,2,2,,,,,0,6,6,6,,,,,,,,,,,,,,,,,,,,,,,,,,,1,5.536954334999905,,,,,,,,,,,,,,,,,,,021119_p1,001,2019_Feb_11_1420,body_behavioural,3.0.3,59.989808931262935,
2,"They looked at the menus as well, which were full of Italian classics like Carbonara and Tiramisu, and in the back section of the menu was a lengthy drink selection.",2,1,,0,2,2,2,,,,,0,7,7,7,,,,,,,,,,,,,,,,,,,,,,,,,,,9,7.687126757999977,,,,,,,,,,,,,,,,,,,021119_p1,001,2019_Feb_11_1420,body_behavioural,3.0.3,59.989808931262935,
2,"After awhile, Mr. Shelton brought the conversation around to business.",2,2,,0,2,2,2,,,,,0,8,8,8,,,,,,,,,,,,,,,,,,,,,,,,,,,9,4.917633668000008,,,,,,,,,,,,,,,,,,,021119_p1,001,2019_Feb_11_1420,body_behavioural,3.0.3,59.989808931262935,
2,"“Mr. Gordon, we really admire what you’re doing at your company.",2,2,,0,2,2,2,,,,,0,9,9,9,,,,,,,,,,,,,,,,,,,,,,,,,,,1,1.7028161580000187,,,,,,,,,,,,,,,,,,,021119_p1,001,2019_Feb_11_1420,body_behavioural,3.0.3,59.989808931262935,
2,We think it’s genius; we want to support your vision and make this tiny company of yours internationally known.,2,2,,0,2,2,2,,,,,0,10,10,10,,,,,,,,,,,,,,,,,,,,,,,,,,,1,5.903380109999944,,,,,,,,,,,,,,,,,,,021119_p1,001,2019_Feb_11_1420,body_behavioural,3.0.3,59.989808931262935,
2,"But honestly, your company doesn’t have the resources to reach international markets right now, maybe in a few years you could, but by that time, other companies may have already filled your niche.",2,2,,0,2,2,2,,,,,0,11,11,11,,,,,,,,,,,,,,,,,,,,,,,,,,,1,9.10369888699995,,,,,,,,,,,,,,,,,,,021119_p1,001,2019_Feb_11_1420,body_behavioural,3.0.3,59.989808931262935,
2,I think we should join forces.”,2,2,,0,2,2,2,,,,,0,12,12,12,,,,,,,,,,,,,,,,,,,,,,,,,,,1,3.552776535000021,,,,,,,,,,,,,,,,,,,021119_p1,001,2019_Feb_11_1420,body_behavioural,3.0.3,59.989808931262935,
2,The waitress came up to them and asked if they were ready to order.,3,2,,0,2,2,2,,,,,0,13,13,13,,,,,,,,,,,,,,,,,,,,,,,,,,,9,4.519983128000035,,,,,,,,,,,,,,,,,,,021119_p1,001,2019_Feb_11_1420,body_behavioural,3.0.3,59.989808931262935,
2,"Mr. Gordon ordered a medium-rare steak and martini, and Mr. Shelton ordered veal and a manhattan. ",3,2,,0,2,2,2,,,,,0,14,14,14,,,,,,,,,,,,,,,,,,,,,,,,,,,1,3.6027777949999518,,,,,,,,,,,,,,,,,,,021119_p1,001,2019_Feb_11_1420,body_behavioural,3.0.3,59.989808931262935,
2,"Then Mr. Shelton continued, “Look, I’ve talked to other members of the board, and we are prepared to offer $600 million to buy your company. ",3,2,,0,2,2,2,,,,,0,15,15,15,,,,,,,,,,,,,,,,,,,,,,,,,,,1,5.636460757000009,,,,,,,,,,,,,,,,,,,021119_p1,001,2019_Feb_11_1420,body_behavioural,3.0.3,59.989808931262935,
2,"We'd keep on all of your current employees, and you would join as the director of your company branch.” ",3,2,,0,2,2,2,,,,,0,16,16,16,,,,,,,,,,,,,,,,,,,,,,,,,,,1,4.3532116300000325,,,,,,,,,,,,,,,,,,,021119_p1,001,2019_Feb_11_1420,body_behavioural,3.0.3,59.989808931262935,
2,Mr. Gordon sat looking at Mr. Shelton for a few moments considering his response. ,3,2,,0,2,2,2,,,,,0,17,17,17,,,,,,,,,,,,,,,,,,,,,,,,,,,1,2.8026579050000464,,,,,,,,,,,,,,,,,,,021119_p1,001,2019_Feb_11_1420,body_behavioural,3.0.3,59.989808931262935,
2,He looked at Mr. Shelton skeptically.,3,2,,0,2,2,2,,,,,0,18,18,18,,,,,,,,,,,,,,,,,,,,,,,,,,,1,2.4698554430000286,,,,,,,,,,,,,,,,,,,021119_p1,001,2019_Feb_11_1420,body_behavioural,3.0.3,59.989808931262935,
2,"He said, “Mr. Shelton, I think that you make a compelling offer, but there are definitely some disadvantages to attaching our small, streamlined productions to a large company like yours.",3,3,,0,2,2,2,,,,,0,19,19,19,,,,,,,,,,,,,,,,,,,,,,,,,,,1,8.136548618000006,,,,,,,,,,,,,,,,,,,021119_p1,001,2019_Feb_11_1420,body_behavioural,3.0.3,59.989808931262935,
2,"We operate in a very different way than a large company, and the kind of administrative complexity that makes the scale of your productions possible would suffocate our business.",3,3,,0,2,2,2,,,,,0,20,20,20,,,,,,,,,,,,,,,,,,,,,,,,,,,1,4.369588909999948,,,,,,,,,,,,,,,,,,,021119_p1,001,2019_Feb_11_1420,body_behavioural,3.0.3,59.989808931262935,
