4,,,,,,,0,4,4,4,,,,,,,,,,,,,,,,,,,,,,,,,,,,,,,,,,,,,,,,,,,,,,,,,,,,,,,,,,,,,,,,,,030419_p1,001,2019_Mar_04_1017,body_behavioural,3.0.4,59.965027196159745,
5,,,,,,,0,5,5,5,0,0,0,0,,,,,,,,,,,,,,,,,,,,,,,,,,,space,1.1507371179977781,space,0.7858586949951132,space,0.6528659969990258,,,,,,,,,,,,,,,,,,,,,,,,,,,,,,030419_p1,001,2019_Mar_04_1017,body_behavioural,3.0.4,59.965027196159745,
5,"Sven and Isabel walked hurriedly from the cab into the Barcelona Airport after an incredible weekend with Isabel’s family, which had wiped away any doubts Sven had had about his decision to propose. ",1,1,,,,0,5,5,5,,,,,0,0,0,0,,,,,,,,,,,,,,,,,,,,,,,,,,,,,1,7.51180481800111,,,,,,,,,,,,,,,,,,,,,,,,,,,,030419_p1,001,2019_Mar_04_1017,body_behavioural,3.0.4,59.965027196159745,
5,"They were a little pressed for time, with only a little over an hour until their flight would take off to go back to the US, but they already had their online boarding passes and no checked luggage. ",1,1,,,,0,5,5,5,,,,,0,1,1,1,,,,,,,,,,,,,,,,,,,,,,,,,,,,,1,3.3875351949973265,,,,,,,,,,,,,,,,,,,,,,,,,,,,030419_p1,001,2019_Mar_04_1017,body_behavioural,3.0.4,59.965027196159745,
5,"When Isabel stopped to rummage through her purse looking for her phone, Sven turned his back to her and took the velvet box out of his backpack, opening it to look at the ring he bought her.",1,2,,,,0,5,5,5,,,,,0,2,2,2,,,,,,,,,,,,,,,,,,,,,,,,,,,,,1,3.2367198949941667,,,,,,,,,,,,,,,,,,,,,,,,,,,,030419_p1,001,2019_Mar_04_1017,body_behavioural,3.0.4,59.965027196159745,
5,"He had received her parents’ blessing during the trip, and he was almost giddy with excitement. ",1,2,,,,0,5,5,5,,,,,0,3,3,3,,,,,,,,,,,,,,,,,,,,,,,,,,,,,1,1.9197691320005106,,,,,,,,,,,,,,,,,,,,,,,,,,,,030419_p1,001,2019_Mar_04_1017,body_behavioural,3.0.4,59.965027196159745,
5,"He tilted the ring backward and forward, despite having already studied it daily since he had purchased it a few weeks ago. ",1,2,,,,0,5,5,5,,,,,0,4,4,4,,,,,,,,,,,,,,,,,,,,,,,,,,,,,1,2.5188281549999374,,,,,,,,,,,,,,,,,,,,,,,,,,,,030419_p1,001,2019_Mar_04_1017,body_behavioural,3.0.4,59.965027196159745,
5,"It was a simple design, with a clear, white diamond on a thin silver band.",1,2,,,,0,5,5,5,,,,,0,5,5,5,,,,,,,,,,,,,,,,,,,,,,,,,,,,,1,1.3040514789972804,,,,,,,,,,,,,,,,,,,,,,,,,,,,030419_p1,001,2019_Mar_04_1017,body_behavioural,3.0.4,59.965027196159745,
5,"“Sven, let’s go! ” Isabel said. ",1,2,,,,0,5,5,5,,,,,0,6,6,6,,,,,,,,,,,,,,,,,,,,,,,,,,,,,1,0.9697461270043277,,,,,,,,,,,,,,,,,,,,,,,,,,,,030419_p1,001,2019_Mar_04_1017,body_behavioural,3.0.4,59.965027196159745,
5,Sven discretely closed the box and put it in his pocket.,1,2,,,,0,5,5,5,,,,,0,7,7,7,,,,,,,,,,,,,,,,,,,,,,,,,,,,,1,1.0671405999964918,,,,,,,,,,,,,,,,,,,,,,,,,,,,030419_p1,001,2019_Mar_04_1017,body_behavioural,3.0.4,59.965027196159745,
5," They entered the security line, weaving through the roped walkways to the front. ",2,2,,,,0,5,5,5,,,,,0,8,8,8,,,,,,,,,,,,,,,,,,,,,,,,,,,,,1,1.6861738699954003,,,,,,,,,,,,,,,,,,,,,,,,,,,,030419_p1,001,2019_Mar_04_1017,body_behavioural,3.0.4,59.965027196159745,
5,"When they were up, Isabel realized her laptop was buried somewhere in her duffle bag. ",2,2,,,,0,5,5,5,,,,,0,9,9,9,,,,,,,,,,,,,,,,,,,,,,,,,,,,,1,2.4029327480020584,,,,,,,,,,,,,,,,,,,,,,,,,,,,030419_p1,001,2019_Mar_04_1017,body_behavioural,3.0.4,59.965027196159745,
5,Sven had to hold the growing mound of objects she pulled from her bag until she unearthed the laptop.,2,2,,,,0,5,5,5,,,,,0,10,10,10,,,,,,,,,,,,,,,,,,,,,,,,,,,,,1,2.184950172995741,,,,,,,,,,,,,,,,,,,,,,,,,,,,030419_p1,001,2019_Mar_04_1017,body_behavioural,3.0.4,59.965027196159745,
5,She set it into a bin and then had to unstrap her leather boots and put everything else into the bins.,2,2,,,,0,5,5,5,,,,,0,11,11,11,,,,,,,,,,,,,,,,,,,,,,,,,,,,,1,2.4204328170017106,,,,,,,,,,,,,,,,,,,,,,,,,,,,030419_p1,001,2019_Mar_04_1017,body_behavioural,3.0.4,59.965027196159745,
5,"Finally, she relieved Sven of his holding duties, and he hurriedly deposited his own backpack on the belt as the people behind them glared without shame. ",2,2,,,,0,5,5,5,,,,,0,12,12,12,,,,,,,,,,,,,,,,,,,,,,,,,,,,,1,4.586526064995269,,,,,,,,,,,,,,,,,,,,,,,,,,,,030419_p1,001,2019_Mar_04_1017,body_behavioural,3.0.4,59.965027196159745,
5,"Sven went into the millimeter wave scanner after Isabel, put his hands up, and the metal bars whirled around him.",2,2,,,,0,5,5,5,,,,,0,13,13,13,,,,,,,,,,,,,,,,,,,,,,,,,,,,,1,1.735305057001824,,,,,,,,,,,,,,,,,,,,,,,,,,,,030419_p1,001,2019_Mar_04_1017,body_behavioural,3.0.4,59.965027196159745,
5,"“Sir, please step to the side.",2,2,,,,0,5,5,5,,,,,0,14,14,14,,,,,,,,,,,,,,,,,,,,,,,,,,,,,1,0.9871071800007485,,,,,,,,,,,,,,,,,,,,,,,,,,,,030419_p1,001,2019_Mar_04_1017,body_behavioural,3.0.4,59.965027196159745,
5,"You need to empty your pockets,” the security guard said.",2,2,,,,0,5,5,5,,,,,0,15,15,15,,,,,,,,,,,,,,,,,,,,,,,,,,,,,1,1.086843871002202,,,,,,,,,,,,,,,,,,,,,,,,,,,,030419_p1,001,2019_Mar_04_1017,body_behavioural,3.0.4,59.965027196159745,
5,"With a sinking feeling Sven realized the mistake he had made forgetting to put the ring back in his bag, as Isabel and the guard both looked at him expectantly.",2,2,,,,0,5,5,5,,,,,0,16,16,16,,,,,,,,,,,,,,,,,,,,,,,,,,,,,9,4.970797732996289,,,,,,,,,,,,,,,,,,,,,,,,,,,,030419_p1,001,2019_Mar_04_1017,body_behavioural,3.0.4,59.965027196159745,
5,"Sven,  deciding he would make the best of the situation, grabbed Isabel's hand as he reached into his pocket.",2,2,,,,0,5,5,5,,,,,0,17,17,17,,,,,,,,,,,,,,,,,,,,,,,,,,,,,1,1.7197516020023613,,,,,,,,,,,,,,,,,,,,,,,,,,,,030419_p1,001,2019_Mar_04_1017,body_behavioural,3.0.4,59.965027196159745,
5,"He got down on one knee and, giggling slightly at her confused look, said, “Isabel, this isn't quite how I'd planned this, but - will you marry me?”",2,3,,,,0,5,5,5,,,,,0,18,18,18,,,,,,,,,,,,,,,,,,,,,,,,,,,,,1,2.7864466449973406,,,,,,,,,,,,,,,,,,,,,,,,,,,,030419_p1,001,2019_Mar_04_1017,body_behavioural,3.0.4,59.965027196159745,
5,The security guard gasped.,2,3,,,,0,5,5,5,,,,,0,19,19,19,,,,,,,,,,,,,,,,,,,,,,,,,,,,,1,1.0521301420012605,,,,,,,,,,,,,,,,,,,,,,,,,,,,030419_p1,001,2019_Mar_04_1017,body_behavioural,3.0.4,59.965027196159745,
5,All the people who were putting their shoes back on and gathering their belongings stopped what they were doing and walked closer to the couple.,2,3,,,,0,5,5,5,,,,,0,20,20,20,,,,,,,,,,,,,,,,,,,,,,,,,,,,,1,3.7023338840008364,,,,,,,,,,,,,,,,,,,,,,,,,,,,030419_p1,001,2019_Mar_04_1017,body_behavioural,3.0.4,59.965027196159745,
5,"Isabel was astonished, and far too shy to respond in front of the backup of passengers waiting behind them.",2,3,,,,0,5,5,5,,,,,0,21,21,21,,,,,,,,,,,,,,,,,,,,,,,,,,,,,1,2.0696378130014637,,,,,,,,,,,,,,,,,,,,,,,,,,,,030419_p1,001,2019_Mar_04_1017,body_behavioural,3.0.4,59.965027196159745,
5,"She attempted to stammer a response as she frantically grabbed her and Sven’s shoes, leaving Sven to retrieve their bags.",2,3,,,,0,5,5,5,,,,,0,22,22,22,,,,,,,,,,,,,,,,,,,,,,,,,,,,,1,2.820527908006625,,,,,,,,,,,,,,,,,,,,,,,,,,,,030419_p1,001,2019_Mar_04_1017,body_behavioural,3.0.4,59.965027196159745,
5,"Both of them slipping in their socked feet, she fled onto the concourse with Sven trying to catch up behind her.",3,3,,,,0,5,5,5,,,,,0,23,23,23,,,,,,,,,,,,,,,,,,,,,,,,,,,,,1,3.136370087006071,,,,,,,,,,,,,,,,,,,,,,,,,,,,030419_p1,001,2019_Mar_04_1017,body_behavioural,3.0.4,59.965027196159745,
5,"Everyone in the terminal was looking at them with confusion as Sven, holding the bags in one hand and the open ring box in the other, finally caught up to her.",3,3,,,,0,5,5,5,,,,,0,24,24,24,,,,,,,,,,,,,,,,,,,,,,,,,,,,,1,3.2196743129970855,,,,,,,,,,,,,,,,,,,,,,,,,,,,030419_p1,001,2019_Mar_04_1017,body_behavioural,3.0.4,59.965027196159745,
5,“Isabel?”,3,3,,,,0,5,5,5,,,,,0,25,25,25,,,,,,,,,,,,,,,,,,,,,,,,,,,,,1,0.7863533249983448,,,,,,,,,,,,,,,,,,,,,,,,,,,,030419_p1,001,2019_Mar_04_1017,body_behavioural,3.0.4,59.965027196159745,
5,"He watched her face as she turned, trying to read her expression.",3,3,,,,0,5,5,5,,,,,0,26,26,26,,,,,,,,,,,,,,,,,,,,,,,,,,,,,1,0.6524230169961811,,,,,,,,,,,,,,,,,,,,,,,,,,,,030419_p1,001,2019_Mar_04_1017,body_behavioural,3.0.4,59.965027196159745,
5,"Her eyes were wide, but she was smiling as she hyperventilated, “Of course yes, Sven, yes!” ",3,4,,,,0,5,5,5,,,,,0,27,27,27,,,,,,,,,,,,,,,,,,,,,,,,,,,,,1,2.3187343850004254,,,,,,,,,,,,,,,,,,,,,,,,,,,,030419_p1,001,2019_Mar_04_1017,body_behavioural,3.0.4,59.965027196159745,
5,"They dropped their belongings and hugged, and Sven slipped the ring onto Isabel’s finger. ",3,4,,,,0,5,5,5,,,,,0,28,28,28,,,,,,,,,,,,,,,,,,,,,,,,,,,,,1,1.9505328980012564,,,,,,,,,,,,,,,,,,,,,,,,,,,,030419_p1,001,2019_Mar_04_1017,body_behavioural,3.0.4,59.965027196159745,
5,"After getting their shoes back on, they practically skipped to the gate, filled with joy.",3,4,,,,0,5,5,5,,,,,0,29,29,29,,,,,,,,,,,,,,,,,,,,,,,,,,,,,1,2.070535826002015,,,,,,,,,,,,,,,,,,,,,,,,,,,,030419_p1,001,2019_Mar_04_1017,body_behavioural,3.0.4,59.965027196159745,
5,Sven high-fived a confused shoe-shine attendant as they passed.,3,4,,,,0,5,5,5,,,,,0,30,30,30,,,,,,,,,,,,,,,,,,,,,,,,,,,,,1,1.419999949997873,,,,,,,,,,,,,,,,,,,,,,,,,,,,030419_p1,001,2019_Mar_04_1017,body_behavioural,3.0.4,59.965027196159745,
5,"They sat down outside their gate, having actually made good time, until the attendant called for passengers.",3,4,,,,0,5,5,5,,,,,0,31,31,31,,,,,,,,,,,,,,,,,,,,,,,,,,,,,1,4.0172030000030645,,,,,,,,,,,,,,,,,,,,,,,,,,,,030419_p1,001,2019_Mar_04_1017,body_behavioural,3.0.4,59.965027196159745,
5,"They boarded, sitting together in first class, and had a glass of champagne to celebrate the departure into their new life together.",4,4,,,,0,5,5,5,,,,,0,32,32,32,,,,,,,,,,,,,,,,,,,,,,,,,,,,,1,2.2195343989951652,,,,,,,,,,,,,,,,,,,,,,,,,,,,030419_p1,001,2019_Mar_04_1017,body_behavioural,3.0.4,59.965027196159745,
5,"Some of their neighboring passengers who had witnessed the proposal congratulated them, and a woman next to them showed them that she had been live-tweeting the whole event and that it was already going viral online.",4,4,,,,0,5,5,5,,,,,0,33,33,33,,,,,,,,,,,,,,,,,,,,,,,,,,,,,1,5.10390832000121,,,,,,,,,,,,,,,,,,,,,,,,,,,,030419_p1,001,2019_Mar_04_1017,body_behavioural,3.0.4,59.965027196159745,
5,"Isabel slid down in her seat with her hands over her face, both embarrassed and overjoyed at the same time.
",4,4,,,,0,5,5,5,,,,,0,34,34,34,,,,,,,,,,,,,,,,,,,,,,,,,,,,,1,1.968878774001496,,,,,,,,,,,,,,,,,,,,,,,,,,,,030419_p1,001,2019_Mar_04_1017,body_behavioural,3.0.4,59.965027196159745,
5,,,,,,,0,5,5,5,,,,,,,,,,,,,,,,,,,,,,,,,,,,,,,,,,,,,,,,,,,,,,,,,,,,,,,,,,,,,,,,,,030419_p1,001,2019_Mar_04_1017,body_behavioural,3.0.4,59.965027196159745,
6,,,,,,,0,6,6,6,0,0,0,0,,,,,,,,,,,,,,,,,,,,,,,,,,,space,1.0016808099971968,space,0.6526447099968209,space,0.7863940429961076,,,,,,,,,,,,,,,,,,,,,,,,,,,,,,030419_p1,001,2019_Mar_04_1017,body_behavioural,3.0.4,59.965027196159745,
6,,,,,,,0,6,6,6,1,0,1,0,,,,,,,,,,,,,,,,,,,,,,,,,,,,,,,space,0.5673497070019948,,,,,,,,,,,,,,,,,,,,,,,,,,,,,,030419_p1,001,2019_Mar_04_1017,body_behavioural,3.0.4,59.965027196159745,
6,,,,,,,0,6,6,6,2,0,2,0,,,,,,,,,,,,,,,,,,,,,,,,,,,,,,,space,0.3860645970053156,,,,,,,,,,,,,,,,,,,,,,,,,,,,,,030419_p1,001,2019_Mar_04_1017,body_behavioural,3.0.4,59.965027196159745,
6,The grocery store was not the place Emmanuella and Liam wanted to be at the moment considering they had been fighting beforehand to the point where Emmanuella was thinking of breaking up with Liam.,1,1,,,,0,6,6,6,,,,,0,0,0,0,,,,,,,,,,,,,,,,,,,,,,,,,,,,,1,6.1370223150006495,,,,,,,,,,,,,,,,,,,,,,,,,,,,030419_p1,001,2019_Mar_04_1017,body_behavioural,3.0.4,59.965027196159745,
6,"However, they had to go grocery shopping because they were hosting a dinner party for friends that evening and had no groceries. ",1,1,,,,0,6,6,6,,,,,0,1,1,1,,,,,,,,,,,,,,,,,,,,,,,,,,,,,1,1.7031290250015445,,,,,,,,,,,,,,,,,,,,,,,,,,,,030419_p1,001,2019_Mar_04_1017,body_behavioural,3.0.4,59.965027196159745,
6,The grocery store was dimly lit and had dark wood paneling for all the shelves.,1,1,,,,0,6,6,6,,,,,0,2,2,2,,,,,,,,,,,,,,,,,,,,,,,,,,,,,1,1.2337117780043627,,,,,,,,,,,,,,,,,,,,,,,,,,,,030419_p1,001,2019_Mar_04_1017,body_behavioural,3.0.4,59.965027196159745,
6,"The store specialized in organic produce and products catering to desires for high-end products, such as imported cheeses and sauces. ",1,1,,,,0,6,6,6,,,,,0,3,3,3,,,,,,,,,,,,,,,,,,,,,,,,,,,,,1,3.1532178970010136,,,,,,,,,,,,,,,,,,,,,,,,,,,,030419_p1,001,2019_Mar_04_1017,body_behavioural,3.0.4,59.965027196159745,
6,"Emmanuella felt angry as she headed immediately for the pasta section, and Liam trailed behind her. ",2,1,,,,0,6,6,6,,,,,0,4,4,4,,,,,,,,,,,,,,,,,,,,,,,,,,,,,1,1.7198103569971863,,,,,,,,,,,,,,,,,,,,,,,,,,,,030419_p1,001,2019_Mar_04_1017,body_behavioural,3.0.4,59.965027196159745,
6,Emmanuella selected a few boxes of linguine.,2,1,,,,0,6,6,6,,,,,0,5,5,5,,,,,,,,,,,,,,,,,,,,,,,,,,,,,1,2.787336632994993,,,,,,,,,,,,,,,,,,,,,,,,,,,,030419_p1,001,2019_Mar_04_1017,body_behavioural,3.0.4,59.965027196159745,
6,"“I guess we are having pasta tonight,” Liam said.",2,1,,,,0,6,6,6,,,,,0,6,6,6,,,,,,,,,,,,,,,,,,,,,,,,,,,,,1,1.3362389120011358,,,,,,,,,,,,,,,,,,,,,,,,,,,,030419_p1,001,2019_Mar_04_1017,body_behavioural,3.0.4,59.965027196159745,
6,"Emmanuella looked back at him and said, “Well if you were going to actually help cook, I would be fine with something else.”",2,1,,,,0,6,6,6,,,,,0,7,7,7,,,,,,,,,,,,,,,,,,,,,,,,,,,,,1,2.1364004319984815,,,,,,,,,,,,,,,,,,,,,,,,,,,,030419_p1,001,2019_Mar_04_1017,body_behavioural,3.0.4,59.965027196159745,
6,"Liam sighed, and finally said, “You don’t want me to help.",2,1,,,,0,6,6,6,,,,,0,8,8,8,,,,,,,,,,,,,,,,,,,,,,,,,,,,,1,1.953221224997833,,,,,,,,,,,,,,,,,,,,,,,,,,,,030419_p1,001,2019_Mar_04_1017,body_behavioural,3.0.4,59.965027196159745,
6,"I try to, but it seems like I always get in the way!” ",2,1,,,,0,6,6,6,,,,,0,9,9,9,,,,,,,,,,,,,,,,,,,,,,,,,,,,,1,1.719766560003336,,,,,,,,,,,,,,,,,,,,,,,,,,,,030419_p1,001,2019_Mar_04_1017,body_behavioural,3.0.4,59.965027196159745,
6,"Emmanuella angrily threw the pasta into the cart, losing her temper.",2,1,,,,0,6,6,6,,,,,0,10,10,10,,,,,,,,,,,,,,,,,,,,,,,,,,,,,1,3.903190232005727,,,,,,,,,,,,,,,,,,,,,,,,,,,,030419_p1,001,2019_Mar_04_1017,body_behavioural,3.0.4,59.965027196159745,
6," “Liam, you don’t even try!",2,1,,,,0,6,6,6,,,,,0,11,11,11,,,,,,,,,,,,,,,,,,,,,,,,,,,,,1,0.9695686169943656,,,,,,,,,,,,,,,,,,,,,,,,,,,,030419_p1,001,2019_Mar_04_1017,body_behavioural,3.0.4,59.965027196159745,
6,You know what?,2,1,,,,0,6,6,6,,,,,0,12,12,12,,,,,,,,,,,,,,,,,,,,,,,,,,,,,1,0.9370661900029518,,,,,,,,,,,,,,,,,,,,,,,,,,,,030419_p1,001,2019_Mar_04_1017,body_behavioural,3.0.4,59.965027196159745,
6,I don’t think I can do this anymore. ,2,2,,,,0,6,6,6,,,,,0,13,13,13,,,,,,,,,,,,,,,,,,,,,,,,,,,,,1,0.903670970001258,,,,,,,,,,,,,,,,,,,,,,,,,,,,030419_p1,001,2019_Mar_04_1017,body_behavioural,3.0.4,59.965027196159745,
6,"I was going to wait until after this unfortunately-timed dinner party tonight to talk about this, but I might as well say it now: I don’t want to be in a relationship with you anymore.",2,2,,,,0,6,6,6,,,,,0,14,14,14,,,,,,,,,,,,,,,,,,,,,,,,,,,,,1,2.736720411994611,,,,,,,,,,,,,,,,,,,,,,,,,,,,030419_p1,001,2019_Mar_04_1017,body_behavioural,3.0.4,59.965027196159745,
6," I’m tired of the constant fighting, and I feel like when we try to do anything fun anymore it ends up unpleasant for the stupidest reasons, and I am just past  trying to work things out.”",2,2,,,,0,6,6,6,,,,,0,15,15,15,,,,,,,,,,,,,,,,,,,,,,,,,,,,,1,4.520074125000974,,,,,,,,,,,,,,,,,,,,,,,,,,,,030419_p1,001,2019_Mar_04_1017,body_behavioural,3.0.4,59.965027196159745,
6,"Liam refused to look at her as she picked out sauces for the pasta, and then she threw up her hands, saying, “You know what, if this party is still happening we are going to just eat pasta.”",2,2,,,,0,6,6,6,,,,,0,16,16,16,,,,,,,,,,,,,,,,,,,,,,,,,,,,,1,4.753356786997756,,,,,,,,,,,,,,,,,,,,,,,,,,,,030419_p1,001,2019_Mar_04_1017,body_behavioural,3.0.4,59.965027196159745,
6,They headed to the checkout area where there was only one station open but it was not crowded at all.,3,2,,,,0,6,6,6,,,,,0,17,17,17,,,,,,,,,,,,,,,,,,,,,,,,,,,,,9,1.9364628180046566,,,,,,,,,,,,,,,,,,,,,,,,,,,,030419_p1,001,2019_Mar_04_1017,body_behavioural,3.0.4,59.965027196159745,
6,Emmanuella sighed and got in line while Liam pretended to be interested in the magazine racks as he thought. ,3,2,,,,0,6,6,6,,,,,0,18,18,18,,,,,,,,,,,,,,,,,,,,,,,,,,,,,1,2.186416625001584,,,,,,,,,,,,,,,,,,,,,,,,,,,,030419_p1,001,2019_Mar_04_1017,body_behavioural,3.0.4,59.965027196159745,
6,"Finally he turned to her and sighed, “Yes, I was thinking the same thing - I think we could definitely be happier with other people.” ",3,3,,,,0,6,6,6,,,,,0,19,19,19,,,,,,,,,,,,,,,,,,,,,,,,,,,,,1,2.334151094997651,,,,,,,,,,,,,,,,,,,,,,,,,,,,030419_p1,001,2019_Mar_04_1017,body_behavioural,3.0.4,59.965027196159745,
6,"As if she hadn't heard him, Emmanuella looked at their cart and said, “I'm not sure this will be enough, could you grab another box of pasta?”",3,3,,,,0,6,6,6,,,,,0,20,20,20,,,,,,,,,,,,,,,,,,,,,,,,,,,,,1,3.3532559749946813,,,,,,,,,,,,,,,,,,,,,,,,,,,,030419_p1,001,2019_Mar_04_1017,body_behavioural,3.0.4,59.965027196159745,
6, Liam scoffed and walked off to quickly get it.,3,3,,,,0,6,6,6,,,,,0,21,21,21,,,,,,,,,,,,,,,,,,,,,,,,,,,,,1,1.4030476499974611,,,,,,,,,,,,,,,,,,,,,,,,,,,,030419_p1,001,2019_Mar_04_1017,body_behavioural,3.0.4,59.965027196159745,
6,"As Emmanuella waited in line, she took a moment to compose herself, deciding that there was no reason to continue making a scene in the store. ",3,3,,,,0,6,6,6,,,,,0,22,22,22,,,,,,,,,,,,,,,,,,,,,,,,,,,,,1,2.485552521997306,,,,,,,,,,,,,,,,,,,,,,,,,,,,030419_p1,001,2019_Mar_04_1017,body_behavioural,3.0.4,59.965027196159745,
6," Right when Liam came back with the pasta, the cashier started scanning their groceries.",4,3,,,,0,6,6,6,,,,,0,23,23,23,,,,,,,,,,,,,,,,,,,,,,,,,,,,,1,1.9030477600026643,,,,,,,,,,,,,,,,,,,,,,,,,,,,030419_p1,001,2019_Mar_04_1017,body_behavioural,3.0.4,59.965027196159745,
6,"The cost came to $30, and Emmanuella paid with her credit card.",4,3,,,,0,6,6,6,,,,,0,24,24,24,,,,,,,,,,,,,,,,,,,,,,,,,,,,,1,2.5864771070046118,,,,,,,,,,,,,,,,,,,,,,,,,,,,030419_p1,001,2019_Mar_04_1017,body_behavioural,3.0.4,59.965027196159745,
6,"She asked Liam politely to take the bags, and he obliged, following her to toward the exit. ",4,3,,,,0,6,6,6,,,,,0,25,25,25,,,,,,,,,,,,,,,,,,,,,,,,,,,,,1,2.2531347449985333,,,,,,,,,,,,,,,,,,,,,,,,,,,,030419_p1,001,2019_Mar_04_1017,body_behavioural,3.0.4,59.965027196159745,
6,"“Liam, I think we are making the right decision.",4,4,,,,0,6,6,6,,,,,0,26,26,26,,,,,,,,,,,,,,,,,,,,,,,,,,,,,1,1.1197201969989692,,,,,,,,,,,,,,,,,,,,,,,,,,,,030419_p1,001,2019_Mar_04_1017,body_behavioural,3.0.4,59.965027196159745,
6,This is good.” ,4,4,,,,0,6,6,6,,,,,0,27,27,27,,,,,,,,,,,,,,,,,,,,,,,,,,,,,1,0.9029465599960531,,,,,,,,,,,,,,,,,,,,,,,,,,,,030419_p1,001,2019_Mar_04_1017,body_behavioural,3.0.4,59.965027196159745,
6,"“I agree,” he said, visibly relieved at the thought that they had gotten through the last fight they would ever need to have.",4,4,,,,0,6,6,6,,,,,0,28,28,28,,,,,,,,,,,,,,,,,,,,,,,,,,,,,1,2.86980179999955,,,,,,,,,,,,,,,,,,,,,,,,,,,,030419_p1,001,2019_Mar_04_1017,body_behavioural,3.0.4,59.965027196159745,
6,"“I think we can still host this dinner tonight, as long as you're still on board,” Emmanuella said.",4,4,,,,0,6,6,6,,,,,0,29,29,29,,,,,,,,,,,,,,,,,,,,,,,,,,,,,1,4.170044942002278,,,,,,,,,,,,,,,,,,,,,,,,,,,,030419_p1,001,2019_Mar_04_1017,body_behavioural,3.0.4,59.965027196159745,
6,"Liam nodded, “Yes, let’s just not tell anyone yet.” ",4,4,,,,0,6,6,6,,,,,0,30,30,30,,,,,,,,,,,,,,,,,,,,,,,,,,,,,1,1.1189979250048054,,,,,,,,,,,,,,,,,,,,,,,,,,,,030419_p1,001,2019_Mar_04_1017,body_behavioural,3.0.4,59.965027196159745,
6,"Emmanuella laughed, “Whoever leaks it loses their rights to the cat.”",4,4,,,,0,6,6,6,,,,,0,31,31,31,,,,,,,,,,,,,,,,,,,,,,,,,,,,,1,2.433896911999909,,,,,,,,,,,,,,,,,,,,,,,,,,,,030419_p1,001,2019_Mar_04_1017,body_behavioural,3.0.4,59.965027196159745,
6,"Liam rolled his eyes and managed a weak chuckle, knowing the cat would be a whole other issue to sort out later.
",4,4,,,,0,6,6,6,,,,,0,32,32,32,,,,,,,,,,,,,,,,,,,,,,,,,,,,,1,4.050934729995788,,,,,,,,,,,,,,,,,,,,,,,,,,,,030419_p1,001,2019_Mar_04_1017,body_behavioural,3.0.4,59.965027196159745,
6,,,,,,,0,6,6,6,,,,,,,,,,,,,,,,,,,,,,,,,,,,,,,,,,,,,,,,,,,,,,,,,,,,,,,,,,,,,,,,,,030419_p1,001,2019_Mar_04_1017,body_behavioural,3.0.4,59.965027196159745,
7,,,,,,,0,7,7,7,0,0,0,0,,,,,,,,,,,,,,,,,,,,,,,,,,,space,0.9863414779974846,space,0.8030130669940263,space,1.2362402400030987,,,,,,,,,,,,,,,,,,,,,,,,,,,,,,030419_p1,001,2019_Mar_04_1017,body_behavioural,3.0.4,59.965027196159745,
7,,,,,,,0,7,7,7,1,0,1,0,,,,,,,,,,,,,,,,,,,,,,,,,,,,,,,space,0.5377219000001787,,,,,,,,,,,,,,,,,,,,,,,,,,,,,,030419_p1,001,2019_Mar_04_1017,body_behavioural,3.0.4,59.965027196159745,
7,,,,,,,0,7,7,7,2,0,2,0,,,,,,,,,,,,,,,,,,,,,,,,,,,,,,,space,0.3697394369955873,,,,,,,,,,,,,,,,,,,,,,,,,,,,,,030419_p1,001,2019_Mar_04_1017,body_behavioural,3.0.4,59.965027196159745,
7,,,,,,,0,7,7,7,3,0,3,0,,,,,,,,,,,,,,,,,,,,,,,,,,,,,,,space,0.40290630500385305,,,,,,,,,,,,,,,,,,,,,,,,,,,,,,030419_p1,001,2019_Mar_04_1017,body_behavioural,3.0.4,59.965027196159745,
7,"Maria walked into lecture beside Henry, and she was mentally rehearsing what she should say to break up with him.",1,1,,,,0,7,7,7,,,,,0,0,0,0,,,,,,,,,,,,,,,,,,,,,,,,,,,,,1,5.5865743850008585,,,,,,,,,,,,,,,,,,,,,,,,,,,,030419_p1,001,2019_Mar_04_1017,body_behavioural,3.0.4,59.965027196159745,
7,"She had been putting it off with a growing sense of dread, and now this lecture was the last chance before she had to leave campus. ",1,1,,,,0,7,7,7,,,,,0,1,1,1,,,,,,,,,,,,,,,,,,,,,,,,,,,,,1,2.153226194997842,,,,,,,,,,,,,,,,,,,,,,,,,,,,030419_p1,001,2019_Mar_04_1017,body_behavioural,3.0.4,59.965027196159745,
7,"The lecture hall was large, with a stage for the lecturer in the front of the room, and tiered seats that stretched up in 15 stacked rows. ",1,1,,,,0,7,7,7,,,,,0,2,2,2,,,,,,,,,,,,,,,,,,,,,,,,,,,,,1,3.5031137320038397,,,,,,,,,,,,,,,,,,,,,,,,,,,,030419_p1,001,2019_Mar_04_1017,body_behavioural,3.0.4,59.965027196159745,
7,"The clock struck 3 pm, and Maria and Henry slid into neighboring seats near the back of the room.",1,1,,,,0,7,7,7,,,,,0,3,3,3,,,,,,,,,,,,,,,,,,,,,,,,,,,,,1,2.3364964549982687,,,,,,,,,,,,,,,,,,,,,,,,,,,,030419_p1,001,2019_Mar_04_1017,body_behavioural,3.0.4,59.965027196159745,
7,"“Good afternoon, everybody,” said the professor, fiddling to connect his laptop with the projector.",2,1,,,,0,7,7,7,,,,,0,4,4,4,,,,,,,,,,,,,,,,,,,,,,,,,,,,,1,2.069781817001058,,,,,,,,,,,,,,,,,,,,,,,,,,,,030419_p1,001,2019_Mar_04_1017,body_behavioural,3.0.4,59.965027196159745,
7,“Welcome to week 4 of Intro to Ancient Philosophy. ,2,1,,,,0,7,7,7,,,,,0,5,5,5,,,,,,,,,,,,,,,,,,,,,,,,,,,,,1,1.5174391719992855,,,,,,,,,,,,,,,,,,,,,,,,,,,,030419_p1,001,2019_Mar_04_1017,body_behavioural,3.0.4,59.965027196159745,
7,Today we are going to continue our lecture on Aristotelian Philosophy.”,2,1,,,,0,7,7,7,,,,,0,6,6,6,,,,,,,,,,,,,,,,,,,,,,,,,,,,,1,1.7031031520018587,,,,,,,,,,,,,,,,,,,,,,,,,,,,030419_p1,001,2019_Mar_04_1017,body_behavioural,3.0.4,59.965027196159745,
7,Everyone in class pulled out their notebooks and settled in their seats as the slides appeared on the large front screens.,2,1,,,,0,7,7,7,,,,,0,7,7,7,,,,,,,,,,,,,,,,,,,,,,,,,,,,,9,1.2030961020063842,,,,,,,,,,,,,,,,,,,,,,,,,,,,030419_p1,001,2019_Mar_04_1017,body_behavioural,3.0.4,59.965027196159745,
7,"“Henry,” Maria whispered.",2,1,,,,0,7,7,7,,,,,0,8,8,8,,,,,,,,,,,,,,,,,,,,,,,,,,,,,1,1.3526529570008279,,,,,,,,,,,,,,,,,,,,,,,,,,,,030419_p1,001,2019_Mar_04_1017,body_behavioural,3.0.4,59.965027196159745,
7,"“Hmm?” he replied, distracted.",2,1,,,,0,7,7,7,,,,,0,9,9,9,,,,,,,,,,,,,,,,,,,,,,,,,,,,,1,0.986360014998354,,,,,,,,,,,,,,,,,,,,,,,,,,,,030419_p1,001,2019_Mar_04_1017,body_behavioural,3.0.4,59.965027196159745,
7,"“Henry, I need to tell you something really important, and I don’t know when else I’ll have a chance to do it,” she said.",2,1,,,,0,7,7,7,,,,,0,10,10,10,,,,,,,,,,,,,,,,,,,,,,,,,,,,,1,1.6364697349999915,,,,,,,,,,,,,,,,,,,,,,,,,,,,030419_p1,001,2019_Mar_04_1017,body_behavioural,3.0.4,59.965027196159745,
7,"“Okay, what's up?”, he said, tilting his head close to her. ",2,1,,,,0,7,7,7,,,,,0,11,11,11,,,,,,,,,,,,,,,,,,,,,,,,,,,,,1,1.7863897219940554,,,,,,,,,,,,,,,,,,,,,,,,,,,,030419_p1,001,2019_Mar_04_1017,body_behavioural,3.0.4,59.965027196159745,
7," “Henry, I don’t think I can do long distance.",2,2,,,,0,7,7,7,,,,,0,12,12,12,,,,,,,,,,,,,,,,,,,,,,,,,,,,,1,1.2363318450006773,,,,,,,,,,,,,,,,,,,,,,,,,,,,030419_p1,001,2019_Mar_04_1017,body_behavioural,3.0.4,59.965027196159745,
7,"I think what we have here is great, but I think it will be really hard when we are so far apart for such an extended period.",2,2,,,,0,7,7,7,,,,,0,13,13,13,,,,,,,,,,,,,,,,,,,,,,,,,,,,,1,1.986092892002489,,,,,,,,,,,,,,,,,,,,,,,,,,,,030419_p1,001,2019_Mar_04_1017,body_behavioural,3.0.4,59.965027196159745,
7,"I’m sorry I’m telling you now in lecture, but I'm out of time, and it’s taken me awhile to come to this decision.",2,2,,,,0,7,7,7,,,,,0,14,14,14,,,,,,,,,,,,,,,,,,,,,,,,,,,,,1,2.919615988001169,,,,,,,,,,,,,,,,,,,,,,,,,,,,030419_p1,001,2019_Mar_04_1017,body_behavioural,3.0.4,59.965027196159745,
7,"I really think this is best, and who knows what will happen when I get back from my study abroad.” ",2,2,,,,0,7,7,7,,,,,0,15,15,15,,,,,,,,,,,,,,,,,,,,,,,,,,,,,1,3.8363074279986904,,,,,,,,,,,,,,,,,,,,,,,,,,,,030419_p1,001,2019_Mar_04_1017,body_behavioural,3.0.4,59.965027196159745,
