2,"“Uh no, why?” ",2,2,,,,0,2,2,2,,,,,0,19,19,19,,,,,,,,,,,,,,,,,,,,,,,,,,,,,1,1.4710847769965767,,,,,,,,,,,,,,,,,,,,,,,,,,,,030419_p1,001,2019_Mar_04_1017,body_behavioural,3.0.4,59.965027196159745,
2,"“Because I’ve been stung by one, and since then, things like bumping into doors seem like pretty small potatoes.” ",2,2,,,,0,2,2,2,,,,,0,20,20,20,,,,,,,,,,,,,,,,,,,,,,,,,,,,,1,1.9718959719975828,,,,,,,,,,,,,,,,,,,,,,,,,,,,030419_p1,001,2019_Mar_04_1017,body_behavioural,3.0.4,59.965027196159745,
2,"They carried on talking, and Teresa told him all about her encounter with a Deathstalker scorpion while she was studying abroad in Egypt.",2,2,,,,0,2,2,2,,,,,0,21,21,21,,,,,,,,,,,,,,,,,,,,,,,,,,,,,1,3.20460998499766,,,,,,,,,,,,,,,,,,,,,,,,,,,,030419_p1,001,2019_Mar_04_1017,body_behavioural,3.0.4,59.965027196159745,
2,"After a few minutes, the waitress behind the counter came up to them, “Alrighty, can I take you order?” ",3,3,,,,0,2,2,2,,,,,0,22,22,22,,,,,,,,,,,,,,,,,,,,,,,,,,,,,9,1.2548164000036195,,,,,,,,,,,,,,,,,,,,,,,,,,,,030419_p1,001,2019_Mar_04_1017,body_behavioural,3.0.4,59.965027196159745,
2,"She first looked at Teresa who answered, “I’ll have a Western Omelette and a glass of milk.”",3,3,,,,0,2,2,2,,,,,0,23,23,23,,,,,,,,,,,,,,,,,,,,,,,,,,,,,9,2.0007718320048298,,,,,,,,,,,,,,,,,,,,,,,,,,,,030419_p1,001,2019_Mar_04_1017,body_behavioural,3.0.4,59.965027196159745,
2,Then the waitress turned to James.,3,3,,,,0,2,2,2,,,,,0,24,24,24,,,,,,,,,,,,,,,,,,,,,,,,,,,,,9,1.088024630000291,,,,,,,,,,,,,,,,,,,,,,,,,,,,030419_p1,001,2019_Mar_04_1017,body_behavioural,3.0.4,59.965027196159745,
2,"James said, “I’ll have the chocolate chip pancakes and a coffee.” ",3,3,,,,0,2,2,2,,,,,0,25,25,25,,,,,,,,,,,,,,,,,,,,,,,,,,,,,9,1.234425127004215,,,,,,,,,,,,,,,,,,,,,,,,,,,,030419_p1,001,2019_Mar_04_1017,body_behavioural,3.0.4,59.965027196159745,
2,"“Alrighty, comin’ right up!”",3,3,,,,0,2,2,2,,,,,0,26,26,26,,,,,,,,,,,,,,,,,,,,,,,,,,,,,9,1.0547079219977604,,,,,,,,,,,,,,,,,,,,,,,,,,,,030419_p1,001,2019_Mar_04_1017,body_behavioural,3.0.4,59.965027196159745,
2,"They picked up their conversation, and James ended up telling Teresa about a concert he was going to later. ",3,3,,,,0,2,2,2,,,,,0,27,27,27,,,,,,,,,,,,,,,,,,,,,,,,,,,,,9,1.4219067320009344,,,,,,,,,,,,,,,,,,,,,,,,,,,,030419_p1,001,2019_Mar_04_1017,body_behavioural,3.0.4,59.965027196159745,
2,"He invited her to come along, promising her that the concert would be indoors and absolutely free of venomous insects.",3,3,,,,0,2,2,2,,,,,0,28,28,28,,,,,,,,,,,,,,,,,,,,,,,,,,,,,9,1.6382505999936257,,,,,,,,,,,,,,,,,,,,,,,,,,,,030419_p1,001,2019_Mar_04_1017,body_behavioural,3.0.4,59.965027196159745,
2,"Teresa agreed, gave him her number, and they worked out that James would pick her up before the concert and drive them there.",3,3,,,,0,2,2,2,,,,,0,29,29,29,,,,,,,,,,,,,,,,,,,,,,,,,,,,,1,2.9883095100012724,,,,,,,,,,,,,,,,,,,,,,,,,,,,030419_p1,001,2019_Mar_04_1017,body_behavioural,3.0.4,59.965027196159745,
2,"This was not what they had expected from their solitary lunch plans and were both excited, even though Teresa was doing a much better job of hiding it than James. ",3,3,,,,0,2,2,2,,,,,0,30,30,30,,,,,,,,,,,,,,,,,,,,,,,,,,,,,1,6.388088274994516,,,,,,,,,,,,,,,,,,,,,,,,,,,,030419_p1,001,2019_Mar_04_1017,body_behavioural,3.0.4,59.965027196159745,
2," After awhile,  the waitress brought out their food, and James took this opportunity to scoot closer to her on the log bench. ",4,4,,,,0,2,2,2,,,,,0,31,31,31,,,,,,,,,,,,,,,,,,,,,,,,,,,,,9,1.7865938920003828,,,,,,,,,,,,,,,,,,,,,,,,,,,,030419_p1,001,2019_Mar_04_1017,body_behavioural,3.0.4,59.965027196159745,
2,"Teresa was happy to share the meal with James, despite their food tasting pretty bad. ",4,4,,,,0,2,2,2,,,,,0,32,32,32,,,,,,,,,,,,,,,,,,,,,,,,,,,,,9,1.2884547210051096,,,,,,,,,,,,,,,,,,,,,,,,,,,,030419_p1,001,2019_Mar_04_1017,body_behavioural,3.0.4,59.965027196159745,
2,"Judging by how salty the pancakes tasted, they suspected that the chef had confused the salt and sugar.",4,4,,,,0,2,2,2,,,,,0,33,33,33,,,,,,,,,,,,,,,,,,,,,,,,,,,,,1,2.5343030099975294,,,,,,,,,,,,,,,,,,,,,,,,,,,,030419_p1,001,2019_Mar_04_1017,body_behavioural,3.0.4,59.965027196159745,
2,"When the meal was over, they got up, hugged, and parted ways. ",4,4,,,,0,2,2,2,,,,,0,34,34,34,,,,,,,,,,,,,,,,,,,,,,,,,,,,,1,0.9845203279983252,,,,,,,,,,,,,,,,,,,,,,,,,,,,030419_p1,001,2019_Mar_04_1017,body_behavioural,3.0.4,59.965027196159745,
2,"James said,“I have to run, got to get to work.",4,4,,,,0,2,2,2,,,,,0,35,35,35,,,,,,,,,,,,,,,,,,,,,,,,,,,,,1,0.9547995050015743,,,,,,,,,,,,,,,,,,,,,,,,,,,,030419_p1,001,2019_Mar_04_1017,body_behavioural,3.0.4,59.965027196159745,
2,See you tonight!”,4,4,,,,0,2,2,2,,,,,0,36,36,36,,,,,,,,,,,,,,,,,,,,,,,,,,,,,1,0.6673608970013447,,,,,,,,,,,,,,,,,,,,,,,,,,,,030419_p1,001,2019_Mar_04_1017,body_behavioural,3.0.4,59.965027196159745,
2,"Teresa smiled and walked towards the door without looking, and almost ran into the door again. ",4,4,,,,0,2,2,2,,,,,0,37,37,37,,,,,,,,,,,,,,,,,,,,,,,,,,,,,1,1.37177016500209,,,,,,,,,,,,,,,,,,,,,,,,,,,,030419_p1,001,2019_Mar_04_1017,body_behavioural,3.0.4,59.965027196159745,
2,They both laughed and smiled once more goodbye. ,4,4,,,,0,2,2,2,,,,,0,38,38,38,,,,,,,,,,,,,,,,,,,,,,,,,,,,,1,1.021291924000252,,,,,,,,,,,,,,,,,,,,,,,,,,,,030419_p1,001,2019_Mar_04_1017,body_behavioural,3.0.4,59.965027196159745,
2,,,,,,,0,2,2,2,,,,,,,,,,,,,,,,,,,,,,,,,,,,,,,,,,,,,,,,,,,,,,,,,,,,,,,,,,,,,,,,,,030419_p1,001,2019_Mar_04_1017,body_behavioural,3.0.4,59.965027196159745,
3,,,,,,,0,3,3,3,0,0,0,0,,,,,,,,,,,,,,,,,,,,,,,,,,,space,1.2844112980019418,space,0.7544755670023733,space,0.9047501480017672,,,,,,,,,,,,,,,,,,,,,,,,,,,,,,030419_p1,001,2019_Mar_04_1017,body_behavioural,3.0.4,59.965027196159745,
3,,,,,,,0,3,3,3,1,0,1,0,,,,,,,,,,,,,,,,,,,,,,,,,,,,,,,space,0.7379102600025362,,,,,,,,,,,,,,,,,,,,,,,,,,,,,,030419_p1,001,2019_Mar_04_1017,body_behavioural,3.0.4,59.965027196159745,
3,,,,,,,0,3,3,3,2,0,2,0,,,,,,,,,,,,,,,,,,,,,,,,,,,,,,,space,0.4864307230018312,,,,,,,,,,,,,,,,,,,,,,,,,,,,,,030419_p1,001,2019_Mar_04_1017,body_behavioural,3.0.4,59.965027196159745,
3,"Ms. Bianchi and Ms. Morrison walked into the grocery store at the same time, and, after a moment of mutual recognition, greeted each other and shook hands.",1,1,,,,0,3,3,3,,,,,0,0,0,0,,,,,,,,,,,,,,,,,,,,,,,,,,,,,1,3.9217559850003454,,,,,,,,,,,,,,,,,,,,,,,,,,,,030419_p1,001,2019_Mar_04_1017,body_behavioural,3.0.4,59.965027196159745,
3,"“Thank you again for inviting me here to discuss my business proposal,” said Ms. Bianchi, “And it’s a pleasure to be out of the office.” ",1,1,,,,0,3,3,3,,,,,0,1,1,1,,,,,,,,,,,,,,,,,,,,,,,,,,,,,1,1.6214234599974588,,,,,,,,,,,,,,,,,,,,,,,,,,,,030419_p1,001,2019_Mar_04_1017,body_behavioural,3.0.4,59.965027196159745,
3,"As a salesperson for an Italian cheese company that was trying to expand its outreach to more mainstream grocery stores, this meeting could be a big break for her.",1,1,,,,0,3,3,3,,,,,0,2,2,2,,,,,,,,,,,,,,,,,,,,,,,,,,,,,9,4.588644172996283,,,,,,,,,,,,,,,,,,,,,,,,,,,,030419_p1,001,2019_Mar_04_1017,body_behavioural,3.0.4,59.965027196159745,
3,"Her sales target, Ms. Morrison,  who had a reputation for being a bit quirky, was a corporate buyer for a large chain grocery store. ",1,1,,,,0,3,3,3,,,,,0,3,3,3,,,,,,,,,,,,,,,,,,,,,,,,,,,,,9,2.2547672300061095,,,,,,,,,,,,,,,,,,,,,,,,,,,,030419_p1,001,2019_Mar_04_1017,body_behavioural,3.0.4,59.965027196159745,
3,"She was known for doing things unconventionally: for example, she said that she liked to make deals with suppliers in the place where the products were sold- “to keep their minds focused on what’s important.” ",1,1,,,,0,3,3,3,,,,,0,4,4,4,,,,,,,,,,,,,,,,,,,,,,,,,,,,,1,3.504915606994473,,,,,,,,,,,,,,,,,,,,,,,,,,,,030419_p1,001,2019_Mar_04_1017,body_behavioural,3.0.4,59.965027196159745,
3,"They chatted a little in the front of the grocery store, which was surrounded by pumpkins and halloween decorations set up in special displays for the holiday season.",1,1,,,,0,3,3,3,,,,,0,5,5,5,,,,,,,,,,,,,,,,,,,,,,,,,,,,,1,4.0508371719988645,,,,,,,,,,,,,,,,,,,,,,,,,,,,030419_p1,001,2019_Mar_04_1017,body_behavioural,3.0.4,59.965027196159745,
3,"Ms. Bianchi and Ms. Morrison walked to the cheese section, and Ms. Morrison picked up a block of parmesan.",2,1,,,,0,3,3,3,,,,,0,6,6,6,,,,,,,,,,,,,,,,,,,,,,,,,,,,,1,1.3060729920034646,,,,,,,,,,,,,,,,,,,,,,,,,,,,030419_p1,001,2019_Mar_04_1017,body_behavioural,3.0.4,59.965027196159745,
3,“We have quite a selection here.,2,1,,,,0,3,3,3,,,,,0,7,7,7,,,,,,,,,,,,,,,,,,,,,,,,,,,,,1,0.7551424600023893,,,,,,,,,,,,,,,,,,,,,,,,,,,,030419_p1,001,2019_Mar_04_1017,body_behavioural,3.0.4,59.965027196159745,
3,I don’t know that it needs an additional section for more gourmet cheeses.” ,2,1,,,,0,3,3,3,,,,,0,8,8,8,,,,,,,,,,,,,,,,,,,,,,,,,,,,,1,1.4882276150019607,,,,,,,,,,,,,,,,,,,,,,,,,,,,030419_p1,001,2019_Mar_04_1017,body_behavioural,3.0.4,59.965027196159745,
3,"Ms. Bianchi's confidence faltered for a minute at this remark, but then she launched into her prepared pitch.",2,1,,,,0,3,3,3,,,,,0,9,9,9,,,,,,,,,,,,,,,,,,,,,,,,,,,,,1,2.4396438039984787,,,,,,,,,,,,,,,,,,,,,,,,,,,,030419_p1,001,2019_Mar_04_1017,body_behavioural,3.0.4,59.965027196159745,
3," “Ms. Morrison, I think you would agree that selling food is more than just providing variety, but also about providing the highest quality.",2,2,,,,0,3,3,3,,,,,0,10,10,10,,,,,,,,,,,,,,,,,,,,,,,,,,,,,1,3.0715692100056913,,,,,,,,,,,,,,,,,,,,,,,,,,,,030419_p1,001,2019_Mar_04_1017,body_behavioural,3.0.4,59.965027196159745,
3,"You don’t have cheeses made in America that are like ours, it is true.",2,2,,,,0,3,3,3,,,,,0,11,11,11,,,,,,,,,,,,,,,,,,,,,,,,,,,,,1,1.6215672050020657,,,,,,,,,,,,,,,,,,,,,,,,,,,,030419_p1,001,2019_Mar_04_1017,body_behavioural,3.0.4,59.965027196159745,
3,Your store could be providing American consumers with a dimension in taste that they've never known before with our product.,2,2,,,,0,3,3,3,,,,,0,12,12,12,,,,,,,,,,,,,,,,,,,,,,,,,,,,,1,1.451143674996274,,,,,,,,,,,,,,,,,,,,,,,,,,,,030419_p1,001,2019_Mar_04_1017,body_behavioural,3.0.4,59.965027196159745,
3,"I propose that you give it a shot, buy $1000 worth of cheese products for a few stores, and see how the sales increase not only in our cheeses but also in products related to cheeses: crackers, jams, olives. ",2,2,,,,0,3,3,3,,,,,0,13,13,13,,,,,,,,,,,,,,,,,,,,,,,,,,,,,1,5.372270239997306,,,,,,,,,,,,,,,,,,,,,,,,,,,,030419_p1,001,2019_Mar_04_1017,body_behavioural,3.0.4,59.965027196159745,
3,"The availability of a finer product leads to the appreciation of the product, and your consumers will start to consume in a new, more profitable way.”",2,2,,,,0,3,3,3,,,,,0,14,14,14,,,,,,,,,,,,,,,,,,,,,,,,,,,,,1,3.688334862003103,,,,,,,,,,,,,,,,,,,,,,,,,,,,030419_p1,001,2019_Mar_04_1017,body_behavioural,3.0.4,59.965027196159745,
3,"Ms. Bianchi picked up a box of crackers by the cheese section, and said, “Here, I will buy these, and we can try some of our cheeses that I've brought with me.”",2,2,,,,0,3,3,3,,,,,0,15,15,15,,,,,,,,,,,,,,,,,,,,,,,,,,,,,1,3.3719066949997796,,,,,,,,,,,,,,,,,,,,,,,,,,,,030419_p1,001,2019_Mar_04_1017,body_behavioural,3.0.4,59.965027196159745,
3,"Ms. Morrison, who was thinking, nodded in agreement and said, “That sounds like a great idea.",2,2,,,,0,3,3,3,,,,,0,16,16,16,,,,,,,,,,,,,,,,,,,,,,,,,,,,,1,1.617485119997582,,,,,,,,,,,,,,,,,,,,,,,,,,,,030419_p1,001,2019_Mar_04_1017,body_behavioural,3.0.4,59.965027196159745,
3,"Let’s head to check out, and those crackers are on me.” ",2,2,,,,0,3,3,3,,,,,0,17,17,17,,,,,,,,,,,,,,,,,,,,,,,,,,,,,1,1.0698687240001163,,,,,,,,,,,,,,,,,,,,,,,,,,,,030419_p1,001,2019_Mar_04_1017,body_behavioural,3.0.4,59.965027196159745,
3,They walked over to the checkout area.,3,2,,,,0,3,3,3,,,,,0,18,18,18,,,,,,,,,,,,,,,,,,,,,,,,,,,,,1,1.138205149996793,,,,,,,,,,,,,,,,,,,,,,,,,,,,030419_p1,001,2019_Mar_04_1017,body_behavioural,3.0.4,59.965027196159745,
3,"There was a very long line, and it was very busy in the checkout area as people were stocking up for Halloween parties and trick-or-treating. ",3,2,,,,0,3,3,3,,,,,0,19,19,19,,,,,,,,,,,,,,,,,,,,,,,,,,,,,9,1.7215685870032758,,,,,,,,,,,,,,,,,,,,,,,,,,,,030419_p1,001,2019_Mar_04_1017,body_behavioural,3.0.4,59.965027196159745,
3,"Since they had almost a 10 minute wait in line, Ms. Bianchi handed a sheet with printed graphs to Ms. Morrison the increase in profits that several other stores had seen after starting to carry their products.",3,2,,,,0,3,3,3,,,,,0,20,20,20,,,,,,,,,,,,,,,,,,,,,,,,,,,,,1,3.7507204249995993,,,,,,,,,,,,,,,,,,,,,,,,,,,,030419_p1,001,2019_Mar_04_1017,body_behavioural,3.0.4,59.965027196159745,
3,"Eventually, Ms. Morrison replied, “You know what, I think you've convinced me that this could work. ",3,3,,,,0,3,3,3,,,,,0,21,21,21,,,,,,,,,,,,,,,,,,,,,,,,,,,,,1,1.3549956470014877,,,,,,,,,,,,,,,,,,,,,,,,,,,,030419_p1,001,2019_Mar_04_1017,body_behavioural,3.0.4,59.965027196159745,
3,We've been trying to find a way to add a little European cachet to our stores.,3,3,,,,0,3,3,3,,,,,0,22,22,22,,,,,,,,,,,,,,,,,,,,,,,,,,,,,1,1.638783943002636,,,,,,,,,,,,,,,,,,,,,,,,,,,,030419_p1,001,2019_Mar_04_1017,body_behavioural,3.0.4,59.965027196159745,
3,There's still a problem though - I'm worried we'll be paying out the nose for the import taxes.,3,3,,,,0,3,3,3,,,,,0,23,23,23,,,,,,,,,,,,,,,,,,,,,,,,,,,,,1,2.3882308799948078,,,,,,,,,,,,,,,,,,,,,,,,,,,,030419_p1,001,2019_Mar_04_1017,body_behavioural,3.0.4,59.965027196159745,
3,Is that the case?",3,3,,,,0,3,3,3,,,,,0,24,24,24,,,,,,,,,,,,,,,,,,,,,,,,,,,,,1,1.387724171996524,,,,,,,,,,,,,,,,,,,,,,,,,,,,030419_p1,001,2019_Mar_04_1017,body_behavioural,3.0.4,59.965027196159745,
3,"It was Ms. Morrison’s turn to checkout, and the two businesswomen continued to talk back and forth as she did so. ",4,3,,,,0,3,3,3,,,,,0,25,25,25,,,,,,,,,,,,,,,,,,,,,,,,,,,,,1,2.538176250003744,,,,,,,,,,,,,,,,,,,,,,,,,,,,030419_p1,001,2019_Mar_04_1017,body_behavioural,3.0.4,59.965027196159745,
3,"The cashier scanned the crackers, and Ms. Bianchi watched in amusement as Ms. Morrison paid the $6 price entirely in quarters from a wallet bulging with change.",4,3,,,,0,3,3,3,,,,,0,26,26,26,,,,,,,,,,,,,,,,,,,,,,,,,,,,,9,4.354912855000293,,,,,,,,,,,,,,,,,,,,,,,,,,,,030419_p1,001,2019_Mar_04_1017,body_behavioural,3.0.4,59.965027196159745,
3,"They shortly came to an agreement and would have enough cheese shipments, $5000 worth, to different stores to qualify for a subsidized import tax. ",4,4,,,,0,3,3,3,,,,,0,27,27,27,,,,,,,,,,,,,,,,,,,,,,,,,,,,,1,2.6546255470020697,,,,,,,,,,,,,,,,,,,,,,,,,,,,030419_p1,001,2019_Mar_04_1017,body_behavioural,3.0.4,59.965027196159745,
3,"Ms. Bianchi retrieved some of her samples from her car, and they toasted their new deal with crackers topped with fresh mozzarella. ",4,4,,,,0,3,3,3,,,,,0,28,28,28,,,,,,,,,,,,,,,,,,,,,,,,,,,,,1,4.237866021998343,,,,,,,,,,,,,,,,,,,,,,,,,,,,030419_p1,001,2019_Mar_04_1017,body_behavioural,3.0.4,59.965027196159745,
3,,,,,,,0,3,3,3,,,,,,,,,,,,,,,,,,,,,,,,,,,,,,,,,,,,,,,,,,,,,,,,,,,,,,,,,,,,,,,,,,030419_p1,001,2019_Mar_04_1017,body_behavioural,3.0.4,59.965027196159745,
4,,,,,,,0,4,4,4,0,0,0,0,,,,,,,,,,,,,,,,,,,,,,,,,,,space,1.3215752219985006,space,0.7045791150012519,space,0.6840169100032654,,,,,,,,,,,,,,,,,,,,,,,,,,,,,,030419_p1,001,2019_Mar_04_1017,body_behavioural,3.0.4,59.965027196159745,
4,David saw Anna for the first time when she burst into the airport with her bag skidding behind her half-zipped. ,1,1,,,,0,4,4,4,,,,,0,0,0,0,,,,,,,,,,,,,,,,,,,,,,,,,,,,,1,5.9676850179967005,,,,,,,,,,,,,,,,,,,,,,,,,,,,030419_p1,001,2019_Mar_04_1017,body_behavioural,3.0.4,59.965027196159745,
4,"He had three hours until his flight, but she clearly had less than one.",1,1,,,,0,4,4,4,,,,,0,1,1,1,,,,,,,,,,,,,,,,,,,,,,,,,,,,,1,1.539225403997989,,,,,,,,,,,,,,,,,,,,,,,,,,,,030419_p1,001,2019_Mar_04_1017,body_behavioural,3.0.4,59.965027196159745,
4,"Anna’s yoga class had ran over, and afterwards, she, forgetting the time, had lingered to talk with friends. ",1,1,,,,0,4,4,4,,,,,0,2,2,2,,,,,,,,,,,,,,,,,,,,,,,,,,,,,1,2.9174532780016307,,,,,,,,,,,,,,,,,,,,,,,,,,,,030419_p1,001,2019_Mar_04_1017,body_behavioural,3.0.4,59.965027196159745,
4,"Despite Anna's frazzled state, David was instantly intrigued by her.",1,1,,,,0,4,4,4,,,,,0,3,3,3,,,,,,,,,,,,,,,,,,,,,,,,,,,,,1,1.3547094719979214,,,,,,,,,,,,,,,,,,,,,,,,,,,,030419_p1,001,2019_Mar_04_1017,body_behavioural,3.0.4,59.965027196159745,
4,"He thought she was beautiful, and she reminded him of one of his favorite paintings.",1,1,,,,0,4,4,4,,,,,0,4,4,4,,,,,,,,,,,,,,,,,,,,,,,,,,,,,1,2.0044251500003156,,,,,,,,,,,,,,,,,,,,,,,,,,,,030419_p1,001,2019_Mar_04_1017,body_behavioural,3.0.4,59.965027196159745,
4,"Anna, a few strides into the airport, suddenly realized her shoes were untied, so she hunched over to tie them.",1,1,,,,0,4,4,4,,,,,0,5,5,5,,,,,,,,,,,,,,,,,,,,,,,,,,,,,1,3.3045581039987155,,,,,,,,,,,,,,,,,,,,,,,,,,,,030419_p1,001,2019_Mar_04_1017,body_behavioural,3.0.4,59.965027196159745,
4,David observed that someone with a tall cart of luggage was heading straight for where Anna was kneeling. ,1,1,,,,0,4,4,4,,,,,0,6,6,6,,,,,,,,,,,,,,,,,,,,,,,,,,,,,1,2.154897622000135,,,,,,,,,,,,,,,,,,,,,,,,,,,,030419_p1,001,2019_Mar_04_1017,body_behavioural,3.0.4,59.965027196159745,
4,Both Anna and the person driving the cart were oblivious to the impending collision. ,1,1,,,,0,4,4,4,,,,,0,7,7,7,,,,,,,,,,,,,,,,,,,,,,,,,,,,,1,1.9213750700000674,,,,,,,,,,,,,,,,,,,,,,,,,,,,030419_p1,001,2019_Mar_04_1017,body_behavioural,3.0.4,59.965027196159745,
4,"David had to intervene, and he ran in front of the cart pushing her out of the way just in the nick of time, and they tumbled on the airport floor. ",1,2,,,,0,4,4,4,,,,,0,8,8,8,,,,,,,,,,,,,,,,,,,,,,,,,,,,,1,2.185994874998869,,,,,,,,,,,,,,,,,,,,,,,,,,,,030419_p1,001,2019_Mar_04_1017,body_behavioural,3.0.4,59.965027196159745,
4,"Anna, bewildered, looked up and saw the cart pass by and then looked over at David. ",1,2,,,,0,4,4,4,,,,,0,9,9,9,,,,,,,,,,,,,,,,,,,,,,,,,,,,,1,1.667250790000253,,,,,,,,,,,,,,,,,,,,,,,,,,,,030419_p1,001,2019_Mar_04_1017,body_behavioural,3.0.4,59.965027196159745,
4,He gave a smile back.,1,2,,,,0,4,4,4,,,,,0,10,10,10,,,,,,,,,,,,,,,,,,,,,,,,,,,,,1,1.2698910050021368,,,,,,,,,,,,,,,,,,,,,,,,,,,,030419_p1,001,2019_Mar_04_1017,body_behavioural,3.0.4,59.965027196159745,
4,"“You alright?”, he said.",1,2,,,,0,4,4,4,,,,,0,11,11,11,,,,,,,,,,,,,,,,,,,,,,,,,,,,,9,1.8530213619960705,,,,,,,,,,,,,,,,,,,,,,,,,,,,030419_p1,001,2019_Mar_04_1017,body_behavioural,3.0.4,59.965027196159745,
4,"She whispered, “Uh yeah.",1,2,,,,0,4,4,4,,,,,0,12,12,12,,,,,,,,,,,,,,,,,,,,,,,,,,,,,1,1.2174973779983702,,,,,,,,,,,,,,,,,,,,,,,,,,,,030419_p1,001,2019_Mar_04_1017,body_behavioural,3.0.4,59.965027196159745,
4,I almost got smooshed by that cart.”,1,2,,,,0,4,4,4,,,,,0,13,13,13,,,,,,,,,,,,,,,,,,,,,,,,,,,,,1,0.9030544050037861,,,,,,,,,,,,,,,,,,,,,,,,,,,,030419_p1,001,2019_Mar_04_1017,body_behavioural,3.0.4,59.965027196159745,
4,Her head was still spinning as she stared at the handsome stranger who had saved her. ,1,2,,,,0,4,4,4,,,,,0,14,14,14,,,,,,,,,,,,,,,,,,,,,,,,,,,,,1,1.8531409600036568,,,,,,,,,,,,,,,,,,,,,,,,,,,,030419_p1,001,2019_Mar_04_1017,body_behavioural,3.0.4,59.965027196159745,
4,David helped her up and had to keep holding on to her arms to steady her even once they were standing.,1,2,,,,0,4,4,4,,,,,0,15,15,15,,,,,,,,,,,,,,,,,,,,,,,,,,,,,1,2.869395601999713,,,,,,,,,,,,,,,,,,,,,,,,,,,,030419_p1,001,2019_Mar_04_1017,body_behavioural,3.0.4,59.965027196159745,
4,"“I’m really late for my flight,” she said. ",1,2,,,,0,4,4,4,,,,,0,16,16,16,,,,,,,,,,,,,,,,,,,,,,,,,,,,,1,1.153077820003091,,,,,,,,,,,,,,,,,,,,,,,,,,,,030419_p1,001,2019_Mar_04_1017,body_behavioural,3.0.4,59.965027196159745,
4,"“Don't worry,” said David, "let me help you get to your gate." ",1,2,,,,0,4,4,4,,,,,0,17,17,17,,,,,,,,,,,,,,,,,,,,,,,,,,,,,1,1.1201944179993006,,,,,,,,,,,,,,,,,,,,,,,,,,,,030419_p1,001,2019_Mar_04_1017,body_behavioural,3.0.4,59.965027196159745,
4,He waved off her half-hearted protests. ,1,2,,,,0,4,4,4,,,,,0,18,18,18,,,,,,,,,,,,,,,,,,,,,,,,,,,,,1,1.3523694469986367,,,,,,,,,,,,,,,,,,,,,,,,,,,,030419_p1,001,2019_Mar_04_1017,body_behavioural,3.0.4,59.965027196159745,
4,"“Really , I have plenty of time and nothing better to do.”",1,2,,,,0,4,4,4,,,,,0,19,19,19,,,,,,,,,,,,,,,,,,,,,,,,,,,,,1,1.2871739600013825,,,,,,,,,,,,,,,,,,,,,,,,,,,,030419_p1,001,2019_Mar_04_1017,body_behavioural,3.0.4,59.965027196159745,
4,They headed to the security line. ,2,2,,,,0,4,4,4,,,,,0,20,20,20,,,,,,,,,,,,,,,,,,,,,,,,,,,,,1,1.6526538070029346,,,,,,,,,,,,,,,,,,,,,,,,,,,,030419_p1,001,2019_Mar_04_1017,body_behavioural,3.0.4,59.965027196159745,
4,"The line was not long, and they spent the time chatting and getting to know each other.",2,2,,,,0,4,4,4,,,,,0,21,21,21,,,,,,,,,,,,,,,,,,,,,,,,,,,,,1,1.5698393519996898,,,,,,,,,,,,,,,,,,,,,,,,,,,,030419_p1,001,2019_Mar_04_1017,body_behavioural,3.0.4,59.965027196159745,
4,It turned out that Anna and David went to the same high school but Anna had been 3 years older.,2,2,,,,0,4,4,4,,,,,0,22,22,22,,,,,,,,,,,,,,,,,,,,,,,,,,,,,9,2.4705065570014995,,,,,,,,,,,,,,,,,,,,,,,,,,,,030419_p1,001,2019_Mar_04_1017,body_behavioural,3.0.4,59.965027196159745,
4,When they got to the front of the line they took off their shoes and pulled off their coats.,2,3,,,,0,4,4,4,,,,,0,23,23,23,,,,,,,,,,,,,,,,,,,,,,,,,,,,,1,1.6341348719943198,,,,,,,,,,,,,,,,,,,,,,,,,,,,030419_p1,001,2019_Mar_04_1017,body_behavioural,3.0.4,59.965027196159745,
4,Both of them went through the metal detector without any problems. ,2,3,,,,0,4,4,4,,,,,0,24,24,24,,,,,,,,,,,,,,,,,,,,,,,,,,,,,1,1.3192911900041508,,,,,,,,,,,,,,,,,,,,,,,,,,,,030419_p1,001,2019_Mar_04_1017,body_behavioural,3.0.4,59.965027196159745,
4,"Anna’s flight was in 20 minutes, and as she was rushing to put her shoes and coat back on, David asked her, “So when are you coming back?”",2,3,,,,0,4,4,4,,,,,0,25,25,25,,,,,,,,,,,,,,,,,,,,,,,,,,,,,1,3.086140815001272,,,,,,,,,,,,,,,,,,,,,,,,,,,,030419_p1,001,2019_Mar_04_1017,body_behavioural,3.0.4,59.965027196159745,
4,"“In a week, it’s a short trip,” Anna replied. ",2,3,,,,0,4,4,4,,,,,0,26,26,26,,,,,,,,,,,,,,,,,,,,,,,,,,,,,1,1.1864024099995731,,,,,,,,,,,,,,,,,,,,,,,,,,,,030419_p1,001,2019_Mar_04_1017,body_behavioural,3.0.4,59.965027196159745,
4,"“Me too,” David said.",2,3,,,,0,4,4,4,,,,,0,27,27,27,,,,,,,,,,,,,,,,,,,,,,,,,,,,,1,0.9692252320019179,,,,,,,,,,,,,,,,,,,,,,,,,,,,030419_p1,001,2019_Mar_04_1017,body_behavioural,3.0.4,59.965027196159745,
4,"He continued, “When we're back in town, is there any chance you'd want to get dinner?",2,3,,,,0,4,4,4,,,,,0,28,28,28,,,,,,,,,,,,,,,,,,,,,,,,,,,,,1,1.1697355919968686,,,,,,,,,,,,,,,,,,,,,,,,,,,,030419_p1,001,2019_Mar_04_1017,body_behavioural,3.0.4,59.965027196159745,
4,"I know we just met, but when life throws a luggage cart at you it seems like we should listen. “",2,3,,,,0,4,4,4,,,,,0,29,29,29,,,,,,,,,,,,,,,,,,,,,,,,,,,,,1,1.919702884995786,,,,,,,,,,,,,,,,,,,,,,,,,,,,030419_p1,001,2019_Mar_04_1017,body_behavioural,3.0.4,59.965027196159745,
4,"She stopped packing, and said with a smile, “Yes I would love that.”",2,3,,,,0,4,4,4,,,,,0,30,30,30,,,,,,,,,,,,,,,,,,,,,,,,,,,,,1,1.8532041950020357,,,,,,,,,,,,,,,,,,,,,,,,,,,,030419_p1,001,2019_Mar_04_1017,body_behavioural,3.0.4,59.965027196159745,
4,Then they ran off to Anna’s gate which was at the end of the terminal. ,3,3,,,,0,4,4,4,,,,,0,31,31,31,,,,,,,,,,,,,,,,,,,,,,,,,,,,,1,1.2693136879970552,,,,,,,,,,,,,,,,,,,,,,,,,,,,030419_p1,001,2019_Mar_04_1017,body_behavioural,3.0.4,59.965027196159745,
4,"David took put on her backpack, grabbed her hand, and navigated quickly through the crowds of people.",3,3,,,,0,4,4,4,,,,,0,32,32,32,,,,,,,,,,,,,,,,,,,,,,,,,,,,,1,1.8696560820026207,,,,,,,,,,,,,,,,,,,,,,,,,,,,030419_p1,001,2019_Mar_04_1017,body_behavioural,3.0.4,59.965027196159745,
4,Anna was amazed at everything that was happening; she had arrived at the airport doubtful that she would make it and was now confident that she would due to this handsome and kind man she just met.,3,3,,,,0,4,4,4,,,,,0,33,33,33,,,,,,,,,,,,,,,,,,,,,,,,,,,,,9,1.9696151899988763,,,,,,,,,,,,,,,,,,,,,,,,,,,,030419_p1,001,2019_Mar_04_1017,body_behavioural,3.0.4,59.965027196159745,
4,"As they approached her gate, Anna fished out a crumbled business card from her pocket and handed it to David, who handed her the backpack, and he promised to call her next week.",3,4,,,,0,4,4,4,,,,,0,34,34,34,,,,,,,,,,,,,,,,,,,,,,,,,,,,,1,2.636388751998311,,,,,,,,,,,,,,,,,,,,,,,,,,,,030419_p1,001,2019_Mar_04_1017,body_behavioural,3.0.4,59.965027196159745,
4,She gave him one last embarrassed smile and approached the flight attendant who scanned her ticket. ,3,4,,,,0,4,4,4,,,,,0,35,35,35,,,,,,,,,,,,,,,,,,,,,,,,,,,,,1,1.8508112819981761,,,,,,,,,,,,,,,,,,,,,,,,,,,,030419_p1,001,2019_Mar_04_1017,body_behavioural,3.0.4,59.965027196159745,
4,"Finally, she boarded the plane, sliding into her window seat located all the way in the back of the plane.",4,4,,,,0,4,4,4,,,,,0,36,36,36,,,,,,,,,,,,,,,,,,,,,,,,,,,,,1,1.4691096840033424,,,,,,,,,,,,,,,,,,,,,,,,,,,,030419_p1,001,2019_Mar_04_1017,body_behavioural,3.0.4,59.965027196159745,
4,"Barely containing her glee, she ignored the grumbles of complaint as she squeezed past the other passengers in her row and settled back in her seat. ",4,4,,,,0,4,4,4,,,,,0,37,37,37,,,,,,,,,,,,,,,,,,,,,,,,,,,,,1,2.150831681996351,,,,,,,,,,,,,,,,,,,,,,,,,,,,030419_p1,001,2019_Mar_04_1017,body_behavioural,3.0.4,59.965027196159745,
4,"She was thankful that she had not only made it onto the plane in time, but also that she had been clumsy enough to forget to tie her shoes.",4,4,,,,0,4,4,4,,,,,0,38,38,38,,,,,,,,,,,,,,,,,,,,,,,,,,,,,1,2.519766024997807,,,,,,,,,,,,,,,,,,,,,,,,,,,,030419_p1,001,2019_Mar_04_1017,body_behavioural,3.0.4,59.965027196159745,
