2,"I think what we have here is great, but I think it will be really hard when we are so far apart for so long during my study abroad.",2,2,None,,,,,,0,2,2,2,,,,,0,10,10,10,,,,,,,,,,,,,,,,,,,,,,,,,,,,,,,,,,,1,6.770121859997744,,,,,,,,,,,,,,,,,,,,,,,,,,,,062019_p2,001,2019_Jun_20_1433,body_behavioural,3.0.4,59.99197727298745,
2,"I’m sorry I’m telling you now in lecture, but you know, I have to leave for the airport after class and this is really hard for me to tell you.",2,2,None,,,,,,0,2,2,2,,,,,0,11,11,11,,,,,,,,,,,,,,,,,,,,,,,,,,,,,,,,,,,1,5.119875033000426,,,,,,,,,,,,,,,,,,,,,,,,,,,,062019_p2,001,2019_Jun_20_1433,body_behavioural,3.0.4,59.99197727298745,
2,I just know when I’m there I’m going to be so busy and I really want to be immersed in the life of the place I’m in.”,2,2,None,,,,,,0,2,2,2,,,,,0,12,12,12,,,,,,,,,,,,,,,,,,,,,,,,,,,,,,,,,,,1,4.269941189999372,,,,,,,,,,,,,,,,,,,,,,,,,,,,062019_p2,001,2019_Jun_20_1433,body_behavioural,3.0.4,59.99197727298745,
2,"The professor said, “We will now talk about one of Aristotle’s works, The Categories.",3,2,None,,,,,,0,2,2,2,,,,,0,13,13,13,,,,,,,,,,,,,,,,,,,,,,,,,,,,,,,,,,,9,3.802961723002227,,,,,,,,,,,,,,,,,,,,,,,,,,,,062019_p2,001,2019_Jun_20_1433,body_behavioural,3.0.4,59.99197727298745,
2,"This text, as you might have been able to guess, is about the kinds, or categories, of things that there are.",3,2,None,,,,,,0,2,2,2,,,,,0,14,14,14,,,,,,,,,,,,,,,,,,,,,,,,,,,,,,,,,,,1,1.7362364230029925,,,,,,,,,,,,,,,,,,,,,,,,,,,,062019_p2,001,2019_Jun_20_1433,body_behavioural,3.0.4,59.99197727298745,
2,"In fact, our term category comes from this Aristotelian context.",3,2,None,,,,,,0,2,2,2,,,,,0,15,15,15,,,,,,,,,,,,,,,,,,,,,,,,,,,,,,,,,,,1,3.7365990430007514,,,,,,,,,,,,,,,,,,,,,,,,,,,,062019_p2,001,2019_Jun_20_1433,body_behavioural,3.0.4,59.99197727298745,
2,"The Categories, traditionally interpreted as an introduction to Aristotle’s logical work, divides all of  being into ten categories.” ",3,2,None,,,,,,0,2,2,2,,,,,0,16,16,16,,,,,,,,,,,,,,,,,,,,,,,,,,,,,,,,,,,1,5.469658174999495,,,,,,,,,,,,,,,,,,,,,,,,,,,,062019_p2,001,2019_Jun_20_1433,body_behavioural,3.0.4,59.99197727298745,
2,"Henry felt horrible, like the wind had just been knocked out of him and he whispered back, “Maria, I don’t want to break up with you because I love you.",3,3,None,,,,,,0,2,2,2,,,,,0,17,17,17,,,,,,,,,,,,,,,,,,,,,,,,,,,,,,,,,,,1,11.320427053000458,,,,,,,,,,,,,,,,,,,,,,,,,,,,062019_p2,001,2019_Jun_20_1433,body_behavioural,3.0.4,59.99197727298745,
2,I’ll come visit you and it will be fine.,3,3,None,,,,,,0,2,2,2,,,,,0,18,18,18,,,,,,,,,,,,,,,,,,,,,,,,,,,,,,,,,,,1,0.9674417669994,,,,,,,,,,,,,,,,,,,,,,,,,,,,062019_p2,001,2019_Jun_20_1433,body_behavioural,3.0.4,59.99197727298745,
2,I don’t want to break up.”,3,3,None,,,,,,0,2,2,2,,,,,0,19,19,19,,,,,,,,,,,,,,,,,,,,,,,,,,,,,,,,,,,1,0.7363345169978857,,,,,,,,,,,,,,,,,,,,,,,,,,,,062019_p2,001,2019_Jun_20_1433,body_behavioural,3.0.4,59.99197727298745,
2,"Maria felt so guilty that she nearly gave in, but forced herself to hold her ground, knowing that this would make things much easier for both of them in the future.",3,3,None,,,,,,0,2,2,2,,,,,0,20,20,20,,,,,,,,,,,,,,,,,,,,,,,,,,,,,,,,,,,9,4.600891179998143,,,,,,,,,,,,,,,,,,,,,,,,,,,,062019_p2,001,2019_Jun_20_1433,body_behavioural,3.0.4,59.99197727298745,
2,"She gave his hand a squeeze but shook her head sadly, before turning back to look at her empty desk. ",3,3,None,,,,,,0,2,2,2,,,,,0,21,21,21,,,,,,,,,,,,,,,,,,,,,,,,,,,,,,,,,,,1,1.6693935399998736,,,,,,,,,,,,,,,,,,,,,,,,,,,,062019_p2,001,2019_Jun_20_1433,body_behavioural,3.0.4,59.99197727298745,
2,"The professor wrapped up, “Alright, class, that’s all for today.",4,3,None,,,,,,0,2,2,2,,,,,0,22,22,22,,,,,,,,,,,,,,,,,,,,,,,,,,,,,,,,,,,9,9.386895104998985,,,,,,,,,,,,,,,,,,,,,,,,,,,,062019_p2,001,2019_Jun_20_1433,body_behavioural,3.0.4,59.99197727298745,
2,"Remember the final exam is coming up next week on Tuesday on the Pre-Socratics, Plato, and Aristotle, so feel free to come by office hours to discuss if you have the inspiration.",4,3,None,,,,,,0,2,2,2,,,,,0,23,23,23,,,,,,,,,,,,,,,,,,,,,,,,,,,,,,,,,,,1,5.053526677998889,,,,,,,,,,,,,,,,,,,,,,,,,,,,062019_p2,001,2019_Jun_20_1433,body_behavioural,3.0.4,59.99197727298745,
2,"If anyone has any conflicts with another exam, please email me so that we can figure out a time to reschedule it. ",4,3,None,,,,,,0,2,2,2,,,,,0,24,24,24,,,,,,,,,,,,,,,,,,,,,,,,,,,,,,,,,,,1,3.953262930001074,,,,,,,,,,,,,,,,,,,,,,,,,,,,062019_p2,001,2019_Jun_20_1433,body_behavioural,3.0.4,59.99197727298745,
2,"Have a good day, folks.” ",4,3,None,,,,,,0,2,2,2,,,,,0,25,25,25,,,,,,,,,,,,,,,,,,,,,,,,,,,,,,,,,,,1,0.7341277950035874,,,,,,,,,,,,,,,,,,,,,,,,,,,,062019_p2,001,2019_Jun_20_1433,body_behavioural,3.0.4,59.99197727298745,
2,"Maria and Henry packed up hurriedly, and they hugged; both of them had tears. ",4,4,None,,,,,,0,2,2,2,,,,,0,26,26,26,,,,,,,,,,,,,,,,,,,,,,,,,,,,,,,,,,,9,1.6840928899982828,,,,,,,,,,,,,,,,,,,,,,,,,,,,062019_p2,001,2019_Jun_20_1433,body_behavioural,3.0.4,59.99197727298745,
2,"“Maria, I don’t want you to leave.",4,4,None,,,,,,0,2,2,2,,,,,0,27,27,27,,,,,,,,,,,,,,,,,,,,,,,,,,,,,,,,,,,1,1.0029398900005617,,,,,,,,,,,,,,,,,,,,,,,,,,,,062019_p2,001,2019_Jun_20_1433,body_behavioural,3.0.4,59.99197727298745,
2,I don’t want this to end. ,4,4,None,,,,,,0,2,2,2,,,,,0,28,28,28,,,,,,,,,,,,,,,,,,,,,,,,,,,,,,,,,,,1,0.7860181000032753,,,,,,,,,,,,,,,,,,,,,,,,,,,,062019_p2,001,2019_Jun_20_1433,body_behavioural,3.0.4,59.99197727298745,
2,"But if this is what you think is best, I can’t make it otherwise.” ",4,4,None,,,,,,0,2,2,2,,,,,0,29,29,29,,,,,,,,,,,,,,,,,,,,,,,,,,,,,,,,,,,1,6.000977472998784,,,,,,,,,,,,,,,,,,,,,,,,,,,,062019_p2,001,2019_Jun_20_1433,body_behavioural,3.0.4,59.99197727298745,
2,"They hugged one last time, and then Maria remembered she had left her favorite Alpaca sweater in Henry’s room.",4,4,None,,,,,,0,2,2,2,,,,,0,30,30,30,,,,,,,,,,,,,,,,,,,,,,,,,,,,,,,,,,,1,6.720265857999038,,,,,,,,,,,,,,,,,,,,,,,,,,,,062019_p2,001,2019_Jun_20_1433,body_behavioural,3.0.4,59.99197727298745,
2,"“Henry, I’m so sorry to ask this now but could you grab my alpaca sweater from your dorm and meet me in front of the student center?”",4,4,None,,,,,,0,2,2,2,,,,,0,31,31,31,,,,,,,,,,,,,,,,,,,,,,,,,,,,,,,,,,,1,5.969920267998532,,,,,,,,,,,,,,,,,,,,,,,,,,,,062019_p2,001,2019_Jun_20_1433,body_behavioural,3.0.4,59.99197727298745,
2,"He agreed, and she ran off to get her things from her dorm as he sadly watched her go. ",4,4,None,,,,,,0,2,2,2,,,,,0,32,32,32,,,,,,,,,,,,,,,,,,,,,,,,,,,,,,,,,,,1,5.30329457300104,,,,,,,,,,,,,,,,,,,,,,,,,,,,062019_p2,001,2019_Jun_20_1433,body_behavioural,3.0.4,59.99197727298745,
2,,,,,,,,,,0,2,2,2,,,,,,,,,,,,,,,,,,,,,,,,,,,,,,,,,,,,,,,,,,,,,,,,,,,,,,,,,,,,,,,,,,,,,,,,062019_p2,001,2019_Jun_20_1433,body_behavioural,3.0.4,59.99197727298745,
3,,,,,,,,,,0,3,3,3,0,0,0,0,,,,,,,,,,,,,,,,,,,,,,,,,,,,,space,1.3340614749977249,space,0.7534094069997082,space,0.6032372529989516,,,,,,,,,,,,,,,,,,,,,,,,,,,,,,,,,,062019_p2,001,2019_Jun_20_1433,body_behavioural,3.0.4,59.99197727298745,
3,,,,,,,,,,0,3,3,3,1,0,1,0,,,,,,,,,,,,,,,,,,,,,,,,,,,,,,,,,space,0.5195822919995408,,,,,,,,,,,,,,,,,,,,,,,,,,,,,,,,,,062019_p2,001,2019_Jun_20_1433,body_behavioural,3.0.4,59.99197727298745,
3,,,,,,,,,,0,3,3,3,2,0,2,0,,,,,,,,,,,,,,,,,,,,,,,,,,,,,,,,,space,0.41977846800000407,,,,,,,,,,,,,,,,,,,,,,,,,,,,,,,,,,062019_p2,001,2019_Jun_20_1433,body_behavioural,3.0.4,59.99197727298745,
3,,,,,,,,,,0,3,3,3,3,0,3,0,,,,,,,,,,,,,,,,,,,,,,,,,,,,,,,,,space,0.45236529499743483,,,,,,,,,,,,,,,,,,,,,,,,,,,,,,,,,,062019_p2,001,2019_Jun_20_1433,body_behavioural,3.0.4,59.99197727298745,
3,Mr. Shelton and Mr. Gordon shook hands inside the waiting area of the restaurant: lunch today was about big business. ,1,1,31.0,,,,,,0,3,3,3,,,,,0,0,0,0,,,,,,,,,,,,,,,,,,,,,,,,,,,,,,,space,1.7361147199990228,space,0.5862040169995453,9,5.303166796998994,,,,,,,,,,,,,,,,,,,,,,,,,,,,062019_p2,001,2019_Jun_20_1433,body_behavioural,3.0.4,59.99197727298745,
3,They were both in the airplane manufacturing industry.,1,1,None,,,,,,0,3,3,3,,,,,0,1,1,1,,,,,,,,,,,,,,,,,,,,,,,,,,,,,,,,,,,1,7.803119977001188,,,,,,,,,,,,,,,,,,,,,,,,,,,,062019_p2,001,2019_Jun_20_1433,body_behavioural,3.0.4,59.99197727298745,
3,"Mr. Shelton was the CFO of a larger, well-established company and had been in the aviation business for decades.",1,1,None,,,,,,0,3,3,3,,,,,0,2,2,2,,,,,,,,,,,,,,,,,,,,,,,,,,,,,,,,,,,1,9.520427940002264,,,,,,,,,,,,,,,,,,,,,,,,,,,,062019_p2,001,2019_Jun_20_1433,body_behavioural,3.0.4,59.99197727298745,
3,Mr. Gordon was the CEO of a smaller but technologically-advanced company that was projected to disrupt the airplane manufacturing market. ,1,1,None,,,,,,0,3,3,3,,,,,0,3,3,3,,,,,,,,,,,,,,,,,,,,,,,,,,,,,,,,,,,1,5.253313152999908,,,,,,,,,,,,,,,,,,,,,,,,,,,,062019_p2,001,2019_Jun_20_1433,body_behavioural,3.0.4,59.99197727298745,
3,"They chose to meet at an old steakhouse with dark wood paneling on the floor and ceilings, taxidermy animals on the walls, and a candelabra on every table.",1,1,None,,,,,,0,3,3,3,,,,,0,4,4,4,,,,,,,,,,,,,,,,,,,,,,,,,,,,,,,,,,,9,6.303348034998635,,,,,,,,,,,,,,,,,,,,,,,,,,,,062019_p2,001,2019_Jun_20_1433,body_behavioural,3.0.4,59.99197727298745,
3,The waitress seated them at their table in the back. ,2,1,None,,,,,,0,3,3,3,,,,,0,5,5,5,,,,,,,,,,,,,,,,,,,,,,,,,,,,,,,,,,,1,7.1866883729999245,,,,,,,,,,,,,,,,,,,,,,,,,,,,062019_p2,001,2019_Jun_20_1433,body_behavioural,3.0.4,59.99197727298745,
3,"She brought out the menus, and they briefly chatted about personal happenings. ",2,1,None,,,,,,0,3,3,3,,,,,0,6,6,6,,,,,,,,,,,,,,,,,,,,,,,,,,,,,,,,,,,1,2.686504977998993,,,,,,,,,,,,,,,,,,,,,,,,,,,,062019_p2,001,2019_Jun_20_1433,body_behavioural,3.0.4,59.99197727298745,
3,"Mr. Gordon took out a picture of his daughter and talked about her recent engagement, and Mr. Gordon mentioned his purchase of a Tesla. ",2,1,None,,,,,,0,3,3,3,,,,,0,7,7,7,,,,,,,,,,,,,,,,,,,,,,,,,,,,,,,,,,,1,7.736969575002149,,,,,,,,,,,,,,,,,,,,,,,,,,,,062019_p2,001,2019_Jun_20_1433,body_behavioural,3.0.4,59.99197727298745,
3,They also looked over the menus which were heavy and covered in felt.,2,1,None,,,,,,0,3,3,3,,,,,0,8,8,8,,,,,,,,,,,,,,,,,,,,,,,,,,,,,,,,,,,1,5.3033225200015295,,,,,,,,,,,,,,,,,,,,,,,,,,,,062019_p2,001,2019_Jun_20_1433,body_behavioural,3.0.4,59.99197727298745,
3,Flipping to the back of the menu brought one to a lengthy drink selection.,2,1,None,,,,,,0,3,3,3,,,,,0,9,9,9,,,,,,,,,,,,,,,,,,,,,,,,,,,,,,,,,,,1,2.0365924979996635,,,,,,,,,,,,,,,,,,,,,,,,,,,,062019_p2,001,2019_Jun_20_1433,body_behavioural,3.0.4,59.99197727298745,
3,Mr. Shelton got serious and brought the conversation around to business.,2,2,None,,,,,,0,3,3,3,,,,,0,10,10,10,,,,,,,,,,,,,,,,,,,,,,,,,,,,,,,,,,,9,2.8198371950020373,,,,,,,,,,,,,,,,,,,,,,,,,,,,062019_p2,001,2019_Jun_20_1433,body_behavioural,3.0.4,59.99197727298745,
3,"“Mr. Gordon, we really admire what you’re doing at your company.",2,2,None,,,,,,0,3,3,3,,,,,0,11,11,11,,,,,,,,,,,,,,,,,,,,,,,,,,,,,,,,,,,1,2.952679285001068,,,,,,,,,,,,,,,,,,,,,,,,,,,,062019_p2,001,2019_Jun_20_1433,body_behavioural,3.0.4,59.99197727298745,
3,We think it’s genius; we want to support your vision and make this tiny company of yours internationally known.,2,2,None,,,,,,0,3,3,3,,,,,0,12,12,12,,,,,,,,,,,,,,,,,,,,,,,,,,,,,,,,,,,1,1.1032203399990976,,,,,,,,,,,,,,,,,,,,,,,,,,,,062019_p2,001,2019_Jun_20_1433,body_behavioural,3.0.4,59.99197727298745,
3,"But honestly, your company doesn’t have the resources to reach international markets right now.",2,2,None,,,,,,0,3,3,3,,,,,0,13,13,13,,,,,,,,,,,,,,,,,,,,,,,,,,,,,,,,,,,1,2.734128903000965,,,,,,,,,,,,,,,,,,,,,,,,,,,,062019_p2,001,2019_Jun_20_1433,body_behavioural,3.0.4,59.99197727298745,
3,"Maybe in a few years you could, but by that time, other companies may have already filled your niche.",2,2,None,,,,,,0,3,3,3,,,,,0,14,14,14,,,,,,,,,,,,,,,,,,,,,,,,,,,,,,,,,,,1,2.7173472450012923,,,,,,,,,,,,,,,,,,,,,,,,,,,,062019_p2,001,2019_Jun_20_1433,body_behavioural,3.0.4,59.99197727298745,
3,I think we should join forces.”,2,2,None,,,,,,0,3,3,3,,,,,0,15,15,15,,,,,,,,,,,,,,,,,,,,,,,,,,,,,,,,,,,1,1.3197060099992086,,,,,,,,,,,,,,,,,,,,,,,,,,,,062019_p2,001,2019_Jun_20_1433,body_behavioural,3.0.4,59.99197727298745,
3,The waitress arrived and asked if they were ready to order.,3,2,None,,,,,,0,3,3,3,,,,,0,16,16,16,,,,,,,,,,,,,,,,,,,,,,,,,,,,,,,,,,,9,3.286609282000427,,,,,,,,,,,,,,,,,,,,,,,,,,,,062019_p2,001,2019_Jun_20_1433,body_behavioural,3.0.4,59.99197727298745,
3,"Mr. Gordon chose the medium-rare steak and a martini, and Mr. Shelton ordered the veal and a manhattan. ",3,2,None,,,,,,0,3,3,3,,,,,0,17,17,17,,,,,,,,,,,,,,,,,,,,,,,,,,,,,,,,,,,1,5.253316632999486,,,,,,,,,,,,,,,,,,,,,,,,,,,,062019_p2,001,2019_Jun_20_1433,body_behavioural,3.0.4,59.99197727298745,
3,"Then Mr. Shelton continued, “Look, I’ve talked to other members of the board, and we are prepared to offer $600 million to buy your company. ",3,2,None,,,,,,0,3,3,3,,,,,0,18,18,18,,,,,,,,,,,,,,,,,,,,,,,,,,,,,,,,,,,9,11.40381927800263,,,,,,,,,,,,,,,,,,,,,,,,,,,,062019_p2,001,2019_Jun_20_1433,body_behavioural,3.0.4,59.99197727298745,
3,"We'd keep on all of your current employees, and you would join as the director of your company branch.” ",3,2,None,,,,,,0,3,3,3,,,,,0,19,19,19,,,,,,,,,,,,,,,,,,,,,,,,,,,,,,,,,,,1,3.8026602149984683,,,,,,,,,,,,,,,,,,,,,,,,,,,,062019_p2,001,2019_Jun_20_1433,body_behavioural,3.0.4,59.99197727298745,
3,"Mr. Gordon looked at Mr. Shelton skeptically for a few moments considering his response until he said, “Mr. Shelton, I think that you make a compelling offer, but there are definitely some disadvantages to attaching our small, streamlined productions to a large company like yours.",3,3,None,,,,,,0,3,3,3,,,,,0,20,20,20,,,,,,,,,,,,,,,,,,,,,,,,,,,,,,,,,,,1,6.552610491999076,,,,,,,,,,,,,,,,,,,,,,,,,,,,062019_p2,001,2019_Jun_20_1433,body_behavioural,3.0.4,59.99197727298745,
3,"We operate in a very different way than a large company, and the kind of administrative complexity that makes the scale of your productions possible would suffocate our business.",3,3,None,,,,,,0,3,3,3,,,,,0,21,21,21,,,,,,,,,,,,,,,,,,,,,,,,,,,,,,,,,,,1,5.770000995002192,,,,,,,,,,,,,,,,,,,,,,,,,,,,062019_p2,001,2019_Jun_20_1433,body_behavioural,3.0.4,59.99197727298745,
3,"With our product, scaling-up doesn’t necessarily make sense.” ",3,3,None,,,,,,0,3,3,3,,,,,0,22,22,22,,,,,,,,,,,,,,,,,,,,,,,,,,,,,,,,,,,1,3.853397875001974,,,,,,,,,,,,,,,,,,,,,,,,,,,,062019_p2,001,2019_Jun_20_1433,body_behavioural,3.0.4,59.99197727298745,
3,Mr. Shelton had expected this response and had come prepared.,3,3,None,,,,,,0,3,3,3,,,,,0,23,23,23,,,,,,,,,,,,,,,,,,,,,,,,,,,,,,,,,,,9,2.4869498400003067,,,,,,,,,,,,,,,,,,,,,,,,,,,,062019_p2,001,2019_Jun_20_1433,body_behavioural,3.0.4,59.99197727298745,
3,He began laying out the details of how he had handled similar acquisitions successfully in the past.,3,3,None,,,,,,0,3,3,3,,,,,0,24,24,24,,,,,,,,,,,,,,,,,,,,,,,,,,,,,,,,,,,1,3.8843904299974383,,,,,,,,,,,,,,,,,,,,,,,,,,,,062019_p2,001,2019_Jun_20_1433,body_behavioural,3.0.4,59.99197727298745,
3,"He also played out projections of how Mr. Gordon’s company could out-compete their own main competitor in the industry, TechJet, by using the resources of a larger corporation. ",3,3,None,,,,,,0,3,3,3,,,,,0,25,25,25,,,,,,,,,,,,,,,,,,,,,,,,,,,,,,,,,,,1,10.22034914300093,,,,,,,,,,,,,,,,,,,,,,,,,,,,062019_p2,001,2019_Jun_20_1433,body_behavioural,3.0.4,59.99197727298745,
3,"Mr. Gordon was impressed, and they went back and forth hashing out what the company configuration would look like post-merger. ",3,3,None,,,,,,0,3,3,3,,,,,0,26,26,26,,,,,,,,,,,,,,,,,,,,,,,,,,,,,,,,,,,1,9.287007217997598,,,,,,,,,,,,,,,,,,,,,,,,,,,,062019_p2,001,2019_Jun_20_1433,body_behavioural,3.0.4,59.99197727298745,
3,The waitress brought out their food on a large tray.,4,3,None,,,,,,0,3,3,3,,,,,0,27,27,27,,,,,,,,,,,,,,,,,,,,,,,,,,,,,,,,,,,9,1.7030853629985359,,,,,,,,,,,,,,,,,,,,,,,,,,,,062019_p2,001,2019_Jun_20_1433,body_behavioural,3.0.4,59.99197727298745,
3,“Oh this looks so good!” Mr. Gordon said. ,4,3,None,,,,,,0,3,3,3,,,,,0,28,28,28,,,,,,,,,,,,,,,,,,,,,,,,,,,,,,,,,,,1,1.0529230200008897,,,,,,,,,,,,,,,,,,,,,,,,,,,,062019_p2,001,2019_Jun_20_1433,body_behavioural,3.0.4,59.99197727298745,
3, “Can I get you anything else?” the waitress asked.,4,3,None,,,,,,0,3,3,3,,,,,0,29,29,29,,,,,,,,,,,,,,,,,,,,,,,,,,,,,,,,,,,1,3.967766768000729,,,,,,,,,,,,,,,,,,,,,,,,,,,,062019_p2,001,2019_Jun_20_1433,body_behavioural,3.0.4,59.99197727298745,
3,They declined and began to eat. ,4,3,None,,,,,,0,3,3,3,,,,,0,30,30,30,,,,,,,,,,,,,,,,,,,,,,,,,,,,,,,,,,,1,1.0194692700024461,,,,,,,,,,,,,,,,,,,,,,,,,,,,062019_p2,001,2019_Jun_20_1433,body_behavioural,3.0.4,59.99197727298745,
3,The meal was subpar- they both found the meat to be a bit overcooked and dry. ,4,3,None,,,,,,0,3,3,3,,,,,0,31,31,31,,,,,,,,,,,,,,,,,,,,,,,,,,,,,,,,,,,9,5.652798798000731,,,,,,,,,,,,,,,,,,,,,,,,,,,,062019_p2,001,2019_Jun_20_1433,body_behavioural,3.0.4,59.99197727298745,
3,"Mr. Gordon, after taking a contemplative bite and swallowing, said, “Mr. Shelton, I think we have a deal. ",4,4,None,,,,,,0,3,3,3,,,,,0,32,32,32,,,,,,,,,,,,,,,,,,,,,,,,,,,,,,,,,,,1,2.970048972998484,,,,,,,,,,,,,,,,,,,,,,,,,,,,062019_p2,001,2019_Jun_20_1433,body_behavioural,3.0.4,59.99197727298745,
3,"If you can guarantee that I can still have the final say in the all the work done by my team, I think this could be beneficial for both of us.",4,4,None,,,,,,0,3,3,3,,,,,0,33,33,33,,,,,,,,,,,,,,,,,,,,,,,,,,,,,,,,,,,1,11.320865334997507,,,,,,,,,,,,,,,,,,,,,,,,,,,,062019_p2,001,2019_Jun_20_1433,body_behavioural,3.0.4,59.99197727298745,
3,I propose a toast to the merging of our companies.”,4,4,None,,,,,,0,3,3,3,,,,,0,34,34,34,,,,,,,,,,,,,,,,,,,,,,,,,,,,,,,,,,,1,1.8699564329981513,,,,,,,,,,,,,,,,,,,,,,,,,,,,062019_p2,001,2019_Jun_20_1433,body_behavioural,3.0.4,59.99197727298745,
3,Mr. Shelton grinned and lifted his martini to clink glasses.,4,4,None,,,,,,0,3,3,3,,,,,0,35,35,35,,,,,,,,,,,,,,,,,,,,,,,,,,,,,,,,,,,1,2.3698569500011217,,,,,,,,,,,,,,,,,,,,,,,,,,,,062019_p2,001,2019_Jun_20_1433,body_behavioural,3.0.4,59.99197727298745,
3,"He said, “Cheers to a lifelong partnership and to the growth of our company.” ",4,4,None,,,,,,0,3,3,3,,,,,0,36,36,36,,,,,,,,,,,,,,,,,,,,,,,,,,,,,,,,,,,1,2.4675070029989,,,,,,,,,,,,,,,,,,,,,,,,,,,,062019_p2,001,2019_Jun_20_1433,body_behavioural,3.0.4,59.99197727298745,
3,,,,,,,,,,0,3,3,3,,,,,,,,,,,,,,,,,,,,,,,,,,,,,,,,,,,,,,,,,,,,,,,,,,,,,,,,,,,,,,,,,,,,,,,,062019_p2,001,2019_Jun_20_1433,body_behavioural,3.0.4,59.99197727298745,
4,,,,,,,,,,0,4,4,4,0,0,0,0,,,,,,,,,,,,,,,,,,,,,,,,,,,,,space,0.8029925580012787,space,0.7193923649974749,space,0.5673774949973449,,,,,,,,,,,,,,,,,,,,,,,,,,,,,,,,,,062019_p2,001,2019_Jun_20_1433,body_behavioural,3.0.4,59.99197727298745,
4,David saw Anna for the first time when she burst into the airport frazzled with her half-zipped bag skidding behind her.,1,1,42.0,,,,,,0,4,4,4,,,,,0,0,0,0,,,,,,,,,,,,,,,,,,,,,,,,,,,,,,,space,0.8696502550010337,space,0.9529198830023233,9,10.320712794997235,,,,,,,,,,,,,,,,,,,,,,,,,,,,062019_p2,001,2019_Jun_20_1433,body_behavioural,3.0.4,59.99197727298745,
4,"He had three hours until his flight and was reading a book on the laptop he was holding in the entrance to the airport, but she had only 35 minutes and was hoping to spend as little time in the entrance as possible. ",1,1,None,,,,,,0,4,4,4,,,,,0,1,1,1,,,,,,,,,,,,,,,,,,,,,,,,,,,,,,,,,,,1,7.184912317999988,,,,,,,,,,,,,,,,,,,,,,,,,,,,062019_p2,001,2019_Jun_20_1433,body_behavioural,3.0.4,59.99197727298745,
4,"Anna, a few strides into the airport, suddenly realized to her dismay that her shoes were untied, so she hunched over to tie them.",1,1,None,,,,,,0,4,4,4,,,,,0,2,2,2,,,,,,,,,,,,,,,,,,,,,,,,,,,,,,,,,,,1,4.303189344998827,,,,,,,,,,,,,,,,,,,,,,,,,,,,062019_p2,001,2019_Jun_20_1433,body_behavioural,3.0.4,59.99197727298745,
4,"David, who had been intrigued by Anna, observed that someone with a tall cart of luggage was heading straight for where she was kneeling and that both her and the person driving the cart were oblivious to the impeding collision. ",1,1,None,,,,,,0,4,4,4,,,,,0,3,3,3,,,,,,,,,,,,,,,,,,,,,,,,,,,,,,,,,,,1,6.586764334999316,,,,,,,,,,,,,,,,,,,,,,,,,,,,062019_p2,001,2019_Jun_20_1433,body_behavioural,3.0.4,59.99197727298745,
4,"After a few moment of deliberation, David decided to intervene, and he ran in front of the cart pushing her out of the way just in the nick of time, and they tumbled on the airport floor. ",1,2,None,,,,,,0,4,4,4,,,,,0,4,4,4,,,,,,,,,,,,,,,,,,,,,,,,,,,,,,,,,,,1,2.187159851000615,,,,,,,,,,,,,,,,,,,,,,,,,,,,062019_p2,001,2019_Jun_20_1433,body_behavioural,3.0.4,59.99197727298745,
4,"Anna, bewildered, looked up and saw the cart pass by and then looked at David. ",1,2,None,,,,,,0,4,4,4,,,,,0,5,5,5,,,,,,,,,,,,,,,,,,,,,,,,,,,,,,,,,,,1,2.669399868002074,,,,,,,,,,,,,,,,,,,,,,,,,,,,062019_p2,001,2019_Jun_20_1433,body_behavioural,3.0.4,59.99197727298745,
4,He flashed a smile.,1,2,None,,,,,,0,4,4,4,,,,,0,6,6,6,,,,,,,,,,,,,,,,,,,,,,,,,,,,,,,,,,,1,1.269693330003065,,,,,,,,,,,,,,,,,,,,,,,,,,,,062019_p2,001,2019_Jun_20_1433,body_behavioural,3.0.4,59.99197727298745,
4,“Were you ever a gymnast?,1,2,None,,,,,,0,4,4,4,,,,,0,7,7,7,,,,,,,,,,,,,,,,,,,,,,,,,,,,,,,,,,,1,2.86965740800224,,,,,,,,,,,,,,,,,,,,,,,,,,,,062019_p2,001,2019_Jun_20_1433,body_behavioural,3.0.4,59.99197727298745,
4," That was a nice tumble,” he said.",1,2,None,,,,,,0,4,4,4,,,,,0,8,8,8,,,,,,,,,,,,,,,,,,,,,,,,,,,,,,,,,,,1,1.1199427850006032,,,,,,,,,,,,,,,,,,,,,,,,,,,,062019_p2,001,2019_Jun_20_1433,body_behavioural,3.0.4,59.99197727298745,
4,"She managed a chuckle and said, “Actually yes, but I’d say that deserved a score of zero.",1,2,None,,,,,,0,4,4,4,,,,,0,9,9,9,,,,,,,,,,,,,,,,,,,,,,,,,,,,,,,,,,,1,2.6032506550000107,,,,,,,,,,,,,,,,,,,,,,,,,,,,062019_p2,001,2019_Jun_20_1433,body_behavioural,3.0.4,59.99197727298745,
4,Wow- I almost got smooshed by that cart.”,1,2,None,,,,,,0,4,4,4,,,,,0,10,10,10,,,,,,,,,,,,,,,,,,,,,,,,,,,,,,,,,,,1,1.1677341430004162,,,,,,,,,,,,,,,,,,,,,,,,,,,,062019_p2,001,2019_Jun_20_1433,body_behavioural,3.0.4,59.99197727298745,
4,Her head was still spinning as she stared at the handsome stranger who had saved her. ,1,2,None,,,,,,0,4,4,4,,,,,0,11,11,11,,,,,,,,,,,,,,,,,,,,,,,,,,,,,,,,,,,9,2.5031769250017533,,,,,,,,,,,,,,,,,,,,,,,,,,,,062019_p2,001,2019_Jun_20_1433,body_behavioural,3.0.4,59.99197727298745,
4,David helped her up and had to keep holding on to her arms to steady her even once they were standing.,1,2,None,,,,,,0,4,4,4,,,,,0,12,12,12,,,,,,,,,,,,,,,,,,,,,,,,,,,,,,,,,,,1,1.270105218001845,,,,,,,,,,,,,,,,,,,,,,,,,,,,062019_p2,001,2019_Jun_20_1433,body_behavioural,3.0.4,59.99197727298745,
4,"“I’m really late for my flight,” she said. ",1,2,None,,,,,,0,4,4,4,,,,,0,13,13,13,,,,,,,,,,,,,,,,,,,,,,,,,,,,,,,,,,,1,2.3366279830006533,,,,,,,,,,,,,,,,,,,,,,,,,,,,062019_p2,001,2019_Jun_20_1433,body_behavioural,3.0.4,59.99197727298745,
4,"“Don't worry,” said David, "let me help you get to your gate." ",1,2,None,,,,,,0,4,4,4,,,,,0,14,14,14,,,,,,,,,,,,,,,,,,,,,,,,,,,,,,,,,,,1,1.4006930129980901,,,,,,,,,,,,,,,,,,,,,,,,,,,,062019_p2,001,2019_Jun_20_1433,body_behavioural,3.0.4,59.99197727298745,
4,He waved off her half-hearted protests. ,1,2,None,,,,,,0,4,4,4,,,,,0,15,15,15,,,,,,,,,,,,,,,,,,,,,,,,,,,,,,,,,,,1,2.6031559450020723,,,,,,,,,,,,,,,,,,,,,,,,,,,,062019_p2,001,2019_Jun_20_1433,body_behavioural,3.0.4,59.99197727298745,
4,“Really- I have plenty of time and nothing better to do.” he said. ,1,2,None,,,,,,0,4,4,4,,,,,0,16,16,16,,,,,,,,,,,,,,,,,,,,,,,,,,,,,,,,,,,1,1.736421359997621,,,,,,,,,,,,,,,,,,,,,,,,,,,,062019_p2,001,2019_Jun_20_1433,body_behavioural,3.0.4,59.99197727298745,
4,"At security, the line was not long, but since Anna’s flight was so soon the security guard allowed them to go to the front of the line.",2,2,None,,,,,,0,4,4,4,,,,,0,17,17,17,,,,,,,,,,,,,,,,,,,,,,,,,,,,,,,,,,,9,2.8346168099997158,,,,,,,,,,,,,,,,,,,,,,,,,,,,062019_p2,001,2019_Jun_20_1433,body_behavioural,3.0.4,59.99197727298745,
4,"They had to wait however, because there was a strange malfunction of the metal detector. ",2,2,None,,,,,,0,4,4,4,,,,,0,18,18,18,,,,,,,,,,,,,,,,,,,,,,,,,,,,,,,,,,,9,4.934336793001421,,,,,,,,,,,,,,,,,,,,,,,,,,,,062019_p2,001,2019_Jun_20_1433,body_behavioural,3.0.4,59.99197727298745,
4,"In this span of time, they managed to find out that they had gone to the same high school and that Anna had graduated 3 years before David. ",2,2,None,,,,,,0,4,4,4,,,,,0,19,19,19,,,,,,,,,,,,,,,,,,,,,,,,,,,,,,,,,,,1,3.2196838349991594,,,,,,,,,,,,,,,,,,,,,,,,,,,,062019_p2,001,2019_Jun_20_1433,body_behavioural,3.0.4,59.99197727298745,
4,They hurriedly took off their shoes and coats.,2,2,None,,,,,,0,4,4,4,,,,,0,20,20,20,,,,,,,,,,,,,,,,,,,,,,,,,,,,,,,,,,,9,2.136677692997182,,,,,,,,,,,,,,,,,,,,,,,,,,,,062019_p2,001,2019_Jun_20_1433,body_behavioural,3.0.4,59.99197727298745,
4,"Anna placed her purse and suitcase on the conveyor belt, and David put his backpack on the conveyor belt as well, with his laptop in a separate bin. ",2,2,None,,,,,,0,4,4,4,,,,,0,21,21,21,,,,,,,,,,,,,,,,,,,,,,,,,,,,,,,,,,,1,5.084876113000064,,,,,,,,,,,,,,,,,,,,,,,,,,,,062019_p2,001,2019_Jun_20_1433,body_behavioural,3.0.4,59.99197727298745,
4,Both of them went through the metal detector without any problems. ,2,2,None,,,,,,0,4,4,4,,,,,0,22,22,22,,,,,,,,,,,,,,,,,,,,,,,,,,,,,,,,,,,1,1.4865237949998118,,,,,,,,,,,,,,,,,,,,,,,,,,,,062019_p2,001,2019_Jun_20_1433,body_behavioural,3.0.4,59.99197727298745,
4,"As they were rushing to put their shoes and coats on, they shared when they were coming back. ",2,2,None,,,,,,0,4,4,4,,,,,0,23,23,23,,,,,,,,,,,,,,,,,,,,,,,,,,,,,,,,,,,1,7.019834594997519,,,,,,,,,,,,,,,,,,,,,,,,,,,,062019_p2,001,2019_Jun_20_1433,body_behavioural,3.0.4,59.99197727298745,
