4,"In a moment of boldness, David asked, “When we're back in town next Tuesday, is there any chance you'd want to get dinner?",2,3,None,,,,,,0,4,4,4,,,,,0,24,24,24,,,,,,,,,,,,,,,,,,,,,,,,,,,,,,,,,,,1,3.085839858998952,,,,,,,,,,,,,,,,,,,,,,,,,,,,062019_p2,001,2019_Jun_20_1433,body_behavioural,3.0.4,59.99197727298745,
4,"I know we just met, but when life throws a luggage cart at you it seems like we should listen. “",2,3,None,,,,,,0,4,4,4,,,,,0,25,25,25,,,,,,,,,,,,,,,,,,,,,,,,,,,,,,,,,,,1,6.137259221999557,,,,,,,,,,,,,,,,,,,,,,,,,,,,062019_p2,001,2019_Jun_20_1433,body_behavioural,3.0.4,59.99197727298745,
4,"She stopped packing, and said with a smile, “Yes I would love that.”",2,3,None,,,,,,0,4,4,4,,,,,0,26,26,26,,,,,,,,,,,,,,,,,,,,,,,,,,,,,,,,,,,1,1.9030642329998955,,,,,,,,,,,,,,,,,,,,,,,,,,,,062019_p2,001,2019_Jun_20_1433,body_behavioural,3.0.4,59.99197727298745,
4,"On the concourse, they were running to get to Anna’s gate, J37, which was at the end of the terminal. ",3,3,None,,,,,,0,4,4,4,,,,,0,27,27,27,,,,,,,,,,,,,,,,,,,,,,,,,,,,,,,,,,,9,3.1508521799987648,,,,,,,,,,,,,,,,,,,,,,,,,,,,062019_p2,001,2019_Jun_20_1433,body_behavioural,3.0.4,59.99197727298745,
4,"David took her suitcase, grabbed her hand, and weaved crowd of people.",3,3,None,,,,,,0,4,4,4,,,,,0,28,28,28,,,,,,,,,,,,,,,,,,,,,,,,,,,,,,,,,,,1,5.486776716999884,,,,,,,,,,,,,,,,,,,,,,,,,,,,062019_p2,001,2019_Jun_20_1433,body_behavioural,3.0.4,59.99197727298745,
4,People passing them were giving them funny looks because Anna looked so bewildered.,3,3,None,,,,,,0,4,4,4,,,,,0,29,29,29,,,,,,,,,,,,,,,,,,,,,,,,,,,,,,,,,,,1,2.5363811899987923,,,,,,,,,,,,,,,,,,,,,,,,,,,,062019_p2,001,2019_Jun_20_1433,body_behavioural,3.0.4,59.99197727298745,
4,"Before getting to the gate, explaining that she would sprint the rest of the way, Anna fished out a crumpled business card from her pocket and handed it to David, who handed her the suitcase.",3,4,None,,,,,,0,4,4,4,,,,,0,30,30,30,,,,,,,,,,,,,,,,,,,,,,,,,,,,,,,,,,,9,13.670686833000218,,,,,,,,,,,,,,,,,,,,,,,,,,,,062019_p2,001,2019_Jun_20_1433,body_behavioural,3.0.4,59.99197727298745,
4,"She gave him one last embarrassed smile, thanked him, and hurried away.",3,4,None,,,,,,0,4,4,4,,,,,0,31,31,31,,,,,,,,,,,,,,,,,,,,,,,,,,,,,,,,,,,1,2.1032475430001796,,,,,,,,,,,,,,,,,,,,,,,,,,,,062019_p2,001,2019_Jun_20_1433,body_behavioural,3.0.4,59.99197727298745,
4,"David looked at his watch which read 10:55 AM, 5 minutes before her flight was supposed to leave. ",3,4,None,,,,,,0,4,4,4,,,,,0,32,32,32,,,,,,,,,,,,,,,,,,,,,,,,,,,,,,,,,,,9,6.086640318000718,,,,,,,,,,,,,,,,,,,,,,,,,,,,062019_p2,001,2019_Jun_20_1433,body_behavioural,3.0.4,59.99197727298745,
4,"At the gate, Anna waved to the flight attendant who motioned for her to hurry and she boarded the plane. ",4,4,None,,,,,,0,4,4,4,,,,,0,33,33,33,,,,,,,,,,,,,,,,,,,,,,,,,,,,,,,,,,,1,6.103870020000613,,,,,,,,,,,,,,,,,,,,,,,,,,,,062019_p2,001,2019_Jun_20_1433,body_behavioural,3.0.4,59.99197727298745,
4,"She slid into her window seat 7D in business class, and barely containing her glee, she hugged the plastic-wrapped blanket. ",4,4,None,,,,,,0,4,4,4,,,,,0,34,34,34,,,,,,,,,,,,,,,,,,,,,,,,,,,,,,,,,,,1,22.237763994999113,,,,,,,,,,,,,,,,,,,,,,,,,,,,062019_p2,001,2019_Jun_20_1433,body_behavioural,3.0.4,59.99197727298745,
4,"She was thankful that she had not only made it onto the plane in time, but also that she had been clumsy enough to forget to tie her shoes.",4,4,None,,,,,,0,4,4,4,,,,,0,35,35,35,,,,,,,,,,,,,,,,,,,,,,,,,,,,,,,,,,,1,1.353290797000227,,,,,,,,,,,,,,,,,,,,,,,,,,,,062019_p2,001,2019_Jun_20_1433,body_behavioural,3.0.4,59.99197727298745,
4,,,,,,,,,,0,4,4,4,,,,,,,,,,,,,,,,,,,,,,,,,,,,,,,,,,,,,,,,,,,,,,,,,,,,,,,,,,,,,,,,,,,,,,,,062019_p2,001,2019_Jun_20_1433,body_behavioural,3.0.4,59.99197727298745,
5,,,,,,,,,,0,5,5,5,0,0,0,0,,,,,,,,,,,,,,,,,,,,,,,,,,,,,space,0.8030273499971372,space,0.4864084830005595,space,0.5363869829998293,,,,,,,,,,,,,,,,,,,,,,,,,,,,,,,,,,062019_p2,001,2019_Jun_20_1433,body_behavioural,3.0.4,59.99197727298745,
5,"Charlie saw Alma as they walked into class, and he motioned for her to come sit in the back next to him because they had a deal to discuss.",1,1,34.0,,,,,,0,5,5,5,,,,,0,0,0,0,,,,,,,,,,,,,,,,,,,,,,,,,,,,,,,space,0.9528907349995279,space,0.48625532999722054,9,6.8340429100026086,,,,,,,,,,,,,,,,,,,,,,,,,,,,062019_p2,001,2019_Jun_20_1433,body_behavioural,3.0.4,59.99197727298745,
5,Charlie and Alma were both history majors with entrepreneurial bents.,1,1,None,,,,,,0,5,5,5,,,,,0,1,1,1,,,,,,,,,,,,,,,,,,,,,,,,,,,,,,,,,,,1,15.504553656999633,,,,,,,,,,,,,,,,,,,,,,,,,,,,062019_p2,001,2019_Jun_20_1433,body_behavioural,3.0.4,59.99197727298745,
5,They were also both very busy and happened to be in the same class.,1,1,None,,,,,,0,5,5,5,,,,,0,2,2,2,,,,,,,,,,,,,,,,,,,,,,,,,,,,,,,,,,,1,1.2035510009991413,,,,,,,,,,,,,,,,,,,,,,,,,,,,062019_p2,001,2019_Jun_20_1433,body_behavioural,3.0.4,59.99197727298745,
5,"After talking at a party, Charlie had discovered that Alma was looking for financing for her web development company of which she was the founder and CEO.",1,1,None,,,,,,0,5,5,5,,,,,0,3,3,3,,,,,,,,,,,,,,,,,,,,,,,,,,,,,,,,,,,9,2.6696633050014498,,,,,,,,,,,,,,,,,,,,,,,,,,,,062019_p2,001,2019_Jun_20_1433,body_behavioural,3.0.4,59.99197727298745,
5,It was serendipitous because he was an investment analyst for a student finance group on campus and he had been talking with other members of the group about making a new investment. ,1,1,None,,,,,,0,5,5,5,,,,,0,4,4,4,,,,,,,,,,,,,,,,,,,,,,,,,,,,,,,,,,,1,9.953362845997617,,,,,,,,,,,,,,,,,,,,,,,,,,,,062019_p2,001,2019_Jun_20_1433,body_behavioural,3.0.4,59.99197727298745,
5,"His financial group had come to a decision that morning about Alma’s startup, and he didn't want to wait until after class to discuss the proposal with her. ",1,1,None,,,,,,0,5,5,5,,,,,0,5,5,5,,,,,,,,,,,,,,,,,,,,,,,,,,,,,,,,,,,1,5.734352562001732,,,,,,,,,,,,,,,,,,,,,,,,,,,,062019_p2,001,2019_Jun_20_1433,body_behavioural,3.0.4,59.99197727298745,
5,The class was in a medium-sized auditorium which was brightly lit and very modern-looking. ,1,1,None,,,,,,0,5,5,5,,,,,0,6,6,6,,,,,,,,,,,,,,,,,,,,,,,,,,,,,,,,,,,9,10.11755328199797,,,,,,,,,,,,,,,,,,,,,,,,,,,,062019_p2,001,2019_Jun_20_1433,body_behavioural,3.0.4,59.99197727298745,
5,There were three projector screens in the front and each row of the audience had a table with power outlets and USB ports. ,1,1,None,,,,,,0,5,5,5,,,,,0,7,7,7,,,,,,,,,,,,,,,,,,,,,,,,,,,,,,,,,,,1,2.9858639529993525,,,,,,,,,,,,,,,,,,,,,,,,,,,,062019_p2,001,2019_Jun_20_1433,body_behavioural,3.0.4,59.99197727298745,
5,“Here we are at Lecture Seven of Archaeology of Rome” said the professor. ,2,1,None,,,,,,0,5,5,5,,,,,0,8,8,8,,,,,,,,,,,,,,,,,,,,,,,,,,,,,,,,,,,1,4.97002384499865,,,,,,,,,,,,,,,,,,,,,,,,,,,,062019_p2,001,2019_Jun_20_1433,body_behavioural,3.0.4,59.99197727298745,
5,"“The topic for today is Augustus, an incredibly important influence in Roman architecture.” ",2,1,None,,,,,,0,5,5,5,,,,,0,9,9,9,,,,,,,,,,,,,,,,,,,,,,,,,,,,,,,,,,,9,1.969840710000426,,,,,,,,,,,,,,,,,,,,,,,,,,,,062019_p2,001,2019_Jun_20_1433,body_behavioural,3.0.4,59.99197727298745,
5,She went into some recap of the last lecture.,2,1,None,,,,,,0,5,5,5,,,,,0,10,10,10,,,,,,,,,,,,,,,,,,,,,,,,,,,,,,,,,,,1,1.819835869999224,,,,,,,,,,,,,,,,,,,,,,,,,,,,062019_p2,001,2019_Jun_20_1433,body_behavioural,3.0.4,59.99197727298745,
5,"Charlie turned to Alma and said, “Okay, so I’ve been thinking about your startup, and I have talked about it with my fellow investors.",2,2,None,,,,,,0,5,5,5,,,,,0,11,11,11,,,,,,,,,,,,,,,,,,,,,,,,,,,,,,,,,,,9,3.270235005002178,,,,,,,,,,,,,,,,,,,,,,,,,,,,062019_p2,001,2019_Jun_20_1433,body_behavioural,3.0.4,59.99197727298745,
5,We’d like to invest half of what you originally suggested.,2,2,None,,,,,,0,5,5,5,,,,,0,12,12,12,,,,,,,,,,,,,,,,,,,,,,,,,,,,,,,,,,,1,0.2863371300009021,,,,,,,,,,,,,,,,,,,,,,,,,,,,062019_p2,001,2019_Jun_20_1433,body_behavioural,3.0.4,59.99197727298745,
5,"So we propose we start with wiring you $28,000.",2,2,None,,,,,,0,5,5,5,,,,,0,13,13,13,,,,,,,,,,,,,,,,,,,,,,,,,,,,,,,,,,,1,1.4534543369991297,,,,,,,,,,,,,,,,,,,,,,,,,,,,062019_p2,001,2019_Jun_20_1433,body_behavioural,3.0.4,59.99197727298745,
5,We would see how the company does and then invest the other half later.” ,2,2,None,,,,,,0,5,5,5,,,,,0,14,14,14,,,,,,,,,,,,,,,,,,,,,,,,,,,,,,,,,,,1,5.603031549999287,,,,,,,,,,,,,,,,,,,,,,,,,,,,062019_p2,001,2019_Jun_20_1433,body_behavioural,3.0.4,59.99197727298745,
5,"The professor said, “The senate had conferred upon him the title of Augustus the sacred and revered one, the restorer of traditional values, the city’s new religious leader, the restorer of temples. ",3,2,None,,,,,,0,5,5,5,,,,,0,15,15,15,,,,,,,,,,,,,,,,,,,,,,,,,,,,,,,,,,,9,6.470109333000437,,,,,,,,,,,,,,,,,,,,,,,,,,,,062019_p2,001,2019_Jun_20_1433,body_behavioural,3.0.4,59.99197727298745,
5,"Augustus also sought to beautify Rome, make it into a new Athens, and dispel the criticisms of Rome as disorganized and ugly.”",3,2,None,,,,,,0,5,5,5,,,,,0,16,16,16,,,,,,,,,,,,,,,,,,,,,,,,,,,,,,,,,,,1,0.7197380400029942,,,,,,,,,,,,,,,,,,,,,,,,,,,,062019_p2,001,2019_Jun_20_1433,body_behavioural,3.0.4,59.99197727298745,
5,"Alma turned to Charlie and offered her rebuttal, “I don’t know about that.",3,3,None,,,,,,0,5,5,5,,,,,0,17,17,17,,,,,,,,,,,,,,,,,,,,,,,,,,,,,,,,,,,1,1.685739745000319,,,,,,,,,,,,,,,,,,,,,,,,,,,,062019_p2,001,2019_Jun_20_1433,body_behavioural,3.0.4,59.99197727298745,
5,It’s not going to be possible to implement our ideas effectively unless the project is fully funded. ,3,3,None,,,,,,0,5,5,5,,,,,0,18,18,18,,,,,,,,,,,,,,,,,,,,,,,,,,,,,,,,,,,1,2.7195919350015174,,,,,,,,,,,,,,,,,,,,,,,,,,,,062019_p2,001,2019_Jun_20_1433,body_behavioural,3.0.4,59.99197727298745,
5,"We would have to find other investors like your competitor on campus, Churchill Capital Group, and that would set us back in our timeline. ",3,3,None,,,,,,0,5,5,5,,,,,0,19,19,19,,,,,,,,,,,,,,,,,,,,,,,,,,,,,,,,,,,1,7.186865490002674,,,,,,,,,,,,,,,,,,,,,,,,,,,,062019_p2,001,2019_Jun_20_1433,body_behavioural,3.0.4,59.99197727298745,
5,"Our profit projections assumed we'd be starting relatively soon, not months down the line.” ",3,3,None,,,,,,0,5,5,5,,,,,0,20,20,20,,,,,,,,,,,,,,,,,,,,,,,,,,,,,,,,,,,1,4.435045890000765,,,,,,,,,,,,,,,,,,,,,,,,,,,,062019_p2,001,2019_Jun_20_1433,body_behavioural,3.0.4,59.99197727298745,
5,They whispered back and forth during the entire class working out a compromise. ,3,3,None,,,,,,0,5,5,5,,,,,0,21,21,21,,,,,,,,,,,,,,,,,,,,,,,,,,,,,,,,,,,1,4.787048344998766,,,,,,,,,,,,,,,,,,,,,,,,,,,,062019_p2,001,2019_Jun_20_1433,body_behavioural,3.0.4,59.99197727298745,
5,The professor dismissed the students with a reminder that the midterm paper was due on Thursday and that they should email their papers to the TA.,4,3,None,,,,,,0,5,5,5,,,,,0,22,22,22,,,,,,,,,,,,,,,,,,,,,,,,,,,,,,,,,,,9,5.0034259099993506,,,,,,,,,,,,,,,,,,,,,,,,,,,,062019_p2,001,2019_Jun_20_1433,body_behavioural,3.0.4,59.99197727298745,
5,"Everyone, except Charlie and Alma, packed up their things and headed out of the lecture hall. ",4,3,None,,,,,,0,5,5,5,,,,,0,23,23,23,,,,,,,,,,,,,,,,,,,,,,,,,,,,,,,,,,,9,5.036706047001644,,,,,,,,,,,,,,,,,,,,,,,,,,,,062019_p2,001,2019_Jun_20_1433,body_behavioural,3.0.4,59.99197727298745,
5,"“Alright, so we’ll have the $30,000 wired to you by tomorrow,” Charlie said. ",4,4,None,,,,,,0,5,5,5,,,,,0,24,24,24,,,,,,,,,,,,,,,,,,,,,,,,,,,,,,,,,,,1,2.0703710229972785,,,,,,,,,,,,,,,,,,,,,,,,,,,,062019_p2,001,2019_Jun_20_1433,body_behavioural,3.0.4,59.99197727298745,
5,"This wasn't ideal for Charlie, but Alma had refused to budge, and his investment group had told him they were willing to pay the full amount if necessary. ",4,4,None,,,,,,0,5,5,5,,,,,0,25,25,25,,,,,,,,,,,,,,,,,,,,,,,,,,,,,,,,,,,1,8.28680442499899,,,,,,,,,,,,,,,,,,,,,,,,,,,,062019_p2,001,2019_Jun_20_1433,body_behavioural,3.0.4,59.99197727298745,
5,They hugged in confirmation of the deal and made plans to sign the official paperwork the next day. ,4,4,None,,,,,,0,5,5,5,,,,,0,26,26,26,,,,,,,,,,,,,,,,,,,,,,,,,,,,,,,,,,,1,1.9034866349975346,,,,,,,,,,,,,,,,,,,,,,,,,,,,062019_p2,001,2019_Jun_20_1433,body_behavioural,3.0.4,59.99197727298745,
5,,,,,,,,,,0,5,5,5,,,,,,,,,,,,,,,,,,,,,,,,,,,,,,,,,,,,,,,,,,,,,,,,,,,,,,,,,,,,,,,,,,,,,,,,062019_p2,001,2019_Jun_20_1433,body_behavioural,3.0.4,59.99197727298745,
6,,,,,,,,,,0,6,6,6,0,0,0,0,,,,,,,,,,,,,,,,,,,,,,,,,,,,,space,3.6698007519989915,space,0.603190829999221,space,3.669075662000978,,,,,,,,,,,,,,,,,,,,,,,,,,,,,,,,,,062019_p2,001,2019_Jun_20_1433,body_behavioural,3.0.4,59.99197727298745,
6,,,,,,,,,,0,6,6,6,1,0,1,0,,,,,,,,,,,,,,,,,,,,,,,,,,,,,,,,,space,0.4196797769982368,,,,,,,,,,,,,,,,,,,,,,,,,,,,,,,,,,062019_p2,001,2019_Jun_20_1433,body_behavioural,3.0.4,59.99197727298745,
6,,,,,,,,,,0,6,6,6,2,0,2,0,,,,,,,,,,,,,,,,,,,,,,,,,,,,,,,,,space,0.9030929829968954,,,,,,,,,,,,,,,,,,,,,,,,,,,,,,,,,,062019_p2,001,2019_Jun_20_1433,body_behavioural,3.0.4,59.99197727298745,
6,"Alex was a distracted, sweaty mess as he walked into the grocery store with Chloe; he was hoping that she wouldn't suspect that he was about to propose.",1,1,23.0,,,,,,0,6,6,6,,,,,0,0,0,0,,,,,,,,,,,,,,,,,,,,,,,,,,,,,,,space,1.6006140379977296,space,1.5863275949996023,9,5.953907292998338,,,,,,,,,,,,,,,,,,,,,,,,,,,,062019_p2,001,2019_Jun_20_1433,body_behavioural,3.0.4,59.99197727298745,
6,The grocery store was brightly lit with sunshine pouring in through glass walls at the front of the store.,1,1,None,,,,,,0,6,6,6,,,,,0,1,1,1,,,,,,,,,,,,,,,,,,,,,,,,,,,,,,,,,,,1,7.103362523001124,,,,,,,,,,,,,,,,,,,,,,,,,,,,062019_p2,001,2019_Jun_20_1433,body_behavioural,3.0.4,59.99197727298745,
6,Also in the front area were large posters advertising thanksgiving promotions.,1,1,None,,,,,,0,6,6,6,,,,,0,2,2,2,,,,,,,,,,,,,,,,,,,,,,,,,,,,,,,,,,,1,2.470244072999776,,,,,,,,,,,,,,,,,,,,,,,,,,,,062019_p2,001,2019_Jun_20_1433,body_behavioural,3.0.4,59.99197727298745,
6,"The store was buzzing with activity because the next day was Thanksgiving, and most shoppers had carts piled high with turkey, stuffing, and pies.",1,1,None,,,,,,0,6,6,6,,,,,0,3,3,3,,,,,,,,,,,,,,,,,,,,,,,,,,,,,,,,,,,1,7.351046972999029,,,,,,,,,,,,,,,,,,,,,,,,,,,,062019_p2,001,2019_Jun_20_1433,body_behavioural,3.0.4,59.99197727298745,
6,Alex wanted to propose here because he knew Chloe would be wonderfully surprised. ,1,1,None,,,,,,0,6,6,6,,,,,0,4,4,4,,,,,,,,,,,,,,,,,,,,,,,,,,,,,,,,,,,9,6.270003619996714,,,,,,,,,,,,,,,,,,,,,,,,,,,,062019_p2,001,2019_Jun_20_1433,body_behavioural,3.0.4,59.99197727298745,
6,"After 23 months of dating, Alex knew one of the things Chloe loved most was surprises. ",1,1,None,,,,,,0,6,6,6,,,,,0,5,5,5,,,,,,,,,,,,,,,,,,,,,,,,,,,,,,,,,,,1,2.4697584150017065,,,,,,,,,,,,,,,,,,,,,,,,,,,,062019_p2,001,2019_Jun_20_1433,body_behavioural,3.0.4,59.99197727298745,
6,"Chloe perused the canned goods aisle, and said, “Alex, we need a couple things.”",2,1,None,,,,,,0,6,6,6,,,,,0,6,6,6,,,,,,,,,,,,,,,,,,,,,,,,,,,,,,,,,,,9,7.137571981998917,,,,,,,,,,,,,,,,,,,,,,,,,,,,062019_p2,001,2019_Jun_20_1433,body_behavioural,3.0.4,59.99197727298745,
6,"He didn’t hear her and was fanning himself, and Chloe asked him if he was okay.",2,1,None,,,,,,0,6,6,6,,,,,0,7,7,7,,,,,,,,,,,,,,,,,,,,,,,,,,,,,,,,,,,1,3.1197565750007925,,,,,,,,,,,,,,,,,,,,,,,,,,,,062019_p2,001,2019_Jun_20_1433,body_behavioural,3.0.4,59.99197727298745,
6,"“Oh yeah, for sure,” he said, unconvincingly. ",2,1,None,,,,,,0,6,6,6,,,,,0,8,8,8,,,,,,,,,,,,,,,,,,,,,,,,,,,,,,,,,,,1,1.2842638479996822,,,,,,,,,,,,,,,,,,,,,,,,,,,,062019_p2,001,2019_Jun_20_1433,body_behavioural,3.0.4,59.99197727298745,
6,"She chuckled, “Alright, whatever you say.” ",2,1,None,,,,,,0,6,6,6,,,,,0,9,9,9,,,,,,,,,,,,,,,,,,,,,,,,,,,,,,,,,,,1,1.3028134400010458,,,,,,,,,,,,,,,,,,,,,,,,,,,,062019_p2,001,2019_Jun_20_1433,body_behavioural,3.0.4,59.99197727298745,
6,"She had a can of pumpkin puree and a bottle of vinegar picked out, and she was now mulling over the different cans of cranberry sauce.",2,1,None,,,,,,0,6,6,6,,,,,0,10,10,10,,,,,,,,,,,,,,,,,,,,,,,,,,,,,,,,,,,9,4.069982158001949,,,,,,,,,,,,,,,,,,,,,,,,,,,,062019_p2,001,2019_Jun_20_1433,body_behavioural,3.0.4,59.99197727298745,
6,"Alex was guessing she would be a while, and he turned his back to her and pulled out the ring to look at it one more time. ",2,2,None,,,,,,0,6,6,6,,,,,0,11,11,11,,,,,,,,,,,,,,,,,,,,,,,,,,,,,,,,,,,1,1.6531160779995844,,,,,,,,,,,,,,,,,,,,,,,,,,,,062019_p2,001,2019_Jun_20_1433,body_behavioural,3.0.4,59.99197727298745,
6,The ring a thin band with one white diamond that glittered excessively in the light. ,2,2,None,,,,,,0,6,6,6,,,,,0,12,12,12,,,,,,,,,,,,,,,,,,,,,,,,,,,,,,,,,,,1,4.353018598001654,,,,,,,,,,,,,,,,,,,,,,,,,,,,062019_p2,001,2019_Jun_20_1433,body_behavioural,3.0.4,59.99197727298745,
6,“Do we need anything else?” she called out to him. ,2,2,None,,,,,,0,6,6,6,,,,,0,13,13,13,,,,,,,,,,,,,,,,,,,,,,,,,,,,,,,,,,,1,1.9867477400002826,,,,,,,,,,,,,,,,,,,,,,,,,,,,062019_p2,001,2019_Jun_20_1433,body_behavioural,3.0.4,59.99197727298745,
6,"“Yeah I don’t know, honey,” he said back, still looking at the ring. ",2,2,None,,,,,,0,6,6,6,,,,,0,14,14,14,,,,,,,,,,,,,,,,,,,,,,,,,,,,,,,,,,,1,2.386730065001757,,,,,,,,,,,,,,,,,,,,,,,,,,,,062019_p2,001,2019_Jun_20_1433,body_behavioural,3.0.4,59.99197727298745,
6,"In the checkout area, there were 5 aisles open and they stepped in line for station 3. ",3,2,None,,,,,,0,6,6,6,,,,,0,15,15,15,,,,,,,,,,,,,,,,,,,,,,,,,,,,,,,,,,,9,11.853798025000287,,,,,,,,,,,,,,,,,,,,,,,,,,,,062019_p2,001,2019_Jun_20_1433,body_behavioural,3.0.4,59.99197727298745,
6,Alex was staring intensely off into the distance for most of the time and fidgeting with his wallet. ,3,2,None,,,,,,0,6,6,6,,,,,0,16,16,16,,,,,,,,,,,,,,,,,,,,,,,,,,,,,,,,,,,1,1.502755760000582,,,,,,,,,,,,,,,,,,,,,,,,,,,,062019_p2,001,2019_Jun_20_1433,body_behavioural,3.0.4,59.99197727298745,
6,"Chloe watched him trying to decide whether he looked scared or confused, and shrugged, pulling out her phone since she figured he’d talk about whatever was on his mind when he was ready. ",3,2,None,,,,,,0,6,6,6,,,,,0,17,17,17,,,,,,,,,,,,,,,,,,,,,,,,,,,,,,,,,,,9,8.737036382000952,,,,,,,,,,,,,,,,,,,,,,,,,,,,062019_p2,001,2019_Jun_20_1433,body_behavioural,3.0.4,59.99197727298745,
6,Alex looked over at their friends who were waiting by the entrance of the grocery store.,3,2,None,,,,,,0,6,6,6,,,,,0,18,18,18,,,,,,,,,,,,,,,,,,,,,,,,,,,,,,,,,,,1,3.0366805379999278,,,,,,,,,,,,,,,,,,,,,,,,,,,,062019_p2,001,2019_Jun_20_1433,body_behavioural,3.0.4,59.99197727298745,
6,They walked over slowly. ,3,2,None,,,,,,0,6,6,6,,,,,0,19,19,19,,,,,,,,,,,,,,,,,,,,,,,,,,,,,,,,,,,1,2.200731437998911,,,,,,,,,,,,,,,,,,,,,,,,,,,,062019_p2,001,2019_Jun_20_1433,body_behavioural,3.0.4,59.99197727298745,
6,"Seemingly out of nowhere, Alex took Chloe’s hand and he got down on one knee. ",3,3,None,,,,,,0,6,6,6,,,,,0,20,20,20,,,,,,,,,,,,,,,,,,,,,,,,,,,,,,,,,,,9,4.002885472000344,,,,,,,,,,,,,,,,,,,,,,,,,,,,062019_p2,001,2019_Jun_20_1433,body_behavioural,3.0.4,59.99197727298745,
6,Chloe gasped,3,3,None,,,,,,0,6,6,6,,,,,0,21,21,21,,,,,,,,,,,,,,,,,,,,,,,,,,,,,,,,,,,1,1.1360258899985638,,,,,,,,,,,,,,,,,,,,,,,,,,,,062019_p2,001,2019_Jun_20_1433,body_behavioural,3.0.4,59.99197727298745,
6,"“Chloe, I love you so much and I want to be with you forever, I can’t imagine a day without you.”",3,3,None,,,,,,0,6,6,6,,,,,0,22,22,22,,,,,,,,,,,,,,,,,,,,,,,,,,,,,,,,,,,1,4.284116660001018,,,,,,,,,,,,,,,,,,,,,,,,,,,,062019_p2,001,2019_Jun_20_1433,body_behavioural,3.0.4,59.99197727298745,
6,"“Alex, me too,” she replied.",3,3,None,,,,,,0,6,6,6,,,,,0,23,23,23,,,,,,,,,,,,,,,,,,,,,,,,,,,,,,,,,,,1,1.7360700099998212,,,,,,,,,,,,,,,,,,,,,,,,,,,,062019_p2,001,2019_Jun_20_1433,body_behavioural,3.0.4,59.99197727298745,
6,"The ring was in the crevice of his wallet, and he opened it.",3,3,None,,,,,,0,6,6,6,,,,,0,24,24,24,,,,,,,,,,,,,,,,,,,,,,,,,,,,,,,,,,,1,4.620606111999223,,,,,,,,,,,,,,,,,,,,,,,,,,,,062019_p2,001,2019_Jun_20_1433,body_behavioural,3.0.4,59.99197727298745,
6,“Will you marry me?”,3,3,None,,,,,,0,6,6,6,,,,,0,25,25,25,,,,,,,,,,,,,,,,,,,,,,,,,,,,,,,,,,,1,1.6695200280009885,,,,,,,,,,,,,,,,,,,,,,,,,,,,062019_p2,001,2019_Jun_20_1433,body_behavioural,3.0.4,59.99197727298745,
6,"The people in line around them realized what was happening, stepped back, and started taking pictures.",3,3,None,,,,,,0,6,6,6,,,,,0,26,26,26,,,,,,,,,,,,,,,,,,,,,,,,,,,,,,,,,,,9,1.8699352680014272,,,,,,,,,,,,,,,,,,,,,,,,,,,,062019_p2,001,2019_Jun_20_1433,body_behavioural,3.0.4,59.99197727298745,
6,Their friends were no longer trying to hide and were videotaping and taking pictures too. ,3,3,None,,,,,,0,6,6,6,,,,,0,27,27,27,,,,,,,,,,,,,,,,,,,,,,,,,,,,,,,,,,,1,7.786844253001618,,,,,,,,,,,,,,,,,,,,,,,,,,,,062019_p2,001,2019_Jun_20_1433,body_behavioural,3.0.4,59.99197727298745,
6,"After a few moments of suspense she shouted,“Yes!”, and she jumped to embrace Alex in a hug. ",3,4,None,,,,,,0,6,6,6,,,,,0,28,28,28,,,,,,,,,,,,,,,,,,,,,,,,,,,,,,,,,,,1,22.40447528200093,,,,,,,,,,,,,,,,,,,,,,,,,,,,062019_p2,001,2019_Jun_20_1433,body_behavioural,3.0.4,59.99197727298745,
6,Everyone in line clapped and cheered. ,3,4,None,,,,,,0,6,6,6,,,,,0,29,29,29,,,,,,,,,,,,,,,,,,,,,,,,,,,,,,,,,,,1,1.2862998800010246,,,,,,,,,,,,,,,,,,,,,,,,,,,,062019_p2,001,2019_Jun_20_1433,body_behavioural,3.0.4,59.99197727298745,
6,"Alex put the ring on Chloe’s finger, who was nearly spinning in excitement.",3,4,None,,,,,,0,6,6,6,,,,,0,30,30,30,,,,,,,,,,,,,,,,,,,,,,,,,,,,,,,,,,,9,1.5527325000002747,,,,,,,,,,,,,,,,,,,,,,,,,,,,062019_p2,001,2019_Jun_20_1433,body_behavioural,3.0.4,59.99197727298745,
6,“I love it!,3,4,None,,,,,,0,6,6,6,,,,,0,31,31,31,,,,,,,,,,,,,,,,,,,,,,,,,,,,,,,,,,,1,1.1362308649986517,,,,,,,,,,,,,,,,,,,,,,,,,,,,062019_p2,001,2019_Jun_20_1433,body_behavioural,3.0.4,59.99197727298745,
6,Oh my- it’s so glittery!,3,4,None,,,,,,0,6,6,6,,,,,0,32,32,32,,,,,,,,,,,,,,,,,,,,,,,,,,,,,,,,,,,1,1.0026307749976695,,,,,,,,,,,,,,,,,,,,,,,,,,,,062019_p2,001,2019_Jun_20_1433,body_behavioural,3.0.4,59.99197727298745,
6,Look at this!” she said as she shoved her hand in a stranger’s face.,3,4,None,,,,,,0,6,6,6,,,,,0,33,33,33,,,,,,,,,,,,,,,,,,,,,,,,,,,,,,,,,,,1,2.719862383000873,,,,,,,,,,,,,,,,,,,,,,,,,,,,062019_p2,001,2019_Jun_20_1433,body_behavioural,3.0.4,59.99197727298745,
6,Their friends came over and hugged them.,3,4,None,,,,,,0,6,6,6,,,,,0,34,34,34,,,,,,,,,,,,,,,,,,,,,,,,,,,,,,,,,,,9,2.500723195000319,,,,,,,,,,,,,,,,,,,,,,,,,,,,062019_p2,001,2019_Jun_20_1433,body_behavioural,3.0.4,59.99197727298745,
6,The other people let them move up to the front of the checkout line. ,3,4,None,,,,,,0,6,6,6,,,,,0,35,35,35,,,,,,,,,,,,,,,,,,,,,,,,,,,,,,,,,,,1,1.4693436380002822,,,,,,,,,,,,,,,,,,,,,,,,,,,,062019_p2,001,2019_Jun_20_1433,body_behavioural,3.0.4,59.99197727298745,
6,Chloe immediately texted her mom a picture of her hand. ,3,4,None,,,,,,0,6,6,6,,,,,0,36,36,36,,,,,,,,,,,,,,,,,,,,,,,,,,,,,,,,,,,1,1.169510736999655,,,,,,,,,,,,,,,,,,,,,,,,,,,,062019_p2,001,2019_Jun_20_1433,body_behavioural,3.0.4,59.99197727298745,
6,The cashier congratulated them and scanned their groceries. ,4,4,None,,,,,,0,6,6,6,,,,,0,37,37,37,,,,,,,,,,,,,,,,,,,,,,,,,,,,,,,,,,,1,1.2367355030000908,,,,,,,,,,,,,,,,,,,,,,,,,,,,062019_p2,001,2019_Jun_20_1433,body_behavioural,3.0.4,59.99197727298745,
6,The total came to $14 and Alex paid in cash while Chloe greeted their friends.,4,4,None,,,,,,0,6,6,6,,,,,0,38,38,38,,,,,,,,,,,,,,,,,,,,,,,,,,,,,,,,,,,9,1.8864985250002064,,,,,,,,,,,,,,,,,,,,,,,,,,,,062019_p2,001,2019_Jun_20_1433,body_behavioural,3.0.4,59.99197727298745,
6,"Alex grabbed the bags, and they all walked out together working out where they’d go to celebrate.  ",4,4,None,,,,,,0,6,6,6,,,,,0,39,39,39,,,,,,,,,,,,,,,,,,,,,,,,,,,,,,,,,,,1,1.1196257219999097,,,,,,,,,,,,,,,,,,,,,,,,,,,,062019_p2,001,2019_Jun_20_1433,body_behavioural,3.0.4,59.99197727298745,
6,,,,,,,,,,0,6,6,6,,,,,,,,,,,,,,,,,,,,,,,,,,,,,,,,,,,,,,,,,,,,,,,,,,,,,,,,,,,,,,,,,,,,,,,,062019_p2,001,2019_Jun_20_1433,body_behavioural,3.0.4,59.99197727298745,
7,,,,,,,,,,0,7,7,7,0,0,0,0,,,,,,,,,,,,,,,,,,,,,,,,,,,,,space,0.8526210550007818,space,0.4196003600009135,space,1.9197815030020138,,,,,,,,,,,,,,,,,,,,,,,,,,,,,,,,,,062019_p2,001,2019_Jun_20_1433,body_behavioural,3.0.4,59.99197727298745,
7,,,,,,,,,,0,7,7,7,1,0,1,0,,,,,,,,,,,,,,,,,,,,,,,,,,,,,,,,,space,0.46958823000022676,,,,,,,,,,,,,,,,,,,,,,,,,,,,,,,,,,062019_p2,001,2019_Jun_20_1433,body_behavioural,3.0.4,59.99197727298745,
7,,,,,,,,,,0,7,7,7,2,0,2,0,,,,,,,,,,,,,,,,,,,,,,,,,,,,,,,,,space,0.5506265849980991,,,,,,,,,,,,,,,,,,,,,,,,,,,,,,,,,,062019_p2,001,2019_Jun_20_1433,body_behavioural,3.0.4,59.99197727298745,
7,,,,,,,,,,0,7,7,7,3,0,3,0,,,,,,,,,,,,,,,,,,,,,,,,,,,,,,,,,space,0.3863737850006146,,,,,,,,,,,,,,,,,,,,,,,,,,,,,,,,,,062019_p2,001,2019_Jun_20_1433,body_behavioural,3.0.4,59.99197727298745,
7,,,,,,,,,,0,7,7,7,4,0,4,0,,,,,,,,,,,,,,,,,,,,,,,,,,,,,,,,,space,0.31958724799915217,,,,,,,,,,,,,,,,,,,,,,,,,,,,,,,,,,062019_p2,001,2019_Jun_20_1433,body_behavioural,3.0.4,59.99197727298745,
7,,,,,,,,,,0,7,7,7,5,0,5,0,,,,,,,,,,,,,,,,,,,,,,,,,,,,,,,,,space,0.38397846299994853,,,,,,,,,,,,,,,,,,,,,,,,,,,,,,,,,,062019_p2,001,2019_Jun_20_1433,body_behavioural,3.0.4,59.99197727298745,
7,,,,,,,,,,0,7,7,7,6,0,6,0,,,,,,,,,,,,,,,,,,,,,,,,,,,,,,,,,space,0.3527589320001425,,,,,,,,,,,,,,,,,,,,,,,,,,,,,,,,,,062019_p2,001,2019_Jun_20_1433,body_behavioural,3.0.4,59.99197727298745,
7,"Thomas, dreading the approaching breakup conversation he was about to start, got to Annika’s Finer Diner late but Sadie, his girlfriend, was not there yet.",1,1,11.0,None,None,None,None,,0,7,7,7,,,,,0,0,0,0,,,,,,,,,,,,,,,,,,,,,,,,,,,,,,,space,0.6026127780023671,space,0.40312102299867547,9,15.385069135001686,,,,,,,,,,,,,,,,,,,,,,,,,,,,062019_p2,001,2019_Jun_20_1433,body_behavioural,3.0.4,59.99197727298745,
