2,The professor quickly switched to the last slide on the powerpoint which was a photo collage Aaron had sent him of pictures of Aaron and Lana. ,3,3,None,,,,0,2,2,2,,,,,0,23,23,23,,,,,,,,,,,,,,,,,,,,,,,,,,,,,,,,,,,1,4.753717367013451,,,,,,,,,,,,,,,,,,,,,,,,,,,,070219_p1,001,2019_Jul_02_0951,body_behavioural,3.0.4,59.97046275834233,
2,"“It's time for us to make a bond of our own, Lana.”",3,3,None,,,,0,2,2,2,,,,,0,24,24,24,,,,,,,,,,,,,,,,,,,,,,,,,,,,,,,,,,,1,6.217628740007058,,,,,,,,,,,,,,,,,,,,,,,,,,,,070219_p1,001,2019_Jul_02_0951,body_behavioural,3.0.4,59.97046275834233,
2,He opened the small notebook he had in his hand and the ring was sitting on the page. ,3,3,None,,,,0,2,2,2,,,,,0,25,25,25,,,,,,,,,,,,,,,,,,,,,,,,,,,,,,,,,,,1,3.286550377961248,,,,,,,,,,,,,,,,,,,,,,,,,,,,070219_p1,001,2019_Jul_02_0951,body_behavioural,3.0.4,59.97046275834233,
2,“Will you marry me?” ,3,3,None,,,,0,2,2,2,,,,,0,26,26,26,,,,,,,,,,,,,,,,,,,,,,,,,,,,,,,,,,,1,1.6508707100292668,,,,,,,,,,,,,,,,,,,,,,,,,,,,070219_p1,001,2019_Jul_02_0951,body_behavioural,3.0.4,59.97046275834233,
2,"Lana had put her hand over her mouth and tears were streaming down her face, but finally, she said, “Yes!”",3,4,None,,,,0,2,2,2,,,,,0,27,27,27,,,,,,,,,,,,,,,,,,,,,,,,,,,,,,,,,,,1,3.3842182920197956,,,,,,,,,,,,,,,,,,,,,,,,,,,,070219_p1,001,2019_Jul_02_0951,body_behavioural,3.0.4,59.97046275834233,
2,"Aaron put the ring on her finger, and they hugged while the whole class applauded and cheered. ",3,4,None,,,,0,2,2,2,,,,,0,28,28,28,,,,,,,,,,,,,,,,,,,,,,,,,,,,,,,,,,,1,2.5194291270454414,,,,,,,,,,,,,,,,,,,,,,,,,,,,070219_p1,001,2019_Jul_02_0951,body_behavioural,3.0.4,59.97046275834233,
2,"Their friends, who had been secretly waiting outside, came into the class and embraced both of them.",3,4,None,,,,0,2,2,2,,,,,0,29,29,29,,,,,,,,,,,,,,,,,,,,,,,,,,,,,,,,,,,1,3.052978675987106,,,,,,,,,,,,,,,,,,,,,,,,,,,,070219_p1,001,2019_Jul_02_0951,body_behavioural,3.0.4,59.97046275834233,
2,The professor gave Aaron a celebratory handshake.,3,4,None,,,,0,2,2,2,,,,,0,30,30,30,,,,,,,,,,,,,,,,,,,,,,,,,,,,,,,,,,,1,1.33686697302619,,,,,,,,,,,,,,,,,,,,,,,,,,,,070219_p1,001,2019_Jul_02_0951,body_behavioural,3.0.4,59.97046275834233,
2,"They made their way back to their seats, and Lana pulled out her phone to text her sister",3,4,None,,,,0,2,2,2,,,,,0,31,31,31,,,,,,,,,,,,,,,,,,,,,,,,,,,,,,,,,,,1,2.5032145540462807,,,,,,,,,,,,,,,,,,,,,,,,,,,,070219_p1,001,2019_Jul_02_0951,body_behavioural,3.0.4,59.97046275834233,
2,"The professor dismissed the class, saying, “That was enough excitement for today!",4,4,None,,,,0,2,2,2,,,,,0,32,32,32,,,,,,,,,,,,,,,,,,,,,,,,,,,,,,,,,,,1,3.537336920038797,,,,,,,,,,,,,,,,,,,,,,,,,,,,070219_p1,001,2019_Jul_02_0951,body_behavioural,3.0.4,59.97046275834233,
2,Don’t forget there’s a midterm exam next week on Monday on the material covered in the first 4 weeks of the semester.,4,4,None,,,,0,2,2,2,,,,,0,33,33,33,,,,,,,,,,,,,,,,,,,,,,,,,,,,,,,,,,,1,2.31745462998515,,,,,,,,,,,,,,,,,,,,,,,,,,,,070219_p1,001,2019_Jul_02_0951,body_behavioural,3.0.4,59.97046275834233,
2,"As everyone was packing up their notebooks and leaving, Lana and Aaron were surrounded by their friends eager to get a glimpse of the ring and congratulate them. ",4,4,None,,,,0,2,2,2,,,,,0,34,34,34,,,,,,,,,,,,,,,,,,,,,,,,,,,,,,,,,,,9,2.517271124990657,,,,,,,,,,,,,,,,,,,,,,,,,,,,070219_p1,001,2019_Jul_02_0951,body_behavioural,3.0.4,59.97046275834233,
2,,,,,,,,0,2,2,2,,,,,,,,,,,,,,,,,,,,,,,,,,,,,,,,,,,,,,,,,,,,,,,,,,,,,,,,,,,,,,,,,,,,,,,,070219_p1,001,2019_Jul_02_0951,body_behavioural,3.0.4,59.97046275834233,
3,,,,,,,,0,3,3,3,0,0,0,0,,,,,,,,,,,,,,,,,,,,,,,,,,,,,space,1.4201108220149763,space,0.7358314649900422,space,0.48627148399828,,,,,,,,,,,,,,,,,,,,,,,,,,,,,,,,,,070219_p1,001,2019_Jul_02_0951,body_behavioural,3.0.4,59.97046275834233,
3,"Alvira and Senna walked into the restaurant hand in sweaty hand with quite different expectations for the night because Senna, after 5 years of dating, was going to propose, and Alvira had no idea.",1,1,21.0,None,None,,0,3,3,3,,,,,0,0,0,0,,,,,,,,,,,,,,,,,,,,,,,,,,,,,,,space,0.8029002029797994,space,0.9697904799832031,9,11.520501749997493,,,,,,,,,,,,,,,,,,,,,,,,,,,,070219_p1,001,2019_Jul_02_0951,body_behavioural,3.0.4,59.97046275834233,
3,"He took a deep breath, trying to calm his nerves as worst case scenarios ran through his mind. ",1,1,None,None,None,,0,3,3,3,,,,,0,1,1,1,,,,,,,,,,,,,,,,,,,,,,,,,,,,,,,,,,,1,2.6676485359785147,,,,,,,,,,,,,,,,,,,,,,,,,,,,070219_p1,001,2019_Jul_02_0951,body_behavioural,3.0.4,59.97046275834233,
3,The restaurant was on the beach and had floor-to-ceiling arched windows that framed an incredible view of the Pacific Ocean.,1,1,None,None,None,,0,3,3,3,,,,,0,2,2,2,,,,,,,,,,,,,,,,,,,,,,,,,,,,,,,,,,,9,2.554896545014344,,,,,,,,,,,,,,,,,,,,,,,,,,,,070219_p1,001,2019_Jul_02_0951,body_behavioural,3.0.4,59.97046275834233,
3,"Besides the view, the restaurant itself was beautiful- crystal chandeliers hung from the high ceiling above small tables covered with white table cloths.
",1,1,None,None,None,,0,3,3,3,,,,,0,3,3,3,,,,,,,,,,,,,,,,,,,,,,,,,,,,,,,,,,,1,2.8365279550198466,,,,,,,,,,,,,,,,,,,,,,,,,,,,070219_p1,001,2019_Jul_02_0951,body_behavioural,3.0.4,59.97046275834233,
3,This was surely one of the best restaurants on the West Coast.,1,1,None,None,None,,0,3,3,3,,,,,0,4,4,4,,,,,,,,,,,,,,,,,,,,,,,,,,,,,,,,,,,1,1.6697354529751465,,,,,,,,,,,,,,,,,,,,,,,,,,,,070219_p1,001,2019_Jul_02_0951,body_behavioural,3.0.4,59.97046275834233,
3,"After Senna gave his name to the host, who discretely winked at Senna, they were seated at a table right by the window. ",2,1,None,7.0,None,,0,3,3,3,,,,,0,5,5,5,,,,,,,,,,,,,,,,,,,,,,,,,,,,,,,,,,,9,1.6840675279963762,,,,,,,,,,,,,,,,,,,,,,,,,,,,070219_p1,001,2019_Jul_02_0951,body_behavioural,3.0.4,59.97046275834233,
3,The waiter brought out some very small menus.,2,1,None,None,9.0,,0,3,3,3,,,,,0,6,6,6,,,,,,,,,,,,,,,,,,,,,,,,,,,,,,,,,,,1,1.3698042840114795,,,,,,,,,,,,,,,,,,,,,,,,,,,,070219_p1,001,2019_Jul_02_0951,body_behavioural,3.0.4,59.97046275834233,
3,"They consisted of a short list of the head chef's carefully selected daily dishes written in a loopy, cursive font unadorned by any mention of prices.",2,1,None,None,None,,0,3,3,3,,,,,0,7,7,7,,,,,,,,,,,,,,,,,,,,,,,,,,,,,,,,,,,9,1.5363510000170209,,,,,,,,,,,,,,,,,,,,,,,,,,,,070219_p1,001,2019_Jul_02_0951,body_behavioural,3.0.4,59.97046275834233,
3,"Senna got nervous about the ring, and he slipped off to the bathroom to check to make sure it looked alright.",2,2,None,None,None,,0,3,3,3,,,,,0,8,8,8,,,,,,,,,,,,,,,,,,,,,,,,,,,,,,,,,,,1,2.9365417300141416,,,,,,,,,,,,,,,,,,,,,,,,,,,,070219_p1,001,2019_Jul_02_0951,body_behavioural,3.0.4,59.97046275834233,
3,The ring contained three canary yellow diamonds that had been in his grandmother’s wedding ring. ,2,2,None,None,None,,0,3,3,3,,,,,0,9,9,9,,,,,,,,,,,,,,,,,,,,,,,,,,,,,,,,,,,1,2.350814078003168,,,,,,,,,,,,,,,,,,,,,,,,,,,,070219_p1,001,2019_Jul_02_0951,body_behavioural,3.0.4,59.97046275834233,
3,"After Senna had gotten back to the table, the waiter appeared at their table to take their order.",3,2,None,None,None,,0,3,3,3,,,,,0,10,10,10,,,,,,,,,,,,,,,,,,,,,,,,,,,,,,,,,,,9,5.386601572972722,,,,,,,,,,,,,,,,,,,,,,,,,,,,070219_p1,001,2019_Jul_02_0951,body_behavioural,3.0.4,59.97046275834233,
3,"Senna ordered the oysters with garlic-parmesan sauce, and Alvira ordered the sauteed sea scallops with caramelized apples. ",3,2,None,None,None,,0,3,3,3,,,,,0,11,11,11,,,,,,,,,,,,,,,,,,,,,,,,,,,,,,,,,,,1,1.7506753170164302,,,,,,,,,,,,,,,,,,,,,,,,,,,,070219_p1,001,2019_Jul_02_0951,body_behavioural,3.0.4,59.97046275834233,
3,"“Excellent choices,” the waiter said, and he left.",3,2,None,None,None,,0,3,3,3,,,,,0,12,12,12,,,,,,,,,,,,,,,,,,,,,,,,,,,,,,,,,,,1,1.4530595780233853,,,,,,,,,,,,,,,,,,,,,,,,,,,,070219_p1,001,2019_Jul_02_0951,body_behavioural,3.0.4,59.97046275834233,
3,"“What a beautiful place, Senna. ",3,2,None,None,None,,0,3,3,3,,,,,0,13,13,13,,,,,,,,,,,,,,,,,,,,,,,,,,,,,,,,,,,1,2.2030453630140983,,,,,,,,,,,,,,,,,,,,,,,,,,,,070219_p1,001,2019_Jul_02_0951,body_behavioural,3.0.4,59.97046275834233,
3,"This is too much just to celebrate the first tomatoes I grew in the garden- really, this is absurd,” Alvira said.",3,2,None,None,None,,0,3,3,3,,,,,0,14,14,14,,,,,,,,,,,,,,,,,,,,,,,,,,,,,,,,,,,1,3.8696670799981803,,,,,,,,,,,,,,,,,,,,,,,,,,,,070219_p1,001,2019_Jul_02_0951,body_behavioural,3.0.4,59.97046275834233,
3,"Senna laughed and said, “No, those were really the best tomatoes I’ve ever had. ",3,2,None,None,None,,0,3,3,3,,,,,0,15,15,15,,,,,,,,,,,,,,,,,,,,,,,,,,,,,,,,,,,1,2.7033031469909474,,,,,,,,,,,,,,,,,,,,,,,,,,,,070219_p1,001,2019_Jul_02_0951,body_behavioural,3.0.4,59.97046275834233,
3,We had to celebrate.” ,3,2,None,None,None,,0,3,3,3,,,,,0,16,16,16,,,,,,,,,,,,,,,,,,,,,,,,,,,,,,,,,,,1,0.9025632219854742,,,,,,,,,,,,,,,,,,,,,,,,,,,,070219_p1,001,2019_Jul_02_0951,body_behavioural,3.0.4,59.97046275834233,
3,"They talked and laughed as the sun sank below the horizon, lighting up the sky and water, and slowly the glow from the windows was replaced by the chandeliers.",3,2,None,8.0,None,,0,3,3,3,,,,,0,17,17,17,,,,,,,,,,,,,,,,,,,,,,,,,,,,,,,,,,,9,2.952970220008865,,,,,,,,,,,,,,,,,,,,,,,,,,,,070219_p1,001,2019_Jul_02_0951,body_behavioural,3.0.4,59.97046275834233,
3,The waiter returned with their dishes.,4,2,None,None,None,,0,3,3,3,,,,,0,18,18,18,,,,,,,,,,,,,,,,,,,,,,,,,,,,,,,,,,,1,0.9006461700191721,,,,,,,,,,,,,,,,,,,,,,,,,,,,070219_p1,001,2019_Jul_02_0951,body_behavioural,3.0.4,59.97046275834233,
3,"Everything was even more delicious than they had expected, especially the oysters, which Senna said tasted like the ocean. ",4,2,None,None,None,,0,3,3,3,,,,,0,19,19,19,,,,,,,,,,,,,,,,,,,,,,,,,,,,,,,,,,,1,3.5364796870271675,,,,,,,,,,,,,,,,,,,,,,,,,,,,070219_p1,001,2019_Jul_02_0951,body_behavioural,3.0.4,59.97046275834233,
3,"As they were eating, Senna recounted to Alvira how they had met, and he told her in many words how much he loved her and what he loved about her, almost tearing up at moments. ",4,2,None,None,None,,0,3,3,3,,,,,0,20,20,20,,,,,,,,,,,,,,,,,,,,,,,,,,,,,,,,,,,1,7.186835068045184,,,,,,,,,,,,,,,,,,,,,,,,,,,,070219_p1,001,2019_Jul_02_0951,body_behavioural,3.0.4,59.97046275834233,
3,"When they had finished eating, Senna nodded at the waiter who had been watching attentively, and he quickly strode over to place a small, elegant cake topped with the ring in front of Alvira. ",4,3,None,None,None,,0,3,3,3,,,,,0,21,21,21,,,,,,,,,,,,,,,,,,,,,,,,,,,,,,,,,,,1,7.469583039986901,,,,,,,,,,,,,,,,,,,,,,,,,,,,070219_p1,001,2019_Jul_02_0951,body_behavioural,3.0.4,59.97046275834233,
3,Her eyes widened in shock when she realized what she was looking at.,4,3,None,None,None,,0,3,3,3,,,,,0,22,22,22,,,,,,,,,,,,,,,,,,,,,,,,,,,,,,,,,,,1,5.303883571992628,,,,,,,,,,,,,,,,,,,,,,,,,,,,070219_p1,001,2019_Jul_02_0951,body_behavioural,3.0.4,59.97046275834233,
3,"Senna got down on one knee and said,“Alvira, will you marry me? ",4,3,None,None,None,,0,3,3,3,,,,,0,23,23,23,,,,,,,,,,,,,,,,,,,,,,,,,,,,,,,,,,,1,3.2703995869960636,,,,,,,,,,,,,,,,,,,,,,,,,,,,070219_p1,001,2019_Jul_02_0951,body_behavioural,3.0.4,59.97046275834233,
3,"I love you, and I will never stop loving you.” ",4,3,None,None,None,,0,3,3,3,,,,,0,24,24,24,,,,,,,,,,,,,,,,,,,,,,,,,,,,,,,,,,,1,1.3667389699839987,,,,,,,,,,,,,,,,,,,,,,,,,,,,070219_p1,001,2019_Jul_02_0951,body_behavioural,3.0.4,59.97046275834233,
3,"After a few moments with everyone turned and looking at Elvira in expectation, she exclaimed, “Yes, of course, yes!”",4,4,None,None,None,,0,3,3,3,,,,,0,25,25,25,,,,,,,,,,,,,,,,,,,,,,,,,,,,,,,,,,,1,3.220553661987651,,,,,,,,,,,,,,,,,,,,,,,,,,,,070219_p1,001,2019_Jul_02_0951,body_behavioural,3.0.4,59.97046275834233,
3,She hugged Senna with tears flowing down her cheeks. ,4,4,None,None,None,,0,3,3,3,,,,,0,26,26,26,,,,,,,,,,,,,,,,,,,,,,,,,,,,,,,,,,,1,0.8369914149516262,,,,,,,,,,,,,,,,,,,,,,,,,,,,070219_p1,001,2019_Jul_02_0951,body_behavioural,3.0.4,59.97046275834233,
3,"The other guests exploded in applause, and the waiter returned with a bottle of champagne and popped it.",4,4,None,None,None,,0,3,3,3,,,,,0,27,27,27,,,,,,,,,,,,,,,,,,,,,,,,,,,,,,,,,,,1,1.8173890420002863,,,,,,,,,,,,,,,,,,,,,,,,,,,,070219_p1,001,2019_Jul_02_0951,body_behavioural,3.0.4,59.97046275834233,
3,"Senna slipped the ring onto Alvira’s finger, and she held up her hand to admire it.",4,4,None,None,None,,0,3,3,3,,,,,0,28,28,28,,,,,,,,,,,,,,,,,,,,,,,,,,,,,,,,,,,1,1.203249366953969,,,,,,,,,,,,,,,,,,,,,,,,,,,,070219_p1,001,2019_Jul_02_0951,body_behavioural,3.0.4,59.97046275834233,
3,“I need to text my dad and tell him!” she sang. ,4,4,None,None,None,,0,3,3,3,,,,,0,29,29,29,,,,,,,,,,,,,,,,,,,,,,,,,,,,,,,,,,,1,1.3695236830390058,,,,,,,,,,,,,,,,,,,,,,,,,,,,070219_p1,001,2019_Jul_02_0951,body_behavioural,3.0.4,59.97046275834233,
3,The whole restaurant proceeded in cheers with them to celebrate the joyous occasion.  ,4,4,None,None,None,,0,3,3,3,,,,,0,30,30,30,,,,,,,,,,,,,,,,,,,,,,,,,,,,,,,,,,,1,1.870536610018462,,,,,,,,,,,,,,,,,,,,,,,,,,,,070219_p1,001,2019_Jul_02_0951,body_behavioural,3.0.4,59.97046275834233,
3,,,,,,,,0,3,3,3,,,,,,,,,,,,,,,,,,,,,,,,,,,,,,,,,,,,,,,,,,,,,,,,,,,,,,,,,,,,,,,,,,,,,,,,070219_p1,001,2019_Jul_02_0951,body_behavioural,3.0.4,59.97046275834233,
4,,,,,,,,0,4,4,4,0,0,0,0,,,,,,,,,,,,,,,,,,,,,,,,,,,,,space,0.9702335100155324,space,0.6529951720149256,space,0.48598512599710375,,,,,,,,,,,,,,,,,,,,,,,,,,,,,,,,,,070219_p1,001,2019_Jul_02_0951,body_behavioural,3.0.4,59.97046275834233,
4,The grocery store was not the place Emmanuella and Liam wanted to be at the moment considering that they had been fighting to the point where Emmanuella was thinking of breaking up with Liam.,1,1,13.0,,,,0,4,4,4,,,,,0,0,0,0,,,,,,,,,,,,,,,,,,,,,,,,,,,,,,,space,0.8006119169876911,space,0.750663906976115,9,10.604054140043445,,,,,,,,,,,,,,,,,,,,,,,,,,,,070219_p1,001,2019_Jul_02_0951,body_behavioural,3.0.4,59.97046275834233,
4,Emmanuella had been thinking of breaking up with Liam for the past 5 months.,1,1,None,,,,0,4,4,4,,,,,0,1,1,1,,,,,,,,,,,,,,,,,,,,,,,,,,,,,,,,,,,1,3.069885487027932,,,,,,,,,,,,,,,,,,,,,,,,,,,,070219_p1,001,2019_Jul_02_0951,body_behavioural,3.0.4,59.97046275834233,
4,"Despite the current tension, they had to go grocery shopping because they were hosting a dinner party for friends that evening and had little at home with which to cook. ",1,1,None,,,,0,4,4,4,,,,,0,2,2,2,,,,,,,,,,,,,,,,,,,,,,,,,,,,,,,,,,,1,6.21939820505213,,,,,,,,,,,,,,,,,,,,,,,,,,,,070219_p1,001,2019_Jul_02_0951,body_behavioural,3.0.4,59.97046275834233,
4,"The grocery store smelled like lavender upon entering and was dimly lit with pine shelves in the entrance and obscure, organic products displayed on them.",1,1,None,,,,0,4,4,4,,,,,0,3,3,3,,,,,,,,,,,,,,,,,,,,,,,,,,,,,,,,,,,9,1.9202989529585466,,,,,,,,,,,,,,,,,,,,,,,,,,,,070219_p1,001,2019_Jul_02_0951,body_behavioural,3.0.4,59.97046275834233,
4,"In the pasta section, Emmanuella grabbed a few boxes of bow-tie pasta.",2,1,None,,,,0,4,4,4,,,,,0,4,4,4,,,,,,,,,,,,,,,,,,,,,,,,,,,,,,,,,,,1,1.6530172280035913,,,,,,,,,,,,,,,,,,,,,,,,,,,,070219_p1,001,2019_Jul_02_0951,body_behavioural,3.0.4,59.97046275834233,
4,"“I guess we are having a pasta dish tonight,” Liam said.",2,1,None,,,,0,4,4,4,,,,,0,5,5,5,,,,,,,,,,,,,,,,,,,,,,,,,,,,,,,,,,,1,1.8180027999915183,,,,,,,,,,,,,,,,,,,,,,,,,,,,070219_p1,001,2019_Jul_02_0951,body_behavioural,3.0.4,59.97046275834233,
4,"Emmanuella looked back at him and said, “Well if you were going to actually help cook, I would be fine with something else.”",2,1,None,,,,0,4,4,4,,,,,0,6,6,6,,,,,,,,,,,,,,,,,,,,,,,,,,,,,,,,,,,1,4.053354592004325,,,,,,,,,,,,,,,,,,,,,,,,,,,,070219_p1,001,2019_Jul_02_0951,body_behavioural,3.0.4,59.97046275834233,
4,"Liam sighed, and finally said, “You know- you don’t want me to help.",2,1,None,,,,0,4,4,4,,,,,0,7,7,7,,,,,,,,,,,,,,,,,,,,,,,,,,,,,,,,,,,1,3.9341944420011714,,,,,,,,,,,,,,,,,,,,,,,,,,,,070219_p1,001,2019_Jul_02_0951,body_behavioural,3.0.4,59.97046275834233,
4,"I try to, but it seems like I always get in the way!” ",2,1,None,,,,0,4,4,4,,,,,0,8,8,8,,,,,,,,,,,,,,,,,,,,,,,,,,,,,,,,,,,1,2.069562641030643,,,,,,,,,,,,,,,,,,,,,,,,,,,,070219_p1,001,2019_Jul_02_0951,body_behavioural,3.0.4,59.97046275834233,
4,Emmanuella shook her head and dropped the pasta boxes in the basket she was holding.,2,1,None,,,,0,4,4,4,,,,,0,9,9,9,,,,,,,,,,,,,,,,,,,,,,,,,,,,,,,,,,,1,2.6860638899961486,,,,,,,,,,,,,,,,,,,,,,,,,,,,070219_p1,001,2019_Jul_02_0951,body_behavioural,3.0.4,59.97046275834233,
4," “Like you even try,” she mumbled to herself. ",2,1,None,,,,0,4,4,4,,,,,0,10,10,10,,,,,,,,,,,,,,,,,,,,,,,,,,,,,,,,,,,1,2.0031185299740173,,,,,,,,,,,,,,,,,,,,,,,,,,,,070219_p1,001,2019_Jul_02_0951,body_behavioural,3.0.4,59.97046275834233,
4,She continued down the aisle and studied a jar of vodka sauce and a can of olives before putting them in the basket as well. ,2,1,None,,,,0,4,4,4,,,,,0,11,11,11,,,,,,,,,,,,,,,,,,,,,,,,,,,,,,,,,,,1,6.704342353972606,,,,,,,,,,,,,,,,,,,,,,,,,,,,070219_p1,001,2019_Jul_02_0951,body_behavioural,3.0.4,59.97046275834233,
4,"Emmanuella suddenly wrinkled her eyebrows, turned to Liam, and said, “I want to break up since I’m tired of the constant fighting. ",2,2,None,,,,0,4,4,4,,,,,0,12,12,12,,,,,,,,,,,,,,,,,,,,,,,,,,,,,,,,,,,9,3.9039207329624332,,,,,,,,,,,,,,,,,,,,,,,,,,,,070219_p1,001,2019_Jul_02_0951,body_behavioural,3.0.4,59.97046275834233,
4,"I was going to wait until after this horribly-timed dinner party tonight to talk about this, but I might as well say it now.",2,2,None,,,,0,4,4,4,,,,,0,13,13,13,,,,,,,,,,,,,,,,,,,,,,,,,,,,,,,,,,,1,3.9699456529924646,,,,,,,,,,,,,,,,,,,,,,,,,,,,070219_p1,001,2019_Jul_02_0951,body_behavioural,3.0.4,59.97046275834233,
4,"I feel like when we try to do anything anymore it ends up unpleasant for the stupidest reasons, and I am just past trying to work things out.”",2,2,None,,,,0,4,4,4,,,,,0,14,14,14,,,,,,,,,,,,,,,,,,,,,,,,,,,,,,,,,,,1,4.685864651983138,,,,,,,,,,,,,,,,,,,,,,,,,,,,070219_p1,001,2019_Jul_02_0951,body_behavioural,3.0.4,59.97046275834233,
4,Liam was nodding automatically.,2,2,None,,,,0,4,4,4,,,,,0,15,15,15,,,,,,,,,,,,,,,,,,,,,,,,,,,,,,,,,,,1,2.4860647519817576,,,,,,,,,,,,,,,,,,,,,,,,,,,,070219_p1,001,2019_Jul_02_0951,body_behavioural,3.0.4,59.97046275834233,
4,"In the checkout area, there was only one station open, Station 2, but it was not very crowded.",3,2,None,,,,0,4,4,4,,,,,0,16,16,16,,,,,,,,,,,,,,,,,,,,,,,,,,,,,,,,,,,9,1.8204179729800671,,,,,,,,,,,,,,,,,,,,,,,,,,,,070219_p1,001,2019_Jul_02_0951,body_behavioural,3.0.4,59.97046275834233,
4,They got in line.,3,2,None,,,,0,4,4,4,,,,,0,17,17,17,,,,,,,,,,,,,,,,,,,,,,,,,,,,,,,,,,,1,0.9356870620395057,,,,,,,,,,,,,,,,,,,,,,,,,,,,070219_p1,001,2019_Jul_02_0951,body_behavioural,3.0.4,59.97046275834233,
4,"Liam gazed in the direction of the magazines, but his eyes were glazed over as he was working things out in his head while Emmanuella scrutinized the pasta sauce again. ",3,2,None,,,,0,4,4,4,,,,,0,18,18,18,,,,,,,,,,,,,,,,,,,,,,,,,,,,,,,,,,,1,6.769763774005696,,,,,,,,,,,,,,,,,,,,,,,,,,,,070219_p1,001,2019_Jul_02_0951,body_behavioural,3.0.4,59.97046275834233,
4,"After a few minutes of thinking, Liam recollected himself, turned to her, and sighed, “Yes, I think the same thing.",3,3,None,,,,0,4,4,4,,,,,0,19,19,19,,,,,,,,,,,,,,,,,,,,,,,,,,,,,,,,,,,1,4.470518285001162,,,,,,,,,,,,,,,,,,,,,,,,,,,,070219_p1,001,2019_Jul_02_0951,body_behavioural,3.0.4,59.97046275834233,
4,I think we should break up because we could definitely be happier with other people.” ,3,3,None,,,,0,4,4,4,,,,,0,20,20,20,,,,,,,,,,,,,,,,,,,,,,,,,,,,,,,,,,,1,4.519535856030416,,,,,,,,,,,,,,,,,,,,,,,,,,,,070219_p1,001,2019_Jul_02_0951,body_behavioural,3.0.4,59.97046275834233,
4,Emmanuella nodded as she listened. ,3,3,None,,,,0,4,4,4,,,,,0,21,21,21,,,,,,,,,,,,,,,,,,,,,,,,,,,,,,,,,,,1,1.102751997008454,,,,,,,,,,,,,,,,,,,,,,,,,,,,070219_p1,001,2019_Jul_02_0951,body_behavioural,3.0.4,59.97046275834233,
4,The cashier scanned their groceries.,4,3,None,,,,0,4,4,4,,,,,0,22,22,22,,,,,,,,,,,,,,,,,,,,,,,,,,,,,,,,,,,9,2.253255990042817,,,,,,,,,,,,,,,,,,,,,,,,,,,,070219_p1,001,2019_Jul_02_0951,body_behavioural,3.0.4,59.97046275834233,
4,"The cost came to $30, and Emmanuella paid with her credit card.",4,3,None,,,,0,4,4,4,,,,,0,23,23,23,,,,,,,,,,,,,,,,,,,,,,,,,,,,,,,,,,,1,1.8857941320165992,,,,,,,,,,,,,,,,,,,,,,,,,,,,070219_p1,001,2019_Jul_02_0951,body_behavioural,3.0.4,59.97046275834233,
4,"She asked Liam politely to take the bags, and he obliged, following her toward the exit. ",4,3,None,,,,0,4,4,4,,,,,0,24,24,24,,,,,,,,,,,,,,,,,,,,,,,,,,,,,,,,,,,1,2.9028672149870545,,,,,,,,,,,,,,,,,,,,,,,,,,,,070219_p1,001,2019_Jul_02_0951,body_behavioural,3.0.4,59.97046275834233,
4,"Filled with a sudden wave of sadness, Emmanuella said, “Liam, I think we are making the right decision- this is good.”",4,4,None,,,,0,4,4,4,,,,,0,25,25,25,,,,,,,,,,,,,,,,,,,,,,,,,,,,,,,,,,,1,5.4369992520078085,,,,,,,,,,,,,,,,,,,,,,,,,,,,070219_p1,001,2019_Jul_02_0951,body_behavioural,3.0.4,59.97046275834233,
4,"“I agree,” he said, relieved at the hope he was entertaining that they had just gotten through their last fight. ",4,4,None,,,,0,4,4,4,,,,,0,26,26,26,,,,,,,,,,,,,,,,,,,,,,,,,,,,,,,,,,,1,6.270876898022834,,,,,,,,,,,,,,,,,,,,,,,,,,,,070219_p1,001,2019_Jul_02_0951,body_behavioural,3.0.4,59.97046275834233,
4,"“I think we can still host this dinner tonight, as long as you're still on board,” Emmanuella said.",4,4,None,,,,0,4,4,4,,,,,0,27,27,27,,,,,,,,,,,,,,,,,,,,,,,,,,,,,,,,,,,1,3.236077989975456,,,,,,,,,,,,,,,,,,,,,,,,,,,,070219_p1,001,2019_Jul_02_0951,body_behavioural,3.0.4,59.97046275834233,
4,"Liam nodded, “Yes, let’s just not tell anyone we’ve broken up tonight.” ",4,4,None,,,,0,4,4,4,,,,,0,28,28,28,,,,,,,,,,,,,,,,,,,,,,,,,,,,,,,,,,,1,2.0526270879781805,,,,,,,,,,,,,,,,,,,,,,,,,,,,070219_p1,001,2019_Jul_02_0951,body_behavioural,3.0.4,59.97046275834233,
4,"Emmanuella laughed, “Whoever leaks it loses their right to the cat.”",4,4,None,,,,0,4,4,4,,,,,0,29,29,29,,,,,,,,,,,,,,,,,,,,,,,,,,,,,,,,,,,1,4.102971846994478,,,,,,,,,,,,,,,,,,,,,,,,,,,,070219_p1,001,2019_Jul_02_0951,body_behavioural,3.0.4,59.97046275834233,
4,"Liam chuckled and responded, “Hey!",4,4,None,,,,0,4,4,4,,,,,0,30,30,30,,,,,,,,,,,,,,,,,,,,,,,,,,,,,,,,,,,1,1.7178264679969288,,,,,,,,,,,,,,,,,,,,,,,,,,,,070219_p1,001,2019_Jul_02_0951,body_behavioural,3.0.4,59.97046275834233,
4,Luna is mine and I want her back.”,4,4,None,,,,0,4,4,4,,,,,0,31,31,31,,,,,,,,,,,,,,,,,,,,,,,,,,,,,,,,,,,1,2.6031205699546263,,,,,,,,,,,,,,,,,,,,,,,,,,,,070219_p1,001,2019_Jul_02_0951,body_behavioural,3.0.4,59.97046275834233,
4,"Emmanuella rolled her eyes, knowing the cat would be a whole other issue to sort out later.
",4,4,None,,,,0,4,4,4,,,,,0,32,32,32,,,,,,,,,,,,,,,,,,,,,,,,,,,,,,,,,,,1,3.2532642529695295,,,,,,,,,,,,,,,,,,,,,,,,,,,,070219_p1,001,2019_Jul_02_0951,body_behavioural,3.0.4,59.97046275834233,
4,,,,,,,,0,4,4,4,,,,,,,,,,,,,,,,,,,,,,,,,,,,,,,,,,,,,,,,,,,,,,,,,,,,,,,,,,,,,,,,,,,,,,,,070219_p1,001,2019_Jul_02_0951,body_behavioural,3.0.4,59.97046275834233,
5,,,,,,,,0,5,5,5,0,0,0,0,,,,,,,,,,,,,,,,,,,,,,,,,,,,,space,0.9529885750380345,space,0.8364084020140581,space,0.5194074639584869,,,,,,,,,,,,,,,,,,,,,,,,,,,,,,,,,,070219_p1,001,2019_Jul_02_0951,body_behavioural,3.0.4,59.97046275834233,
5,David saw Anna for the first time when she burst into the airport frazzled with her half-zipped bag skidding behind her.,1,1,42.0,,,,0,5,5,5,,,,,0,0,0,0,,,,,,,,,,,,,,,,,,,,,,,,,,,,,,,space,1.519455788016785,space,0.7362543920171447,9,5.7509872750379145,,,,,,,,,,,,,,,,,,,,,,,,,,,,070219_p1,001,2019_Jul_02_0951,body_behavioural,3.0.4,59.97046275834233,
5,"He had three hours until his flight and had been reading a book on the laptop he was holding in the entrance to the airport, but she had only 35 minutes and was hoping to spend as little time in the entrance as possible. ",1,1,None,,,,0,5,5,5,,,,,0,1,1,1,,,,,,,,,,,,,,,,,,,,,,,,,,,,,,,,,,,1,8.37050578999333,,,,,,,,,,,,,,,,,,,,,,,,,,,,070219_p1,001,2019_Jul_02_0951,body_behavioural,3.0.4,59.97046275834233,
5,"Anna, a few strides into the airport, suddenly realized to her dismay that her shoes were untied, so she hunched over to tie them.",1,1,None,,,,0,5,5,5,,,,,0,2,2,2,,,,,,,,,,,,,,,,,,,,,,,,,,,,,,,,,,,9,4.936594373022672,,,,,,,,,,,,,,,,,,,,,,,,,,,,070219_p1,001,2019_Jul_02_0951,body_behavioural,3.0.4,59.97046275834233,
5,"David, who had been intrigued by Anna, observed that someone with a tall cart of luggage was heading straight for where she was kneeling and that both her and the person driving the cart were oblivious to the impending collision. ",1,1,None,,,,0,5,5,5,,,,,0,3,3,3,,,,,,,,,,,,,,,,,,,,,,,,,,,,,,,,,,,1,6.036274403042626,,,,,,,,,,,,,,,,,,,,,,,,,,,,070219_p1,001,2019_Jul_02_0951,body_behavioural,3.0.4,59.97046275834233,
5,"After a few moment of deliberation, David decided to intervene, and he ran in front of the cart pushing her out of the way just in the nick of time, and they tumbled on the airport floor. ",1,2,None,,,,0,5,5,5,,,,,0,4,4,4,,,,,,,,,,,,,,,,,,,,,,,,,,,,,,,,,,,1,7.469556064985227,,,,,,,,,,,,,,,,,,,,,,,,,,,,070219_p1,001,2019_Jul_02_0951,body_behavioural,3.0.4,59.97046275834233,
5,"Anna, bewildered, looked up and saw the cart pass by and then looked at David. ",1,2,None,,,,0,5,5,5,,,,,0,5,5,5,,,,,,,,,,,,,,,,,,,,,,,,,,,,,,,,,,,1,4.98482850601431,,,,,,,,,,,,,,,,,,,,,,,,,,,,070219_p1,001,2019_Jul_02_0951,body_behavioural,3.0.4,59.97046275834233,
5,"He flashed a smile and asked, “Were you ever a gymnast?",1,2,None,,,,0,5,5,5,,,,,0,6,6,6,,,,,,,,,,,,,,,,,,,,,,,,,,,,,,,,,,,1,2.6527855430031195,,,,,,,,,,,,,,,,,,,,,,,,,,,,070219_p1,001,2019_Jul_02_0951,body_behavioural,3.0.4,59.97046275834233,
