7,"If you feel this way, then I think we should break up because I don’t want to keep boring you.",3,3,None,,,,0,7,7,7,,,,,0,20,20,20,,,,,,,,,,,,,,,,,,,,,,,,,,,,,,,,,,,1,5.619220551976468,,,,,,,,,,,,,,,,,,,,,,,,,,,,070219_p1,001,2019_Jul_02_0951,body_behavioural,3.0.4,59.97046275834233,
7,"I agree, let’s part ways once we make it back.",3,3,None,,,,0,7,7,7,,,,,0,21,21,21,,,,,,,,,,,,,,,,,,,,,,,,,,,,,,,,,,,1,1.4370589430327527,,,,,,,,,,,,,,,,,,,,,,,,,,,,070219_p1,001,2019_Jul_02_0951,body_behavioural,3.0.4,59.97046275834233,
7,You should’ve spoken up about my apparent intolerability before you decided to plan this vacation.”,3,3,None,,,,0,7,7,7,,,,,0,22,22,22,,,,,,,,,,,,,,,,,,,,,,,,,,,,,,,,,,,1,3.6199067670386285,,,,,,,,,,,,,,,,,,,,,,,,,,,,070219_p1,001,2019_Jul_02_0951,body_behavioural,3.0.4,59.97046275834233,
7,"He was very hurt, even though he didn’t want to show it. ",3,3,None,,,,0,7,7,7,,,,,0,23,23,23,,,,,,,,,,,,,,,,,,,,,,,,,,,,,,,,,,,1,2.4373964780243114,,,,,,,,,,,,,,,,,,,,,,,,,,,,070219_p1,001,2019_Jul_02_0951,body_behavioural,3.0.4,59.97046275834233,
7,"Having made it to their gate, they scanned their tickets, and the annoyed flight attendant shooed them onto the jet bridge and then closed the plane door behind them.",4,3,None,,,,0,7,7,7,,,,,0,24,24,24,,,,,,,,,,,,,,,,,,,,,,,,,,,,,,,,,,,1,5.253166750015225,,,,,,,,,,,,,,,,,,,,,,,,,,,,070219_p1,001,2019_Jul_02_0951,body_behavioural,3.0.4,59.97046275834233,
7,"Luckily, they had forgotten to arrange seats next to each other on the flight back.",4,3,None,,,,0,7,7,7,,,,,0,25,25,25,,,,,,,,,,,,,,,,,,,,,,,,,,,,,,,,,,,1,4.1543163059977815,,,,,,,,,,,,,,,,,,,,,,,,,,,,070219_p1,001,2019_Jul_02_0951,body_behavioural,3.0.4,59.97046275834233,
7,"They were both in economy, but Jessie was headed for seat 33A while Calvin's seat was 33F. ",4,3,None,,,,0,7,7,7,,,,,0,26,26,26,,,,,,,,,,,,,,,,,,,,,,,,,,,,,,,,,,,1,5.55338723998284,,,,,,,,,,,,,,,,,,,,,,,,,,,,070219_p1,001,2019_Jul_02_0951,body_behavioural,3.0.4,59.97046275834233,
7,"Before Jessie sat down, she took a deep breath, calmed her emotions, and then awkwardly shook Calvin’s hand, mumbling, “Have a nice flight. ",4,4,None,,,,0,7,7,7,,,,,0,27,27,27,,,,,,,,,,,,,,,,,,,,,,,,,,,,,,,,,,,1,8.9864835269982,,,,,,,,,,,,,,,,,,,,,,,,,,,,070219_p1,001,2019_Jul_02_0951,body_behavioural,3.0.4,59.97046275834233,
7,"Oh, and when you get a chance, could you send me back all the philosophy books I lent you?”",4,4,None,,,,0,7,7,7,,,,,0,28,28,28,,,,,,,,,,,,,,,,,,,,,,,,,,,,,,,,,,,1,4.2857995349913836,,,,,,,,,,,,,,,,,,,,,,,,,,,,070219_p1,001,2019_Jul_02_0951,body_behavioural,3.0.4,59.97046275834233,
7,He laughed in disbelief and walked to his window seat three rows back to get ready for takeoff.,4,4,None,,,,0,7,7,7,,,,,0,29,29,29,,,,,,,,,,,,,,,,,,,,,,,,,,,,,,,,,,,1,5.219489315000828,,,,,,,,,,,,,,,,,,,,,,,,,,,,070219_p1,001,2019_Jul_02_0951,body_behavioural,3.0.4,59.97046275834233,
7,Both were upset but glad that they would have this flight in solitude.,4,4,None,,,,0,7,7,7,,,,,0,30,30,30,,,,,,,,,,,,,,,,,,,,,,,,,,,,,,,,,,,1,2.4531714629847556,,,,,,,,,,,,,,,,,,,,,,,,,,,,070219_p1,001,2019_Jul_02_0951,body_behavioural,3.0.4,59.97046275834233,
7,,,,,,,,0,7,7,7,,,,,,,,,,,,,,,,,,,,,,,,,,,,,,,,,,,,,,,,,,,,,,,,,,,,,,,,,,,,,,,,,,,,,,,,070219_p1,001,2019_Jul_02_0951,body_behavioural,3.0.4,59.97046275834233,
,,,,,,,,,,,,,,,,,,,,,,,,,,,,,,,,,,,,,,,,,,,,,,,,,,,,,,,,1225.729146595986,space,0.7363335380214266,,,,,,,,,,,,,,,,,,,,,,,,,070219_p1,001,2019_Jul_02_0951,body_behavioural,3.0.4,59.97046275834233,
,,,,,,,"In this next part of the experiment, please recall each story to the best of your ability.",,,,,,,,,,,,,0,0,0,0,,,,,,,,,,,,,,,,,,,,,,,,,,,,,,,,,,,,space,4.920245484972838,,,,,,,,,,,,,,,,,,,,,,,070219_p1,001,2019_Jul_02_0951,body_behavioural,3.0.4,59.97046275834233,
,,,,,,,"You will be presented with the story title, names, the images, and a blank text box for each story.",,,,,,,,,,,,,0,1,1,1,,,,,,,,,,,,,,,,,,,,,,,,,,,,,,,,,,,,space,3.7341835550032556,,,,,,,,,,,,,,,,,,,,,,,070219_p1,001,2019_Jul_02_0951,body_behavioural,3.0.4,59.97046275834233,
,,,,,,,Describe the story indicated with as many details as you can remember in the space provided. ,,,,,,,,,,,,,0,2,2,2,,,,,,,,,,,,,,,,,,,,,,,,,,,,,,,,,,,,space,2.8203813859727234,,,,,,,,,,,,,,,,,,,,,,,070219_p1,001,2019_Jul_02_0951,body_behavioural,3.0.4,59.97046275834233,
,,,,,,,"When you are finished recalling one story, to move onto the next one, press the ‘return’ key. ",,,,,,,,,,,,,0,3,3,3,,,,,,,,,,,,,,,,,,,,,,,,,,,,,,,,,,,,space,4.969898986048065,,,,,,,,,,,,,,,,,,,,,,,070219_p1,001,2019_Jul_02_0951,body_behavioural,3.0.4,59.97046275834233,
,,,,,,,There is a 5 minute time limit to make your response. ,,,,,,,,,,,,,0,4,4,4,,,,,,,,,,,,,,,,,,,,,,,,,,,,,,,,,,,,space,2.3361963370116428,,,,,,,,,,,,,,,,,,,,,,,070219_p1,001,2019_Jul_02_0951,body_behavioural,3.0.4,59.97046275834233,
,,,,,,,Please note that you will not be able to capitalize any letters except for the first letter of your answer. This will not effect the scoring of your recall answer.,,,,,,,,,,,,,0,5,5,5,,,,,,,,,,,,,,,,,,,,,,,,,,,,,,,,,,,,space,7.136765050992835,,,,,,,,,,,,,,,,,,,,,,,070219_p1,001,2019_Jul_02_0951,body_behavioural,3.0.4,59.97046275834233,
0,,,,,,,,,,,,,,,,,,,,,,,,0,0,0,0,,,,,,,,,,,,,,,,,,,,,,,,,,,,,,,,,,space,1.0865000350167975,They met at a grocery store. they were at the meat section when they started to flirt with each other. they continued flirting when they got in line. simon paid for carina's groceries then she had to race off to prepped for her guests for the bbq she was hosting. both agreed to see each other again.,,,,,,,,,,,,,,,,,,,,070219_p1,001,2019_Jul_02_0951,body_behavioural,3.0.4,59.97046275834233,
1,,,,,,,,,,,,,,,,,,,,,,,,0,1,1,1,,,,,,,,,,,,,,,,,,,,,,,,,,,,,,,,,,space,1.1529998580226675,"Both are web developers who had the same class and needed to collaborate to make something work. throughout the whole lecture, they went back and forth on what this deal would entail in a way that would benefit both parties. at the end of the conversation, they hugged and agreed and made plans to meet again to sign the official paperwork.",,,,,,,,,,,,,,,,,,,,070219_p1,001,2019_Jul_02_0951,body_behavioural,3.0.4,59.97046275834233,
2,,,,,,,,,,,,,,,,,,,,,,,,0,2,2,2,,,,,,,,,,,,,,,,,,,,,,,,,,,,,,,,,,space,1.0033925939933397,Aaron and lana had been dating for awhile. they had the same class together. aaron reached out to the professor and told her of his plans to proposed to lana in class. she was agreed to be apart of it. the professor winked at aaraon when it was time. he looked at the ring once more. it was not a traditional ring but with red stones around a band as that was lana's style. the professor called lana to the front for a demonstration. aaron followed up and told her i want to make a bond with you too. will you marry me. she said yes and was crying. the class cheered. the friends from the hallway came into the class. the professor was proud.,,,,,,,,,,,,,,,,,,,,070219_p1,001,2019_Jul_02_0951,body_behavioural,3.0.4,59.97046275834233,
3,,,,,,,,,,,,,,,,,,,,,,,,0,3,3,3,,,,,,,,,,,,,,,,,,,,,,,,,,,,,,,,,,space,1.853697523009032,"Senna and alvira been together for a while. they are at a fancy restaruant. she thinks it's to celebrate her totamtoe garden but it's really an opportunity for senna to proposed to alvira. throughout the whole dinner, senna spoke of his love for alvira then got the waiter to bring everything over and proposed. alvira gladly said yes. the other folks in the restaraunt applaud.",,,,,,,,,,,,,,,,,,,,070219_p1,001,2019_Jul_02_0951,body_behavioural,3.0.4,59.97046275834233,
4,,,,,,,,,,,,,,,,,,,,,,,,0,4,4,4,,,,,,,,,,,,,,,,,,,,,,,,,,,,,,,,,,space,3.8174857560079545,"Emma and liam been fighting. they were both grocery store shopping because they both were hosting a dinner party for friends,oddly. emma grabbed pasta and such and liam was like oh so we eating pasta huh. emma was like well yes, since you not about to help me out. liam is like when i do, i just seem to get in the way. while they grabbed the remaining items and got into line, it was decided that they needed to break up. both were in agreement. they decided to continue with the dinner party and not tell their guests about the break up. at the end, we are shown that there would be a fight over who keeps the cat.",,,,,,,,,,,,,,,,,,,,070219_p1,001,2019_Jul_02_0951,body_behavioural,3.0.4,59.97046275834233,
5,,,,,,,,,,,,,,,,,,,,,,,,0,5,5,5,,,,,,,,,,,,,,,,,,,,,,,,,,,,,,,,,,space,4.386957585986238,"The scene is the aiport. anna shoe laces were untied. she bent down to tie them, unaware that there was a cart racing her way. david saved anna and make a lame joke. love at first sight. anna was like im running late for my flight. david is like oh let me help you. they get through security and race for the gate. in that, they find out they went to the same high school and agreed to meet up again. anna gave david her business card as she entered the jetway. ",,,,,,,,,,,,,,,,,,,,070219_p1,001,2019_Jul_02_0951,body_behavioural,3.0.4,59.97046275834233,
6,,,,,,,,,,,,,,,,,,,,,,,,0,6,6,6,,,,,,,,,,,,,,,,,,,,,,,,,,,,,,,,,,space,1.0694926799624227,They're at a restaraunt trying to broker a deal. mr. g has a big company who is trying to merge with mr. s small company. they order their food and begin eating and conluding the meal was subpar. they went back and forth on talk about the advantages and disadvantages of this merge. it ended with an agreement to merge and a toast. ,,,,,,,,,,,,,,,,,,,,070219_p1,001,2019_Jul_02_0951,body_behavioural,3.0.4,59.97046275834233,
7,,,,,,,,,,,,,,,,,,,,,,,,0,7,7,7,,,,,,,,,,,,,,,,,,,,,,,,,,,,,,,,,,space,0.9197388250031509,"Calvin and jessie were having problems in their relationship and going on this vacation to jamaica did not help. while they were going through typical airport stuff and boarding, it was decided to break up. calvin was hurt but did not want to show it. jessie wanted her books back. luckily they didnt have to sit next to each other on the plan. calvin felt unappreciated. ",,,,,,,,,,,,,,,,,,,,070219_p1,001,2019_Jul_02_0951,body_behavioural,3.0.4,59.97046275834233,
,,,,,,,,,,,,,,,,,,,,,,,,,,,,,,,,,,,,,,,,,,,,,,,,,,,,,,,,,,,,,,,,2115.487994997995,space,1.5509308869950473,,,,,,,,,,,,,,,,,070219_p1,001,2019_Jul_02_0951,body_behavioural,3.0.4,59.97046275834233,
,,,,,,,"In this last part of the experiment, please answer 8 questions about each story.",,,,,,,,,,,,,,,,,,,,,0,0,0,0,,,,,,,,,,,,,,,,,,,,,,,,,,,,,,,,,,,,space,6.418439842003863,,,,,,,,,,,,,,,070219_p1,001,2019_Jul_02_0951,body_behavioural,3.0.4,59.97046275834233,
,,,,,,,Some of the questions are not related to the perspective you were asked to assume.,,,,,,,,,,,,,,,,,,,,,0,1,1,1,,,,,,,,,,,,,,,,,,,,,,,,,,,,,,,,,,,,space,3.2546797950053588,,,,,,,,,,,,,,,070219_p1,001,2019_Jul_02_0951,body_behavioural,3.0.4,59.97046275834233,
,,,,,,,"We realize that we did not tell you to think of these questions during the story, but please do your best to answer them.",,,,,,,,,,,,,,,,,,,,,0,2,2,2,,,,,,,,,,,,,,,,,,,,,,,,,,,,,,,,,,,,space,4.837296429963317,,,,,,,,,,,,,,,070219_p1,001,2019_Jul_02_0951,body_behavioural,3.0.4,59.97046275834233,
,,,,,,,"When you have finished typing your answer, hit ‘return’ to submit your answer and move onto the next question. ",,,,,,,,,,,,,,,,,,,,,0,3,3,3,,,,,,,,,,,,,,,,,,,,,,,,,,,,,,,,,,,,space,3.70317645202158,,,,,,,,,,,,,,,070219_p1,001,2019_Jul_02_0951,body_behavioural,3.0.4,59.97046275834233,
0,,,,,,,,,,,,,,,,,,,,,,,,,,,,,,,,0,0,0,0,,,,,,,,,,,,,,,,,,,,,,,,,,,,60 credit card,,,,,,space,2.2528176509658806,Meat,non-primed first,This looks like a baby chicken,Tuesday for a dinner date,430,Busy,Meat and other items for a bbq,They step into the same ones,60 credit card,,,,070219_p1,001,2019_Jul_02_0951,body_behavioural,3.0.4,59.97046275834233,
1,,,,,,,,,,,,,,,,,,,,,,,,,,,,,,,,0,1,1,1,,,,,,,,,,,,,,,,,,,,,,,,,,,,Hug,,,,,,space,2.319844049983658,Average ,primed first,I do not recall,I do not recall,Midterm next class,Web developers,50k,I do not recall,Hug,,,,070219_p1,001,2019_Jul_02_0951,body_behavioural,3.0.4,59.97046275834233,
2,,,,,,,,,,,,,,,,,,,,,,,,,,,,,,,,0,2,2,2,,,,,,,,,,,,,,,,,,,,,,,,,,,,Midterm next class,,,,,,space,1.2508690350223333,8,primed first,Red 6,Notebook,Dad,Average,Bonds science,Create bonds,Midterm next class,,,,070219_p1,001,2019_Jul_02_0951,body_behavioural,3.0.4,59.97046275834233,
3,,,,,,,,,,,,,,,,,,,,,,,,,,,,,,,,0,3,3,3,,,,,,,,,,,,,,,,,,,,,,,,,,,,Dad,,,,,,space,1.6030833280528896,High ceilings,primed first,I do not recall,I do not recall,They love it,4,1 white,Ring box,Dad,,,,070219_p1,001,2019_Jul_02_0951,body_behavioural,3.0.4,59.97046275834233,
4,,,,,,,,,,,,,,,,,,,,,,,,,,,,,,,,0,4,4,4,,,,,,,,,,,,,,,,,,,,,,,,,,,,Cat,,,,,,space,0.9860175140202045,Busy,non-primed first,Pasta and such,3,30 credit card,A while,The personalities clash,Yes and he believes they are not compatible as well,Cat,,,,070219_p1,001,2019_Jul_02_0951,body_behavioural,3.0.4,59.97046275834233,
5,,,,,,,,,,,,,,,,,,,,,,,,,,,,,,,,0,5,5,5,,,,,,,,,,,,,,,,,,,,,,,,,,,,1055,,,,,,space,2.002836952044163,Anna has a short window; david has a lot of time,non-primed first,Items on the belt,Far end of the terminal,Business class,Her hands,You didn't see that cart coming for you,Tuesday,1055,,,,070219_p1,001,2019_Jul_02_0951,body_behavioural,3.0.4,59.97046275834233,
6,,,,,,,,,,,,,,,,,,,,,,,,,,,,,,,,0,6,6,6,,,,,,,,,,,,,,,,,,,,,,,,,,,,Toast,,,,,,space,0.9530501120025292,Fancy,non-primed first,Covered in felt,Steak,They think it's subpar,Ceos of their perspective companies,A decent amount,I do not recall,Toast,,,,070219_p1,001,2019_Jul_02_0951,body_behavioural,3.0.4,59.97046275834233,
7,,,,,,,,,,,,,,,,,,,,,,,,,,,,,,,,0,7,7,7,,,,,,,,,,,,,,,,,,,,,,,,,,,,Books,,,,,,space,0.7363712270162068,Not long,primed first,I do not recall,Towards the end of the terminal,Main cabin 33a 33f,Long before the vacation,Incompatible personalities,"It didnt seem so at first but he agreed to separate upon return to the states; he thinks he did a lot to please her especially during the vacation but he's like oh since im boring or whatever, bye.",Books,,,,070219_p1,001,2019_Jul_02_0951,body_behavioural,3.0.4,59.97046275834233,
,,,,,,,,,,,,,,,,,,,,,,,,,,,,,,,,,,,,,,,,,,,,,,,,,,,,,,,,,,,,,,,,,,,,,,,,,,,,,,,,2646.2407769869897,space,1.1356811649748124,070219_p1,001,2019_Jul_02_0951,body_behavioural,3.0.4,59.97046275834233,
,,,,,,,,,,,,,,,,,,,,,,,,,,,,,,,,,,,,0,0,0,0,,,,,,,,,,,,,,,,,,,,,,,,,,,,,,,,,,,,,,,,,,,,070219_p1,001,2019_Jul_02_0951,body_behavioural,3.0.4,59.97046275834233,
,,,,,,,,,,,,,,,,,,,,,,,,,,,,,,,,,,,,1,0,1,0,,,,,,,,,,,,,,,,,,,,,,,,,,,,,,,,,,,,,,,,,,,,070219_p1,001,2019_Jul_02_0951,body_behavioural,3.0.4,59.97046275834233,
,,,,,,,,,,,,,,,,,,,,,,,,,,,,,,,,,,,,2,0,2,0,,,,,,,,,,,,,,,,,,,,,,,,,,,,,,,,,,,,,,,,,,,,070219_p1,001,2019_Jul_02_0951,body_behavioural,3.0.4,59.97046275834233,
,,,,,,,,,,,,,,,,,,,,,,,,,,,,,,,,,,,,3,0,3,0,,,,,,,,,,,,,,,,,,,,,,,,,,,,,,,,,,,,,,,,,,,,070219_p1,001,2019_Jul_02_0951,body_behavioural,3.0.4,59.97046275834233,
,,,,,,,,,,,,,,,,,,,,,,,,,,,,,,,,,,,,4,0,4,0,,,,,,,,,,,,,,,,,,,,,,,,,,,,,,,,,,,,,,,,,,,,070219_p1,001,2019_Jul_02_0951,body_behavioural,3.0.4,59.97046275834233,
