5,Because that was a nice tumble.”,1,2,None,,,,0,5,5,5,,,,,0,7,7,7,,,,,,,,,,,,,,,,,,,,,,,,,,,,,,,,,,,1,3.220399273035582,,,,,,,,,,,,,,,,,,,,,,,,,,,,070219_p1,001,2019_Jul_02_0951,body_behavioural,3.0.4,59.97046275834233,
5,"She managed a chuckle and said, “Actually, yes, but I’d say that deserved a score of zero.",1,2,None,,,,0,5,5,5,,,,,0,8,8,8,,,,,,,,,,,,,,,,,,,,,,,,,,,,,,,,,,,1,2.236849147011526,,,,,,,,,,,,,,,,,,,,,,,,,,,,070219_p1,001,2019_Jul_02_0951,body_behavioural,3.0.4,59.97046275834233,
5,Maybe a ‘1’ at least for your effort. ,1,2,None,,,,0,5,5,5,,,,,0,9,9,9,,,,,,,,,,,,,,,,,,,,,,,,,,,,,,,,,,,1,1.3863649730337784,,,,,,,,,,,,,,,,,,,,,,,,,,,,070219_p1,001,2019_Jul_02_0951,body_behavioural,3.0.4,59.97046275834233,
5,Wow- I almost got smooshed by that cart.”,1,2,None,,,,0,5,5,5,,,,,0,10,10,10,,,,,,,,,,,,,,,,,,,,,,,,,,,,,,,,,,,1,1.734060857037548,,,,,,,,,,,,,,,,,,,,,,,,,,,,070219_p1,001,2019_Jul_02_0951,body_behavioural,3.0.4,59.97046275834233,
5,Her head was still spinning as she stared at the handsome stranger who had saved her. ,1,2,None,,,,0,5,5,5,,,,,0,11,11,11,,,,,,,,,,,,,,,,,,,,,,,,,,,,,,,,,,,1,4.819994995021261,,,,,,,,,,,,,,,,,,,,,,,,,,,,070219_p1,001,2019_Jul_02_0951,body_behavioural,3.0.4,59.97046275834233,
5,David helped her up and had to keep holding on to her arms to steady her even once they were standing.,1,2,None,,,,0,5,5,5,,,,,0,12,12,12,,,,,,,,,,,,,,,,,,,,,,,,,,,,,,,,,,,1,4.35337528702803,,,,,,,,,,,,,,,,,,,,,,,,,,,,070219_p1,001,2019_Jul_02_0951,body_behavioural,3.0.4,59.97046275834233,
5,"“I’m really late for my flight,” she said. ",1,2,None,,,,0,5,5,5,,,,,0,13,13,13,,,,,,,,,,,,,,,,,,,,,,,,,,,,,,,,,,,1,1.916742357017938,,,,,,,,,,,,,,,,,,,,,,,,,,,,070219_p1,001,2019_Jul_02_0951,body_behavioural,3.0.4,59.97046275834233,
5,"“Don't worry,” said David, "let me help you get to your gate." ",1,2,None,,,,0,5,5,5,,,,,0,14,14,14,,,,,,,,,,,,,,,,,,,,,,,,,,,,,,,,,,,1,2.6202789539820515,,,,,,,,,,,,,,,,,,,,,,,,,,,,070219_p1,001,2019_Jul_02_0951,body_behavioural,3.0.4,59.97046275834233,
5,He waved off her half-hearted protests. ,1,2,None,,,,0,5,5,5,,,,,0,15,15,15,,,,,,,,,,,,,,,,,,,,,,,,,,,,,,,,,,,1,3.786426442966331,,,,,,,,,,,,,,,,,,,,,,,,,,,,070219_p1,001,2019_Jul_02_0951,body_behavioural,3.0.4,59.97046275834233,
5,“Really- I have plenty of time and nothing better to do.” he said. ,1,2,None,,,,0,5,5,5,,,,,0,16,16,16,,,,,,,,,,,,,,,,,,,,,,,,,,,,,,,,,,,1,2.8372430420131423,,,,,,,,,,,,,,,,,,,,,,,,,,,,070219_p1,001,2019_Jul_02_0951,body_behavioural,3.0.4,59.97046275834233,
5,"At security, the line was not long, but, since Anna’s flight departure was close at hand, the security guard allowed them to go to the front of the line.",2,2,None,,,,0,5,5,5,,,,,0,17,17,17,,,,,,,,,,,,,,,,,,,,,,,,,,,,,,,,,,,9,6.052936823980417,,,,,,,,,,,,,,,,,,,,,,,,,,,,070219_p1,001,2019_Jul_02_0951,body_behavioural,3.0.4,59.97046275834233,
5,"They had to wait however, because there was a strange malfunction of the metal detector. ",2,2,None,,,,0,5,5,5,,,,,0,18,18,18,,,,,,,,,,,,,,,,,,,,,,,,,,,,,,,,,,,1,4.303242965019308,,,,,,,,,,,,,,,,,,,,,,,,,,,,070219_p1,001,2019_Jul_02_0951,body_behavioural,3.0.4,59.97046275834233,
5,"In this span of time, they managed to find out that they had gone to the same high school and that Anna had graduated 3 years before David. ",2,2,None,,,,0,5,5,5,,,,,0,19,19,19,,,,,,,,,,,,,,,,,,,,,,,,,,,,,,,,,,,9,8.203563395014498,,,,,,,,,,,,,,,,,,,,,,,,,,,,070219_p1,001,2019_Jul_02_0951,body_behavioural,3.0.4,59.97046275834233,
5,They hurriedly took off their shoes and coats.,2,2,None,,,,0,5,5,5,,,,,0,20,20,20,,,,,,,,,,,,,,,,,,,,,,,,,,,,,,,,,,,9,5.436617768020369,,,,,,,,,,,,,,,,,,,,,,,,,,,,070219_p1,001,2019_Jul_02_0951,body_behavioural,3.0.4,59.97046275834233,
5,"Anna placed her purse and suitcase on the conveyor belt, and David put his backpack on the conveyor belt as well, with his laptop in a separate bin. ",2,2,None,,,,0,5,5,5,,,,,0,21,21,21,,,,,,,,,,,,,,,,,,,,,,,,,,,,,,,,,,,1,1.4189281619619578,,,,,,,,,,,,,,,,,,,,,,,,,,,,070219_p1,001,2019_Jul_02_0951,body_behavioural,3.0.4,59.97046275834233,
5,Both of them went through the metal detector without any problems. ,2,2,None,,,,0,5,5,5,,,,,0,22,22,22,,,,,,,,,,,,,,,,,,,,,,,,,,,,,,,,,,,1,1.6846910770400427,,,,,,,,,,,,,,,,,,,,,,,,,,,,070219_p1,001,2019_Jul_02_0951,body_behavioural,3.0.4,59.97046275834233,
5,"As they were rushing to put their shoes and coats on, they shared when they were coming back. ",2,2,None,,,,0,5,5,5,,,,,0,23,23,23,,,,,,,,,,,,,,,,,,,,,,,,,,,,,,,,,,,1,2.4008188630104996,,,,,,,,,,,,,,,,,,,,,,,,,,,,070219_p1,001,2019_Jul_02_0951,body_behavioural,3.0.4,59.97046275834233,
5,"In a moment of boldness, David asked, “When we're back in town next Tuesday, is there any chance you'd want to get dinner?",2,3,None,,,,0,5,5,5,,,,,0,24,24,24,,,,,,,,,,,,,,,,,,,,,,,,,,,,,,,,,,,1,5.903562233026605,,,,,,,,,,,,,,,,,,,,,,,,,,,,070219_p1,001,2019_Jul_02_0951,body_behavioural,3.0.4,59.97046275834233,
5,"I know we just met, but when life throws a luggage cart at you it seems like we should listen. “",2,3,None,,,,0,5,5,5,,,,,0,25,25,25,,,,,,,,,,,,,,,,,,,,,,,,,,,,,,,,,,,1,2.5032601099810563,,,,,,,,,,,,,,,,,,,,,,,,,,,,070219_p1,001,2019_Jul_02_0951,body_behavioural,3.0.4,59.97046275834233,
5,"She stopped packing, and said with a smile, “Yes I would love that.”",2,3,None,,,,0,5,5,5,,,,,0,26,26,26,,,,,,,,,,,,,,,,,,,,,,,,,,,,,,,,,,,1,1.2533993019605987,,,,,,,,,,,,,,,,,,,,,,,,,,,,070219_p1,001,2019_Jul_02_0951,body_behavioural,3.0.4,59.97046275834233,
5,"On the concourse, they were running to get to Anna’s gate, J37, which was at the end of the terminal. ",3,3,None,,,,0,5,5,5,,,,,0,27,27,27,,,,,,,,,,,,,,,,,,,,,,,,,,,,,,,,,,,9,3.4027787930099294,,,,,,,,,,,,,,,,,,,,,,,,,,,,070219_p1,001,2019_Jul_02_0951,body_behavioural,3.0.4,59.97046275834233,
5,"David took her suitcase, grabbed her hand, and weaved crowd of people.",3,3,None,,,,0,5,5,5,,,,,0,28,28,28,,,,,,,,,,,,,,,,,,,,,,,,,,,,,,,,,,,1,1.5198133750236593,,,,,,,,,,,,,,,,,,,,,,,,,,,,070219_p1,001,2019_Jul_02_0951,body_behavioural,3.0.4,59.97046275834233,
5,People passing them were giving them funny looks because Anna appeared so bewildered on account of David’s help.,3,3,None,,,,0,5,5,5,,,,,0,29,29,29,,,,,,,,,,,,,,,,,,,,,,,,,,,,,,,,,,,1,3.9198696889798157,,,,,,,,,,,,,,,,,,,,,,,,,,,,070219_p1,001,2019_Jul_02_0951,body_behavioural,3.0.4,59.97046275834233,
5,"Before getting to the gate, explaining that she would sprint the rest of the way, Anna fished out a crumpled business card from her pocket and handed it to David, who handed her the suitcase.",3,4,None,,,,0,5,5,5,,,,,0,30,30,30,,,,,,,,,,,,,,,,,,,,,,,,,,,,,,,,,,,1,8.35337281198008,,,,,,,,,,,,,,,,,,,,,,,,,,,,070219_p1,001,2019_Jul_02_0951,body_behavioural,3.0.4,59.97046275834233,
5,"She gave him one last embarrassed smile, thanked him, and hurried away.",3,4,None,,,,0,5,5,5,,,,,0,31,31,31,,,,,,,,,,,,,,,,,,,,,,,,,,,,,,,,,,,1,2.253083182964474,,,,,,,,,,,,,,,,,,,,,,,,,,,,070219_p1,001,2019_Jul_02_0951,body_behavioural,3.0.4,59.97046275834233,
5,"David looked at his watch which read 10:55 AM, 5 minutes before her flight was supposed to leave. ",3,4,None,,,,0,5,5,5,,,,,0,32,32,32,,,,,,,,,,,,,,,,,,,,,,,,,,,,,,,,,,,1,3.6028689119848423,,,,,,,,,,,,,,,,,,,,,,,,,,,,070219_p1,001,2019_Jul_02_0951,body_behavioural,3.0.4,59.97046275834233,
5,"At the gate, Anna waved to the flight attendant who motioned for her to hurry, and she boarded the plane. ",4,4,None,,,,0,5,5,5,,,,,0,33,33,33,,,,,,,,,,,,,,,,,,,,,,,,,,,,,,,,,,,1,3.0865005500381812,,,,,,,,,,,,,,,,,,,,,,,,,,,,070219_p1,001,2019_Jul_02_0951,body_behavioural,3.0.4,59.97046275834233,
5,"She slid into her window seat, 7D, in business class, and barely containing her glee, she hugged the plastic-wrapped blanket. ",4,4,None,,,,0,5,5,5,,,,,0,34,34,34,,,,,,,,,,,,,,,,,,,,,,,,,,,,,,,,,,,9,7.81945305300178,,,,,,,,,,,,,,,,,,,,,,,,,,,,070219_p1,001,2019_Jul_02_0951,body_behavioural,3.0.4,59.97046275834233,
5,"She was thankful that she had not only made it onto the plane in time, but also that she had been clumsy enough to forget to tie her shoes.",4,4,None,,,,0,5,5,5,,,,,0,35,35,35,,,,,,,,,,,,,,,,,,,,,,,,,,,,,,,,,,,1,5.153339278011117,,,,,,,,,,,,,,,,,,,,,,,,,,,,070219_p1,001,2019_Jul_02_0951,body_behavioural,3.0.4,59.97046275834233,
5,,,,,,,,0,5,5,5,,,,,,,,,,,,,,,,,,,,,,,,,,,,,,,,,,,,,,,,,,,,,,,,,,,,,,,,,,,,,,,,,,,,,,,,070219_p1,001,2019_Jul_02_0951,body_behavioural,3.0.4,59.97046275834233,
6,,,,,,,,0,6,6,6,0,0,0,0,,,,,,,,,,,,,,,,,,,,,,,,,,,,,space,1.0857903079595417,space,0.5855772049981169,space,0.5529660820029676,,,,,,,,,,,,,,,,,,,,,,,,,,,,,,,,,,070219_p1,001,2019_Jul_02_0951,body_behavioural,3.0.4,59.97046275834233,
6,Mr. Shelton and Mr. Gordon shook hands inside the waiting area of the restaurant: lunch today was about big business. ,1,1,31.0,,,,0,6,6,6,,,,,0,0,0,0,,,,,,,,,,,,,,,,,,,,,,,,,,,,,,,space,1.420697565015871,space,0.3868642000015825,9,6.153906947991345,,,,,,,,,,,,,,,,,,,,,,,,,,,,070219_p1,001,2019_Jul_02_0951,body_behavioural,3.0.4,59.97046275834233,
6,They were both in the airplane manufacturing industry.,1,1,None,,,,0,6,6,6,,,,,0,1,1,1,,,,,,,,,,,,,,,,,,,,,,,,,,,,,,,,,,,1,3.7204152679769322,,,,,,,,,,,,,,,,,,,,,,,,,,,,070219_p1,001,2019_Jul_02_0951,body_behavioural,3.0.4,59.97046275834233,
6,"Mr. Shelton was the CFO of a larger, well-established company and had been in the aviation business for decades.",1,1,None,,,,0,6,6,6,,,,,0,2,2,2,,,,,,,,,,,,,,,,,,,,,,,,,,,,,,,,,,,1,1.6834622220485471,,,,,,,,,,,,,,,,,,,,,,,,,,,,070219_p1,001,2019_Jul_02_0951,body_behavioural,3.0.4,59.97046275834233,
6,Mr. Gordon was the CEO of a smaller but technologically-advanced company that was projected to disrupt the airplane manufacturing market. ,1,1,None,,,,0,6,6,6,,,,,0,3,3,3,,,,,,,,,,,,,,,,,,,,,,,,,,,,,,,,,,,1,1.1690291250124574,,,,,,,,,,,,,,,,,,,,,,,,,,,,070219_p1,001,2019_Jul_02_0951,body_behavioural,3.0.4,59.97046275834233,
6,"They chose to meet at an old steakhouse with dark wood paneling on the floor and ceilings, taxidermy animals on the walls, and a candelabra on every table.",1,1,None,,,,0,6,6,6,,,,,0,4,4,4,,,,,,,,,,,,,,,,,,,,,,,,,,,,,,,,,,,1,5.086524905986153,,,,,,,,,,,,,,,,,,,,,,,,,,,,070219_p1,001,2019_Jul_02_0951,body_behavioural,3.0.4,59.97046275834233,
6,The waitress seated them at their table in the back. ,2,1,None,,,,0,6,6,6,,,,,0,5,5,5,,,,,,,,,,,,,,,,,,,,,,,,,,,,,,,,,,,1,1.9698849939741194,,,,,,,,,,,,,,,,,,,,,,,,,,,,070219_p1,001,2019_Jul_02_0951,body_behavioural,3.0.4,59.97046275834233,
6,"She brought out the menus, and they briefly chatted about personal happenings. ",2,1,None,,,,0,6,6,6,,,,,0,6,6,6,,,,,,,,,,,,,,,,,,,,,,,,,,,,,,,,,,,1,1.302741440013051,,,,,,,,,,,,,,,,,,,,,,,,,,,,070219_p1,001,2019_Jul_02_0951,body_behavioural,3.0.4,59.97046275834233,
6,"Mr. Gordon took out a picture of his daughter and talked about her recent engagement, and Mr. Gordon mentioned his purchase of a Tesla. ",2,1,None,,,,0,6,6,6,,,,,0,7,7,7,,,,,,,,,,,,,,,,,,,,,,,,,,,,,,,,,,,1,3.719927333004307,,,,,,,,,,,,,,,,,,,,,,,,,,,,070219_p1,001,2019_Jul_02_0951,body_behavioural,3.0.4,59.97046275834233,
6,They also looked over the menus which were heavy and covered in felt.,2,1,None,,,,0,6,6,6,,,,,0,8,8,8,,,,,,,,,,,,,,,,,,,,,,,,,,,,,,,,,,,1,3.035854419984389,,,,,,,,,,,,,,,,,,,,,,,,,,,,070219_p1,001,2019_Jul_02_0951,body_behavioural,3.0.4,59.97046275834233,
6,Flipping to the back of the menu brought one to a lengthy drink selection.,2,1,None,,,,0,6,6,6,,,,,0,9,9,9,,,,,,,,,,,,,,,,,,,,,,,,,,,,,,,,,,,1,2.485977858013939,,,,,,,,,,,,,,,,,,,,,,,,,,,,070219_p1,001,2019_Jul_02_0951,body_behavioural,3.0.4,59.97046275834233,
6,Mr. Shelton got serious and brought the conversation around to business.,2,2,None,,,,0,6,6,6,,,,,0,10,10,10,,,,,,,,,,,,,,,,,,,,,,,,,,,,,,,,,,,1,2.5359409150551073,,,,,,,,,,,,,,,,,,,,,,,,,,,,070219_p1,001,2019_Jul_02_0951,body_behavioural,3.0.4,59.97046275834233,
6,"“Mr. Gordon, we really admire what you’re doing at your company.",2,2,None,,,,0,6,6,6,,,,,0,11,11,11,,,,,,,,,,,,,,,,,,,,,,,,,,,,,,,,,,,9,3.036055803007912,,,,,,,,,,,,,,,,,,,,,,,,,,,,070219_p1,001,2019_Jul_02_0951,body_behavioural,3.0.4,59.97046275834233,
6,We think it’s genius; we want to support your vision and make this tiny company of yours internationally known.,2,2,None,,,,0,6,6,6,,,,,0,12,12,12,,,,,,,,,,,,,,,,,,,,,,,,,,,,,,,,,,,1,1.0692849199986085,,,,,,,,,,,,,,,,,,,,,,,,,,,,070219_p1,001,2019_Jul_02_0951,body_behavioural,3.0.4,59.97046275834233,
6,"But honestly, your company doesn’t have the resources to reach international markets right now.",2,2,None,,,,0,6,6,6,,,,,0,13,13,13,,,,,,,,,,,,,,,,,,,,,,,,,,,,,,,,,,,1,2.2699290770106018,,,,,,,,,,,,,,,,,,,,,,,,,,,,070219_p1,001,2019_Jul_02_0951,body_behavioural,3.0.4,59.97046275834233,
6,"Maybe in a few years you could, but by that time, other companies may have already filled your niche.",2,2,None,,,,0,6,6,6,,,,,0,14,14,14,,,,,,,,,,,,,,,,,,,,,,,,,,,,,,,,,,,1,1.1030742700095288,,,,,,,,,,,,,,,,,,,,,,,,,,,,070219_p1,001,2019_Jul_02_0951,body_behavioural,3.0.4,59.97046275834233,
6,I think we should join forces.”,2,2,None,,,,0,6,6,6,,,,,0,15,15,15,,,,,,,,,,,,,,,,,,,,,,,,,,,,,,,,,,,1,1.1030853519914672,,,,,,,,,,,,,,,,,,,,,,,,,,,,070219_p1,001,2019_Jul_02_0951,body_behavioural,3.0.4,59.97046275834233,
6,The waitress arrived and asked if they were ready to order.,3,2,None,,,,0,6,6,6,,,,,0,16,16,16,,,,,,,,,,,,,,,,,,,,,,,,,,,,,,,,,,,1,7.937575617979746,,,,,,,,,,,,,,,,,,,,,,,,,,,,070219_p1,001,2019_Jul_02_0951,body_behavioural,3.0.4,59.97046275834233,
6,"Mr. Gordon chose the medium-rare steak and a martini, and Mr. Shelton ordered the veal and a manhattan. ",3,2,None,,,,0,6,6,6,,,,,0,17,17,17,,,,,,,,,,,,,,,,,,,,,,,,,,,,,,,,,,,1,1.869297077995725,,,,,,,,,,,,,,,,,,,,,,,,,,,,070219_p1,001,2019_Jul_02_0951,body_behavioural,3.0.4,59.97046275834233,
6,"Then Mr. Shelton continued, “Look, I’ve talked to other members of the board, and we are prepared to offer $600 million to buy your company. ",3,2,None,,,,0,6,6,6,,,,,0,18,18,18,,,,,,,,,,,,,,,,,,,,,,,,,,,,,,,,,,,1,2.53602244600188,,,,,,,,,,,,,,,,,,,,,,,,,,,,070219_p1,001,2019_Jul_02_0951,body_behavioural,3.0.4,59.97046275834233,
6,"We'd keep on all of your current employees, and you would join as the director of your company branch.” ",3,2,None,,,,0,6,6,6,,,,,0,19,19,19,,,,,,,,,,,,,,,,,,,,,,,,,,,,,,,,,,,1,1.2026786539936438,,,,,,,,,,,,,,,,,,,,,,,,,,,,070219_p1,001,2019_Jul_02_0951,body_behavioural,3.0.4,59.97046275834233,
6,"Mr. Gordon looked at Mr. Shelton skeptically for a few moments considering his response until he said, “Mr. Shelton, I think that you make a compelling offer, but there are definitely some disadvantages to attaching our small, streamlined productions to a large company like yours.",3,3,None,,,,0,6,6,6,,,,,0,20,20,20,,,,,,,,,,,,,,,,,,,,,,,,,,,,,,,,,,,1,7.520191173010971,,,,,,,,,,,,,,,,,,,,,,,,,,,,070219_p1,001,2019_Jul_02_0951,body_behavioural,3.0.4,59.97046275834233,
6,"We operate in a very different way than a large company, and the kind of administrative complexity that makes the scale of your productions possible would suffocate our business.",3,3,None,,,,0,6,6,6,,,,,0,21,21,21,,,,,,,,,,,,,,,,,,,,,,,,,,,,,,,,,,,1,2.6365061429678462,,,,,,,,,,,,,,,,,,,,,,,,,,,,070219_p1,001,2019_Jul_02_0951,body_behavioural,3.0.4,59.97046275834233,
6,"With our product, scaling-up doesn’t necessarily make sense.” ",3,3,None,,,,0,6,6,6,,,,,0,22,22,22,,,,,,,,,,,,,,,,,,,,,,,,,,,,,,,,,,,1,1.152536500012502,,,,,,,,,,,,,,,,,,,,,,,,,,,,070219_p1,001,2019_Jul_02_0951,body_behavioural,3.0.4,59.97046275834233,
6,Mr. Shelton had expected this response and had come prepared.,3,3,None,,,,0,6,6,6,,,,,0,23,23,23,,,,,,,,,,,,,,,,,,,,,,,,,,,,,,,,,,,1,2.4030870279530063,,,,,,,,,,,,,,,,,,,,,,,,,,,,070219_p1,001,2019_Jul_02_0951,body_behavioural,3.0.4,59.97046275834233,
6,He began laying out the details of how he had handled similar acquisitions successfully in the past.,3,3,None,,,,0,6,6,6,,,,,0,24,24,24,,,,,,,,,,,,,,,,,,,,,,,,,,,,,,,,,,,1,2.785763831983786,,,,,,,,,,,,,,,,,,,,,,,,,,,,070219_p1,001,2019_Jul_02_0951,body_behavioural,3.0.4,59.97046275834233,
6,"He also played out projections of how Mr. Gordon’s company could out-compete their own main competitor in the industry, TechJet, by using the resources of a larger corporation. ",3,3,None,,,,0,6,6,6,,,,,0,25,25,25,,,,,,,,,,,,,,,,,,,,,,,,,,,,,,,,,,,1,2.3361506960354745,,,,,,,,,,,,,,,,,,,,,,,,,,,,070219_p1,001,2019_Jul_02_0951,body_behavioural,3.0.4,59.97046275834233,
6,"Mr. Gordon was impressed, and they went back and forth hashing out what the company configuration would look like post-merger. ",3,3,None,,,,0,6,6,6,,,,,0,26,26,26,,,,,,,,,,,,,,,,,,,,,,,,,,,,,,,,,,,1,3.3842055579880252,,,,,,,,,,,,,,,,,,,,,,,,,,,,070219_p1,001,2019_Jul_02_0951,body_behavioural,3.0.4,59.97046275834233,
6,The waitress brought out their food on a large tray.,4,3,None,,,,0,6,6,6,,,,,0,27,27,27,,,,,,,,,,,,,,,,,,,,,,,,,,,,,,,,,,,1,1.7364414649782702,,,,,,,,,,,,,,,,,,,,,,,,,,,,070219_p1,001,2019_Jul_02_0951,body_behavioural,3.0.4,59.97046275834233,
6,“Oh this looks so good!” Mr. Gordon said. ,4,3,None,,,,0,6,6,6,,,,,0,28,28,28,,,,,,,,,,,,,,,,,,,,,,,,,,,,,,,,,,,1,1.7862758580013178,,,,,,,,,,,,,,,,,,,,,,,,,,,,070219_p1,001,2019_Jul_02_0951,body_behavioural,3.0.4,59.97046275834233,
6,“Can I get you anything else?” the waitress asked.,4,3,None,,,,0,6,6,6,,,,,0,29,29,29,,,,,,,,,,,,,,,,,,,,,,,,,,,,,,,,,,,1,2.020142812980339,,,,,,,,,,,,,,,,,,,,,,,,,,,,070219_p1,001,2019_Jul_02_0951,body_behavioural,3.0.4,59.97046275834233,
6,They declined and began to eat. ,4,3,None,,,,0,6,6,6,,,,,0,30,30,30,,,,,,,,,,,,,,,,,,,,,,,,,,,,,,,,,,,1,1.3530459169996902,,,,,,,,,,,,,,,,,,,,,,,,,,,,070219_p1,001,2019_Jul_02_0951,body_behavioural,3.0.4,59.97046275834233,
6,The meal was subpar- they both found the meat to be overcooked and dry. ,4,3,None,,,,0,6,6,6,,,,,0,31,31,31,,,,,,,,,,,,,,,,,,,,,,,,,,,,,,,,,,,1,4.000907775014639,,,,,,,,,,,,,,,,,,,,,,,,,,,,070219_p1,001,2019_Jul_02_0951,body_behavioural,3.0.4,59.97046275834233,
6,"Mr. Gordon, after taking a contemplative bite and swallowing, said, “Mr. Shelton, I think we have a deal. ",4,4,None,,,,0,6,6,6,,,,,0,32,32,32,,,,,,,,,,,,,,,,,,,,,,,,,,,,,,,,,,,1,4.087210690020584,,,,,,,,,,,,,,,,,,,,,,,,,,,,070219_p1,001,2019_Jul_02_0951,body_behavioural,3.0.4,59.97046275834233,
6,"If you can guarantee that I can still have the final say in all the work done by my team, I think this could be beneficial for both of us.",4,4,None,,,,0,6,6,6,,,,,0,33,33,33,,,,,,,,,,,,,,,,,,,,,,,,,,,,,,,,,,,1,4.986718475993257,,,,,,,,,,,,,,,,,,,,,,,,,,,,070219_p1,001,2019_Jul_02_0951,body_behavioural,3.0.4,59.97046275834233,
6,I propose a toast to the merging of our companies.”,4,4,None,,,,0,6,6,6,,,,,0,34,34,34,,,,,,,,,,,,,,,,,,,,,,,,,,,,,,,,,,,1,1.3530160470400006,,,,,,,,,,,,,,,,,,,,,,,,,,,,070219_p1,001,2019_Jul_02_0951,body_behavioural,3.0.4,59.97046275834233,
6,Mr. Shelton grinned and lifted his martini to clink glasses.,4,4,None,,,,0,6,6,6,,,,,0,35,35,35,,,,,,,,,,,,,,,,,,,,,,,,,,,,,,,,,,,1,1.4697257379884832,,,,,,,,,,,,,,,,,,,,,,,,,,,,070219_p1,001,2019_Jul_02_0951,body_behavioural,3.0.4,59.97046275834233,
6,"He said, “Cheers to a lifelong partnership and to the growth of our company.” ",4,4,None,,,,0,6,6,6,,,,,0,36,36,36,,,,,,,,,,,,,,,,,,,,,,,,,,,,,,,,,,,1,1.8872754229814745,,,,,,,,,,,,,,,,,,,,,,,,,,,,070219_p1,001,2019_Jul_02_0951,body_behavioural,3.0.4,59.97046275834233,
6,,,,,,,,0,6,6,6,,,,,,,,,,,,,,,,,,,,,,,,,,,,,,,,,,,,,,,,,,,,,,,,,,,,,,,,,,,,,,,,,,,,,,,,070219_p1,001,2019_Jul_02_0951,body_behavioural,3.0.4,59.97046275834233,
7,,,,,,,,0,7,7,7,0,0,0,0,,,,,,,,,,,,,,,,,,,,,,,,,,,,,space,0.8702475620084442,space,2.1370079000480473,space,1.903024377010297,,,,,,,,,,,,,,,,,,,,,,,,,,,,,,,,,,070219_p1,001,2019_Jul_02_0951,body_behavioural,3.0.4,59.97046275834233,
7,"It didn’t help the situation that Calvin and Jessie were running late to the airport, since Jessie had already been fuming at Calvin and preparing to end the relationship with him.",1,1,12.0,,,,0,7,7,7,,,,,0,0,0,0,,,,,,,,,,,,,,,,,,,,,,,,,,,,,,,space,0.9868400699924678,space,1.3196794420364313,9,11.204173278994858,,,,,,,,,,,,,,,,,,,,,,,,,,,,070219_p1,001,2019_Jul_02_0951,body_behavioural,3.0.4,59.97046275834233,
7,"Upon arriving at their terminal, they only had 45 minutes until their international flight would depart from Jamaica for the US.",1,1,None,,,,0,7,7,7,,,,,0,1,1,1,,,,,,,,,,,,,,,,,,,,,,,,,,,,,,,,,,,1,4.986114021972753,,,,,,,,,,,,,,,,,,,,,,,,,,,,070219_p1,001,2019_Jul_02_0951,body_behavioural,3.0.4,59.97046275834233,
7,"It had been a tough vacation, which was planned well before Jessie began to think of breaking up with Calvin 6 weeks ago.  ",1,1,None,,,,0,7,7,7,,,,,0,2,2,2,,,,,,,,,,,,,,,,,,,,,,,,,,,,,,,,,,,1,7.336172465002164,,,,,,,,,,,,,,,,,,,,,,,,,,,,070219_p1,001,2019_Jul_02_0951,body_behavioural,3.0.4,59.97046275834233,
7,"Calvin knew that Jessie was upset, but wasn't sure what to do besides attempt to carry on as normal.",1,1,None,,,,0,7,7,7,,,,,0,3,3,3,,,,,,,,,,,,,,,,,,,,,,,,,,,,,,,,,,,1,5.403526949987281,,,,,,,,,,,,,,,,,,,,,,,,,,,,070219_p1,001,2019_Jul_02_0951,body_behavioural,3.0.4,59.97046275834233,
7,"The security line was very short, and once the online boarding passes were scanned, they put their bags on the conveyor belt.",2,1,None,,,,0,7,7,7,,,,,0,4,4,4,,,,,,,,,,,,,,,,,,,,,,,,,,,,,,,,,,,9,4.15325011004461,,,,,,,,,,,,,,,,,,,,,,,,,,,,070219_p1,001,2019_Jul_02_0951,body_behavioural,3.0.4,59.97046275834233,
7,Calvin also took off his belt and watch.,2,1,None,,,,0,7,7,7,,,,,0,5,5,5,,,,,,,,,,,,,,,,,,,,,,,,,,,,,,,,,,,1,1.9031694500008598,,,,,,,,,,,,,,,,,,,,,,,,,,,,070219_p1,001,2019_Jul_02_0951,body_behavioural,3.0.4,59.97046275834233,
7,"There was a short halt in security proceedings so that the security guards could change shifts, but, once everything was back in order, they were ushered quickly through the metal detector. ",2,1,None,,,,0,7,7,7,,,,,0,6,6,6,,,,,,,,,,,,,,,,,,,,,,,,,,,,,,,,,,,1,7.134504999965429,,,,,,,,,,,,,,,,,,,,,,,,,,,,070219_p1,001,2019_Jul_02_0951,body_behavioural,3.0.4,59.97046275834233,
7,"“The infrastructure of this airport is really quite poor," said Calvin as they waited for their bags to emerge from the x-ray machine.",2,1,None,,,,0,7,7,7,,,,,0,7,7,7,,,,,,,,,,,,,,,,,,,,,,,,,,,,,,,,,,,1,4.470623507048003,,,,,,,,,,,,,,,,,,,,,,,,,,,,070219_p1,001,2019_Jul_02_0951,body_behavioural,3.0.4,59.97046275834233,
7,“I could've hidden something in my shoes easily.” ,2,1,None,,,,0,7,7,7,,,,,0,8,8,8,,,,,,,,,,,,,,,,,,,,,,,,,,,,,,,,,,,1,2.3027619519853033,,,,,,,,,,,,,,,,,,,,,,,,,,,,070219_p1,001,2019_Jul_02_0951,body_behavioural,3.0.4,59.97046275834233,
7,"Jessie, exasperated, scowled at the conveyor belt.",2,1,None,,,,0,7,7,7,,,,,0,9,9,9,,,,,,,,,,,,,,,,,,,,,,,,,,,,,,,,,,,1,2.2006103720050305,,,,,,,,,,,,,,,,,,,,,,,,,,,,070219_p1,001,2019_Jul_02_0951,body_behavioural,3.0.4,59.97046275834233,
7,“What?” he asked.,2,1,None,,,,0,7,7,7,,,,,0,10,10,10,,,,,,,,,,,,,,,,,,,,,,,,,,,,,,,,,,,1,0.9368304689996876,,,,,,,,,,,,,,,,,,,,,,,,,,,,070219_p1,001,2019_Jul_02_0951,body_behavioural,3.0.4,59.97046275834233,
7,"Balling up her fists and turning to him angrily, she said, “Calvin, I really don’t think I can do this anymore because I don’t think our personalities are compatible. ",2,2,None,,,,0,7,7,7,,,,,0,11,11,11,,,,,,,,,,,,,,,,,,,,,,,,,,,,,,,,,,,1,6.03752260201145,,,,,,,,,,,,,,,,,,,,,,,,,,,,070219_p1,001,2019_Jul_02_0951,body_behavioural,3.0.4,59.97046275834233,
7,I think it’s best that once we get to the States we part ways for good.” ,2,2,None,,,,0,7,7,7,,,,,0,12,12,12,,,,,,,,,,,,,,,,,,,,,,,,,,,,,,,,,,,1,3.6848795849946328,,,,,,,,,,,,,,,,,,,,,,,,,,,,070219_p1,001,2019_Jul_02_0951,body_behavioural,3.0.4,59.97046275834233,
7,Calvin said nothing as he grabbed his bag and walked down the concourse.,3,2,None,,,,0,7,7,7,,,,,0,13,13,13,,,,,,,,,,,,,,,,,,,,,,,,,,,,,,,,,,,1,4.287295754998922,,,,,,,,,,,,,,,,,,,,,,,,,,,,070219_p1,001,2019_Jul_02_0951,body_behavioural,3.0.4,59.97046275834233,
7,Jessie trailed behind him as they hurried their way quickly toward gate A28.,3,2,None,,,,0,7,7,7,,,,,0,14,14,14,,,,,,,,,,,,,,,,,,,,,,,,,,,,,,,,,,,1,4.369929195032455,,,,,,,,,,,,,,,,,,,,,,,,,,,,070219_p1,001,2019_Jul_02_0951,body_behavioural,3.0.4,59.97046275834233,
7,“So now you have nothing to say?” Jessie said. ,3,2,None,,,,0,7,7,7,,,,,0,15,15,15,,,,,,,,,,,,,,,,,,,,,,,,,,,,,,,,,,,1,1.3507934480439872,,,,,,,,,,,,,,,,,,,,,,,,,,,,070219_p1,001,2019_Jul_02_0951,body_behavioural,3.0.4,59.97046275834233,
7,"Calvin didn't answer, gritting his teeth and staring straight ahead. ",3,2,None,,,,0,7,7,7,,,,,0,16,16,16,,,,,,,,,,,,,,,,,,,,,,,,,,,,,,,,,,,1,3.670672421983909,,,,,,,,,,,,,,,,,,,,,,,,,,,,070219_p1,001,2019_Jul_02_0951,body_behavioural,3.0.4,59.97046275834233,
7,"He was very frustrated that he felt he had been trying to appease Jessie for the entirety of the vacation, and it seemed to be completed unappreciated. ",3,2,None,,,,0,7,7,7,,,,,0,17,17,17,,,,,,,,,,,,,,,,,,,,,,,,,,,,,,,,,,,1,6.220680681988597,,,,,,,,,,,,,,,,,,,,,,,,,,,,070219_p1,001,2019_Jul_02_0951,body_behavioural,3.0.4,59.97046275834233,
7,"Their silence was punctuated only by the rapid, rhythmic clacking of their suitcase wheels over the tile floor as they continued power-walking through the terminal. ",3,2,None,,,,0,7,7,7,,,,,0,18,18,18,,,,,,,,,,,,,,,,,,,,,,,,,,,,,,,,,,,1,6.203474113019183,,,,,,,,,,,,,,,,,,,,,,,,,,,,070219_p1,001,2019_Jul_02_0951,body_behavioural,3.0.4,59.97046275834233,
7,"Calvin finally turned to address her as they continued walking: “Jessie, this makes perfect sense. ",3,3,None,,,,0,7,7,7,,,,,0,19,19,19,,,,,,,,,,,,,,,,,,,,,,,,,,,,,,,,,,,1,2.403170739999041,,,,,,,,,,,,,,,,,,,,,,,,,,,,070219_p1,001,2019_Jul_02_0951,body_behavioural,3.0.4,59.97046275834233,
