count,storyText,locationEvent,socialEvent,story,locationEventSize,socialEventSize,instructText,trials.thisRepN,trials.thisTrialN,trials.thisN,trials.thisIndex,trials_7.thisRepN,trials_7.thisTrialN,trials_7.thisN,trials_7.thisIndex,trials_2.thisRepN,trials_2.thisTrialN,trials_2.thisN,trials_2.thisIndex,trials_3.thisRepN,trials_3.thisTrialN,trials_3.thisN,trials_3.thisIndex,trials_4.thisRepN,trials_4.thisTrialN,trials_4.thisN,trials_4.thisIndex,trials_5.thisRepN,trials_5.thisTrialN,trials_5.thisN,trials_5.thisIndex,trials_6.thisRepN,trials_6.thisTrialN,trials_6.thisN,trials_6.thisIndex,trials_8.thisRepN,trials_8.thisTrialN,trials_8.thisN,trials_8.thisIndex,order of stories,order of perspectives,participant 2 order - stories,participant 2 order  - schemas types,key_resp_8.keys,key_resp_8.rt,key_resp_5.keys,key_resp_5.rt,key_resp_7.keys,key_resp_7.rt,key_resp_15.keys,key_resp_15.rt,key_resp_14.keys,key_resp_14.rt,story_presses.keys,story_presses.rt,story time,key_resp_6.keys,key_resp_6.rt,key_resp_2.keys,key_resp_2.rt,key_resp_10.keys,key_resp_10.rt,recall,recall time,key_resp_12.keys,key_resp_12.rt,key_resp_3.keys,key_resp_3.rt,key_resp_11.keys,key_resp_11.rt,question1_answer,order of question,question2_answer,question3_answer,question4_answer,question5_answer,question6_answer,question7_answer,question8_answer,questions time,key_resp_13.keys,key_resp_13.rt,participant,session,date,expName,psychopyVersion,frameRate,
0,,,,,,,,0,0,0,0,0,0,0,0,,,,,,,,,,,,,,,,,,,,,,,,,[43 34 24 21 13 42 31 12 22 44 14 33 11 41 23 32],"['Location' 'Location' 'Social' 'Location' 'Social' 'Social' 'Social'
 'Location' 'Location' 'Location' 'Social' 'Location' 'Location' 'Social'
 'Social' 'Social']",[22 44 14 33 11 41 23 32],"['Location' 'Location' 'Social' 'Location' 'Location' 'Social' 'Social'
 'Social']",space,16.334994180011563,space,1.369314777024556,space,2.036568845040165,,,,,,,,,,,,,,,,,,,,,,,,,,,,,,,,,,070219_p1,001,2019_Jul_02_0951,body_behavioural,3.0.4,59.97046275834233,
0,"Carina and Simon, both distracted in thought, nearly ran into each other as they walked into the grocery store. ",1,1,43.0,,,,0,0,0,0,,,,,0,0,0,0,,,,,,,,,,,,,,,,,,,,,,,,,,,,,,,space,1.6197472710045986,space,2.587214074039366,9,16.25446050101891,,,,,,,,,,,,,,,,,,,,,,,,,,,,070219_p1,001,2019_Jul_02_0951,body_behavioural,3.0.4,59.97046275834233,
0,She almost dropped the keys she was holding. ,1,1,None,,,,0,0,0,0,,,,,0,1,1,1,,,,,,,,,,,,,,,,,,,,,,,,,,,,,,,,,,,1,3.186009467986878,,,,,,,,,,,,,,,,,,,,,,,,,,,,070219_p1,001,2019_Jul_02_0951,body_behavioural,3.0.4,59.97046275834233,
0,"The store they had entered looked like a warehouse, with high, black ceilings, industrial lights, and large packages of food. ",1,1,None,,,,0,0,0,0,,,,,0,2,2,2,,,,,,,,,,,,,,,,,,,,,,,,,,,,,,,,,,,9,18.30182996497024,,,,,,,,,,,,,,,,,,,,,,,,,,,,070219_p1,001,2019_Jul_02_0951,body_behavioural,3.0.4,59.97046275834233,
0,"In the meat section, Carina and Simon were looking over the same cuts of meat, because they were both preparing for barbecues.",2,1,None,,,,0,0,0,0,,,,,0,3,3,3,,,,,,,,,,,,,,,,,,,,,,,,,,,,,,,,,,,1,5.55334322003182,,,,,,,,,,,,,,,,,,,,,,,,,,,,070219_p1,001,2019_Jul_02_0951,body_behavioural,3.0.4,59.97046275834233,
0,"Simon had wanted to talk to Carina, and Carina had wanted to say something to Simon, but they felt embarrassed striking up a conversation with a stranger.",2,1,None,,,,0,0,0,0,,,,,0,4,4,4,,,,,,,,,,,,,,,,,,,,,,,,,,,,,,,,,,,1,8.202980951988138,,,,,,,,,,,,,,,,,,,,,,,,,,,,070219_p1,001,2019_Jul_02_0951,body_behavioural,3.0.4,59.97046275834233,
0,"Carina mustered the courage, turned to Simon and, pointing at a Cornish hen, asked, “Isn’t this meat cute?”",2,2,None,,,,0,0,0,0,,,,,0,5,5,5,,,,,,,,,,,,,,,,,,,,,,,,,,,,,,,,,,,1,5.3533113049925305,,,,,,,,,,,,,,,,,,,,,,,,,,,,070219_p1,001,2019_Jul_02_0951,body_behavioural,3.0.4,59.97046275834233,
0,"He laughed, and said, “It is very cute.",2,2,None,,,,0,0,0,0,,,,,0,6,6,6,,,,,,,,,,,,,,,,,,,,,,,,,,,,,,,,,,,1,1.419915027974639,,,,,,,,,,,,,,,,,,,,,,,,,,,,070219_p1,001,2019_Jul_02_0951,body_behavioural,3.0.4,59.97046275834233,
0,"Probably the younger brother of this guy,” and he picked up a regular-sized chicken.",2,2,None,,,,0,0,0,0,,,,,0,7,7,7,,,,,,,,,,,,,,,,,,,,,,,,,,,,,,,,,,,1,3.6532854299875908,,,,,,,,,,,,,,,,,,,,,,,,,,,,070219_p1,001,2019_Jul_02_0951,body_behavioural,3.0.4,59.97046275834233,
0,"“Unlucky family,” she responded as she shook her head. ",2,2,None,,,,0,0,0,0,,,,,0,8,8,8,,,,,,,,,,,,,,,,,,,,,,,,,,,,,,,,,,,1,2.0365022600162774,,,,,,,,,,,,,,,,,,,,,,,,,,,,070219_p1,001,2019_Jul_02_0951,body_behavioural,3.0.4,59.97046275834233,
0,They chatted as they picked out a few last-minute groceries.,2,2,None,,,,0,0,0,0,,,,,0,9,9,9,,,,,,,,,,,,,,,,,,,,,,,,,,,,,,,,,,,1,2.434742279991042,,,,,,,,,,,,,,,,,,,,,,,,,,,,070219_p1,001,2019_Jul_02_0951,body_behavioural,3.0.4,59.97046275834233,
0,"Simon helped Carina select the best ribs and his personal favorite barbecue sauce, and she helped him choose red peppers and spices for a vegetable kabob she recommended.",2,2,None,,,,0,0,0,0,,,,,0,10,10,10,,,,,,,,,,,,,,,,,,,,,,,,,,,,,,,,,,,1,4.770109275006689,,,,,,,,,,,,,,,,,,,,,,,,,,,,070219_p1,001,2019_Jul_02_0951,body_behavioural,3.0.4,59.97046275834233,
0,"In the checkout area, there were three lines open, and they went to the one labeled “8.”",3,2,None,,,,0,0,0,0,,,,,0,11,11,11,,,,,,,,,,,,,,,,,,,,,,,,,,,,,,,,,,,9,7.853354342048988,,,,,,,,,,,,,,,,,,,,,,,,,,,,070219_p1,001,2019_Jul_02_0951,body_behavioural,3.0.4,59.97046275834233,
0,"Carina and Simon made jokes about the magazine covers while waiting in line, and they were laughing so hard their stomachs hurt. ",3,2,None,,,,0,0,0,0,,,,,0,12,12,12,,,,,,,,,,,,,,,,,,,,,,,,,,,,,,,,,,,1,4.886779708031099,,,,,,,,,,,,,,,,,,,,,,,,,,,,070219_p1,001,2019_Jul_02_0951,body_behavioural,3.0.4,59.97046275834233,
0,"Simon turned to face Carina and, while looking at her straight in the eyes, asked, “Would you like to go out to dinner with me?",3,3,None,,,,0,0,0,0,,,,,0,13,13,13,,,,,,,,,,,,,,,,,,,,,,,,,,,,,,,,,,,1,5.119881233025808,,,,,,,,,,,,,,,,,,,,,,,,,,,,070219_p1,001,2019_Jul_02_0951,body_behavioural,3.0.4,59.97046275834233,
0,Next Saturday we could tour around Harvard Square and get something to eat.,3,3,None,,,,0,0,0,0,,,,,0,14,14,14,,,,,,,,,,,,,,,,,,,,,,,,,,,,,,,,,,,1,3.7175005699973553,,,,,,,,,,,,,,,,,,,,,,,,,,,,070219_p1,001,2019_Jul_02_0951,body_behavioural,3.0.4,59.97046275834233,
0,"There are a lot of great places around there, and it’s really nice during the summer.”",3,3,None,,,,0,0,0,0,,,,,0,15,15,15,,,,,,,,,,,,,,,,,,,,,,,,,,,,,,,,,,,1,2.7870017269742675,,,,,,,,,,,,,,,,,,,,,,,,,,,,070219_p1,001,2019_Jul_02_0951,body_behavioural,3.0.4,59.97046275834233,
0,"Carina smiled, “I’d love to.",3,3,None,,,,0,0,0,0,,,,,0,16,16,16,,,,,,,,,,,,,,,,,,,,,,,,,,,,,,,,,,,1,2.2696755170472898,,,,,,,,,,,,,,,,,,,,,,,,,,,,070219_p1,001,2019_Jul_02_0951,body_behavioural,3.0.4,59.97046275834233,
0,That sounds great!”,3,3,None,,,,0,0,0,0,,,,,0,17,17,17,,,,,,,,,,,,,,,,,,,,,,,,,,,,,,,,,,,1,1.1028906829888,,,,,,,,,,,,,,,,,,,,,,,,,,,,070219_p1,001,2019_Jul_02_0951,body_behavioural,3.0.4,59.97046275834233,
0,The cashier scanned Carina’s groceries.,4,3,None,,,,0,0,0,0,,,,,0,18,18,18,,,,,,,,,,,,,,,,,,,,,,,,,,,,,,,,,,,9,2.069809674983844,,,,,,,,,,,,,,,,,,,,,,,,,,,,070219_p1,001,2019_Jul_02_0951,body_behavioural,3.0.4,59.97046275834233,
0,"Simon lifted up the divider on the conveyor belt and said to the cashier, “Actually, these are together.",4,3,None,,,,0,0,0,0,,,,,0,19,19,19,,,,,,,,,,,,,,,,,,,,,,,,,,,,,,,,,,,1,5.486670777958352,,,,,,,,,,,,,,,,,,,,,,,,,,,,070219_p1,001,2019_Jul_02_0951,body_behavioural,3.0.4,59.97046275834233,
0,"Carina, I’ve got it.",4,3,None,,,,0,0,0,0,,,,,0,20,20,20,,,,,,,,,,,,,,,,,,,,,,,,,,,,,,,,,,,1,2.286470563034527,,,,,,,,,,,,,,,,,,,,,,,,,,,,070219_p1,001,2019_Jul_02_0951,body_behavioural,3.0.4,59.97046275834233,
0,This was kind-of a date today.”,4,3,None,,,,0,0,0,0,,,,,0,21,21,21,,,,,,,,,,,,,,,,,,,,,,,,,,,,,,,,,,,1,2.003106999967713,,,,,,,,,,,,,,,,,,,,,,,,,,,,070219_p1,001,2019_Jul_02_0951,body_behavioural,3.0.4,59.97046275834233,
0,Carina blushed and laughed; she thought this was ridiculous but also very sweet. ,4,3,None,,,,0,0,0,0,,,,,0,22,22,22,,,,,,,,,,,,,,,,,,,,,,,,,,,,,,,,,,,1,3.8042406890308484,,,,,,,,,,,,,,,,,,,,,,,,,,,,070219_p1,001,2019_Jul_02_0951,body_behavioural,3.0.4,59.97046275834233,
0,"The cashier rolled her eyes when they weren’t looking, and she scanned the rest of his items. ",4,3,None,,,,0,0,0,0,,,,,0,23,23,23,,,,,,,,,,,,,,,,,,,,,,,,,,,,,,,,,,,1,3.569783274026122,,,,,,,,,,,,,,,,,,,,,,,,,,,,070219_p1,001,2019_Jul_02_0951,body_behavioural,3.0.4,59.97046275834233,
0,"The total came to $52, and he paid with his credit card.",4,3,None,,,,0,0,0,0,,,,,0,24,24,24,,,,,,,,,,,,,,,,,,,,,,,,,,,,,,,,,,,1,2.053109458007384,,,,,,,,,,,,,,,,,,,,,,,,,,,,070219_p1,001,2019_Jul_02_0951,body_behavioural,3.0.4,59.97046275834233,
0,"Seeing that it was 4:30 PM on her phone, Carina gasped because she realized she was late for her own barbecue. ",4,4,None,,,,0,0,0,0,,,,,0,25,25,25,,,,,,,,,,,,,,,,,,,,,,,,,,,,,,,,,,,9,5.7363605329883285,,,,,,,,,,,,,,,,,,,,,,,,,,,,070219_p1,001,2019_Jul_02_0951,body_behavioural,3.0.4,59.97046275834233,
0,Carina thanked Simon and took her groceries and ran. ,4,4,None,,,,0,0,0,0,,,,,0,26,26,26,,,,,,,,,,,,,,,,,,,,,,,,,,,,,,,,,,,1,2.052794062998146,,,,,,,,,,,,,,,,,,,,,,,,,,,,070219_p1,001,2019_Jul_02_0951,body_behavioural,3.0.4,59.97046275834233,
0,"“I hope her guests aren’t hungry,” the cashier remarked.",4,4,None,,,,0,0,0,0,,,,,0,27,27,27,,,,,,,,,,,,,,,,,,,,,,,,,,,,,,,,,,,1,5.851032476988621,,,,,,,,,,,,,,,,,,,,,,,,,,,,070219_p1,001,2019_Jul_02_0951,body_behavioural,3.0.4,59.97046275834233,
0,Simon was thoroughly charmed and barely heard the comment as he watched her go. ,4,4,None,,,,0,0,0,0,,,,,0,28,28,28,,,,,,,,,,,,,,,,,,,,,,,,,,,,,,,,,,,1,4.419747948006261,,,,,,,,,,,,,,,,,,,,,,,,,,,,070219_p1,001,2019_Jul_02_0951,body_behavioural,3.0.4,59.97046275834233,
0,,,,,,,,0,0,0,0,,,,,,,,,,,,,,,,,,,,,,,,,,,,,,,,,,,,,,,,,,,,,,,,,,,,,,,,,,,,,,,,,,,,,,,,070219_p1,001,2019_Jul_02_0951,body_behavioural,3.0.4,59.97046275834233,
1,,,,,,,,0,1,1,1,0,0,0,0,,,,,,,,,,,,,,,,,,,,,,,,,,,,,space,1.9363942730124108,space,2.6697314030025154,space,0.8339913269737735,,,,,,,,,,,,,,,,,,,,,,,,,,,,,,,,,,070219_p1,001,2019_Jul_02_0951,body_behavioural,3.0.4,59.97046275834233,
1,"Charlie saw Alma as they walked into class, and he motioned for her to come sit in the back next to him because they had a deal to discuss.",1,1,34.0,,,,0,1,1,1,,,,,0,0,0,0,,,,,,,,,,,,,,,,,,,,,,,,,,,,,,,space,1.3191352300345898,space,1.0696423629997298,9,12.703858121996745,,,,,,,,,,,,,,,,,,,,,,,,,,,,070219_p1,001,2019_Jul_02_0951,body_behavioural,3.0.4,59.97046275834233,
1,Charlie and Alma were both history majors with entrepreneurial bents.,1,1,None,,,,0,1,1,1,,,,,0,1,1,1,,,,,,,,,,,,,,,,,,,,,,,,,,,,,,,,,,,9,5.603440253005829,,,,,,,,,,,,,,,,,,,,,,,,,,,,070219_p1,001,2019_Jul_02_0951,body_behavioural,3.0.4,59.97046275834233,
1,They were also both very busy and happened to be in the same class.,1,1,None,,,,0,1,1,1,,,,,0,2,2,2,,,,,,,,,,,,,,,,,,,,,,,,,,,,,,,,,,,1,5.570176981971599,,,,,,,,,,,,,,,,,,,,,,,,,,,,070219_p1,001,2019_Jul_02_0951,body_behavioural,3.0.4,59.97046275834233,
1,"After talking at a party, Charlie had discovered that Alma was looking for financing for her web development company of which she was the founder and CEO.",1,1,None,,,,0,1,1,1,,,,,0,3,3,3,,,,,,,,,,,,,,,,,,,,,,,,,,,,,,,,,,,1,7.066450642014388,,,,,,,,,,,,,,,,,,,,,,,,,,,,070219_p1,001,2019_Jul_02_0951,body_behavioural,3.0.4,59.97046275834233,
1,"It was serendipitous because he was an investment analyst for a student finance group on campus, and he had just been talking with other members of the group about making a new investment. ",1,1,None,,,,0,1,1,1,,,,,0,4,4,4,,,,,,,,,,,,,,,,,,,,,,,,,,,,,,,,,,,1,2.902796968992334,,,,,,,,,,,,,,,,,,,,,,,,,,,,070219_p1,001,2019_Jul_02_0951,body_behavioural,3.0.4,59.97046275834233,
1,"His financial group had come to a decision that morning about Alma’s startup, and he didn't want to wait until after class to discuss the proposal with her. ",1,1,None,,,,0,1,1,1,,,,,0,5,5,5,,,,,,,,,,,,,,,,,,,,,,,,,,,,,,,,,,,1,2.6864688000059687,,,,,,,,,,,,,,,,,,,,,,,,,,,,070219_p1,001,2019_Jul_02_0951,body_behavioural,3.0.4,59.97046275834233,
1,The class was in a medium-sized auditorium which was brightly lit and very modern-looking. ,1,1,None,,,,0,1,1,1,,,,,0,6,6,6,,,,,,,,,,,,,,,,,,,,,,,,,,,,,,,,,,,9,1.8865310460096225,,,,,,,,,,,,,,,,,,,,,,,,,,,,070219_p1,001,2019_Jul_02_0951,body_behavioural,3.0.4,59.97046275834233,
1,There were three projector screens in the front and each row of the audience which had a table with power outlets and USB ports. ,1,1,None,,,,0,1,1,1,,,,,0,7,7,7,,,,,,,,,,,,,,,,,,,,,,,,,,,,,,,,,,,1,1.552448940987233,,,,,,,,,,,,,,,,,,,,,,,,,,,,070219_p1,001,2019_Jul_02_0951,body_behavioural,3.0.4,59.97046275834233,
1,"“Here we are at Lecture Seven of Archaeology of Rome,” said the professor. ",2,1,None,,,,0,1,1,1,,,,,0,8,8,8,,,,,,,,,,,,,,,,,,,,,,,,,,,,,,,,,,,1,2.2529243630124256,,,,,,,,,,,,,,,,,,,,,,,,,,,,070219_p1,001,2019_Jul_02_0951,body_behavioural,3.0.4,59.97046275834233,
1,"“The topic for today is Augustus, an incredibly important influence in Roman architecture.” ",2,1,None,,,,0,1,1,1,,,,,0,9,9,9,,,,,,,,,,,,,,,,,,,,,,,,,,,,,,,,,,,1,1.0027998890145682,,,,,,,,,,,,,,,,,,,,,,,,,,,,070219_p1,001,2019_Jul_02_0951,body_behavioural,3.0.4,59.97046275834233,
1,She went into some recap of the last lecture.,2,1,None,,,,0,1,1,1,,,,,0,10,10,10,,,,,,,,,,,,,,,,,,,,,,,,,,,,,,,,,,,1,1.4030264060129412,,,,,,,,,,,,,,,,,,,,,,,,,,,,070219_p1,001,2019_Jul_02_0951,body_behavioural,3.0.4,59.97046275834233,
1,"Charlie turned to Alma and said, “Okay, so I’ve been thinking about your startup, and I have talked about it with my fellow investors.",2,2,None,,,,0,1,1,1,,,,,0,11,11,11,,,,,,,,,,,,,,,,,,,,,,,,,,,,,,,,,,,9,3.753749521973077,,,,,,,,,,,,,,,,,,,,,,,,,,,,070219_p1,001,2019_Jul_02_0951,body_behavioural,3.0.4,59.97046275834233,
1,We’d like to invest half of what you originally suggested.,2,2,None,,,,0,1,1,1,,,,,0,12,12,12,,,,,,,,,,,,,,,,,,,,,,,,,,,,,,,,,,,1,2.4691210300079547,,,,,,,,,,,,,,,,,,,,,,,,,,,,070219_p1,001,2019_Jul_02_0951,body_behavioural,3.0.4,59.97046275834233,
1,"So we propose we start with wiring you $28,000.",2,2,None,,,,0,1,1,1,,,,,0,13,13,13,,,,,,,,,,,,,,,,,,,,,,,,,,,,,,,,,,,1,1.1529986570239998,,,,,,,,,,,,,,,,,,,,,,,,,,,,070219_p1,001,2019_Jul_02_0951,body_behavioural,3.0.4,59.97046275834233,
1,We would see how the company does and then invest the other half.” ,2,2,None,,,,0,1,1,1,,,,,0,14,14,14,,,,,,,,,,,,,,,,,,,,,,,,,,,,,,,,,,,1,1.9031523650046438,,,,,,,,,,,,,,,,,,,,,,,,,,,,070219_p1,001,2019_Jul_02_0951,body_behavioural,3.0.4,59.97046275834233,
1,"The professor said, “The senate had conferred upon him the title of Augustus, the sacred and revered one, the restorer of traditional values, the city’s new religious leader, the restorer of temples. ",3,2,None,,,,0,1,1,1,,,,,0,15,15,15,,,,,,,,,,,,,,,,,,,,,,,,,,,,,,,,,,,9,1.9005844200146385,,,,,,,,,,,,,,,,,,,,,,,,,,,,070219_p1,001,2019_Jul_02_0951,body_behavioural,3.0.4,59.97046275834233,
1,"Augustus also sought to beautify Rome, make it into a new Athens, and dispel the criticisms of Rome as disorganized and ugly.”",3,2,None,,,,0,1,1,1,,,,,0,16,16,16,,,,,,,,,,,,,,,,,,,,,,,,,,,,,,,,,,,1,2.6028035290073603,,,,,,,,,,,,,,,,,,,,,,,,,,,,070219_p1,001,2019_Jul_02_0951,body_behavioural,3.0.4,59.97046275834233,
1,"Alma turned to Charlie and offered her rebuttal, “I don’t know about that.",3,3,None,,,,0,1,1,1,,,,,0,17,17,17,,,,,,,,,,,,,,,,,,,,,,,,,,,,,,,,,,,9,3.8692828649654984,,,,,,,,,,,,,,,,,,,,,,,,,,,,070219_p1,001,2019_Jul_02_0951,body_behavioural,3.0.4,59.97046275834233,
1,It’s not going to be possible to implement our ideas effectively unless the project is fully funded. ,3,3,None,,,,0,1,1,1,,,,,0,18,18,18,,,,,,,,,,,,,,,,,,,,,,,,,,,,,,,,,,,1,2.603192713984754,,,,,,,,,,,,,,,,,,,,,,,,,,,,070219_p1,001,2019_Jul_02_0951,body_behavioural,3.0.4,59.97046275834233,
1,"We would have to find other investors like your competitor on campus, Churchill Capital Group, and that would set us back in our timeline. ",3,3,None,,,,0,1,1,1,,,,,0,19,19,19,,,,,,,,,,,,,,,,,,,,,,,,,,,,,,,,,,,1,1.2861536569544114,,,,,,,,,,,,,,,,,,,,,,,,,,,,070219_p1,001,2019_Jul_02_0951,body_behavioural,3.0.4,59.97046275834233,
1,"Our profit projections assumed we'd be starting relatively soon, not months down the line.” ",3,3,None,,,,0,1,1,1,,,,,0,20,20,20,,,,,,,,,,,,,,,,,,,,,,,,,,,,,,,,,,,1,1.0529616679996252,,,,,,,,,,,,,,,,,,,,,,,,,,,,070219_p1,001,2019_Jul_02_0951,body_behavioural,3.0.4,59.97046275834233,
1,They whispered back and forth during the entire class working out a compromise. ,3,3,None,,,,0,1,1,1,,,,,0,21,21,21,,,,,,,,,,,,,,,,,,,,,,,,,,,,,,,,,,,1,1.3193269009934738,,,,,,,,,,,,,,,,,,,,,,,,,,,,070219_p1,001,2019_Jul_02_0951,body_behavioural,3.0.4,59.97046275834233,
1,The professor dismissed the students with a reminder that the midterm paper was due on Thursday and that they should email their papers to the TA.,4,3,None,,,,0,1,1,1,,,,,0,22,22,22,,,,,,,,,,,,,,,,,,,,,,,,,,,,,,,,,,,9,3.253205219982192,,,,,,,,,,,,,,,,,,,,,,,,,,,,070219_p1,001,2019_Jul_02_0951,body_behavioural,3.0.4,59.97046275834233,
1,"Everyone, except Charlie and Alma, packed up their things and headed out of the lecture hall. ",4,3,None,,,,0,1,1,1,,,,,0,23,23,23,,,,,,,,,,,,,,,,,,,,,,,,,,,,,,,,,,,1,3.5869745049858466,,,,,,,,,,,,,,,,,,,,,,,,,,,,070219_p1,001,2019_Jul_02_0951,body_behavioural,3.0.4,59.97046275834233,
1,"“Alright, so we’ll have the $30,000 wired to you by tomorrow,” Charlie said. ",4,4,None,,,,0,1,1,1,,,,,0,24,24,24,,,,,,,,,,,,,,,,,,,,,,,,,,,,,,,,,,,1,1.7844395430292934,,,,,,,,,,,,,,,,,,,,,,,,,,,,070219_p1,001,2019_Jul_02_0951,body_behavioural,3.0.4,59.97046275834233,
1,"This wasn't ideal for Charlie, but Alma had refused to budge, and his investment group had told him they were willing to pay the full amount if necessary. ",4,4,None,,,,0,1,1,1,,,,,0,25,25,25,,,,,,,,,,,,,,,,,,,,,,,,,,,,,,,,,,,1,2.7528237840160728,,,,,,,,,,,,,,,,,,,,,,,,,,,,070219_p1,001,2019_Jul_02_0951,body_behavioural,3.0.4,59.97046275834233,
1,They got up and hugged in confirmation of the deal and made plans to sign the official paperwork the next day. ,4,4,None,,,,0,1,1,1,,,,,0,26,26,26,,,,,,,,,,,,,,,,,,,,,,,,,,,,,,,,,,,1,3.720423760008998,,,,,,,,,,,,,,,,,,,,,,,,,,,,070219_p1,001,2019_Jul_02_0951,body_behavioural,3.0.4,59.97046275834233,
1,,,,,,,,0,1,1,1,,,,,,,,,,,,,,,,,,,,,,,,,,,,,,,,,,,,,,,,,,,,,,,,,,,,,,,,,,,,,,,,,,,,,,,,070219_p1,001,2019_Jul_02_0951,body_behavioural,3.0.4,59.97046275834233,
2,,,,,,,,0,2,2,2,0,0,0,0,,,,,,,,,,,,,,,,,,,,,,,,,,,,,space,1.0177143369801342,space,0.8527979470090941,space,0.5692649350385182,,,,,,,,,,,,,,,,,,,,,,,,,,,,,,,,,,070219_p1,001,2019_Jul_02_0951,body_behavioural,3.0.4,59.97046275834233,
2,"Lana walked into lecture holding hands with her boyfriend, Aaron, who was trying to contain his excitement about proposing to Lana in this class.",1,1,24.0,,,,0,2,2,2,,,,,0,0,0,0,,,,,,,,,,,,,,,,,,,,,,,,,,,,,,,space,1.2364429079461843,space,0.8858712560031563,9,1.5373325970140286,,,,,,,,,,,,,,,,,,,,,,,,,,,,070219_p1,001,2019_Jul_02_0951,body_behavioural,3.0.4,59.97046275834233,
2,"Lana was lost in thought, puzzling over an integral on her problem set for another class.",1,1,None,,,,0,2,2,2,,,,,0,1,1,1,,,,,,,,,,,,,,,,,,,,,,,,,,,,,,,,,,,1,2.6698385479976423,,,,,,,,,,,,,,,,,,,,,,,,,,,,070219_p1,001,2019_Jul_02_0951,body_behavioural,3.0.4,59.97046275834233,
2,"The lecture hall they had entered was the fanciest one at Princeton, with chandeliers, high ceilings, wood floors, and a large projector screen where chalkboards used to be. ",1,1,None,,,,0,2,2,2,,,,,0,2,2,2,,,,,,,,,,,,,,,,,,,,,,,,,,,,,,,,,,,1,7.33750671002781,,,,,,,,,,,,,,,,,,,,,,,,,,,,070219_p1,001,2019_Jul_02_0951,body_behavioural,3.0.4,59.97046275834233,
2,Aaron and Lana had met when they first started dating three years ago in freshman year.,1,1,None,,,,0,2,2,2,,,,,0,3,3,3,,,,,,,,,,,,,,,,,,,,,,,,,,,,,,,,,,,9,2.28704176802421,,,,,,,,,,,,,,,,,,,,,,,,,,,,070219_p1,001,2019_Jul_02_0951,body_behavioural,3.0.4,59.97046275834233,
2,They coincidentally had another class together in this same lecture hall. ,1,1,None,,,,0,2,2,2,,,,,0,4,4,4,,,,,,,,,,,,,,,,,,,,,,,,,,,,,,,,,,,1,2.019821038004011,,,,,,,,,,,,,,,,,,,,,,,,,,,,070219_p1,001,2019_Jul_02_0951,body_behavioural,3.0.4,59.97046275834233,
2,The professor caught Aaron's eye as he walked up to the front of the classroom and gave him a wink before the lecture began. ,1,1,None,,,,0,2,2,2,,,,,0,5,5,5,,,,,,,,,,,,,,,,,,,,,,,,,,,,,,,,,,,1,8.083871434966568,,,,,,,,,,,,,,,,,,,,,,,,,,,,070219_p1,001,2019_Jul_02_0951,body_behavioural,3.0.4,59.97046275834233,
2,Aaron flashed him a half-smile and nodded. ,1,1,None,,,,0,2,2,2,,,,,0,6,6,6,,,,,,,,,,,,,,,,,,,,,,,,,,,,,,,,,,,1,1.5704713580198586,,,,,,,,,,,,,,,,,,,,,,,,,,,,070219_p1,001,2019_Jul_02_0951,body_behavioural,3.0.4,59.97046275834233,
2,"The professor cleared his throat and said,“Alright, good afternoon, everyone!",2,1,None,,,,0,2,2,2,,,,,0,7,7,7,,,,,,,,,,,,,,,,,,,,,,,,,,,,,,,,,,,1,2.3027640420477837,,,,,,,,,,,,,,,,,,,,,,,,,,,,070219_p1,001,2019_Jul_02_0951,body_behavioural,3.0.4,59.97046275834233,
2,Welcome to another week of Introduction to Chemistry,2,1,None,,,,0,2,2,2,,,,,0,8,8,8,,,,,,,,,,,,,,,,,,,,,,,,,,,,,,,,,,,1,1.636958888033405,,,,,,,,,,,,,,,,,,,,,,,,,,,,070219_p1,001,2019_Jul_02_0951,body_behavioural,3.0.4,59.97046275834233,
2,This week the topic is ions.,2,1,None,,,,0,2,2,2,,,,,0,9,9,9,,,,,,,,,,,,,,,,,,,,,,,,,,,,,,,,,,,1,1.8530783919850364,,,,,,,,,,,,,,,,,,,,,,,,,,,,070219_p1,001,2019_Jul_02_0951,body_behavioural,3.0.4,59.97046275834233,
2,"Now, let me get my computer set up, and while I do that, does anyone want to tell me what makes elements definitionally distinct from one another.”",2,1,None,,,,0,2,2,2,,,,,0,10,10,10,,,,,,,,,,,,,,,,,,,,,,,,,,,,,,,,,,,1,4.303234789986163,,,,,,,,,,,,,,,,,,,,,,,,,,,,070219_p1,001,2019_Jul_02_0951,body_behavioural,3.0.4,59.97046275834233,
2,Lana pulled out the problem set she was thinking about as Aaron unzipped the small pocket in his backpack and pulled out the ring.,2,2,None,,,,0,2,2,2,,,,,0,11,11,11,,,,,,,,,,,,,,,,,,,,,,,,,,,,,,,,,,,1,10.62093128298875,,,,,,,,,,,,,,,,,,,,,,,,,,,,070219_p1,001,2019_Jul_02_0951,body_behavioural,3.0.4,59.97046275834233,
2,"Turning away from her, he looked it over yet again. ",2,2,None,,,,0,2,2,2,,,,,0,12,12,12,,,,,,,,,,,,,,,,,,,,,,,,,,,,,,,,,,,1,3.769879508006852,,,,,,,,,,,,,,,,,,,,,,,,,,,,070219_p1,001,2019_Jul_02_0951,body_behavioural,3.0.4,59.97046275834233,
2,"Instead of one large diamond, there were 5 red diamonds embedded in a thick band. ",2,2,None,,,,0,2,2,2,,,,,0,13,13,13,,,,,,,,,,,,,,,,,,,,,,,,,,,,,,,,,,,1,7.970860093017109,,,,,,,,,,,,,,,,,,,,,,,,,,,,070219_p1,001,2019_Jul_02_0951,body_behavioural,3.0.4,59.97046275834233,
2,He knew Lana would like this because her style was more avant-garde than traditional.,2,2,None,,,,0,2,2,2,,,,,0,14,14,14,,,,,,,,,,,,,,,,,,,,,,,,,,,,,,,,,,,1,4.869773996004369,,,,,,,,,,,,,,,,,,,,,,,,,,,,070219_p1,001,2019_Jul_02_0951,body_behavioural,3.0.4,59.97046275834233,
2,"The professor said, “Remember, class, that the number of protons determines the identity of the element. ",3,2,None,,,,0,2,2,2,,,,,0,15,15,15,,,,,,,,,,,,,,,,,,,,,,,,,,,,,,,,,,,9,2.636286709981505,,,,,,,,,,,,,,,,,,,,,,,,,,,,070219_p1,001,2019_Jul_02_0951,body_behavioural,3.0.4,59.97046275834233,
2,"So for example, all atoms of sodium have 11 protons in the nucleus. ",3,2,None,,,,0,2,2,2,,,,,0,16,16,16,,,,,,,,,,,,,,,,,,,,,,,,,,,,,,,,,,,1,1.4862451680237427,,,,,,,,,,,,,,,,,,,,,,,,,,,,070219_p1,001,2019_Jul_02_0951,body_behavioural,3.0.4,59.97046275834233,
2,"And if you look on the periodic table, the atomic number for sodium, the symbol is Na, is eleven.",3,2,None,,,,0,2,2,2,,,,,0,17,17,17,,,,,,,,,,,,,,,,,,,,,,,,,,,,,,,,,,,1,2.0365848979563452,,,,,,,,,,,,,,,,,,,,,,,,,,,,070219_p1,001,2019_Jul_02_0951,body_behavioural,3.0.4,59.97046275834233,
2,"An ion retains the same number of protons despite losing electrons, and therefore keeps the same identity in the periodic table. ",3,2,None,,,,0,2,2,2,,,,,0,18,18,18,,,,,,,,,,,,,,,,,,,,,,,,,,,,,,,,,,,1,0.6530895779724233,,,,,,,,,,,,,,,,,,,,,,,,,,,,070219_p1,001,2019_Jul_02_0951,body_behavioural,3.0.4,59.97046275834233,
2,Lana and Aaron tried to take notes during the lecture.,3,2,None,,,,0,2,2,2,,,,,0,19,19,19,,,,,,,,,,,,,,,,,,,,,,,,,,,,,,,,,,,1,8.853633382997941,,,,,,,,,,,,,,,,,,,,,,,,,,,,070219_p1,001,2019_Jul_02_0951,body_behavioural,3.0.4,59.97046275834233,
2,"Right after talking about how two ions bond into one stable molecule by covalent bonds, the professor stopped the lecture, gave another wink to Aaron, and asked Lana to come to the front of the class to do a demonstration. ",3,3,None,,,,0,2,2,2,,,,,0,20,20,20,,,,,,,,,,,,,,,,,,,,,,,,,,,,,,,,,,,9,12.437802840024233,,,,,,,,,,,,,,,,,,,,,,,,,,,,070219_p1,001,2019_Jul_02_0951,body_behavioural,3.0.4,59.97046275834233,
2,"She walked to the front of the class confused, and the professor asked her to stand in the middle of the stage.",3,3,None,,,,0,2,2,2,,,,,0,21,21,21,,,,,,,,,,,,,,,,,,,,,,,,,,,,,,,,,,,1,5.569964160036761,,,,,,,,,,,,,,,,,,,,,,,,,,,,070219_p1,001,2019_Jul_02_0951,body_behavioural,3.0.4,59.97046275834233,
2,"Then Aaron walked up and, taking Lana’s hand, got down on one knee. ",3,3,None,,,,0,2,2,2,,,,,0,22,22,22,,,,,,,,,,,,,,,,,,,,,,,,,,,,,,,,,,,1,4.003276634961367,,,,,,,,,,,,,,,,,,,,,,,,,,,,070219_p1,001,2019_Jul_02_0951,body_behavioural,3.0.4,59.97046275834233,
