instruct_text,instruct_text2,rolePic,job,trials_2.thisRepN,trials_2.thisTrialN,trials_2.thisN,trials_2.thisIndex,trials_4.thisRepN,trials_4.thisTrialN,trials_4.thisN,trials_4.thisIndex,loop3.thisRepN,loop3.thisTrialN,loop3.thisN,loop3.thisIndex,trials_3.thisRepN,trials_3.thisTrialN,trials_3.thisN,trials_3.thisIndex,Q1,Q2,Q3,Q4,D1,D2,roleName,trials.thisRepN,trials.thisTrialN,trials.thisN,trials.thisIndex,key_resp_6.keys,key_resp_6.rt,key_resp_2.keys,key_resp_2.rt,key_resp_14.keys,key_resp_14.rt,key_resp_10.keys,key_resp_10.rt,key_resp_11.keys,key_resp_11.rt,key_resp_12.keys,key_resp_12.rt,key_resp_13.keys,key_resp_13.rt,key_resp_4.keys,key_resp_4.rt,participant,session,date,expName,frameRate,
Welcome to the Job Simulator Task!,(press the space bar to continue),,,0,0,0,0,,,,,,,,,,,,,,,,,,,,,,,,space,0.3185665450291708,,,,,,,,,,,,,,,,001,2018_Dec_13_1356,part1,59.970634983936634,
"In this task, you will read 16 stories.",None,,,0,1,1,1,,,,,,,,,,,,,,,,,,,,,,,,space,0.13490487297531217,,,,,,,,,,,,,,,,001,2018_Dec_13_1356,part1,59.970634983936634,
"Before each story you will be assigned a perspective of a particular career to assume while reading that story.
",None,,,0,2,2,2,,,,,,,,,,,,,,,,,,,,,,,,space,0.11787157400976866,,,,,,,,,,,,,,,,001,2018_Dec_13_1356,part1,59.970634983936634,
You should read the story according to the designated perspective.,None,,,0,3,3,3,,,,,,,,,,,,,,,,,,,,,,,,space,0.13423636299557984,,,,,,,,,,,,,,,,001,2018_Dec_13_1356,part1,59.970634983936634,
The perspectives are as follows:,None,,,0,4,4,4,,,,,,,,,,,,,,,,,,,,,,,,space,0.10062787099741399,,,,,,,,,,,,,,,,001,2018_Dec_13_1356,part1,59.970634983936634,
,,dean.jpg,Dean of Academic Studies,,,,,0,0,0,6,,,,,,,,,,,,,,,,,,,,,,space,0.05090448900591582,,,,,,,,,,,,,,001,2018_Dec_13_1356,part1,59.970634983936634,
,,gscem.jpg,"Grocery Store Customer Experience Manager
",,,,,0,1,1,5,,,,,,,,,,,,,,,,,,,,,,space,0.020454199984669685,,,,,,,,,,,,,,001,2018_Dec_13_1356,part1,59.970634983936634,
,,restaurant_critic.jpg,Restaurant Critic,,,,,0,2,2,1,,,,,,,,,,,,,,,,,,,,,,space,0.35177014500368387,,,,,,,,,,,,,,001,2018_Dec_13_1356,part1,59.970634983936634,
,,matchmaker.jpg,Matchmaker,,,,,0,3,3,2,,,,,,,,,,,,,,,,,,,,,,space,0.2851366300601512,,,,,,,,,,,,,,001,2018_Dec_13_1356,part1,59.970634983936634,
,,business_reporter.jpg,Business Reporter,,,,,0,4,4,0,,,,,,,,,,,,,,,,,,,,,,space,0.11925227497704327,,,,,,,,,,,,,,001,2018_Dec_13_1356,part1,59.970634983936634,
,,weddingplanner.jpg,Wedding Planner,,,,,0,5,5,3,,,,,,,,,,,,,,,,,,,,,,space,0.1185798019869253,,,,,,,,,,,,,,001,2018_Dec_13_1356,part1,59.970634983936634,
,,couples.jpeg,"Couples Therapist
",,,,,0,6,6,7,,,,,,,,,,,,,,,,,,,,,,space,0.1172086379956454,,,,,,,,,,,,,,001,2018_Dec_13_1356,part1,59.970634983936634,
,,acem.jpg,Airport Customer Experience Manager,,,,,0,7,7,4,,,,,,,,,,,,,,,,,,,,,,space,0.10225446906406432,,,,,,,,,,,,,,001,2018_Dec_13_1356,part1,59.970634983936634,
"In addition to reading all 16 stories, your task will be to answer perspective-related questions about each story.
",(press the space bar to continue),,,,,,,,,,,0,0,0,0,,,,,,,,,,,,,,,,space,0.4002047989051789,,,,,,,,,,,,,,,,001,2018_Dec_13_1356,part1,59.970634983936634,
You will answer the questions about each story after reading all 16 stories. ,None,,,,,,,,,,,0,1,1,1,,,,,,,,,,,,,,,,space,0.31898695800919086,,,,,,,,,,,,,,,,001,2018_Dec_13_1356,part1,59.970634983936634,
There will be four questions to answer per story.,None,,,,,,,,,,,0,2,2,2,,,,,,,,,,,,,,,,space,0.13433664594776928,,,,,,,,,,,,,,,,001,2018_Dec_13_1356,part1,59.970634983936634,
These questions are determined by the perspective you take during the story. ,None,,,,,,,,,,,0,3,3,3,,,,,,,,,,,,,,,,space,0.13473170308861881,,,,,,,,,,,,,,,,001,2018_Dec_13_1356,part1,59.970634983936634,
The questions will be the same for the stories read with the same perspective. ,None,,,,,,,,,,,0,4,4,4,,,,,,,,,,,,,,,,space,0.28480332996696234,,,,,,,,,,,,,,,,001,2018_Dec_13_1356,part1,59.970634983936634,
"Before reading the stories, you will learn the questions associated with each career perspective in order to help you answer them. ",None,,,,,,,,,,,0,5,5,5,,,,,,,,,,,,,,,,space,0.13587692799046636,,,,,,,,,,,,,,,,001,2018_Dec_13_1356,part1,59.970634983936634,
You will have to try to learn these questions with a series of pre-task quizzes.,None,,,,,,,,,,,0,6,6,6,,,,,,,,,,,,,,,,space,0.11773501697462052,,,,,,,,,,,,,,,,001,2018_Dec_13_1356,part1,59.970634983936634,
"Once the story-reading task has begun, remember your answers to the questions for each story.",None,,,,,,,,,,,0,7,7,7,,,,,,,,,,,,,,,,space,0.10170572507195175,,,,,,,,,,,,,,,,001,2018_Dec_13_1356,part1,59.970634983936634,
"Again, you will be asked about the answers to these questions for each story at end of the experiment. ",None,,,,,,,,,,,0,8,8,8,,,,,,,,,,,,,,,,space,0.11896896990947425,,,,,,,,,,,,,,,,001,2018_Dec_13_1356,part1,59.970634983936634,
Press the space bar to begin learning the perspectives and the questions for each one.,None,,,,,,,,,,,0,9,9,9,,,,,,,,,,,,,,,,space,0.10133175400551409,,,,,,,,,,,,,,,,001,2018_Dec_13_1356,part1,59.970634983936634,
,,,,,,,,,,,,,,,,,,,,,,,,,,,,,,,,,,,space,0.11799751804210246,space,0.08433571795467287,space,0.2851979340193793,space,0.3511129799298942,space,0.4180735959671438,space,0.7356231700396165,,,,,,
